"2016-09-27 01:20:12.491295","74","60953  >  443 [SYN] Seq=0 Win=4380 Len=0 MSS=1460 SACK_PERM=1 TSval=53830479 TSecr=0 WS=16"
"2016-09-27 01:20:12.705493","54","60953  >  443 [ACK] Seq=1 Ack=1 Win=4384 Len=0"
"2016-09-27 01:20:12.834066","371","Client Hello"
"2016-09-27 01:20:13.056975","54","60953  >  443 [ACK] Seq=318 Ack=1461 Win=7312 Len=0"
"2016-09-27 01:20:13.057144","54","60953  >  443 [ACK] Seq=318 Ack=2921 Win=10224 Len=0"
"2016-09-27 01:20:13.057242","54","60953  >  443 [ACK] Seq=318 Ack=3294 Win=13152 Len=0"
"2016-09-27 01:20:13.081601","180","Client Key Exchange"
"2016-09-27 01:20:13.301264","54","60953  >  443 [ACK] Seq=444 Ack=3345 Win=13152 Len=0"
"2016-09-27 01:20:13.333135","1514","60953  >  443 [ACK] Seq=444 Ack=3345 Win=13152 Len=1460 [TCP segment of a reassembled PDU]"
"2016-09-27 01:20:13.333257","431","Application Data"
"2016-09-27 01:20:13.681186","54","60953  >  443 [ACK] Seq=2281 Ack=3886 Win=18992 Len=0"
"2016-09-27 01:20:13.756337","54","60953  >  443 [ACK] Seq=2281 Ack=4055 Win=21904 Len=0"
"2016-09-27 01:20:13.777619","207","Application Data"
"2016-09-27 01:20:13.843014","252","Application Data"
"2016-09-27 01:20:13.846644","275","Application Data"
"2016-09-27 01:20:13.853701","545","Application Data"
"2016-09-27 01:20:13.857633","380","Application Data"
"2016-09-27 01:20:13.860018","191","Application Data"
"2016-09-27 01:20:14.023929","184","Application Data"
"2016-09-27 01:20:14.024918","375","Application Data"
"2016-09-27 01:20:18.291722","54","60953  >  443 [ACK] Seq=4258 Ack=4096 Win=21904 Len=0"
"2016-09-27 01:20:18.292234","95","Application Data"
"2016-09-27 01:20:48.321233","95","Application Data"
"2016-09-27 01:20:48.580428","54","60953  >  443 [ACK] Seq=4340 Ack=4137 Win=21904 Len=0"
"2016-09-27 01:21:18.292364","54","60953  >  443 [ACK] Seq=4340 Ack=4178 Win=21904 Len=0"
"2016-09-27 01:21:18.292466","95","Application Data"
"2016-09-27 01:21:48.321298","95","Application Data"
"2016-09-27 01:21:48.576344","54","60953  >  443 [ACK] Seq=4422 Ack=4219 Win=21904 Len=0"
"2016-09-27 01:22:18.299177","54","60953  >  443 [ACK] Seq=4422 Ack=4260 Win=21904 Len=0"
"2016-09-27 01:22:18.299721","95","Application Data"
"2016-09-27 01:22:48.326587","95","Application Data"
"2016-09-27 01:22:48.580405","54","60953  >  443 [ACK] Seq=4504 Ack=4301 Win=21904 Len=0"
"2016-09-27 01:23:18.295891","54","60953  >  443 [ACK] Seq=4504 Ack=4342 Win=21904 Len=0"
"2016-09-27 01:23:18.295988","95","Application Data"
"2016-09-27 01:23:48.323880","95","Application Data"
"2016-09-27 01:23:48.579895","54","60953  >  443 [ACK] Seq=4586 Ack=4383 Win=21904 Len=0"
"2016-09-27 01:24:18.568480","95","Application Data"
"2016-09-27 01:24:19.005603","95","[TCP Spurious Retransmission] "
"2016-09-27 01:24:19.794905","54","60953  >  443 [ACK] Seq=4627 Ack=4424 Win=21904 Len=0"
"2016-09-27 01:24:19.795418","95","Application Data"
"2016-09-27 01:24:20.044649","54","60953  >  443 [ACK] Seq=4668 Ack=4465 Win=21904 Len=0"
"2016-09-27 01:24:50.035803","95","Application Data"
"2016-09-27 01:24:50.248215","54","60953  >  443 [ACK] Seq=4709 Ack=4506 Win=21904 Len=0"
"2016-09-27 01:25:18.302590","54","60953  >  443 [ACK] Seq=4709 Ack=4547 Win=21904 Len=0"
"2016-09-27 01:25:18.303138","95","Application Data"
"2016-09-27 01:25:48.330594","95","Application Data"
"2016-09-27 01:25:48.583370","54","60953  >  443 [ACK] Seq=4791 Ack=4588 Win=21904 Len=0"
"2016-09-27 01:26:18.296365","54","60953  >  443 [ACK] Seq=4791 Ack=4629 Win=21904 Len=0"
"2016-09-27 01:26:18.296479","95","Application Data"
"2016-09-27 01:26:48.336521","95","Application Data"
"2016-09-27 01:26:48.587823","54","60953  >  443 [ACK] Seq=4873 Ack=4670 Win=21904 Len=0"
"2016-09-27 01:27:18.302746","54","60953  >  443 [ACK] Seq=4873 Ack=4711 Win=21904 Len=0"
"2016-09-27 01:27:18.302865","95","Application Data"
"2016-09-27 01:27:48.331965","95","Application Data"
"2016-09-27 01:27:48.583052","54","60953  >  443 [ACK] Seq=4955 Ack=4752 Win=21904 Len=0"
"2016-09-27 01:28:18.299912","54","60953  >  443 [ACK] Seq=4955 Ack=4793 Win=21904 Len=0"
"2016-09-27 01:28:18.300018","95","Application Data"
"2016-09-27 01:28:48.328050","95","Application Data"
"2016-09-27 01:28:48.582895","54","60953  >  443 [ACK] Seq=5037 Ack=4834 Win=21904 Len=0"
"2016-09-27 01:29:18.294835","54","60953  >  443 [ACK] Seq=5037 Ack=4875 Win=21904 Len=0"
"2016-09-27 01:29:18.294933","95","Application Data"
"2016-09-27 01:29:48.323339","95","Application Data"
"2016-09-27 01:29:48.580203","54","60953  >  443 [ACK] Seq=5119 Ack=4916 Win=21904 Len=0"
"2016-09-27 01:30:18.297724","54","60953  >  443 [ACK] Seq=5119 Ack=4957 Win=21904 Len=0"
"2016-09-27 01:30:18.298405","95","Application Data"
"2016-09-27 01:30:48.325060","95","Application Data"
"2016-09-27 01:30:48.582544","54","60953  >  443 [ACK] Seq=5201 Ack=4998 Win=21904 Len=0"
"2016-09-27 01:31:18.575038","95","Application Data"
"2016-09-27 01:31:18.750666","54","60953  >  443 [ACK] Seq=5242 Ack=5039 Win=21904 Len=0"
"2016-09-27 01:31:18.751191","95","Application Data"
"2016-09-27 01:31:19.000359","54","60953  >  443 [ACK] Seq=5283 Ack=5080 Win=21904 Len=0"
"2016-09-27 01:31:48.993553","95","Application Data"
"2016-09-27 01:31:49.668576","54","60953  >  443 [ACK] Seq=5324 Ack=5121 Win=21904 Len=0"
"2016-09-27 01:32:19.219979","54","60953  >  443 [ACK] Seq=5324 Ack=5162 Win=21904 Len=0"
"2016-09-27 01:32:19.220091","95","Application Data"
"2016-09-27 01:32:49.247879","95","Application Data"
"2016-09-27 01:32:49.504004","54","60953  >  443 [ACK] Seq=5406 Ack=5203 Win=21904 Len=0"
"2016-09-27 01:33:18.750858","54","60953  >  443 [ACK] Seq=5406 Ack=5244 Win=21904 Len=0"
"2016-09-27 01:33:18.750970","95","Application Data"
"2016-09-27 01:33:39.890609","54","60953  >  443 [ACK] Seq=5447 Ack=5616 Win=24832 Len=0"
"2016-09-27 01:33:40.296829","210","Application Data"
"2016-09-27 01:33:40.516675","54","60953  >  443 [ACK] Seq=5603 Ack=5787 Win=27744 Len=0"
"2016-09-27 01:33:42.177719","201","Application Data"
"2016-09-27 01:33:42.992857","334","Application Data"
"2016-09-27 01:34:13.029088","95","Application Data"
"2016-09-27 01:34:13.246291","54","60953  >  443 [ACK] Seq=6071 Ack=5828 Win=27744 Len=0"
"2016-09-27 01:34:18.303648","54","60953  >  443 [ACK] Seq=6071 Ack=5869 Win=27744 Len=0"
"2016-09-27 01:34:18.305950","95","Application Data"
"2016-09-27 01:34:48.328219","95","Application Data"
"2016-09-27 01:34:48.589619","54","60953  >  443 [ACK] Seq=6153 Ack=5910 Win=27744 Len=0"
"2016-09-27 01:35:18.292894","54","60953  >  443 [ACK] Seq=6153 Ack=5951 Win=27744 Len=0"
"2016-09-27 01:35:18.293472","95","Application Data"
"2016-09-27 01:35:48.320194","95","Application Data"
"2016-09-27 01:35:48.565995","54","60953  >  443 [ACK] Seq=6235 Ack=5992 Win=27744 Len=0"
"2016-09-27 01:36:18.301582","54","60953  >  443 [ACK] Seq=6235 Ack=6033 Win=27744 Len=0"
"2016-09-27 01:36:18.301695","95","Application Data"
"2016-09-27 01:36:48.326791","95","Application Data"
"2016-09-27 01:36:48.573556","54","60953  >  443 [ACK] Seq=6317 Ack=6074 Win=27744 Len=0"
"2016-09-27 01:37:18.300323","54","60953  >  443 [ACK] Seq=6317 Ack=6115 Win=27744 Len=0"
"2016-09-27 01:37:18.300981","95","Application Data"
"2016-09-27 01:37:48.325931","95","Application Data"
"2016-09-27 01:37:48.578151","54","60953  >  443 [ACK] Seq=6399 Ack=6156 Win=27744 Len=0"
"2016-09-27 01:38:18.298588","54","60953  >  443 [ACK] Seq=6399 Ack=6197 Win=27744 Len=0"
"2016-09-27 01:38:18.299204","95","Application Data"
"2016-09-27 01:38:48.330214","95","Application Data"
"2016-09-27 01:38:48.583269","54","60953  >  443 [ACK] Seq=6481 Ack=6238 Win=27744 Len=0"
"2016-09-27 01:39:18.302941","54","60953  >  443 [ACK] Seq=6481 Ack=6279 Win=27744 Len=0"
"2016-09-27 01:39:18.303056","95","Application Data"
"2016-09-27 01:39:48.329546","95","Application Data"
"2016-09-27 01:39:48.579403","54","60953  >  443 [ACK] Seq=6563 Ack=6320 Win=27744 Len=0"
"2016-09-27 01:40:18.298147","54","60953  >  443 [ACK] Seq=6563 Ack=6361 Win=27744 Len=0"
"2016-09-27 01:40:18.298675","95","Application Data"
"2016-09-27 01:40:48.330436","95","Application Data"
"2016-09-27 01:40:48.578984","54","60953  >  443 [ACK] Seq=6645 Ack=6402 Win=27744 Len=0"
"2016-09-27 01:41:18.294932","54","60953  >  443 [ACK] Seq=6645 Ack=6443 Win=27744 Len=0"
"2016-09-27 01:41:18.295044","95","Application Data"
"2016-09-27 01:41:48.322546","95","Application Data"
"2016-09-27 01:41:48.590581","54","60953  >  443 [ACK] Seq=6727 Ack=6484 Win=27744 Len=0"
"2016-09-27 01:42:18.298528","54","60953  >  443 [ACK] Seq=6727 Ack=6525 Win=27744 Len=0"
"2016-09-27 01:42:18.298648","95","Application Data"
"2016-09-27 01:42:48.327148","95","Application Data"
"2016-09-27 01:42:48.578680","54","60953  >  443 [ACK] Seq=6809 Ack=6566 Win=27744 Len=0"
"2016-09-27 01:43:18.297915","54","60953  >  443 [ACK] Seq=6809 Ack=6607 Win=27744 Len=0"
"2016-09-27 01:43:18.298217","95","Application Data"
"2016-09-27 01:43:48.327595","95","Application Data"
"2016-09-27 01:43:48.578429","54","60953  >  443 [ACK] Seq=6891 Ack=6648 Win=27744 Len=0"
"2016-09-27 01:44:18.298272","54","60953  >  443 [ACK] Seq=6891 Ack=6689 Win=27744 Len=0"
"2016-09-27 01:44:18.298380","95","Application Data"
"2016-09-27 01:44:48.328284","95","Application Data"
"2016-09-27 01:44:49.027932","54","60953  >  443 [ACK] Seq=6973 Ack=6730 Win=27744 Len=0"
"2016-09-27 01:45:18.297907","54","60953  >  443 [ACK] Seq=6973 Ack=6771 Win=27744 Len=0"
"2016-09-27 01:45:18.298012","95","Application Data"
"2016-09-27 01:45:48.328324","95","Application Data"
"2016-09-27 01:45:48.579922","54","60953  >  443 [ACK] Seq=7055 Ack=6812 Win=27744 Len=0"
"2016-09-27 01:46:18.301811","54","60953  >  443 [ACK] Seq=7055 Ack=6853 Win=27744 Len=0"
"2016-09-27 01:46:18.301919","95","Application Data"
"2016-09-27 01:46:48.331813","95","Application Data"
"2016-09-27 01:46:49.042756","54","60953  >  443 [ACK] Seq=7137 Ack=6894 Win=27744 Len=0"
"2016-09-27 01:47:19.031395","95","Application Data"
"2016-09-27 01:47:19.210903","54","60953  >  443 [ACK] Seq=7178 Ack=6935 Win=27744 Len=0"
"2016-09-27 01:47:19.211714","95","Application Data"
"2016-09-27 01:47:19.460595","54","60953  >  443 [ACK] Seq=7219 Ack=6976 Win=27744 Len=0"
"2016-09-27 01:47:49.451886","95","Application Data"
"2016-09-27 01:47:49.891062","95","[TCP Spurious Retransmission] "
"2016-09-27 01:47:50.125138","54","60953  >  443 [ACK] Seq=7260 Ack=7017 Win=27744 Len=0"
"2016-09-27 01:48:19.223947","54","60953  >  443 [ACK] Seq=7260 Ack=7058 Win=27744 Len=0"
"2016-09-27 01:48:19.224076","95","Application Data"
"2016-09-27 01:48:49.253806","95","Application Data"
"2016-09-27 01:48:49.503333","54","60953  >  443 [ACK] Seq=7342 Ack=7099 Win=27744 Len=0"
"2016-09-27 01:49:18.297429","54","60953  >  443 [ACK] Seq=7342 Ack=7140 Win=27744 Len=0"
"2016-09-27 01:49:18.297554","95","Application Data"
"2016-09-27 01:49:48.324651","95","Application Data"
"2016-09-27 01:49:48.764980","95","[TCP Spurious Retransmission] "
"2016-09-27 01:49:49.029785","54","60953  >  443 [ACK] Seq=7424 Ack=7181 Win=27744 Len=0"
"2016-09-27 01:50:18.305034","54","60953  >  443 [ACK] Seq=7424 Ack=7222 Win=27744 Len=0"
"2016-09-27 01:50:18.305599","95","Application Data"
"2016-09-27 01:50:48.336838","95","Application Data"
"2016-09-27 01:50:48.780364","95","[TCP Spurious Retransmission] "
"2016-09-27 01:50:49.038193","54","60953  >  443 [ACK] Seq=7506 Ack=7263 Win=27744 Len=0"
"2016-09-27 01:50:53.613797","222","Application Data"
"2016-09-27 01:51:18.297074","54","60953  >  443 [ACK] Seq=7674 Ack=7304 Win=27744 Len=0"
"2016-09-27 01:51:18.297184","95","Application Data"
"2016-09-27 01:51:48.327475","95","Application Data"
"2016-09-27 01:51:48.596605","54","60953  >  443 [ACK] Seq=7756 Ack=7345 Win=27744 Len=0"
"2016-09-27 01:52:18.293451","54","60953  >  443 [ACK] Seq=7756 Ack=7386 Win=27744 Len=0"
"2016-09-27 01:52:18.293555","95","Application Data"
"2016-09-27 01:52:48.323226","95","Application Data"
"2016-09-27 01:52:48.768535","95","[TCP Spurious Retransmission] "
"2016-09-27 01:52:49.035626","54","60953  >  443 [ACK] Seq=7838 Ack=7427 Win=27744 Len=0"
"2016-09-27 01:53:18.304142","54","60953  >  443 [ACK] Seq=7838 Ack=7468 Win=27744 Len=0"
"2016-09-27 01:53:18.304615","95","Application Data"
"2016-09-27 01:53:48.330965","95","Application Data"
"2016-09-27 01:53:48.779789","95","[TCP Spurious Retransmission] "
"2016-09-27 01:53:49.037579","54","60953  >  443 [ACK] Seq=7920 Ack=7509 Win=27744 Len=0"
"2016-09-27 01:54:18.300303","54","60953  >  443 [ACK] Seq=7920 Ack=7550 Win=27744 Len=0"
"2016-09-27 01:54:18.300421","95","Application Data"
"2016-09-27 01:54:48.347141","95","Application Data"
"2016-09-27 01:54:48.775642","95","[TCP Spurious Retransmission] "
"2016-09-27 01:54:49.053008","54","60953  >  443 [ACK] Seq=8002 Ack=7591 Win=27744 Len=0"
"2016-09-27 01:55:18.296086","54","60953  >  443 [ACK] Seq=8002 Ack=7632 Win=27744 Len=0"
"2016-09-27 01:55:18.296188","95","Application Data"
"2016-09-27 01:55:48.324495","95","Application Data"
"2016-09-27 01:55:48.599675","54","60953  >  443 [ACK] Seq=8084 Ack=7673 Win=27744 Len=0"
"2016-09-27 01:56:18.303027","54","60953  >  443 [ACK] Seq=8084 Ack=7714 Win=27744 Len=0"
"2016-09-27 01:56:18.303560","95","Application Data"
"2016-09-27 01:56:48.332975","95","Application Data"
"2016-09-27 01:56:48.583867","54","60953  >  443 [ACK] Seq=8166 Ack=7755 Win=27744 Len=0"
"2016-09-27 01:57:18.295939","54","60953  >  443 [ACK] Seq=8166 Ack=7796 Win=27744 Len=0"
"2016-09-27 01:57:18.296056","95","Application Data"
"2016-09-27 01:57:48.323412","95","Application Data"
"2016-09-27 01:57:48.579852","54","60953  >  443 [ACK] Seq=8248 Ack=7837 Win=27744 Len=0"
"2016-09-27 01:58:18.299552","54","60953  >  443 [ACK] Seq=8248 Ack=7878 Win=27744 Len=0"
"2016-09-27 01:58:18.299672","95","Application Data"
"2016-09-27 01:58:48.326150","95","Application Data"
"2016-09-27 01:58:48.580846","54","60953  >  443 [ACK] Seq=8330 Ack=7919 Win=27744 Len=0"
"2016-09-27 01:59:18.568028","95","Application Data"
"2016-09-27 01:59:18.751684","54","60953  >  443 [ACK] Seq=8371 Ack=7960 Win=27744 Len=0"
"2016-09-27 01:59:18.752263","95","Application Data"
"2016-09-27 01:59:19.001412","54","60953  >  443 [ACK] Seq=8412 Ack=8001 Win=27744 Len=0"
"2016-09-27 01:59:48.993009","95","Application Data"
"2016-09-27 01:59:49.204885","54","60953  >  443 [ACK] Seq=8453 Ack=8042 Win=27744 Len=0"
"2016-09-27 02:00:18.306349","54","60953  >  443 [ACK] Seq=8453 Ack=8083 Win=27744 Len=0"
"2016-09-27 02:00:18.306865","95","Application Data"
"2016-09-27 02:00:48.337495","95","Application Data"
"2016-09-27 02:00:48.778569","95","[TCP Spurious Retransmission] "
"2016-09-27 02:00:49.044121","54","60953  >  443 [ACK] Seq=8535 Ack=8124 Win=27744 Len=0"
"2016-09-27 02:01:19.032661","95","Application Data"
"2016-09-27 02:01:19.208351","54","60953  >  443 [ACK] Seq=8576 Ack=8165 Win=27744 Len=0"
"2016-09-27 02:01:19.208861","95","Application Data"
"2016-09-27 02:01:19.458047","54","60953  >  443 [ACK] Seq=8617 Ack=8206 Win=27744 Len=0"
"2016-09-27 02:01:49.446264","95","Application Data"
"2016-09-27 02:01:49.661496","54","60953  >  443 [ACK] Seq=8658 Ack=8247 Win=27744 Len=0"
"2016-09-27 02:02:18.759708","54","60953  >  443 [ACK] Seq=8658 Ack=8288 Win=27744 Len=0"
"2016-09-27 02:02:18.759816","95","Application Data"
"2016-09-27 02:02:48.784058","95","Application Data"
"2016-09-27 02:02:49.031972","54","60953  >  443 [ACK] Seq=8740 Ack=8329 Win=27744 Len=0"
"2016-09-27 02:03:18.307005","54","60953  >  443 [ACK] Seq=8740 Ack=8370 Win=27744 Len=0"
"2016-09-27 02:03:18.307120","95","Application Data"
"2016-09-27 02:03:48.334434","95","Application Data"
"2016-09-27 02:03:48.582572","54","60953  >  443 [ACK] Seq=8822 Ack=8411 Win=27744 Len=0"
"2016-09-27 02:04:18.297774","54","60953  >  443 [ACK] Seq=8822 Ack=8452 Win=27744 Len=0"
"2016-09-27 02:04:18.301110","95","Application Data"
"2016-09-27 02:04:48.329611","95","Application Data"
"2016-09-27 02:04:48.578504","54","60953  >  443 [ACK] Seq=8904 Ack=8493 Win=27744 Len=0"
"2016-09-27 02:05:18.302376","54","60953  >  443 [ACK] Seq=8904 Ack=8534 Win=27744 Len=0"
"2016-09-27 02:05:18.302488","95","Application Data"
"2016-09-27 02:05:48.330854","95","Application Data"
"2016-09-27 02:05:48.578646","54","60953  >  443 [ACK] Seq=8986 Ack=8575 Win=27744 Len=0"
"2016-09-27 02:06:18.298013","54","60953  >  443 [ACK] Seq=8986 Ack=8616 Win=27744 Len=0"
"2016-09-27 02:06:18.298134","95","Application Data"
"2016-09-27 02:06:48.329845","95","Application Data"
"2016-09-27 02:06:48.578150","54","60953  >  443 [ACK] Seq=9068 Ack=8657 Win=27744 Len=0"
"2016-09-27 02:07:18.297953","54","60953  >  443 [ACK] Seq=9068 Ack=8698 Win=27744 Len=0"
"2016-09-27 02:07:18.298075","95","Application Data"
"2016-09-27 02:07:48.329201","95","Application Data"
"2016-09-27 02:07:48.577922","54","60953  >  443 [ACK] Seq=9150 Ack=8739 Win=27744 Len=0"
"2016-09-27 02:08:18.297474","54","60953  >  443 [ACK] Seq=9150 Ack=8780 Win=27744 Len=0"
"2016-09-27 02:08:18.297591","95","Application Data"
"2016-09-27 02:08:48.340898","95","Application Data"
"2016-09-27 02:08:48.769187","95","[TCP Spurious Retransmission] "
"2016-09-27 02:08:49.052961","54","60953  >  443 [ACK] Seq=9232 Ack=8821 Win=27744 Len=0"
"2016-09-27 02:09:18.293095","54","60953  >  443 [ACK] Seq=9232 Ack=8862 Win=27744 Len=0"
"2016-09-27 02:09:18.293206","95","Application Data"
"2016-09-27 02:09:48.320906","95","Application Data"
"2016-09-27 02:09:48.577583","54","60953  >  443 [ACK] Seq=9314 Ack=8903 Win=27744 Len=0"
"2016-09-27 02:10:18.300826","54","60953  >  443 [ACK] Seq=9314 Ack=8944 Win=27744 Len=0"
"2016-09-27 02:10:18.301300","95","Application Data"
"2016-09-27 02:10:48.327339","95","Application Data"
"2016-09-27 02:10:48.581280","54","60953  >  443 [ACK] Seq=9396 Ack=8985 Win=27744 Len=0"
"2016-09-27 02:11:18.302097","54","60953  >  443 [ACK] Seq=9396 Ack=9026 Win=27744 Len=0"
"2016-09-27 02:11:18.302216","95","Application Data"
"2016-09-27 02:11:48.332204","95","Application Data"
"2016-09-27 02:11:48.581194","54","60953  >  443 [ACK] Seq=9478 Ack=9067 Win=27744 Len=0"
"2016-09-27 02:12:18.296905","54","60953  >  443 [ACK] Seq=9478 Ack=9108 Win=27744 Len=0"
"2016-09-27 02:12:18.297013","95","Application Data"
"2016-09-27 02:12:48.327259","95","Application Data"
"2016-09-27 02:12:48.573043","54","60953  >  443 [ACK] Seq=9560 Ack=9149 Win=27744 Len=0"
"2016-09-27 02:13:18.296710","54","60953  >  443 [ACK] Seq=9560 Ack=9190 Win=27744 Len=0"
"2016-09-27 02:13:18.296826","95","Application Data"
"2016-09-27 02:13:48.325771","95","Application Data"
"2016-09-27 02:13:48.580740","54","60953  >  443 [ACK] Seq=9642 Ack=9231 Win=27744 Len=0"
"2016-09-27 02:14:18.569554","95","Application Data"
"2016-09-27 02:14:18.764449","54","60953  >  443 [ACK] Seq=9683 Ack=9272 Win=27744 Len=0"
"2016-09-27 02:14:18.765132","95","Application Data"
"2016-09-27 02:14:19.014194","54","60953  >  443 [ACK] Seq=9724 Ack=9313 Win=27744 Len=0"
"2016-09-27 02:14:49.002690","95","Application Data"
"2016-09-27 02:14:49.221519","54","60953  >  443 [ACK] Seq=9765 Ack=9354 Win=27744 Len=0"
"2016-09-27 02:15:18.295622","54","60953  >  443 [ACK] Seq=9765 Ack=9395 Win=27744 Len=0"
"2016-09-27 02:15:18.296166","95","Application Data"
"2016-09-27 02:15:48.326321","95","Application Data"
"2016-09-27 02:15:48.572517","54","60953  >  443 [ACK] Seq=9847 Ack=9436 Win=27744 Len=0"
"2016-09-27 02:16:18.296198","54","60953  >  443 [ACK] Seq=9847 Ack=9477 Win=27744 Len=0"
"2016-09-27 02:16:18.296306","95","Application Data"
"2016-09-27 02:16:48.325148","95","Application Data"
"2016-09-27 02:16:48.597135","54","60953  >  443 [ACK] Seq=9929 Ack=9518 Win=27744 Len=0"
"2016-09-27 02:17:18.586085","95","Application Data"
"2016-09-27 02:17:18.759971","54","60953  >  443 [ACK] Seq=9970 Ack=9559 Win=27744 Len=0"
"2016-09-27 02:17:18.760672","95","Application Data"
"2016-09-27 02:17:19.014354","54","60953  >  443 [ACK] Seq=10011 Ack=9600 Win=27744 Len=0"
"2016-09-27 02:17:48.999089","95","Application Data"
"2016-09-27 02:17:49.455493","95","[TCP Spurious Retransmission] "
"2016-09-27 02:17:49.674202","54","60953  >  443 [ACK] Seq=10052 Ack=9641 Win=27744 Len=0"
"2016-09-27 02:18:18.300471","54","60953  >  443 [ACK] Seq=10052 Ack=9682 Win=27744 Len=0"
"2016-09-27 02:18:18.300588","95","Application Data"
"2016-09-27 02:18:48.331590","95","Application Data"
"2016-09-27 02:18:48.583385","54","60953  >  443 [ACK] Seq=10134 Ack=9723 Win=27744 Len=0"
"2016-09-27 02:19:18.296092","54","60953  >  443 [ACK] Seq=10134 Ack=9764 Win=27744 Len=0"
"2016-09-27 02:19:18.296550","95","Application Data"
"2016-09-27 02:19:48.326028","95","Application Data"
"2016-09-27 02:19:48.576488","54","60953  >  443 [ACK] Seq=10216 Ack=9805 Win=27744 Len=0"
"2016-09-27 02:20:18.303242","54","60953  >  443 [ACK] Seq=10216 Ack=9846 Win=27744 Len=0"
"2016-09-27 02:20:18.303346","95","Application Data"
"2016-09-27 02:20:48.332202","95","Application Data"
"2016-09-27 02:20:49.039453","54","60953  >  443 [ACK] Seq=10298 Ack=9887 Win=27744 Len=0"
"2016-09-27 02:21:18.302337","54","60953  >  443 [ACK] Seq=10298 Ack=9928 Win=27744 Len=0"
"2016-09-27 02:21:18.302449","95","Application Data"
"2016-09-27 02:21:48.329693","95","Application Data"
"2016-09-27 02:21:48.586102","54","60953  >  443 [ACK] Seq=10380 Ack=9969 Win=27744 Len=0"
"2016-09-27 02:22:18.302041","54","60953  >  443 [ACK] Seq=10380 Ack=10010 Win=27744 Len=0"
"2016-09-27 02:22:18.302160","95","Application Data"
"2016-09-27 02:22:48.329491","95","Application Data"
"2016-09-27 02:22:48.578095","54","60953  >  443 [ACK] Seq=10462 Ack=10051 Win=27744 Len=0"
"2016-09-27 02:23:18.294128","54","60953  >  443 [ACK] Seq=10462 Ack=10092 Win=27744 Len=0"
"2016-09-27 02:23:18.294239","95","Application Data"
"2016-09-27 02:23:48.323186","95","Application Data"
"2016-09-27 02:23:48.574043","54","60953  >  443 [ACK] Seq=10544 Ack=10133 Win=27744 Len=0"
"2016-09-27 02:24:18.293903","54","60953  >  443 [ACK] Seq=10544 Ack=10174 Win=27744 Len=0"
"2016-09-27 02:24:18.294012","95","Application Data"
"2016-09-27 02:24:48.324226","95","Application Data"
"2016-09-27 02:24:49.030861","54","60953  >  443 [ACK] Seq=10626 Ack=10215 Win=27744 Len=0"
"2016-09-27 02:25:18.300596","54","60953  >  443 [ACK] Seq=10626 Ack=10256 Win=27744 Len=0"
"2016-09-27 02:25:18.301168","95","Application Data"
"2016-09-27 02:25:48.330921","95","Application Data"
"2016-09-27 02:25:48.577533","54","60953  >  443 [ACK] Seq=10708 Ack=10297 Win=27744 Len=0"
"2016-09-27 02:26:18.301338","54","60953  >  443 [ACK] Seq=10708 Ack=10338 Win=27744 Len=0"
"2016-09-27 02:26:18.301449","95","Application Data"
"2016-09-27 02:26:48.329097","95","Application Data"
"2016-09-27 02:26:48.581244","54","60953  >  443 [ACK] Seq=10790 Ack=10379 Win=27744 Len=0"
"2016-09-27 02:27:18.305023","54","60953  >  443 [ACK] Seq=10790 Ack=10420 Win=27744 Len=0"
"2016-09-27 02:27:18.305143","95","Application Data"
"2016-09-27 02:27:48.335308","95","Application Data"
"2016-09-27 02:27:48.588825","54","60953  >  443 [ACK] Seq=10872 Ack=10461 Win=27744 Len=0"
"2016-09-27 02:28:18.581574","95","Application Data"
"2016-09-27 02:28:18.770015","54","60953  >  443 [ACK] Seq=10913 Ack=10502 Win=27744 Len=0"
"2016-09-27 02:28:18.770132","95","Application Data"
"2016-09-27 02:28:19.018521","54","60953  >  443 [ACK] Seq=10954 Ack=10543 Win=27744 Len=0"
"2016-09-27 02:28:49.009968","95","Application Data"
"2016-09-27 02:28:49.452029","95","[TCP Spurious Retransmission] "
"2016-09-27 02:28:49.720332","54","60953  >  443 [ACK] Seq=10995 Ack=10584 Win=27744 Len=0"
"2016-09-27 02:29:18.298593","54","60953  >  443 [ACK] Seq=10995 Ack=10625 Win=27744 Len=0"
"2016-09-27 02:29:18.298713","95","Application Data"
"2016-09-27 02:29:48.328074","95","Application Data"
"2016-09-27 02:29:48.576776","54","60953  >  443 [ACK] Seq=11077 Ack=10666 Win=27744 Len=0"
"2016-09-27 02:30:18.295809","54","60953  >  443 [ACK] Seq=11077 Ack=10707 Win=27744 Len=0"
"2016-09-27 02:30:18.296330","95","Application Data"
"2016-09-27 02:30:48.323771","95","Application Data"
"2016-09-27 02:30:48.576588","54","60953  >  443 [ACK] Seq=11159 Ack=10748 Win=27744 Len=0"
"2016-09-27 02:31:18.300420","54","60953  >  443 [ACK] Seq=11159 Ack=10789 Win=27744 Len=0"
"2016-09-27 02:31:18.300539","95","Application Data"
"2016-09-27 02:31:48.330635","95","Application Data"
"2016-09-27 02:31:48.584539","54","60953  >  443 [ACK] Seq=11241 Ack=10830 Win=27744 Len=0"
"2016-09-27 02:32:18.575800","95","Application Data"
"2016-09-27 02:32:18.760229","54","60953  >  443 [ACK] Seq=11282 Ack=10871 Win=27744 Len=0"
"2016-09-27 02:32:18.760723","95","Application Data"
"2016-09-27 02:32:19.011111","54","60953  >  443 [ACK] Seq=11323 Ack=10912 Win=27744 Len=0"
"2016-09-27 02:32:48.997351","95","Application Data"
"2016-09-27 02:32:49.213356","54","60953  >  443 [ACK] Seq=11364 Ack=10953 Win=27744 Len=0"
"2016-09-27 02:33:18.301371","54","60953  >  443 [ACK] Seq=11364 Ack=10994 Win=27744 Len=0"
"2016-09-27 02:33:18.303559","95","Application Data"
"2016-09-27 02:33:43.888634","54","60953  >  443 [ACK] Seq=11405 Ack=11196 Win=27744 Len=0"
"2016-09-27 02:34:13.881589","95","Application Data"
"2016-09-27 02:34:14.096268","54","60953  >  443 [ACK] Seq=11446 Ack=11237 Win=27744 Len=0"
"2016-09-27 02:34:18.298878","54","60953  >  443 [ACK] Seq=11446 Ack=11278 Win=27744 Len=0"
"2016-09-27 02:34:18.299437","95","Application Data"
"2016-09-27 02:34:48.328495","95","Application Data"
"2016-09-27 02:34:48.583640","54","60953  >  443 [ACK] Seq=11528 Ack=11319 Win=27744 Len=0"
"2016-09-27 02:35:18.299354","54","60953  >  443 [ACK] Seq=11528 Ack=11360 Win=27744 Len=0"
"2016-09-27 02:35:18.299473","95","Application Data"
"2016-09-27 02:35:48.326109","95","Application Data"
"2016-09-27 02:35:48.575608","54","60953  >  443 [ACK] Seq=11610 Ack=11401 Win=27744 Len=0"
"2016-09-27 02:36:18.294568","54","60953  >  443 [ACK] Seq=11610 Ack=11442 Win=27744 Len=0"
"2016-09-27 02:36:18.295165","95","Application Data"
"2016-09-27 02:36:32.208812","85","Encrypted Alert"
"2016-09-27 02:36:32.225072","54","60953  >  443 [FIN"
"2016-09-27 02:36:32.392496","74","53074  >  443 [SYN] Seq=0 Win=4380 Len=0 MSS=1460 SACK_PERM=1 TSval=55002934 TSecr=0 WS=16"
"2016-09-27 02:36:32.427519","54","60953  >  443 [RST] Seq=11682 Win=0 Len=0"
"2016-09-27 02:36:32.439034","54","60953  >  443 [RST] Seq=11683 Win=0 Len=0"
"2016-09-27 02:36:32.603187","54","53074  >  443 [ACK] Seq=1 Ack=1 Win=4384 Len=0"
"2016-09-27 02:36:32.703339","371","Client Hello"
"2016-09-27 02:36:32.923767","54","53074  >  443 [ACK] Seq=318 Ack=1461 Win=7312 Len=0"
"2016-09-27 02:36:32.924462","54","53074  >  443 [ACK] Seq=318 Ack=2921 Win=10224 Len=0"
"2016-09-27 02:36:32.924552","54","53074  >  443 [ACK] Seq=318 Ack=3294 Win=13152 Len=0"
"2016-09-27 02:36:32.962552","180","Client Key Exchange"
"2016-09-27 02:36:33.140036","54","[TCP Dup ACK 71081#1] 53074  >  443 [ACK] Seq=444 Ack=3294 Win=13152 Len=0"
"2016-09-27 02:36:33.140144","54","[TCP Dup ACK 71081#2] 53074  >  443 [ACK] Seq=444 Ack=3294 Win=13152 Len=0"
"2016-09-27 02:36:33.140208","54","[TCP Dup ACK 71081#3] 53074  >  443 [ACK] Seq=444 Ack=3294 Win=13152 Len=0"
"2016-09-27 02:36:33.181841","54","53074  >  443 [ACK] Seq=444 Ack=3300 Win=13152 Len=0"
"2016-09-27 02:36:33.182466","54","53074  >  443 [ACK] Seq=444 Ack=3345 Win=13152 Len=0"
"2016-09-27 02:36:33.231877","1514","53074  >  443 [ACK] Seq=444 Ack=3345 Win=13152 Len=1460 [TCP segment of a reassembled PDU]"
"2016-09-27 02:36:33.231979","431","Application Data"
"2016-09-27 02:36:33.607041","54","53074  >  443 [ACK] Seq=2281 Ack=3689 Win=16064 Len=0"
"2016-09-27 02:36:33.618771","54","53074  >  443 [ACK] Seq=2281 Ack=3887 Win=18992 Len=0"
"2016-09-27 02:36:33.678516","54","53074  >  443 [ACK] Seq=2281 Ack=4056 Win=21904 Len=0"
"2016-09-27 02:36:33.725014","262","Application Data"
"2016-09-27 02:36:33.813435","275","Application Data"
"2016-09-27 02:36:33.819794","544","Application Data"
"2016-09-27 02:36:33.827136","380","Application Data"
"2016-09-27 02:36:33.831027","191","Application Data"
"2016-09-27 02:36:33.858809","186","Application Data"
"2016-09-27 02:36:33.971753","149","Application Data"
"2016-09-27 02:36:33.972995","380","Application Data"
"2016-09-27 02:36:38.173463","54","53074  >  443 [ACK] Seq=4216 Ack=4097 Win=21904 Len=0"
"2016-09-27 02:36:38.174009","95","Application Data"
"2016-09-27 02:37:08.204189","95","Application Data"
"2016-09-27 02:37:08.454127","54","53074  >  443 [ACK] Seq=4298 Ack=4138 Win=21904 Len=0"
"2016-09-27 02:37:38.181186","54","53074  >  443 [ACK] Seq=4298 Ack=4179 Win=21904 Len=0"
"2016-09-27 02:37:38.181722","95","Application Data"
"2016-09-27 02:38:08.210313","95","Application Data"
"2016-09-27 02:38:08.465874","54","53074  >  443 [ACK] Seq=4380 Ack=4220 Win=21904 Len=0"
"2016-09-27 02:38:38.174123","54","53074  >  443 [ACK] Seq=4380 Ack=4261 Win=21904 Len=0"
"2016-09-27 02:38:38.174233","95","Application Data"
"2016-09-27 02:39:08.200369","95","Application Data"
"2016-09-27 02:39:08.454045","54","53074  >  443 [ACK] Seq=4462 Ack=4302 Win=21904 Len=0"
"2016-09-27 02:39:38.177276","54","53074  >  443 [ACK] Seq=4462 Ack=4343 Win=21904 Len=0"
"2016-09-27 02:39:38.177392","95","Application Data"
"2016-09-27 02:40:08.204734","95","Application Data"
"2016-09-27 02:40:08.453712","54","53074  >  443 [ACK] Seq=4544 Ack=4384 Win=21904 Len=0"
"2016-09-27 02:40:38.181768","54","53074  >  443 [ACK] Seq=4544 Ack=4425 Win=21904 Len=0"
"2016-09-27 02:40:38.181879","95","Application Data"
"2016-09-27 02:41:08.208558","95","Application Data"
"2016-09-27 02:41:08.476945","54","53074  >  443 [ACK] Seq=4626 Ack=4466 Win=21904 Len=0"
"2016-09-27 02:41:38.172477","54","53074  >  443 [ACK] Seq=4626 Ack=4507 Win=21904 Len=0"
"2016-09-27 02:41:38.173035","95","Application Data"
"2016-09-27 02:42:08.200693","95","Application Data"
"2016-09-27 02:42:08.457229","54","53074  >  443 [ACK] Seq=4708 Ack=4548 Win=21904 Len=0"
"2016-09-27 02:42:38.172734","54","53074  >  443 [ACK] Seq=4708 Ack=4589 Win=21904 Len=0"
"2016-09-27 02:42:38.172844","95","Application Data"
"2016-09-27 02:43:08.200239","95","Application Data"
"2016-09-27 02:43:08.465040","54","53074  >  443 [ACK] Seq=4790 Ack=4630 Win=21904 Len=0"
"2016-09-27 02:43:38.172737","54","53074  >  443 [ACK] Seq=4790 Ack=4671 Win=21904 Len=0"
"2016-09-27 02:43:38.172846","95","Application Data"
"2016-09-27 02:44:08.203390","95","Application Data"
"2016-09-27 02:44:08.453010","54","53074  >  443 [ACK] Seq=4872 Ack=4712 Win=21904 Len=0"
"2016-09-27 02:44:38.176675","54","53074  >  443 [ACK] Seq=4872 Ack=4753 Win=21904 Len=0"
"2016-09-27 02:44:38.176785","95","Application Data"
"2016-09-27 02:45:08.203954","95","Application Data"
"2016-09-27 02:45:08.453443","54","53074  >  443 [ACK] Seq=4954 Ack=4794 Win=21904 Len=0"
"2016-09-27 02:45:38.180537","54","53074  >  443 [ACK] Seq=4954 Ack=4835 Win=21904 Len=0"
"2016-09-27 02:45:38.180649","95","Application Data"
"2016-09-27 02:46:08.211040","95","Application Data"
"2016-09-27 02:46:08.905728","54","53074  >  443 [ACK] Seq=5036 Ack=4876 Win=21904 Len=0"
"2016-09-27 02:46:26.215613","54","53074  >  443 [ACK] Seq=5036 Ack=5247 Win=24832 Len=0"
"2016-09-27 02:46:26.664561","210","Application Data"
"2016-09-27 02:46:26.882510","54","53074  >  443 [ACK] Seq=5192 Ack=5420 Win=27744 Len=0"
"2016-09-27 02:46:28.852297","201","Application Data"
"2016-09-27 02:46:28.999201","336","Application Data"
"2016-09-27 02:46:38.175676","54","53074  >  443 [ACK] Seq=5621 Ack=5461 Win=27744 Len=0"
"2016-09-27 02:46:38.176834","95","Application Data"
"2016-09-27 02:47:08.205531","95","Application Data"
"2016-09-27 02:47:08.453772","54","53074  >  443 [ACK] Seq=5703 Ack=5502 Win=27744 Len=0"
"2016-09-27 02:47:38.179988","54","53074  >  443 [ACK] Seq=5703 Ack=5543 Win=27744 Len=0"
"2016-09-27 02:47:38.180109","95","Application Data"
"2016-09-27 02:48:08.210365","95","Application Data"
"2016-09-27 02:48:08.463893","54","53074  >  443 [ACK] Seq=5785 Ack=5584 Win=27744 Len=0"
"2016-09-27 02:48:38.449642","95","Application Data"
"2016-09-27 02:48:38.624335","54","53074  >  443 [ACK] Seq=5826 Ack=5625 Win=27744 Len=0"
"2016-09-27 02:48:38.624881","95","Application Data"
"2016-09-27 02:48:38.874283","54","53074  >  443 [ACK] Seq=5867 Ack=5666 Win=27744 Len=0"
"2016-09-27 02:49:08.862579","95","Application Data"
"2016-09-27 02:49:09.073798","54","53074  >  443 [ACK] Seq=5908 Ack=5707 Win=27744 Len=0"
"2016-09-27 02:49:38.181453","54","53074  >  443 [ACK] Seq=5908 Ack=5748 Win=27744 Len=0"
"2016-09-27 02:49:38.181570","95","Application Data"
"2016-09-27 02:50:08.209050","95","Application Data"
"2016-09-27 02:50:08.467619","54","53074  >  443 [ACK] Seq=5990 Ack=5789 Win=27744 Len=0"
"2016-09-27 02:50:38.174633","54","53074  >  443 [ACK] Seq=5990 Ack=5830 Win=27744 Len=0"
"2016-09-27 02:50:38.175177","95","Application Data"
"2016-09-27 02:50:53.613118","224","Application Data"
"2016-09-27 02:51:23.643371","95","Application Data"
"2016-09-27 02:51:23.889142","54","53074  >  443 [ACK] Seq=6242 Ack=5871 Win=27744 Len=0"
"2016-09-27 02:51:38.182561","54","53074  >  443 [ACK] Seq=6242 Ack=5912 Win=27744 Len=0"
"2016-09-27 02:51:38.183155","95","Application Data"
"2016-09-27 02:52:08.214613","95","Application Data"
"2016-09-27 02:52:08.467265","54","53074  >  443 [ACK] Seq=6324 Ack=5953 Win=27744 Len=0"
"2016-09-27 02:52:38.184266","54","53074  >  443 [ACK] Seq=6324 Ack=5994 Win=27744 Len=0"
"2016-09-27 02:52:38.184690","95","Application Data"
"2016-09-27 02:53:08.206216","95","Application Data"
"2016-09-27 02:53:08.459156","54","53074  >  443 [ACK] Seq=6406 Ack=6035 Win=27744 Len=0"
"2016-09-27 02:53:38.174881","54","53074  >  443 [ACK] Seq=6406 Ack=6076 Win=27744 Len=0"
"2016-09-27 02:53:38.174991","95","Application Data"
"2016-09-27 02:54:08.204955","95","Application Data"
"2016-09-27 02:54:08.454985","54","53074  >  443 [ACK] Seq=6488 Ack=6117 Win=27744 Len=0"
"2016-09-27 02:54:38.174727","54","53074  >  443 [ACK] Seq=6488 Ack=6158 Win=27744 Len=0"
"2016-09-27 02:54:38.174836","95","Application Data"
"2016-09-27 02:55:08.202142","95","Application Data"
"2016-09-27 02:55:08.462634","54","53074  >  443 [ACK] Seq=6570 Ack=6199 Win=27744 Len=0"
"2016-09-27 02:55:38.174445","54","53074  >  443 [ACK] Seq=6570 Ack=6240 Win=27744 Len=0"
"2016-09-27 02:55:38.174552","95","Application Data"
"2016-09-27 02:56:08.201453","95","Application Data"
"2016-09-27 02:56:08.450697","54","53074  >  443 [ACK] Seq=6652 Ack=6281 Win=27744 Len=0"
"2016-09-27 02:56:38.173866","54","53074  >  443 [ACK] Seq=6652 Ack=6322 Win=27744 Len=0"
"2016-09-27 02:56:38.173969","95","Application Data"
"2016-09-27 02:57:08.197731","95","Application Data"
"2016-09-27 02:57:08.442723","54","53074  >  443 [ACK] Seq=6734 Ack=6363 Win=27744 Len=0"
"2016-09-27 02:57:38.210299","54","53074  >  443 [ACK] Seq=6734 Ack=6404 Win=27744 Len=0"
"2016-09-27 02:57:38.210411","95","Application Data"
"2016-09-27 02:58:08.240157","95","Application Data"
"2016-09-27 02:58:08.489404","54","53074  >  443 [ACK] Seq=6816 Ack=6445 Win=27744 Len=0"
"2016-09-27 02:58:38.176731","54","53074  >  443 [ACK] Seq=6816 Ack=6486 Win=27744 Len=0"
"2016-09-27 02:58:38.176849","95","Application Data"
"2016-09-27 02:59:08.204483","95","Application Data"
"2016-09-27 02:59:08.457951","54","53074  >  443 [ACK] Seq=6898 Ack=6527 Win=27744 Len=0"
"2016-09-27 02:59:38.181570","54","53074  >  443 [ACK] Seq=6898 Ack=6568 Win=27744 Len=0"
"2016-09-27 02:59:38.181689","95","Application Data"
"2016-09-27 03:00:08.209430","95","Application Data"
"2016-09-27 03:00:08.465569","54","53074  >  443 [ACK] Seq=6980 Ack=6609 Win=27744 Len=0"
"2016-09-27 03:00:38.182276","54","53074  >  443 [ACK] Seq=6980 Ack=6650 Win=27744 Len=0"
"2016-09-27 03:00:38.182396","95","Application Data"
"2016-09-27 03:01:08.219941","95","Application Data"
"2016-09-27 03:01:08.473157","54","53074  >  443 [ACK] Seq=7062 Ack=6691 Win=27744 Len=0"
"2016-09-27 03:01:38.180424","54","53074  >  443 [ACK] Seq=7062 Ack=6732 Win=27744 Len=0"
"2016-09-27 03:01:38.180947","95","Application Data"
"2016-09-27 03:02:08.210087","95","Application Data"
"2016-09-27 03:02:08.465308","54","53074  >  443 [ACK] Seq=7144 Ack=6773 Win=27744 Len=0"
"2016-09-27 03:02:38.458076","95","Application Data"
"2016-09-27 03:02:38.648902","54","53074  >  443 [ACK] Seq=7185 Ack=6814 Win=27744 Len=0"
"2016-09-27 03:02:38.649422","95","Application Data"
"2016-09-27 03:02:38.910421","54","53074  >  443 [ACK] Seq=7226 Ack=6855 Win=27744 Len=0"
"2016-09-27 03:03:08.903485","95","Application Data"
"2016-09-27 03:03:09.114094","54","53074  >  443 [ACK] Seq=7267 Ack=6896 Win=27744 Len=0"
"2016-09-27 03:03:38.173623","54","53074  >  443 [ACK] Seq=7267 Ack=6937 Win=27744 Len=0"
"2016-09-27 03:03:38.173733","95","Application Data"
"2016-09-27 03:04:08.201102","95","Application Data"
"2016-09-27 03:04:08.472981","54","53074  >  443 [ACK] Seq=7349 Ack=6978 Win=27744 Len=0"
"2016-09-27 03:04:38.177663","54","53074  >  443 [ACK] Seq=7349 Ack=7019 Win=27744 Len=0"
"2016-09-27 03:04:38.177776","95","Application Data"
"2016-09-27 03:05:08.207646","95","Application Data"
"2016-09-27 03:05:08.460712","54","53074  >  443 [ACK] Seq=7431 Ack=7060 Win=27744 Len=0"
"2016-09-27 03:05:38.450195","95","Application Data"
"2016-09-27 03:05:38.640642","54","53074  >  443 [ACK] Seq=7472 Ack=7101 Win=27744 Len=0"
"2016-09-27 03:05:38.641181","95","Application Data"
"2016-09-27 03:05:38.891056","54","53074  >  443 [ACK] Seq=7513 Ack=7142 Win=27744 Len=0"
"2016-09-27 03:06:08.882381","95","Application Data"
"2016-09-27 03:06:09.097842","54","53074  >  443 [ACK] Seq=7554 Ack=7183 Win=27744 Len=0"
"2016-09-27 03:06:38.175559","54","53074  >  443 [ACK] Seq=7554 Ack=7224 Win=27744 Len=0"
"2016-09-27 03:06:38.176094","95","Application Data"
"2016-09-27 03:07:08.204985","95","Application Data"
"2016-09-27 03:07:08.460326","54","53074  >  443 [ACK] Seq=7636 Ack=7265 Win=27744 Len=0"
"2016-09-27 03:07:38.177126","54","53074  >  443 [ACK] Seq=7636 Ack=7306 Win=27744 Len=0"
"2016-09-27 03:07:38.177244","95","Application Data"
"2016-09-27 03:08:08.207745","95","Application Data"
"2016-09-27 03:08:08.457338","54","53074  >  443 [ACK] Seq=7718 Ack=7347 Win=27744 Len=0"
"2016-09-27 03:08:38.449319","95","Application Data"
"2016-09-27 03:08:38.636968","54","53074  >  443 [ACK] Seq=7759 Ack=7388 Win=27744 Len=0"
"2016-09-27 03:08:38.637743","95","Application Data"
"2016-09-27 03:08:38.886923","54","53074  >  443 [ACK] Seq=7800 Ack=7429 Win=27744 Len=0"
"2016-09-27 03:09:08.877889","95","Application Data"
"2016-09-27 03:09:09.086816","54","53074  >  443 [ACK] Seq=7841 Ack=7470 Win=27744 Len=0"
"2016-09-27 03:09:38.637210","54","53074  >  443 [ACK] Seq=7841 Ack=7511 Win=27744 Len=0"
"2016-09-27 03:09:38.638136","95","Application Data"
"2016-09-27 03:10:08.667993","95","Application Data"
"2016-09-27 03:10:08.919361","54","53074  >  443 [ACK] Seq=7923 Ack=7552 Win=27744 Len=0"
"2016-09-27 03:10:38.177039","54","53074  >  443 [ACK] Seq=7923 Ack=7593 Win=27744 Len=0"
"2016-09-27 03:10:38.177147","95","Application Data"
"2016-09-27 03:11:08.205010","95","Application Data"
"2016-09-27 03:11:08.464149","54","53074  >  443 [ACK] Seq=8005 Ack=7634 Win=27744 Len=0"
"2016-09-27 03:11:38.179589","54","53074  >  443 [ACK] Seq=8005 Ack=7675 Win=27744 Len=0"
"2016-09-27 03:11:38.180123","95","Application Data"
"2016-09-27 03:12:08.208802","95","Application Data"
"2016-09-27 03:12:08.464421","54","53074  >  443 [ACK] Seq=8087 Ack=7716 Win=27744 Len=0"
"2016-09-27 03:12:38.171636","54","53074  >  443 [ACK] Seq=8087 Ack=7757 Win=27744 Len=0"
"2016-09-27 03:12:38.172180","95","Application Data"
"2016-09-27 03:13:08.194973","95","Application Data"
"2016-09-27 03:13:08.446731","54","53074  >  443 [ACK] Seq=8169 Ack=7798 Win=27744 Len=0"
"2016-09-27 03:13:38.179829","54","53074  >  443 [ACK] Seq=8169 Ack=7839 Win=27744 Len=0"
"2016-09-27 03:13:38.179960","95","Application Data"
"2016-09-27 03:14:08.214795","95","Application Data"
