"2016-09-27 00:10:41.631761","74","51573  >  443 [SYN] Seq=0 Win=4380 Len=0 MSS=1460 SACK_PERM=1 TSval=52762738 TSecr=0 WS=16"
"2016-09-27 00:10:41.847014","54","51573  >  443 [ACK] Seq=1 Ack=1 Win=4384 Len=0"
"2016-09-27 00:10:41.960906","371","Client Hello"
"2016-09-27 00:10:42.208694","54","51573  >  443 [ACK] Seq=318 Ack=1461 Win=7312 Len=0"
"2016-09-27 00:10:42.208812","54","51573  >  443 [ACK] Seq=318 Ack=2921 Win=10224 Len=0"
"2016-09-27 00:10:42.208874","54","51573  >  443 [ACK] Seq=318 Ack=3294 Win=13152 Len=0"
"2016-09-27 00:10:42.229087","180","Client Key Exchange"
"2016-09-27 00:10:42.444398","54","51573  >  443 [ACK] Seq=444 Ack=3345 Win=13152 Len=0"
"2016-09-27 00:10:42.494588","1514","51573  >  443 [ACK] Seq=444 Ack=3345 Win=13152 Len=1460 [TCP segment of a reassembled PDU]"
"2016-09-27 00:10:42.494706","429","Application Data"
"2016-09-27 00:10:42.806936","54","51573  >  443 [ACK] Seq=2279 Ack=3688 Win=16064 Len=0"
"2016-09-27 00:10:42.817924","54","51573  >  443 [ACK] Seq=2279 Ack=3883 Win=18992 Len=0"
"2016-09-27 00:10:42.876516","54","51573  >  443 [ACK] Seq=2279 Ack=4053 Win=21904 Len=0"
"2016-09-27 00:10:42.922608","206","Application Data"
"2016-09-27 00:10:42.989924","251","Application Data"
"2016-09-27 00:10:43.012344","274","Application Data"
"2016-09-27 00:10:43.014947","368","Application Data"
"2016-09-27 00:10:43.018712","548","Application Data"
"2016-09-27 00:10:43.028905","182","Application Data"
"2016-09-27 00:10:43.170351","189","Application Data"
"2016-09-27 00:10:43.172936","365","Application Data"
"2016-09-27 00:10:47.446646","54","51573  >  443 [ACK] Seq=4230 Ack=4094 Win=21904 Len=0"
"2016-09-27 00:10:47.447590","95","Application Data"
"2016-09-27 00:11:17.477138","95","Application Data"
"2016-09-27 00:11:17.731448","54","51573  >  443 [ACK] Seq=4312 Ack=4135 Win=21904 Len=0"
"2016-09-27 00:11:47.447291","54","51573  >  443 [ACK] Seq=4312 Ack=4176 Win=21904 Len=0"
"2016-09-27 00:11:47.447395","95","Application Data"
"2016-09-27 00:12:17.476096","95","Application Data"
"2016-09-27 00:12:17.731419","54","51573  >  443 [ACK] Seq=4394 Ack=4217 Win=21904 Len=0"
"2016-09-27 00:12:47.594617","54","51573  >  443 [ACK] Seq=4394 Ack=4258 Win=21904 Len=0"
"2016-09-27 00:12:47.595310","95","Application Data"
"2016-09-27 00:13:17.620479","95","Application Data"
"2016-09-27 00:13:17.867868","54","51573  >  443 [ACK] Seq=4476 Ack=4299 Win=21904 Len=0"
"2016-09-27 00:13:47.439165","54","51573  >  443 [ACK] Seq=4476 Ack=4340 Win=21904 Len=0"
"2016-09-27 00:13:47.439271","95","Application Data"
"2016-09-27 00:14:17.469817","95","Application Data"
"2016-09-27 00:14:17.719192","54","51573  >  443 [ACK] Seq=4558 Ack=4381 Win=21904 Len=0"
"2016-09-27 00:14:47.442369","54","51573  >  443 [ACK] Seq=4558 Ack=4422 Win=21904 Len=0"
"2016-09-27 00:14:47.443548","95","Application Data"
"2016-09-27 00:15:17.471523","95","Application Data"
"2016-09-27 00:15:17.727154","54","51573  >  443 [ACK] Seq=4640 Ack=4463 Win=21904 Len=0"
"2016-09-27 00:15:47.443016","54","51573  >  443 [ACK] Seq=4640 Ack=4504 Win=21904 Len=0"
"2016-09-27 00:15:47.443620","95","Application Data"
"2016-09-27 00:16:17.473398","95","Application Data"
"2016-09-27 00:16:17.723017","54","51573  >  443 [ACK] Seq=4722 Ack=4545 Win=21904 Len=0"
"2016-09-27 00:16:47.714283","95","Application Data"
"2016-09-27 00:16:47.910764","54","51573  >  443 [ACK] Seq=4763 Ack=4586 Win=21904 Len=0"
"2016-09-27 00:16:47.911252","95","Application Data"
"2016-09-27 00:16:48.160423","54","51573  >  443 [ACK] Seq=4804 Ack=4627 Win=21904 Len=0"
"2016-09-27 00:17:18.151743","95","Application Data"
"2016-09-27 00:17:18.360992","54","51573  >  443 [ACK] Seq=4845 Ack=4668 Win=21904 Len=0"
"2016-09-27 00:17:38.387220","54","51573  >  443 [ACK] Seq=4845 Ack=5039 Win=24832 Len=0"
"2016-09-27 00:17:38.844337","211","Application Data"
"2016-09-27 00:17:39.066856","54","51573  >  443 [ACK] Seq=5002 Ack=5207 Win=27744 Len=0"
"2016-09-27 00:17:41.011096","359","Application Data"
"2016-09-27 00:17:41.144233","179","Application Data"
"2016-09-27 00:17:47.450368","54","51573  >  443 [ACK] Seq=5432 Ack=5248 Win=27744 Len=0"
"2016-09-27 00:17:47.450481","95","Application Data"
"2016-09-27 00:18:17.476986","95","Application Data"
"2016-09-27 00:18:17.726568","54","51573  >  443 [ACK] Seq=5514 Ack=5289 Win=27744 Len=0"
"2016-09-27 00:18:47.443319","54","51573  >  443 [ACK] Seq=5514 Ack=5330 Win=27744 Len=0"
"2016-09-27 00:18:47.443431","95","Application Data"
"2016-09-27 00:19:17.472995","95","Application Data"
"2016-09-27 00:19:17.722467","54","51573  >  443 [ACK] Seq=5596 Ack=5371 Win=27744 Len=0"
"2016-09-27 00:19:47.450095","54","51573  >  443 [ACK] Seq=5596 Ack=5412 Win=27744 Len=0"
"2016-09-27 00:19:47.450208","95","Application Data"
"2016-09-27 00:20:17.480572","95","Application Data"
"2016-09-27 00:20:17.730149","54","51573  >  443 [ACK] Seq=5678 Ack=5453 Win=27744 Len=0"
"2016-09-27 00:20:47.449168","54","51573  >  443 [ACK] Seq=5678 Ack=5494 Win=27744 Len=0"
"2016-09-27 00:20:47.451633","95","Application Data"
"2016-09-27 00:21:17.479407","95","Application Data"
"2016-09-27 00:21:17.917539","95","[TCP Spurious Retransmission] "
"2016-09-27 00:21:18.190664","54","51573  >  443 [ACK] Seq=5760 Ack=5535 Win=27744 Len=0"
"2016-09-27 00:21:47.449729","54","51573  >  443 [ACK] Seq=5760 Ack=5576 Win=27744 Len=0"
"2016-09-27 00:21:47.449844","95","Application Data"
"2016-09-27 00:22:17.480109","95","Application Data"
"2016-09-27 00:22:17.729819","54","51573  >  443 [ACK] Seq=5842 Ack=5617 Win=27744 Len=0"
"2016-09-27 00:22:47.444906","54","51573  >  443 [ACK] Seq=5842 Ack=5658 Win=27744 Len=0"
"2016-09-27 00:22:47.445488","95","Application Data"
"2016-09-27 00:23:17.472245","95","Application Data"
"2016-09-27 00:23:17.721986","54","51573  >  443 [ACK] Seq=5924 Ack=5699 Win=27744 Len=0"
"2016-09-27 00:23:47.714321","95","Application Data"
"2016-09-27 00:23:47.897758","54","51573  >  443 [ACK] Seq=5965 Ack=5740 Win=27744 Len=0"
"2016-09-27 00:23:47.898288","95","Application Data"
"2016-09-27 00:23:48.147501","54","51573  >  443 [ACK] Seq=6006 Ack=5781 Win=27744 Len=0"
"2016-09-27 00:24:18.136099","95","Application Data"
"2016-09-27 00:24:18.343702","54","51573  >  443 [ACK] Seq=6047 Ack=5822 Win=27744 Len=0"
"2016-09-27 00:24:47.449321","54","51573  >  443 [ACK] Seq=6047 Ack=5863 Win=27744 Len=0"
"2016-09-27 00:24:47.449439","95","Application Data"
"2016-09-27 00:25:17.476071","95","Application Data"
"2016-09-27 00:25:17.733149","54","51573  >  443 [ACK] Seq=6129 Ack=5904 Win=27744 Len=0"
"2016-09-27 00:25:47.444278","54","51573  >  443 [ACK] Seq=6129 Ack=5945 Win=27744 Len=0"
"2016-09-27 00:25:47.444796","95","Application Data"
"2016-09-27 00:26:17.475162","95","Application Data"
"2016-09-27 00:26:17.729033","54","51573  >  443 [ACK] Seq=6211 Ack=5986 Win=27744 Len=0"
"2016-09-27 00:26:47.444762","54","51573  >  443 [ACK] Seq=6211 Ack=6027 Win=27744 Len=0"
"2016-09-27 00:26:47.444870","95","Application Data"
"2016-09-27 00:27:17.475184","95","Application Data"
"2016-09-27 00:27:17.728309","54","51573  >  443 [ACK] Seq=6293 Ack=6068 Win=27744 Len=0"
"2016-09-27 00:27:47.444954","54","51573  >  443 [ACK] Seq=6293 Ack=6109 Win=27744 Len=0"
"2016-09-27 00:27:47.445074","95","Application Data"
"2016-09-27 00:28:17.475239","95","Application Data"
"2016-09-27 00:28:17.724878","54","51573  >  443 [ACK] Seq=6375 Ack=6150 Win=27744 Len=0"
"2016-09-27 00:28:47.440607","54","51573  >  443 [ACK] Seq=6375 Ack=6191 Win=27744 Len=0"
"2016-09-27 00:28:47.440719","95","Application Data"
"2016-09-27 00:29:17.466337","95","Application Data"
"2016-09-27 00:29:17.712919","54","51573  >  443 [ACK] Seq=6457 Ack=6232 Win=27744 Len=0"
"2016-09-27 00:29:47.705063","95","Application Data"
"2016-09-27 00:29:47.900654","54","51573  >  443 [ACK] Seq=6498 Ack=6273 Win=27744 Len=0"
"2016-09-27 00:29:47.901048","95","Application Data"
"2016-09-27 00:29:48.162048","54","51573  >  443 [ACK] Seq=6539 Ack=6314 Win=27744 Len=0"
"2016-09-27 00:30:18.160382","95","Application Data"
"2016-09-27 00:30:18.830217","54","51573  >  443 [ACK] Seq=6580 Ack=6355 Win=27744 Len=0"
"2016-09-27 00:30:47.448345","54","51573  >  443 [ACK] Seq=6580 Ack=6396 Win=27744 Len=0"
"2016-09-27 00:30:47.448856","95","Application Data"
"2016-09-27 00:31:17.480271","95","Application Data"
"2016-09-27 00:31:17.728176","54","51573  >  443 [ACK] Seq=6662 Ack=6437 Win=27744 Len=0"
"2016-09-27 00:31:47.444245","54","51573  >  443 [ACK] Seq=6662 Ack=6478 Win=27744 Len=0"
"2016-09-27 00:31:47.444367","95","Application Data"
"2016-09-27 00:32:17.474610","95","Application Data"
"2016-09-27 00:32:17.724099","54","51573  >  443 [ACK] Seq=6744 Ack=6519 Win=27744 Len=0"
"2016-09-27 00:32:47.444121","54","51573  >  443 [ACK] Seq=6744 Ack=6560 Win=27744 Len=0"
"2016-09-27 00:32:47.444232","95","Application Data"
"2016-09-27 00:33:17.474379","95","Application Data"
"2016-09-27 00:33:17.723981","54","51573  >  443 [ACK] Seq=6826 Ack=6601 Win=27744 Len=0"
"2016-09-27 00:33:47.446829","54","51573  >  443 [ACK] Seq=6826 Ack=6642 Win=27744 Len=0"
"2016-09-27 00:33:47.447368","95","Application Data"
"2016-09-27 00:34:17.475687","95","Application Data"
"2016-09-27 00:34:17.734574","54","51573  >  443 [ACK] Seq=6908 Ack=6683 Win=27744 Len=0"
"2016-09-27 00:34:47.448152","54","51573  >  443 [ACK] Seq=6908 Ack=6724 Win=27744 Len=0"
"2016-09-27 00:34:47.448264","95","Application Data"
"2016-09-27 00:35:17.478584","95","Application Data"
"2016-09-27 00:35:17.728236","54","51573  >  443 [ACK] Seq=6990 Ack=6765 Win=27744 Len=0"
"2016-09-27 00:35:47.446389","54","51573  >  443 [ACK] Seq=6990 Ack=6806 Win=27744 Len=0"
"2016-09-27 00:35:47.446952","95","Application Data"
"2016-09-27 00:36:17.477610","95","Application Data"
"2016-09-27 00:36:17.918687","95","[TCP Spurious Retransmission] "
"2016-09-27 00:36:18.184303","54","51573  >  443 [ACK] Seq=7072 Ack=6847 Win=27744 Len=0"
"2016-09-27 00:36:47.447175","54","51573  >  443 [ACK] Seq=7072 Ack=6888 Win=27744 Len=0"
"2016-09-27 00:36:47.447290","95","Application Data"
"2016-09-27 00:37:17.474611","95","Application Data"
"2016-09-27 00:37:17.723198","54","51573  >  443 [ACK] Seq=7154 Ack=6929 Win=27744 Len=0"
"2016-09-27 00:37:47.439884","54","51573  >  443 [ACK] Seq=7154 Ack=6970 Win=27744 Len=0"
"2016-09-27 00:37:47.440004","95","Application Data"
"2016-09-27 00:38:17.469518","95","Application Data"
"2016-09-27 00:38:17.722971","54","51573  >  443 [ACK] Seq=7236 Ack=7011 Win=27744 Len=0"
"2016-09-27 00:38:47.445943","54","51573  >  443 [ACK] Seq=7236 Ack=7052 Win=27744 Len=0"
"2016-09-27 00:38:47.446550","95","Application Data"
"2016-09-27 00:39:17.476156","95","Application Data"
"2016-09-27 00:39:18.183807","54","51573  >  443 [ACK] Seq=7318 Ack=7093 Win=27744 Len=0"
"2016-09-27 00:39:47.446489","54","51573  >  443 [ACK] Seq=7318 Ack=7134 Win=27744 Len=0"
"2016-09-27 00:39:47.447649","95","Application Data"
"2016-09-27 00:40:17.476907","95","Application Data"
"2016-09-27 00:40:17.722634","54","51573  >  443 [ACK] Seq=7400 Ack=7175 Win=27744 Len=0"
"2016-09-27 00:40:47.449385","54","51573  >  443 [ACK] Seq=7400 Ack=7216 Win=27744 Len=0"
"2016-09-27 00:40:47.449909","95","Application Data"
"2016-09-27 00:41:17.477110","95","Application Data"
"2016-09-27 00:41:17.730344","54","51573  >  443 [ACK] Seq=7482 Ack=7257 Win=27744 Len=0"
"2016-09-27 00:41:47.451057","54","51573  >  443 [ACK] Seq=7482 Ack=7298 Win=27744 Len=0"
"2016-09-27 00:41:47.451176","95","Application Data"
"2016-09-27 00:42:17.480773","95","Application Data"
"2016-09-27 00:42:17.726183","54","51573  >  443 [ACK] Seq=7564 Ack=7339 Win=27744 Len=0"
"2016-09-27 00:42:47.715017","95","Application Data"
"2016-09-27 00:42:47.923338","54","51573  >  443 [ACK] Seq=7605 Ack=7380 Win=27744 Len=0"
"2016-09-27 00:42:47.923446","95","Application Data"
"2016-09-27 00:42:48.171420","54","51573  >  443 [ACK] Seq=7646 Ack=7421 Win=27744 Len=0"
"2016-09-27 00:43:18.161310","95","Application Data"
"2016-09-27 00:43:18.378760","54","51573  >  443 [ACK] Seq=7687 Ack=7462 Win=27744 Len=0"
"2016-09-27 00:43:47.450155","54","51573  >  443 [ACK] Seq=7687 Ack=7503 Win=27744 Len=0"
"2016-09-27 00:43:47.450285","95","Application Data"
"2016-09-27 00:44:17.476057","95","Application Data"
"2016-09-27 00:44:18.190685","54","51573  >  443 [ACK] Seq=7769 Ack=7544 Win=27744 Len=0"
"2016-09-27 00:44:48.179261","95","Application Data"
"2016-09-27 00:44:48.365265","54","51573  >  443 [ACK] Seq=7810 Ack=7585 Win=27744 Len=0"
"2016-09-27 00:44:48.365383","95","Application Data"
"2016-09-27 00:44:48.612443","54","51573  >  443 [ACK] Seq=7851 Ack=7626 Win=27744 Len=0"
"2016-09-27 00:45:18.601115","95","Application Data"
"2016-09-27 00:45:18.812434","54","51573  >  443 [ACK] Seq=7892 Ack=7667 Win=27744 Len=0"
"2016-09-27 00:45:47.445998","54","51573  >  443 [ACK] Seq=7892 Ack=7708 Win=27744 Len=0"
"2016-09-27 00:45:47.447779","95","Application Data"
"2016-09-27 00:46:17.475108","95","Application Data"
"2016-09-27 00:46:17.729316","54","51573  >  443 [ACK] Seq=7974 Ack=7749 Win=27744 Len=0"
"2016-09-27 00:46:47.441349","54","51573  >  443 [ACK] Seq=7974 Ack=7790 Win=27744 Len=0"
"2016-09-27 00:46:47.441471","95","Application Data"
"2016-09-27 00:47:17.469588","95","Application Data"
"2016-09-27 00:47:17.721360","54","51573  >  443 [ACK] Seq=8056 Ack=7831 Win=27744 Len=0"
"2016-09-27 00:47:47.448210","54","51573  >  443 [ACK] Seq=8056 Ack=7872 Win=27744 Len=0"
"2016-09-27 00:47:47.448796","95","Application Data"
"2016-09-27 00:48:17.477872","95","Application Data"
"2016-09-27 00:48:17.728978","54","51573  >  443 [ACK] Seq=8138 Ack=7913 Win=27744 Len=0"
"2016-09-27 00:48:47.448453","54","51573  >  443 [ACK] Seq=8138 Ack=7954 Win=27744 Len=0"
"2016-09-27 00:48:47.448572","95","Application Data"
"2016-09-27 00:49:17.475242","95","Application Data"
"2016-09-27 00:49:17.721006","54","51573  >  443 [ACK] Seq=8220 Ack=7995 Win=27744 Len=0"
"2016-09-27 00:49:47.448439","54","51573  >  443 [ACK] Seq=8220 Ack=8036 Win=27744 Len=0"
"2016-09-27 00:49:47.448563","95","Application Data"
"2016-09-27 00:50:17.481342","95","Application Data"
"2016-09-27 00:50:17.738187","54","51573  >  443 [ACK] Seq=8302 Ack=8077 Win=27744 Len=0"
"2016-09-27 00:50:47.451523","54","51573  >  443 [ACK] Seq=8302 Ack=8118 Win=27744 Len=0"
"2016-09-27 00:50:47.452076","95","Application Data"
"2016-09-27 00:50:53.612226","221","Application Data"
"2016-09-27 00:51:23.642087","95","Application Data"
"2016-09-27 00:51:23.896366","54","51573  >  443 [ACK] Seq=8551 Ack=8159 Win=27744 Len=0"
"2016-09-27 00:51:47.447494","54","51573  >  443 [ACK] Seq=8551 Ack=8200 Win=27744 Len=0"
"2016-09-27 00:51:47.448058","95","Application Data"
"2016-09-27 00:52:17.473237","95","Application Data"
"2016-09-27 00:52:17.728795","54","51573  >  443 [ACK] Seq=8633 Ack=8241 Win=27744 Len=0"
"2016-09-27 00:52:47.447909","54","51573  >  443 [ACK] Seq=8633 Ack=8282 Win=27744 Len=0"
"2016-09-27 00:52:47.448024","95","Application Data"
"2016-09-27 00:53:17.477179","95","Application Data"
"2016-09-27 00:53:17.724188","54","51573  >  443 [ACK] Seq=8715 Ack=8323 Win=27744 Len=0"
"2016-09-27 00:53:47.448439","54","51573  >  443 [ACK] Seq=8715 Ack=8364 Win=27744 Len=0"
"2016-09-27 00:53:47.448905","95","Application Data"
"2016-09-27 00:54:17.476010","95","Application Data"
"2016-09-27 00:54:18.181057","54","51573  >  443 [ACK] Seq=8797 Ack=8405 Win=27744 Len=0"
"2016-09-27 00:54:47.447638","54","51573  >  443 [ACK] Seq=8797 Ack=8446 Win=27744 Len=0"
"2016-09-27 00:54:47.447756","95","Application Data"
"2016-09-27 00:55:17.477456","95","Application Data"
"2016-09-27 00:55:17.727793","54","51573  >  443 [ACK] Seq=8879 Ack=8487 Win=27744 Len=0"
"2016-09-27 00:55:47.450557","54","51573  >  443 [ACK] Seq=8879 Ack=8528 Win=27744 Len=0"
"2016-09-27 00:55:47.451095","95","Application Data"
"2016-09-27 00:56:17.478306","95","Application Data"
"2016-09-27 00:56:17.731646","54","51573  >  443 [ACK] Seq=8961 Ack=8569 Win=27744 Len=0"
"2016-09-27 00:56:47.449385","54","51573  >  443 [ACK] Seq=8961 Ack=8610 Win=27744 Len=0"
"2016-09-27 00:56:47.450095","95","Application Data"
"2016-09-27 00:57:17.487018","95","Application Data"
"2016-09-27 00:57:17.924580","95","[TCP Spurious Retransmission] "
"2016-09-27 00:57:18.197955","54","51573  >  443 [ACK] Seq=9043 Ack=8651 Win=27744 Len=0"
"2016-09-27 00:57:47.449021","54","51573  >  443 [ACK] Seq=9043 Ack=8692 Win=27744 Len=0"
"2016-09-27 00:57:47.449165","95","Application Data"
"2016-09-27 00:58:17.480058","95","Application Data"
"2016-09-27 00:58:17.732897","54","51573  >  443 [ACK] Seq=9125 Ack=8733 Win=27744 Len=0"
"2016-09-27 00:58:47.721544","95","Application Data"
"2016-09-27 00:58:47.893418","54","51573  >  443 [ACK] Seq=9166 Ack=8774 Win=27744 Len=0"
"2016-09-27 00:58:47.893522","95","Application Data"
"2016-09-27 00:58:48.145148","54","51573  >  443 [ACK] Seq=9207 Ack=8815 Win=27744 Len=0"
"2016-09-27 00:59:18.134775","95","Application Data"
"2016-09-27 00:59:18.346758","54","51573  >  443 [ACK] Seq=9248 Ack=8856 Win=27744 Len=0"
"2016-09-27 00:59:47.446011","54","51573  >  443 [ACK] Seq=9248 Ack=8897 Win=27744 Len=0"
"2016-09-27 00:59:47.446131","95","Application Data"
"2016-09-27 01:00:17.474077","95","Application Data"
"2016-09-27 01:00:17.915336","95","[TCP Spurious Retransmission] "
"2016-09-27 01:00:18.170021","54","51573  >  443 [ACK] Seq=9330 Ack=8938 Win=27744 Len=0"
"2016-09-27 01:00:47.450068","54","51573  >  443 [ACK] Seq=9330 Ack=8979 Win=27744 Len=0"
"2016-09-27 01:00:47.450694","95","Application Data"
"2016-09-27 01:01:17.474789","95","Application Data"
"2016-09-27 01:01:18.177689","54","51573  >  443 [ACK] Seq=9412 Ack=9020 Win=27744 Len=0"
"2016-09-27 01:01:47.449408","54","51573  >  443 [ACK] Seq=9412 Ack=9061 Win=27744 Len=0"
"2016-09-27 01:01:47.450141","95","Application Data"
"2016-09-27 01:02:17.478391","95","Application Data"
"2016-09-27 01:02:17.732196","54","51573  >  443 [ACK] Seq=9494 Ack=9102 Win=27744 Len=0"
"2016-09-27 01:02:47.444030","54","51573  >  443 [ACK] Seq=9494 Ack=9143 Win=27744 Len=0"
"2016-09-27 01:02:47.444138","95","Application Data"
"2016-09-27 01:03:17.473852","95","Application Data"
"2016-09-27 01:03:17.720369","54","51573  >  443 [ACK] Seq=9576 Ack=9184 Win=27744 Len=0"
"2016-09-27 01:03:47.439887","54","51573  >  443 [ACK] Seq=9576 Ack=9225 Win=27744 Len=0"
"2016-09-27 01:03:47.440006","95","Application Data"
"2016-09-27 01:04:17.470179","95","Application Data"
"2016-09-27 01:04:17.911570","95","[TCP Spurious Retransmission] "
"2016-09-27 01:04:18.177201","54","51573  >  443 [ACK] Seq=9658 Ack=9266 Win=27744 Len=0"
"2016-09-27 01:04:47.443887","54","51573  >  443 [ACK] Seq=9658 Ack=9307 Win=27744 Len=0"
"2016-09-27 01:04:47.444007","95","Application Data"
"2016-09-27 01:05:17.470354","95","Application Data"
"2016-09-27 01:05:17.915298","95","[TCP Spurious Retransmission] "
"2016-09-27 01:05:18.173108","54","51573  >  443 [ACK] Seq=9740 Ack=9348 Win=27744 Len=0"
"2016-09-27 01:05:47.441638","54","51573  >  443 [ACK] Seq=9740 Ack=9389 Win=27744 Len=0"
"2016-09-27 01:05:47.442249","95","Application Data"
"2016-09-27 01:06:17.470100","95","Application Data"
"2016-09-27 01:06:17.728821","54","51573  >  443 [ACK] Seq=9822 Ack=9430 Win=27744 Len=0"
"2016-09-27 01:06:47.446468","54","51573  >  443 [ACK] Seq=9822 Ack=9471 Win=27744 Len=0"
"2016-09-27 01:06:47.447016","95","Application Data"
"2016-09-27 01:07:17.477857","95","Application Data"
"2016-09-27 01:07:18.192243","54","51573  >  443 [ACK] Seq=9904 Ack=9512 Win=27744 Len=0"
"2016-09-27 01:07:47.451099","54","51573  >  443 [ACK] Seq=9904 Ack=9553 Win=27744 Len=0"
"2016-09-27 01:07:47.451215","95","Application Data"
"2016-09-27 01:08:17.477653","95","Application Data"
"2016-09-27 01:08:17.727271","54","51573  >  443 [ACK] Seq=9986 Ack=9594 Win=27744 Len=0"
"2016-09-27 01:08:47.443388","54","51573  >  443 [ACK] Seq=9986 Ack=9635 Win=27744 Len=0"
"2016-09-27 01:08:47.443825","95","Application Data"
"2016-09-27 01:09:17.475363","95","Application Data"
"2016-09-27 01:09:17.723198","54","51573  >  443 [ACK] Seq=10068 Ack=9676 Win=27744 Len=0"
"2016-09-27 01:09:47.450205","54","51573  >  443 [ACK] Seq=10068 Ack=9717 Win=27744 Len=0"
"2016-09-27 01:09:47.450737","95","Application Data"
"2016-09-27 01:10:17.479555","95","Application Data"
"2016-09-27 01:10:17.730808","54","51573  >  443 [ACK] Seq=10150 Ack=9758 Win=27744 Len=0"
"2016-09-27 01:10:47.445840","54","51573  >  443 [ACK] Seq=10150 Ack=9799 Win=27744 Len=0"
"2016-09-27 01:10:47.446467","95","Application Data"
"2016-09-27 01:11:17.475415","95","Application Data"
"2016-09-27 01:11:17.734601","54","51573  >  443 [ACK] Seq=10232 Ack=9840 Win=27744 Len=0"
"2016-09-27 01:11:47.449604","54","51573  >  443 [ACK] Seq=10232 Ack=9881 Win=27744 Len=0"
"2016-09-27 01:11:47.450248","95","Application Data"
"2016-09-27 01:12:17.481400","95","Application Data"
"2016-09-27 01:12:17.734570","54","51573  >  443 [ACK] Seq=10314 Ack=9922 Win=27744 Len=0"
"2016-09-27 01:12:47.723869","95","Application Data"
"2016-09-27 01:12:47.902503","54","51573  >  443 [ACK] Seq=10355 Ack=9963 Win=27744 Len=0"
"2016-09-27 01:12:47.903040","95","Application Data"
"2016-09-27 01:12:48.153397","54","51573  >  443 [ACK] Seq=10396 Ack=10004 Win=27744 Len=0"
"2016-09-27 01:13:18.145624","95","Application Data"
"2016-09-27 01:13:18.361257","54","51573  >  443 [ACK] Seq=10437 Ack=10045 Win=27744 Len=0"
"2016-09-27 01:13:47.902955","54","51573  >  443 [ACK] Seq=10437 Ack=10086 Win=27744 Len=0"
"2016-09-27 01:13:47.903067","95","Application Data"
"2016-09-27 01:14:17.933366","95","Application Data"
"2016-09-27 01:14:18.183127","54","51573  >  443 [ACK] Seq=10519 Ack=10127 Win=27744 Len=0"
"2016-09-27 01:14:47.898163","54","51573  >  443 [ACK] Seq=10519 Ack=10168 Win=27744 Len=0"
"2016-09-27 01:14:47.898717","95","Application Data"
"2016-09-27 01:15:17.929879","95","Application Data"
"2016-09-27 01:15:18.183160","54","51573  >  443 [ACK] Seq=10601 Ack=10209 Win=27744 Len=0"
"2016-09-27 01:15:47.441017","54","51573  >  443 [ACK] Seq=10601 Ack=10250 Win=27744 Len=0"
"2016-09-27 01:15:47.441570","95","Application Data"
"2016-09-27 01:16:17.471141","95","Application Data"
"2016-09-27 01:16:17.717995","54","51573  >  443 [ACK] Seq=10683 Ack=10291 Win=27744 Len=0"
"2016-09-27 01:16:47.449525","54","51573  >  443 [ACK] Seq=10683 Ack=10332 Win=27744 Len=0"
"2016-09-27 01:16:47.449627","95","Application Data"
"2016-09-27 01:17:17.475524","95","Application Data"
"2016-09-27 01:17:17.722302","54","51573  >  443 [ACK] Seq=10765 Ack=10373 Win=27744 Len=0"
"2016-09-27 01:17:41.477771","54","51573  >  443 [ACK] Seq=10765 Ack=10574 Win=27744 Len=0"
"2016-09-27 01:17:47.448420","54","51573  >  443 [ACK] Seq=10765 Ack=10615 Win=27744 Len=0"
"2016-09-27 01:17:47.448967","95","Application Data"
"2016-09-27 01:18:17.475875","95","Application Data"
"2016-09-27 01:18:17.725457","54","51573  >  443 [ACK] Seq=10847 Ack=10656 Win=27744 Len=0"
"2016-09-27 01:18:47.441360","54","51573  >  443 [ACK] Seq=10847 Ack=10697 Win=27744 Len=0"
"2016-09-27 01:18:47.441471","95","Application Data"
"2016-09-27 01:19:17.470771","95","Application Data"
"2016-09-27 01:19:17.725262","54","51573  >  443 [ACK] Seq=10929 Ack=10738 Win=27744 Len=0"
"2016-09-27 01:19:47.449563","54","51573  >  443 [ACK] Seq=10929 Ack=10779 Win=27744 Len=0"
"2016-09-27 01:19:47.449676","95","Application Data"
"2016-09-27 01:20:12.134354","85","Encrypted Alert"
"2016-09-27 01:20:12.134474","54","51573  >  443 [FIN"
"2016-09-27 01:20:12.343170","54","51573  >  443 [RST] Seq=11002 Win=0 Len=0"
"2016-09-27 01:20:12.343276","54","51573  >  443 [RST] Seq=11002 Win=0 Len=0"
"2016-09-27 08:35:47.520425","74","37083  >  443 [SYN] Seq=0 Win=4380 Len=0 MSS=1460 SACK_PERM=1 TSval=60521045 TSecr=0 WS=16"
"2016-09-27 08:35:47.741923","54","37083  >  443 [ACK] Seq=1 Ack=1 Win=4384 Len=0"
"2016-09-27 08:35:47.898386","371","Client Hello"
"2016-09-27 08:35:48.128866","54","37083  >  443 [ACK] Seq=318 Ack=1461 Win=7312 Len=0"
"2016-09-27 08:35:48.131058","54","37083  >  443 [ACK] Seq=318 Ack=2921 Win=10224 Len=0"
"2016-09-27 08:35:48.131153","54","37083  >  443 [ACK] Seq=318 Ack=3294 Win=13152 Len=0"
"2016-09-27 08:35:48.157531","180","Client Key Exchange"
"2016-09-27 08:35:48.387865","54","37083  >  443 [ACK] Seq=444 Ack=3345 Win=13152 Len=0"
"2016-09-27 08:35:48.434555","1514","37083  >  443 [ACK] Seq=444 Ack=3345 Win=13152 Len=1460 [TCP segment of a reassembled PDU]"
"2016-09-27 08:35:48.434998","430","Application Data"
"2016-09-27 08:35:48.781289","54","37083  >  443 [ACK] Seq=2280 Ack=3891 Win=18992 Len=0"
"2016-09-27 08:35:48.855527","54","37083  >  443 [ACK] Seq=2280 Ack=4059 Win=21904 Len=0"
"2016-09-27 08:35:48.902498","264","Application Data"
"2016-09-27 08:35:48.933392","276","Application Data"
"2016-09-27 08:35:48.968067","545","Application Data"
"2016-09-27 08:35:48.975528","377","Application Data"
"2016-09-27 08:35:48.978674","190","Application Data"
"2016-09-27 08:35:48.993283","185","Application Data"
"2016-09-27 08:35:49.156565","149","Application Data"
"2016-09-27 08:35:49.157844","380","Application Data"
"2016-09-27 08:35:53.382739","54","37083  >  443 [ACK] Seq=4214 Ack=4100 Win=21904 Len=0"
"2016-09-27 08:35:53.383274","95","Application Data"
"2016-09-27 08:36:23.413700","95","Application Data"
"2016-09-27 08:36:23.674971","54","37083  >  443 [ACK] Seq=4296 Ack=4141 Win=21904 Len=0"
"2016-09-27 08:36:53.378312","54","37083  >  443 [ACK] Seq=4296 Ack=4182 Win=21904 Len=0"
"2016-09-27 08:36:53.378883","95","Application Data"
"2016-09-27 08:37:23.405718","95","Application Data"
"2016-09-27 08:37:23.674791","54","37083  >  443 [ACK] Seq=4378 Ack=4223 Win=21904 Len=0"
"2016-09-27 08:37:53.666911","95","Application Data"
"2016-09-27 08:37:53.886951","54","[TCP Dup ACK 198006#1] 37083  >  443 [ACK] Seq=4419 Ack=4223 Win=21904 Len=0"
"2016-09-27 08:37:53.956264","54","37083  >  443 [ACK] Seq=4419 Ack=4305 Win=21904 Len=0"
"2016-09-27 08:37:53.956824","95","Application Data"
"2016-09-27 08:38:23.986008","95","Application Data"
"2016-09-27 08:38:24.246090","54","37083  >  443 [ACK] Seq=4501 Ack=4346 Win=21904 Len=0"
"2016-09-27 08:38:49.679996","54","37083  >  443 [ACK] Seq=4501 Ack=4719 Win=24832 Len=0"
"2016-09-27 08:38:50.133268","211","Application Data"
"2016-09-27 08:38:50.366396","54","37083  >  443 [ACK] Seq=4658 Ack=4891 Win=27744 Len=0"
"2016-09-27 08:38:52.013008","358","Application Data"
"2016-09-27 08:38:52.602337","179","Application Data"
"2016-09-27 08:38:53.385847","54","37083  >  443 [ACK] Seq=5087 Ack=4932 Win=27744 Len=0"
"2016-09-27 08:38:53.386351","95","Application Data"
"2016-09-27 08:39:23.414904","95","Application Data"
"2016-09-27 08:39:23.674497","54","37083  >  443 [ACK] Seq=5169 Ack=4973 Win=27744 Len=0"
"2016-09-27 08:39:53.378683","54","37083  >  443 [ACK] Seq=5169 Ack=5014 Win=27744 Len=0"
"2016-09-27 08:39:53.378795","95","Application Data"
"2016-09-27 08:40:23.408182","95","Application Data"
"2016-09-27 08:40:23.670599","54","37083  >  443 [ACK] Seq=5251 Ack=5055 Win=27744 Len=0"
"2016-09-27 08:40:53.522254","54","37083  >  443 [ACK] Seq=5251 Ack=5096 Win=27744 Len=0"
"2016-09-27 08:40:53.522817","95","Application Data"
"2016-09-27 08:41:23.553817","95","Application Data"
"2016-09-27 08:41:24.002404","95","[TCP Spurious Retransmission] "
"2016-09-27 08:41:24.272701","54","37083  >  443 [ACK] Seq=5333 Ack=5137 Win=27744 Len=0"
"2016-09-27 08:41:54.262509","95","Application Data"
"2016-09-27 08:41:54.308729","54","37083  >  443 [ACK] Seq=5374 Ack=5178 Win=27744 Len=0"
"2016-09-27 08:41:54.308844","95","Application Data"
"2016-09-27 08:41:54.568682","54","37083  >  443 [ACK] Seq=5415 Ack=5219 Win=27744 Len=0"
"2016-09-27 08:42:24.559416","95","Application Data"
"2016-09-27 08:42:24.784951","54","37083  >  443 [ACK] Seq=5456 Ack=5260 Win=27744 Len=0"
"2016-09-27 08:42:53.386259","54","37083  >  443 [ACK] Seq=5456 Ack=5301 Win=27744 Len=0"
"2016-09-27 08:42:53.386373","95","Application Data"
"2016-09-27 08:43:23.412668","95","Application Data"
"2016-09-27 08:43:23.677842","54","37083  >  443 [ACK] Seq=5538 Ack=5342 Win=27744 Len=0"
"2016-09-27 08:43:53.385193","54","37083  >  443 [ACK] Seq=5538 Ack=5383 Win=27744 Len=0"
"2016-09-27 08:43:53.385948","95","Application Data"
"2016-09-27 08:44:23.418281","95","Application Data"
"2016-09-27 08:44:23.677960","54","37083  >  443 [ACK] Seq=5620 Ack=5424 Win=27744 Len=0"
"2016-09-27 08:44:53.381033","54","37083  >  443 [ACK] Seq=5620 Ack=5465 Win=27744 Len=0"
"2016-09-27 08:44:53.381586","95","Application Data"
"2016-09-27 08:45:23.404671","95","Application Data"
"2016-09-27 08:45:23.665937","54","37083  >  443 [ACK] Seq=5702 Ack=5506 Win=27744 Len=0"
"2016-09-27 08:45:53.384871","54","37083  >  443 [ACK] Seq=5702 Ack=5547 Win=27744 Len=0"
"2016-09-27 08:45:53.385414","95","Application Data"
"2016-09-27 08:46:23.414839","95","Application Data"
"2016-09-27 08:46:23.677414","54","37083  >  443 [ACK] Seq=5784 Ack=5588 Win=27744 Len=0"
"2016-09-27 08:46:53.389529","54","37083  >  443 [ACK] Seq=5784 Ack=5629 Win=27744 Len=0"
"2016-09-27 08:46:53.389647","95","Application Data"
"2016-09-27 08:47:23.419815","95","Application Data"
"2016-09-27 08:47:23.681305","54","37083  >  443 [ACK] Seq=5866 Ack=5670 Win=27744 Len=0"
"2016-09-27 08:47:53.407457","54","37083  >  443 [ACK] Seq=5866 Ack=5711 Win=27744 Len=0"
"2016-09-27 08:47:53.407575","95","Application Data"
"2016-09-27 08:48:23.412532","95","Application Data"
"2016-09-27 08:48:23.870233","95","[TCP Spurious Retransmission] "
"2016-09-27 08:48:24.142118","54","37083  >  443 [ACK] Seq=5948 Ack=5752 Win=27744 Len=0"
"2016-09-27 08:48:53.394335","54","37083  >  443 [ACK] Seq=5948 Ack=5793 Win=27744 Len=0"
"2016-09-27 08:48:53.394444","95","Application Data"
"2016-09-27 08:49:23.415457","95","Application Data"
"2016-09-27 08:49:23.681007","54","37083  >  443 [ACK] Seq=6030 Ack=5834 Win=27744 Len=0"
"2016-09-27 08:49:53.669515","95","Application Data"
"2016-09-27 08:49:53.850850","54","37083  >  443 [ACK] Seq=6071 Ack=5875 Win=27744 Len=0"
"2016-09-27 08:49:53.850973","95","Application Data"
"2016-09-27 08:49:54.111558","54","37083  >  443 [ACK] Seq=6112 Ack=5916 Win=27744 Len=0"
"2016-09-27 08:50:24.099911","95","Application Data"
"2016-09-27 08:50:24.320032","54","37083  >  443 [ACK] Seq=6153 Ack=5957 Win=27744 Len=0"
"2016-09-27 08:50:53.382872","54","37083  >  443 [ACK] Seq=6153 Ack=5998 Win=27744 Len=0"
"2016-09-27 08:50:53.382983","95","Application Data"
"2016-09-27 08:50:53.618602","222","Application Data"
"2016-09-27 08:51:23.651332","95","Application Data"
"2016-09-27 08:51:23.911264","54","37083  >  443 [ACK] Seq=6403 Ack=6039 Win=27744 Len=0"
"2016-09-27 08:51:53.388956","54","37083  >  443 [ACK] Seq=6403 Ack=6080 Win=27744 Len=0"
"2016-09-27 08:51:53.389063","95","Application Data"
"2016-09-27 08:52:23.417226","95","Application Data"
"2016-09-27 08:52:23.868157","95","[TCP Spurious Retransmission] "
"2016-09-27 08:52:24.140795","54","37083  >  443 [ACK] Seq=6485 Ack=6121 Win=27744 Len=0"
"2016-09-27 08:52:53.384479","54","37083  >  443 [ACK] Seq=6485 Ack=6162 Win=27744 Len=0"
"2016-09-27 08:52:53.384586","95","Application Data"
"2016-09-27 08:53:23.411363","95","Application Data"
"2016-09-27 08:53:23.676589","54","37083  >  443 [ACK] Seq=6567 Ack=6203 Win=27744 Len=0"
"2016-09-27 08:53:53.380745","54","37083  >  443 [ACK] Seq=6567 Ack=6244 Win=27744 Len=0"
"2016-09-27 08:53:53.380855","95","Application Data"
"2016-09-27 08:54:23.409842","95","Application Data"
"2016-09-27 08:54:23.672609","54","37083  >  443 [ACK] Seq=6649 Ack=6285 Win=27744 Len=0"
"2016-09-27 08:54:53.397429","54","37083  >  443 [ACK] Seq=6649 Ack=6326 Win=27744 Len=0"
"2016-09-27 08:54:53.409010","95","Application Data"
"2016-09-27 08:55:23.424233","95","Application Data"
"2016-09-27 08:55:23.681538","54","37083  >  443 [ACK] Seq=6731 Ack=6367 Win=27744 Len=0"
"2016-09-27 08:55:53.388797","54","37083  >  443 [ACK] Seq=6731 Ack=6408 Win=27744 Len=0"
"2016-09-27 08:55:53.389340","95","Application Data"
"2016-09-27 08:56:23.418382","95","Application Data"
"2016-09-27 08:56:23.677493","54","37083  >  443 [ACK] Seq=6813 Ack=6449 Win=27744 Len=0"
"2016-09-27 08:56:53.389436","54","37083  >  443 [ACK] Seq=6813 Ack=6490 Win=27744 Len=0"
"2016-09-27 08:56:53.390300","95","Application Data"
"2016-09-27 08:57:23.419164","95","Application Data"
"2016-09-27 08:57:23.681334","54","37083  >  443 [ACK] Seq=6895 Ack=6531 Win=27744 Len=0"
"2016-09-27 08:57:53.671400","95","Application Data"
"2016-09-27 08:57:53.853353","54","37083  >  443 [ACK] Seq=6936 Ack=6572 Win=27744 Len=0"
"2016-09-27 08:57:53.853990","95","Application Data"
"2016-09-27 08:57:54.114831","54","37083  >  443 [ACK] Seq=6977 Ack=6613 Win=27744 Len=0"
"2016-09-27 08:58:24.110208","95","Application Data"
"2016-09-27 08:58:24.338198","54","37083  >  443 [ACK] Seq=7018 Ack=6654 Win=27744 Len=0"
"2016-09-27 08:58:53.385689","54","37083  >  443 [ACK] Seq=7018 Ack=6695 Win=27744 Len=0"
"2016-09-27 08:58:53.385808","95","Application Data"
"2016-09-27 08:59:23.410832","95","Application Data"
"2016-09-27 08:59:23.669333","54","37083  >  443 [ACK] Seq=7100 Ack=6736 Win=27744 Len=0"
"2016-09-27 08:59:53.385508","54","37083  >  443 [ACK] Seq=7100 Ack=6777 Win=27744 Len=0"
"2016-09-27 08:59:53.385625","95","Application Data"
"2016-09-27 09:00:23.414654","95","Application Data"
"2016-09-27 09:00:24.141809","54","37083  >  443 [ACK] Seq=7182 Ack=6818 Win=27744 Len=0"
"2016-09-27 09:00:53.384730","54","37083  >  443 [ACK] Seq=7182 Ack=6859 Win=27744 Len=0"
"2016-09-27 09:00:53.384848","95","Application Data"
"2016-09-27 09:01:23.411752","95","Application Data"
"2016-09-27 09:01:23.669056","54","37083  >  443 [ACK] Seq=7264 Ack=6900 Win=27744 Len=0"
"2016-09-27 09:01:53.386167","54","37083  >  443 [ACK] Seq=7264 Ack=6941 Win=27744 Len=0"
"2016-09-27 09:01:53.386287","95","Application Data"
"2016-09-27 09:02:23.415368","95","Application Data"
"2016-09-27 09:02:23.868156","95","[TCP Spurious Retransmission] "
"2016-09-27 09:02:24.139630","54","37083  >  443 [ACK] Seq=7346 Ack=6982 Win=27744 Len=0"
"2016-09-27 09:02:53.385444","54","37083  >  443 [ACK] Seq=7346 Ack=7023 Win=27744 Len=0"
"2016-09-27 09:02:53.385939","95","Application Data"
"2016-09-27 09:03:23.415125","95","Application Data"
"2016-09-27 09:03:23.871894","95","[TCP Spurious Retransmission] "
"2016-09-27 09:03:24.131310","54","37083  >  443 [ACK] Seq=7428 Ack=7064 Win=27744 Len=0"
"2016-09-27 09:03:53.387877","54","37083  >  443 [ACK] Seq=7428 Ack=7105 Win=27744 Len=0"
"2016-09-27 09:03:53.388444","95","Application Data"
"2016-09-27 09:04:23.413905","95","Application Data"
"2016-09-27 09:04:23.869162","95","[TCP Spurious Retransmission] "
"2016-09-27 09:04:24.125666","54","37083  >  443 [ACK] Seq=7510 Ack=7146 Win=27744 Len=0"
"2016-09-27 09:04:53.388626","54","37083  >  443 [ACK] Seq=7510 Ack=7187 Win=27744 Len=0"
"2016-09-27 09:04:53.388746","95","Application Data"
"2016-09-27 09:05:23.417784","95","Application Data"
"2016-09-27 09:05:24.133328","54","37083  >  443 [ACK] Seq=7592 Ack=7228 Win=27744 Len=0"
"2016-09-27 09:05:53.384312","54","37083  >  443 [ACK] Seq=7592 Ack=7269 Win=27744 Len=0"
"2016-09-27 09:05:53.384425","95","Application Data"
"2016-09-27 09:06:23.414367","95","Application Data"
"2016-09-27 09:06:23.680166","54","37083  >  443 [ACK] Seq=7674 Ack=7310 Win=27744 Len=0"
"2016-09-27 09:06:53.379553","54","37083  >  443 [ACK] Seq=7674 Ack=7351 Win=27744 Len=0"
"2016-09-27 09:06:53.381073","95","Application Data"
"2016-09-27 09:07:23.411801","95","Application Data"
"2016-09-27 09:07:23.868762","95","[TCP Spurious Retransmission] "
"2016-09-27 09:07:24.129980","54","37083  >  443 [ACK] Seq=7756 Ack=7392 Win=27744 Len=0"
"2016-09-27 09:07:53.387302","54","37083  >  443 [ACK] Seq=7756 Ack=7433 Win=27744 Len=0"
"2016-09-27 09:07:53.387854","95","Application Data"
"2016-09-27 09:08:23.412613","95","Application Data"
"2016-09-27 09:08:23.672079","54","37083  >  443 [ACK] Seq=7838 Ack=7474 Win=27744 Len=0"
"2016-09-27 09:08:53.662209","95","Application Data"
"2016-09-27 09:08:53.848087","54","37083  >  443 [ACK] Seq=7879 Ack=7515 Win=27744 Len=0"
"2016-09-27 09:08:53.848199","95","Application Data"
"2016-09-27 09:08:54.113890","54","37083  >  443 [ACK] Seq=7920 Ack=7556 Win=27744 Len=0"
"2016-09-27 09:09:24.100089","95","Application Data"
"2016-09-27 09:09:24.320963","54","37083  >  443 [ACK] Seq=7961 Ack=7597 Win=27744 Len=0"
"2016-09-27 09:09:53.383842","54","37083  >  443 [ACK] Seq=7961 Ack=7638 Win=27744 Len=0"
"2016-09-27 09:09:53.383960","95","Application Data"
"2016-09-27 09:10:23.414308","95","Application Data"
"2016-09-27 09:10:23.679539","54","37083  >  443 [ACK] Seq=8043 Ack=7679 Win=27744 Len=0"
"2016-09-27 09:10:53.387407","54","37083  >  443 [ACK] Seq=8043 Ack=7720 Win=27744 Len=0"
"2016-09-27 09:10:53.387522","95","Application Data"
"2016-09-27 09:11:23.412564","95","Application Data"
"2016-09-27 09:11:23.676018","54","37083  >  443 [ACK] Seq=8125 Ack=7761 Win=27744 Len=0"
"2016-09-27 09:11:53.387238","54","37083  >  443 [ACK] Seq=8125 Ack=7802 Win=27744 Len=0"
"2016-09-27 09:11:53.387355","95","Application Data"
"2016-09-27 09:12:23.417605","95","Application Data"
"2016-09-27 09:12:23.683107","54","37083  >  443 [ACK] Seq=8207 Ack=7843 Win=27744 Len=0"
"2016-09-27 09:12:53.379640","54","37083  >  443 [ACK] Seq=8207 Ack=7884 Win=27744 Len=0"
"2016-09-27 09:12:53.381366","95","Application Data"
"2016-09-27 09:13:23.408066","95","Application Data"
"2016-09-27 09:13:23.671308","54","37083  >  443 [ACK] Seq=8289 Ack=7925 Win=27744 Len=0"
"2016-09-27 09:13:53.387219","54","37083  >  443 [ACK] Seq=8289 Ack=7966 Win=27744 Len=0"
"2016-09-27 09:13:53.387329","95","Application Data"
"2016-09-27 09:14:23.408621","95","Application Data"
"2016-09-27 09:14:23.859896","95","[TCP Spurious Retransmission] "
"2016-09-27 09:14:24.143801","54","37083  >  443 [ACK] Seq=8371 Ack=8007 Win=27744 Len=0"
"2016-09-27 09:14:53.383138","54","37083  >  443 [ACK] Seq=8371 Ack=8048 Win=27744 Len=0"
"2016-09-27 09:14:53.383254","95","Application Data"
"2016-09-27 09:15:23.411396","95","Application Data"
"2016-09-27 09:15:23.674876","54","37083  >  443 [ACK] Seq=8453 Ack=8089 Win=27744 Len=0"
"2016-09-27 09:15:53.386735","54","37083  >  443 [ACK] Seq=8453 Ack=8130 Win=27744 Len=0"
"2016-09-27 09:15:53.386838","95","Application Data"
"2016-09-27 09:16:23.420557","95","Application Data"
"2016-09-27 09:16:24.155781","54","37083  >  443 [ACK] Seq=8535 Ack=8171 Win=27744 Len=0"
"2016-09-27 09:16:54.152033","95","Application Data"
"2016-09-27 09:16:54.336381","54","37083  >  443 [ACK] Seq=8576 Ack=8212 Win=27744 Len=0"
"2016-09-27 09:16:54.350158","95","Application Data"
"2016-09-27 09:16:54.607258","54","37083  >  443 [ACK] Seq=8617 Ack=8253 Win=27744 Len=0"
"2016-09-27 09:17:24.596934","95","Application Data"
"2016-09-27 09:17:24.817796","54","37083  >  443 [ACK] Seq=8658 Ack=8294 Win=27744 Len=0"
"2016-09-27 09:17:53.378985","54","37083  >  443 [ACK] Seq=8658 Ack=8335 Win=27744 Len=0"
"2016-09-27 09:17:53.379095","95","Application Data"
"2016-09-27 09:18:23.408045","95","Application Data"
"2016-09-27 09:18:23.862089","95","[TCP Spurious Retransmission] "
"2016-09-27 09:18:24.127735","54","37083  >  443 [ACK] Seq=8740 Ack=8376 Win=27744 Len=0"
"2016-09-27 09:18:54.116271","95","Application Data"
"2016-09-27 09:18:54.319270","54","37083  >  443 [ACK] Seq=8781 Ack=8417 Win=27744 Len=0"
"2016-09-27 09:18:54.319778","95","Application Data"
"2016-09-27 09:18:54.580680","54","37083  >  443 [ACK] Seq=8822 Ack=8458 Win=27744 Len=0"
"2016-09-27 09:19:24.572257","95","Application Data"
"2016-09-27 09:19:24.817725","54","37083  >  443 [ACK] Seq=8863 Ack=8499 Win=27744 Len=0"
"2016-09-27 09:19:53.378416","54","37083  >  443 [ACK] Seq=8863 Ack=8540 Win=27744 Len=0"
"2016-09-27 09:19:53.378528","95","Application Data"
"2016-09-27 09:20:23.405896","95","Application Data"
"2016-09-27 09:20:23.861768","95","[TCP Spurious Retransmission] "
