"2016-09-27 18:09:44.473849","74","51875  >  443 [SYN] Seq=0 Win=4380 Len=0 MSS=1460 SACK_PERM=1 TSval=69336904 TSecr=0 WS=16"
"2016-09-27 18:09:44.697622","54","51875  >  443 [ACK] Seq=1 Ack=1 Win=4384 Len=0"
"2016-09-27 18:09:44.795448","294","Client Hello"
"2016-09-27 18:09:45.012910","54","51875  >  443 [ACK] Seq=241 Ack=1461 Win=7312 Len=0"
"2016-09-27 18:09:45.013027","54","51875  >  443 [ACK] Seq=241 Ack=2876 Win=10224 Len=0"
"2016-09-27 18:09:45.023411","380","Client Key Exchange"
"2016-09-27 18:09:45.248973","1514","Application Data"
"2016-09-27 18:09:45.249095","476","Application Data"
"2016-09-27 18:09:45.483043","91","Encrypted Alert"
"2016-09-27 18:09:45.497566","54","51875  >  443 [FIN"
"2016-09-27 18:09:45.715571","54","51875  >  443 [ACK] Seq=2487 Ack=3325 Win=13152 Len=0"
