"2016-09-27 05:03:30.994377","74","54817  >  443 [SYN] Seq=0 Win=4380 Len=0 MSS=1460 SACK_PERM=1 TSval=57260496 TSecr=0 WS=16"
"2016-09-27 05:03:31.216487","54","54817  >  443 [ACK] Seq=1 Ack=1 Win=4384 Len=0"
"2016-09-27 05:03:31.343846","371","Client Hello"
"2016-09-27 05:03:31.583467","54","54817  >  443 [ACK] Seq=318 Ack=1461 Win=7312 Len=0"
"2016-09-27 05:03:31.583578","54","54817  >  443 [ACK] Seq=318 Ack=2921 Win=10224 Len=0"
"2016-09-27 05:03:31.583642","54","54817  >  443 [ACK] Seq=318 Ack=3294 Win=13152 Len=0"
"2016-09-27 05:03:31.622954","180","Client Key Exchange"
"2016-09-27 05:03:31.851151","54","54817  >  443 [ACK] Seq=444 Ack=3345 Win=13152 Len=0"
"2016-09-27 05:03:31.892019","1514","54817  >  443 [ACK] Seq=444 Ack=3345 Win=13152 Len=1460 [TCP segment of a reassembled PDU]"
"2016-09-27 05:03:31.892136","425","Application Data"
"2016-09-27 05:03:32.213849","54","54817  >  443 [ACK] Seq=2275 Ack=3688 Win=16064 Len=0"
"2016-09-27 05:03:32.213953","54","54817  >  443 [ACK] Seq=2275 Ack=3886 Win=18992 Len=0"
"2016-09-27 05:03:32.271192","54","54817  >  443 [ACK] Seq=2275 Ack=4055 Win=21904 Len=0"
"2016-09-27 05:03:32.316965","264","Application Data"
"2016-09-27 05:03:32.400081","278","Application Data"
"2016-09-27 05:03:32.401694","370","Application Data"
"2016-09-27 05:03:32.405192","548","Application Data"
"2016-09-27 05:03:32.407066","193","Application Data"
"2016-09-27 05:03:32.410903","183","Application Data"
"2016-09-27 05:03:32.577653","142","Application Data"
"2016-09-27 05:03:32.579514","368","Application Data"
"2016-09-27 05:03:36.853179","54","54817  >  443 [ACK] Seq=4189 Ack=4096 Win=21904 Len=0"
"2016-09-27 05:03:36.853688","95","Application Data"
"2016-09-27 05:04:06.881711","95","Application Data"
"2016-09-27 05:04:07.150204","54","54817  >  443 [ACK] Seq=4271 Ack=4137 Win=21904 Len=0"
"2016-09-27 05:04:37.141478","95","Application Data"
"2016-09-27 05:04:37.364788","54","[TCP Dup ACK 119641#1] 54817  >  443 [ACK] Seq=4312 Ack=4137 Win=21904 Len=0"
"2016-09-27 05:04:37.446751","54","54817  >  443 [ACK] Seq=4312 Ack=4219 Win=21904 Len=0"
"2016-09-27 05:04:37.448181","95","Application Data"
"2016-09-27 05:05:07.478806","95","Application Data"
"2016-09-27 05:05:07.739400","54","54817  >  443 [ACK] Seq=4394 Ack=4260 Win=21904 Len=0"
"2016-09-27 05:05:36.847024","54","54817  >  443 [ACK] Seq=4394 Ack=4301 Win=21904 Len=0"
"2016-09-27 05:05:36.847189","95","Application Data"
"2016-09-27 05:06:06.873983","95","Application Data"
"2016-09-27 05:06:07.333035","95","[TCP Spurious Retransmission] "
"2016-09-27 05:06:07.717925","54","54817  >  443 [ACK] Seq=4476 Ack=4342 Win=21904 Len=0"
"2016-09-27 05:06:36.853919","54","54817  >  443 [ACK] Seq=4476 Ack=4383 Win=21904 Len=0"
"2016-09-27 05:06:36.854038","95","Application Data"
"2016-09-27 05:07:06.880015","95","Application Data"
"2016-09-27 05:07:07.340574","95","[TCP Spurious Retransmission] "
"2016-09-27 05:07:07.688210","54","54817  >  443 [ACK] Seq=4558 Ack=4424 Win=21904 Len=0"
"2016-09-27 05:07:36.845417","54","54817  >  443 [ACK] Seq=4558 Ack=4465 Win=21904 Len=0"
"2016-09-27 05:07:36.845541","95","Application Data"
"2016-09-27 05:08:06.875828","95","Application Data"
"2016-09-27 05:08:07.133305","54","54817  >  443 [ACK] Seq=4640 Ack=4506 Win=21904 Len=0"
"2016-09-27 05:08:12.098435","54","54817  >  443 [ACK] Seq=4640 Ack=4878 Win=24832 Len=0"
"2016-09-27 05:08:12.540833","208","Application Data"
"2016-09-27 05:08:12.766419","54","54817  >  443 [ACK] Seq=4794 Ack=5050 Win=27744 Len=0"
"2016-09-27 05:08:14.842504","199","Application Data"
"2016-09-27 05:08:15.000712","335","Application Data"
"2016-09-27 05:08:36.856132","54","54817  >  443 [ACK] Seq=5220 Ack=5091 Win=27744 Len=0"
"2016-09-27 05:08:36.856674","95","Application Data"
"2016-09-27 05:09:06.885780","95","Application Data"
"2016-09-27 05:09:07.334237","95","[TCP Spurious Retransmission] "
"2016-09-27 05:09:07.607692","54","54817  >  443 [ACK] Seq=5302 Ack=5132 Win=27744 Len=0"
"2016-09-27 05:09:36.849450","54","54817  >  443 [ACK] Seq=5302 Ack=5173 Win=27744 Len=0"
"2016-09-27 05:09:36.849560","95","Application Data"
"2016-09-27 05:10:06.875731","95","Application Data"
"2016-09-27 05:10:07.328257","95","[TCP Spurious Retransmission] "
"2016-09-27 05:10:07.585997","54","54817  >  443 [ACK] Seq=5384 Ack=5214 Win=27744 Len=0"
"2016-09-27 05:10:36.856472","54","54817  >  443 [ACK] Seq=5384 Ack=5255 Win=27744 Len=0"
"2016-09-27 05:10:36.856582","95","Application Data"
"2016-09-27 05:11:06.886885","95","Application Data"
"2016-09-27 05:11:07.152285","54","54817  >  443 [ACK] Seq=5466 Ack=5296 Win=27744 Len=0"
"2016-09-27 05:11:36.852432","54","54817  >  443 [ACK] Seq=5466 Ack=5337 Win=27744 Len=0"
"2016-09-27 05:11:36.852545","95","Application Data"
"2016-09-27 05:12:06.883495","95","Application Data"
"2016-09-27 05:12:07.593582","54","54817  >  443 [ACK] Seq=5548 Ack=5378 Win=27744 Len=0"
"2016-09-27 05:12:36.847230","54","54817  >  443 [ACK] Seq=5548 Ack=5419 Win=27744 Len=0"
"2016-09-27 05:12:36.847348","95","Application Data"
"2016-09-27 05:13:06.871893","95","Application Data"
"2016-09-27 05:13:07.132655","54","54817  >  443 [ACK] Seq=5630 Ack=5460 Win=27744 Len=0"
"2016-09-27 05:13:36.843452","54","54817  >  443 [ACK] Seq=5630 Ack=5501 Win=27744 Len=0"
"2016-09-27 05:13:36.843999","95","Application Data"
"2016-09-27 05:14:06.863965","95","Application Data"
"2016-09-27 05:14:07.581423","54","54817  >  443 [ACK] Seq=5712 Ack=5542 Win=27744 Len=0"
"2016-09-27 05:14:36.844174","54","54817  >  443 [ACK] Seq=5712 Ack=5583 Win=27744 Len=0"
"2016-09-27 05:14:36.844663","95","Application Data"
"2016-09-27 05:15:06.870672","95","Application Data"
"2016-09-27 05:15:07.135954","54","54817  >  443 [ACK] Seq=5794 Ack=5624 Win=27744 Len=0"
"2016-09-27 05:15:36.849069","54","54817  >  443 [ACK] Seq=5794 Ack=5665 Win=27744 Len=0"
"2016-09-27 05:15:36.849215","95","Application Data"
"2016-09-27 05:16:06.879947","95","Application Data"
"2016-09-27 05:16:07.136797","54","54817  >  443 [ACK] Seq=5876 Ack=5706 Win=27744 Len=0"
"2016-09-27 05:16:36.852967","54","54817  >  443 [ACK] Seq=5876 Ack=5747 Win=27744 Len=0"
"2016-09-27 05:16:36.853079","95","Application Data"
"2016-09-27 05:17:06.881152","95","Application Data"
"2016-09-27 05:17:07.144143","54","54817  >  443 [ACK] Seq=5958 Ack=5788 Win=27744 Len=0"
"2016-09-27 05:17:36.847500","54","54817  >  443 [ACK] Seq=5958 Ack=5829 Win=27744 Len=0"
"2016-09-27 05:17:36.848396","95","Application Data"
"2016-09-27 05:18:06.878844","95","Application Data"
"2016-09-27 05:18:07.141456","54","54817  >  443 [ACK] Seq=6040 Ack=5870 Win=27744 Len=0"
"2016-09-27 05:18:36.851318","54","54817  >  443 [ACK] Seq=6040 Ack=5911 Win=27744 Len=0"
"2016-09-27 05:18:36.851824","95","Application Data"
"2016-09-27 05:19:06.881126","95","Application Data"
"2016-09-27 05:19:07.144616","54","54817  >  443 [ACK] Seq=6122 Ack=5952 Win=27744 Len=0"
"2016-09-27 05:19:37.133454","95","Application Data"
"2016-09-27 05:19:37.312740","54","54817  >  443 [ACK] Seq=6163 Ack=5993 Win=27744 Len=0"
"2016-09-27 05:19:37.313341","95","Application Data"
"2016-09-27 05:19:37.574060","54","54817  >  443 [ACK] Seq=6204 Ack=6034 Win=27744 Len=0"
"2016-09-27 05:20:07.558938","95","Application Data"
"2016-09-27 05:20:08.013505","95","[TCP Spurious Retransmission] "
"2016-09-27 05:20:08.249548","54","54817  >  443 [ACK] Seq=6245 Ack=6075 Win=27744 Len=0"
"2016-09-27 05:20:36.851606","54","54817  >  443 [ACK] Seq=6245 Ack=6116 Win=27744 Len=0"
"2016-09-27 05:20:36.851724","95","Application Data"
"2016-09-27 05:21:06.878806","95","Application Data"
"2016-09-27 05:21:07.139398","54","54817  >  443 [ACK] Seq=6327 Ack=6157 Win=27744 Len=0"
"2016-09-27 05:21:36.844052","54","54817  >  443 [ACK] Seq=6327 Ack=6198 Win=27744 Len=0"
"2016-09-27 05:21:36.844161","95","Application Data"
"2016-09-27 05:22:06.873729","95","Application Data"
"2016-09-27 05:22:07.131605","54","54817  >  443 [ACK] Seq=6409 Ack=6239 Win=27744 Len=0"
"2016-09-27 05:22:36.855172","54","54817  >  443 [ACK] Seq=6409 Ack=6280 Win=27744 Len=0"
"2016-09-27 05:22:36.855292","95","Application Data"
"2016-09-27 05:23:06.885363","95","Application Data"
"2016-09-27 05:23:07.150783","54","54817  >  443 [ACK] Seq=6491 Ack=6321 Win=27744 Len=0"
"2016-09-27 05:23:36.850205","54","54817  >  443 [ACK] Seq=6491 Ack=6362 Win=27744 Len=0"
"2016-09-27 05:23:36.850721","95","Application Data"
"2016-09-27 05:24:06.877075","95","Application Data"
"2016-09-27 05:24:07.142728","54","54817  >  443 [ACK] Seq=6573 Ack=6403 Win=27744 Len=0"
"2016-09-27 05:24:36.854526","54","54817  >  443 [ACK] Seq=6573 Ack=6444 Win=27744 Len=0"
"2016-09-27 05:24:36.854644","95","Application Data"
"2016-09-27 05:25:06.881290","95","Application Data"
"2016-09-27 05:25:07.142602","54","54817  >  443 [ACK] Seq=6655 Ack=6485 Win=27744 Len=0"
"2016-09-27 05:25:36.854595","54","54817  >  443 [ACK] Seq=6655 Ack=6526 Win=27744 Len=0"
"2016-09-27 05:25:36.854681","95","Application Data"
"2016-09-27 05:26:06.885440","95","Application Data"
"2016-09-27 05:26:07.615021","54","54817  >  443 [ACK] Seq=6737 Ack=6567 Win=27744 Len=0"
"2016-09-27 05:26:36.850753","54","54817  >  443 [ACK] Seq=6737 Ack=6608 Win=27744 Len=0"
"2016-09-27 05:26:36.850870","95","Application Data"
"2016-09-27 05:27:06.880922","95","Application Data"
"2016-09-27 05:27:07.614834","54","54817  >  443 [ACK] Seq=6819 Ack=6649 Win=27744 Len=0"
"2016-09-27 05:27:36.846133","54","54817  >  443 [ACK] Seq=6819 Ack=6690 Win=27744 Len=0"
"2016-09-27 05:27:36.846242","95","Application Data"
"2016-09-27 05:28:06.876035","95","Application Data"
"2016-09-27 05:28:07.138308","54","54817  >  443 [ACK] Seq=6901 Ack=6731 Win=27744 Len=0"
"2016-09-27 05:28:36.849230","54","54817  >  443 [ACK] Seq=6901 Ack=6772 Win=27744 Len=0"
"2016-09-27 05:28:36.849757","95","Application Data"
"2016-09-27 05:29:06.878315","95","Application Data"
"2016-09-27 05:29:07.141795","54","54817  >  443 [ACK] Seq=6983 Ack=6813 Win=27744 Len=0"
"2016-09-27 05:29:37.131450","95","Application Data"
"2016-09-27 05:29:37.325555","54","54817  >  443 [ACK] Seq=7024 Ack=6854 Win=27744 Len=0"
"2016-09-27 05:29:37.326077","95","Application Data"
"2016-09-27 05:29:37.586966","54","54817  >  443 [ACK] Seq=7065 Ack=6895 Win=27744 Len=0"
"2016-09-27 05:30:07.579417","95","Application Data"
"2016-09-27 05:30:07.806321","54","54817  >  443 [ACK] Seq=7106 Ack=6936 Win=27744 Len=0"
"2016-09-27 05:30:36.852692","54","54817  >  443 [ACK] Seq=7106 Ack=6977 Win=27744 Len=0"
"2016-09-27 05:30:36.853220","95","Application Data"
"2016-09-27 05:31:06.881607","95","Application Data"
"2016-09-27 05:31:07.145296","54","54817  >  443 [ACK] Seq=7188 Ack=7018 Win=27744 Len=0"
"2016-09-27 05:31:36.853356","54","54817  >  443 [ACK] Seq=7188 Ack=7059 Win=27744 Len=0"
"2016-09-27 05:31:36.853469","95","Application Data"
"2016-09-27 05:32:06.879825","95","Application Data"
"2016-09-27 05:32:07.137315","54","54817  >  443 [ACK] Seq=7270 Ack=7100 Win=27744 Len=0"
"2016-09-27 05:32:36.852425","54","54817  >  443 [ACK] Seq=7270 Ack=7141 Win=27744 Len=0"
"2016-09-27 05:32:36.852983","95","Application Data"
"2016-09-27 05:33:06.879756","95","Application Data"
"2016-09-27 05:33:07.144894","54","54817  >  443 [ACK] Seq=7352 Ack=7182 Win=27744 Len=0"
"2016-09-27 05:33:36.844383","54","54817  >  443 [ACK] Seq=7352 Ack=7223 Win=27744 Len=0"
"2016-09-27 05:33:36.844943","95","Application Data"
"2016-09-27 05:34:06.876877","95","Application Data"
"2016-09-27 05:34:07.140894","54","54817  >  443 [ACK] Seq=7434 Ack=7264 Win=27744 Len=0"
"2016-09-27 05:34:37.133797","95","Application Data"
"2016-09-27 05:34:37.324604","54","54817  >  443 [ACK] Seq=7475 Ack=7305 Win=27744 Len=0"
"2016-09-27 05:34:37.325120","95","Application Data"
"2016-09-27 05:34:37.586010","54","54817  >  443 [ACK] Seq=7516 Ack=7346 Win=27744 Len=0"
"2016-09-27 05:35:07.574607","95","Application Data"
"2016-09-27 05:35:07.797288","54","54817  >  443 [ACK] Seq=7557 Ack=7387 Win=27744 Len=0"
"2016-09-27 05:35:36.852491","54","54817  >  443 [ACK] Seq=7557 Ack=7428 Win=27744 Len=0"
"2016-09-27 05:35:36.852609","95","Application Data"
"2016-09-27 05:36:06.882973","95","Application Data"
"2016-09-27 05:36:07.335796","95","[TCP Spurious Retransmission] "
"2016-09-27 05:36:07.605265","54","54817  >  443 [ACK] Seq=7639 Ack=7469 Win=27744 Len=0"
"2016-09-27 05:36:36.851489","54","54817  >  443 [ACK] Seq=7639 Ack=7510 Win=27744 Len=0"
"2016-09-27 05:36:36.852181","95","Application Data"
"2016-09-27 05:37:06.882351","95","Application Data"
"2016-09-27 05:37:07.617987","54","54817  >  443 [ACK] Seq=7721 Ack=7551 Win=27744 Len=0"
"2016-09-27 05:37:36.848075","54","54817  >  443 [ACK] Seq=7721 Ack=7592 Win=27744 Len=0"
"2016-09-27 05:37:36.848182","95","Application Data"
"2016-09-27 05:38:06.876925","95","Application Data"
"2016-09-27 05:38:07.144217","54","54817  >  443 [ACK] Seq=7803 Ack=7633 Win=27744 Len=0"
"2016-09-27 05:38:36.843286","54","54817  >  443 [ACK] Seq=7803 Ack=7674 Win=27744 Len=0"
"2016-09-27 05:38:36.843936","95","Application Data"
"2016-09-27 05:39:06.873999","95","Application Data"
"2016-09-27 05:39:07.139815","54","54817  >  443 [ACK] Seq=7885 Ack=7715 Win=27744 Len=0"
"2016-09-27 05:39:36.844067","54","54817  >  443 [ACK] Seq=7885 Ack=7756 Win=27744 Len=0"
"2016-09-27 05:39:36.844185","95","Application Data"
"2016-09-27 05:40:06.874344","95","Application Data"
"2016-09-27 05:40:07.139622","54","54817  >  443 [ACK] Seq=7967 Ack=7797 Win=27744 Len=0"
"2016-09-27 05:40:36.846907","54","54817  >  443 [ACK] Seq=7967 Ack=7838 Win=27744 Len=0"
"2016-09-27 05:40:36.847598","95","Application Data"
"2016-09-27 05:41:06.877437","95","Application Data"
"2016-09-27 05:41:07.139461","54","54817  >  443 [ACK] Seq=8049 Ack=7879 Win=27744 Len=0"
"2016-09-27 05:41:36.850723","54","54817  >  443 [ACK] Seq=8049 Ack=7920 Win=27744 Len=0"
"2016-09-27 05:41:36.851255","95","Application Data"
"2016-09-27 05:42:06.877903","95","Application Data"
"2016-09-27 05:42:07.137537","54","54817  >  443 [ACK] Seq=8131 Ack=7961 Win=27744 Len=0"
"2016-09-27 05:42:36.847976","54","54817  >  443 [ACK] Seq=8131 Ack=8002 Win=27744 Len=0"
"2016-09-27 05:42:36.848088","95","Application Data"
"2016-09-27 05:43:06.877934","95","Application Data"
"2016-09-27 05:43:07.144296","54","54817  >  443 [ACK] Seq=8213 Ack=8043 Win=27744 Len=0"
"2016-09-27 05:43:36.850291","54","54817  >  443 [ACK] Seq=8213 Ack=8084 Win=27744 Len=0"
"2016-09-27 05:43:36.850835","95","Application Data"
"2016-09-27 05:44:06.880643","95","Application Data"
"2016-09-27 05:44:07.146667","54","54817  >  443 [ACK] Seq=8295 Ack=8125 Win=27744 Len=0"
"2016-09-27 05:44:36.847795","54","54817  >  443 [ACK] Seq=8295 Ack=8166 Win=27744 Len=0"
"2016-09-27 05:44:36.847914","95","Application Data"
"2016-09-27 05:45:06.877334","95","Application Data"
"2016-09-27 05:45:07.142635","54","54817  >  443 [ACK] Seq=8377 Ack=8207 Win=27744 Len=0"
"2016-09-27 05:45:36.846768","54","54817  >  443 [ACK] Seq=8377 Ack=8248 Win=27744 Len=0"
"2016-09-27 05:45:36.846884","95","Application Data"
"2016-09-27 05:46:06.868260","95","Application Data"
"2016-09-27 05:46:07.126783","54","54817  >  443 [ACK] Seq=8459 Ack=8289 Win=27744 Len=0"
"2016-09-27 05:46:36.846584","54","54817  >  443 [ACK] Seq=8459 Ack=8330 Win=27744 Len=0"
"2016-09-27 05:46:36.846694","95","Application Data"
"2016-09-27 05:47:06.876613","95","Application Data"
"2016-09-27 05:47:07.142228","54","54817  >  443 [ACK] Seq=8541 Ack=8371 Win=27744 Len=0"
"2016-09-27 05:47:36.847216","54","54817  >  443 [ACK] Seq=8541 Ack=8412 Win=27744 Len=0"
"2016-09-27 05:47:36.847325","95","Application Data"
"2016-09-27 05:48:06.876801","95","Application Data"
"2016-09-27 05:48:07.134243","54","54817  >  443 [ACK] Seq=8623 Ack=8453 Win=27744 Len=0"
"2016-09-27 05:48:36.849284","54","54817  >  443 [ACK] Seq=8623 Ack=8494 Win=27744 Len=0"
"2016-09-27 05:48:36.850776","95","Application Data"
"2016-09-27 05:49:06.879701","95","Application Data"
"2016-09-27 05:49:07.141878","54","54817  >  443 [ACK] Seq=8705 Ack=8535 Win=27744 Len=0"
"2016-09-27 05:49:36.852974","54","54817  >  443 [ACK] Seq=8705 Ack=8576 Win=27744 Len=0"
"2016-09-27 05:49:36.853543","95","Application Data"
"2016-09-27 05:50:06.881143","95","Application Data"
"2016-09-27 05:50:07.150766","54","54817  >  443 [ACK] Seq=8787 Ack=8617 Win=27744 Len=0"
"2016-09-27 05:50:36.852896","54","54817  >  443 [ACK] Seq=8787 Ack=8658 Win=27744 Len=0"
"2016-09-27 05:50:36.853468","95","Application Data"
"2016-09-27 05:50:53.634791","224","Application Data"
"2016-09-27 05:51:23.644366","95","Application Data"
"2016-09-27 05:51:23.903118","54","54817  >  443 [ACK] Seq=9039 Ack=8699 Win=27744 Len=0"
"2016-09-27 05:51:36.848667","54","54817  >  443 [ACK] Seq=9039 Ack=8740 Win=27744 Len=0"
"2016-09-27 05:51:36.849193","95","Application Data"
"2016-09-27 05:52:06.877921","95","Application Data"
"2016-09-27 05:52:07.137364","54","54817  >  443 [ACK] Seq=9121 Ack=8781 Win=27744 Len=0"
"2016-09-27 05:52:36.845600","54","54817  >  443 [ACK] Seq=9121 Ack=8822 Win=27744 Len=0"
"2016-09-27 05:52:36.845716","95","Application Data"
"2016-09-27 05:53:06.873127","95","Application Data"
"2016-09-27 05:53:07.137179","54","54817  >  443 [ACK] Seq=9203 Ack=8863 Win=27744 Len=0"
"2016-09-27 05:53:36.848270","54","54817  >  443 [ACK] Seq=9203 Ack=8904 Win=27744 Len=0"
"2016-09-27 05:53:36.848810","95","Application Data"
"2016-09-27 05:54:06.875635","95","Application Data"
"2016-09-27 05:54:07.136910","54","54817  >  443 [ACK] Seq=9285 Ack=8945 Win=27744 Len=0"
"2016-09-27 05:54:36.855917","54","54817  >  443 [ACK] Seq=9285 Ack=8986 Win=27744 Len=0"
"2016-09-27 05:54:36.856459","95","Application Data"
"2016-09-27 05:55:06.886792","95","Application Data"
"2016-09-27 05:55:07.339941","95","[TCP Spurious Retransmission] "
"2016-09-27 05:55:07.609420","54","54817  >  443 [ACK] Seq=9367 Ack=9027 Win=27744 Len=0"
"2016-09-27 05:55:36.856831","54","54817  >  443 [ACK] Seq=9367 Ack=9068 Win=27744 Len=0"
"2016-09-27 05:55:36.856940","95","Application Data"
"2016-09-27 05:56:06.885160","95","Application Data"
"2016-09-27 05:56:07.154759","54","54817  >  443 [ACK] Seq=9449 Ack=9109 Win=27744 Len=0"
"2016-09-27 05:56:36.851961","54","54817  >  443 [ACK] Seq=9449 Ack=9150 Win=27744 Len=0"
"2016-09-27 05:56:36.852068","95","Application Data"
"2016-09-27 05:57:06.880502","95","Application Data"
"2016-09-27 05:57:07.140258","54","54817  >  443 [ACK] Seq=9531 Ack=9191 Win=27744 Len=0"
"2016-09-27 05:57:37.132702","95","Application Data"
"2016-09-27 05:57:37.327994","54","54817  >  443 [ACK] Seq=9572 Ack=9232 Win=27744 Len=0"
"2016-09-27 05:57:37.328557","95","Application Data"
"2016-09-27 05:57:37.589373","54","54817  >  443 [ACK] Seq=9613 Ack=9273 Win=27744 Len=0"
"2016-09-27 05:58:07.580733","95","Application Data"
"2016-09-27 05:58:07.800946","54","54817  >  443 [ACK] Seq=9654 Ack=9314 Win=27744 Len=0"
"2016-09-27 05:58:36.851959","54","54817  >  443 [ACK] Seq=9654 Ack=9355 Win=27744 Len=0"
"2016-09-27 05:58:36.852084","95","Application Data"
"2016-09-27 05:59:06.881228","95","Application Data"
"2016-09-27 05:59:07.143785","54","54817  >  443 [ACK] Seq=9736 Ack=9396 Win=27744 Len=0"
"2016-09-27 05:59:36.851159","54","54817  >  443 [ACK] Seq=9736 Ack=9437 Win=27744 Len=0"
"2016-09-27 05:59:36.851807","95","Application Data"
"2016-09-27 06:00:06.880377","95","Application Data"
"2016-09-27 06:00:07.147547","54","54817  >  443 [ACK] Seq=9818 Ack=9478 Win=27744 Len=0"
"2016-09-27 06:00:36.851649","54","54817  >  443 [ACK] Seq=9818 Ack=9519 Win=27744 Len=0"
"2016-09-27 06:00:36.851764","95","Application Data"
"2016-09-27 06:01:06.882442","95","Application Data"
"2016-09-27 06:01:07.143487","54","54817  >  443 [ACK] Seq=9900 Ack=9560 Win=27744 Len=0"
"2016-09-27 06:01:36.844147","54","54817  >  443 [ACK] Seq=9900 Ack=9601 Win=27744 Len=0"
"2016-09-27 06:01:36.844270","95","Application Data"
"2016-09-27 06:02:06.873391","95","Application Data"
"2016-09-27 06:02:07.135399","54","54817  >  443 [ACK] Seq=9982 Ack=9642 Win=27744 Len=0"
"2016-09-27 06:02:36.843540","54","54817  >  443 [ACK] Seq=9982 Ack=9683 Win=27744 Len=0"
"2016-09-27 06:02:36.843649","95","Application Data"
"2016-09-27 06:03:06.870683","95","Application Data"
"2016-09-27 06:03:07.135326","54","54817  >  443 [ACK] Seq=10064 Ack=9724 Win=27744 Len=0"
"2016-09-27 06:03:36.850237","54","54817  >  443 [ACK] Seq=10064 Ack=9765 Win=27744 Len=0"
"2016-09-27 06:03:36.850767","95","Application Data"
"2016-09-27 06:04:06.883001","95","Application Data"
"2016-09-27 06:04:07.147268","54","54817  >  443 [ACK] Seq=10146 Ack=9806 Win=27744 Len=0"
"2016-09-27 06:04:37.134662","95","Application Data"
"2016-09-27 06:04:37.318850","54","54817  >  443 [ACK] Seq=10187 Ack=9847 Win=27744 Len=0"
"2016-09-27 06:04:37.320060","95","Application Data"
"2016-09-27 06:04:37.591972","54","54817  >  443 [ACK] Seq=10228 Ack=9888 Win=27744 Len=0"
"2016-09-27 06:05:07.583840","95","Application Data"
"2016-09-27 06:05:07.811412","54","54817  >  443 [ACK] Seq=10269 Ack=9929 Win=27744 Len=0"
"2016-09-27 06:05:36.854638","54","54817  >  443 [ACK] Seq=10269 Ack=9970 Win=27744 Len=0"
"2016-09-27 06:05:36.854756","95","Application Data"
"2016-09-27 06:06:06.883618","95","Application Data"
"2016-09-27 06:06:07.334443","95","[TCP Spurious Retransmission] "
"2016-09-27 06:06:07.607286","54","54817  >  443 [ACK] Seq=10351 Ack=10011 Win=27744 Len=0"
"2016-09-27 06:06:36.849672","54","54817  >  443 [ACK] Seq=10351 Ack=10052 Win=27744 Len=0"
"2016-09-27 06:06:36.851623","95","Application Data"
"2016-09-27 06:07:06.878046","95","Application Data"
"2016-09-27 06:07:07.142290","54","54817  >  443 [ACK] Seq=10433 Ack=10093 Win=27744 Len=0"
"2016-09-27 06:07:36.854238","54","54817  >  443 [ACK] Seq=10433 Ack=10134 Win=27744 Len=0"
"2016-09-27 06:07:36.854349","95","Application Data"
"2016-09-27 06:08:06.880560","95","Application Data"
"2016-09-27 06:08:07.145902","54","54817  >  443 [ACK] Seq=10515 Ack=10175 Win=27744 Len=0"
"2016-09-27 06:08:15.418357","54","54817  >  443 [ACK] Seq=10515 Ack=10376 Win=27744 Len=0"
"2016-09-27 06:08:36.846060","54","54817  >  443 [ACK] Seq=10515 Ack=10417 Win=27744 Len=0"
"2016-09-27 06:08:36.846176","95","Application Data"
"2016-09-27 06:09:06.874153","95","Application Data"
"2016-09-27 06:09:07.144067","54","54817  >  443 [ACK] Seq=10597 Ack=10458 Win=27744 Len=0"
"2016-09-27 06:09:36.849891","54","54817  >  443 [ACK] Seq=10597 Ack=10499 Win=27744 Len=0"
"2016-09-27 06:09:36.849999","95","Application Data"
"2016-09-27 06:10:06.874996","95","Application Data"
"2016-09-27 06:10:07.141624","54","54817  >  443 [ACK] Seq=10679 Ack=10540 Win=27744 Len=0"
"2016-09-27 06:10:36.847543","54","54817  >  443 [ACK] Seq=10679 Ack=10581 Win=27744 Len=0"
"2016-09-27 06:10:36.847670","95","Application Data"
"2016-09-27 06:11:06.873510","95","Application Data"
"2016-09-27 06:11:07.133638","54","54817  >  443 [ACK] Seq=10761 Ack=10622 Win=27744 Len=0"
"2016-09-27 06:11:36.860467","54","54817  >  443 [ACK] Seq=10761 Ack=10663 Win=27744 Len=0"
"2016-09-27 06:11:36.861023","95","Application Data"
"2016-09-27 06:11:37.313250","95","[TCP Spurious Retransmission] "
"2016-09-27 06:11:38.219570","95","[TCP Spurious Retransmission] "
"2016-09-27 06:12:06.888690","95","Application Data"
"2016-09-27 06:12:07.149073","54","54817  >  443 [ACK] Seq=10843 Ack=10704 Win=27744 Len=0"
"2016-09-27 06:12:36.851940","54","54817  >  443 [ACK] Seq=10843 Ack=10745 Win=27744 Len=0"
"2016-09-27 06:12:36.852475","95","Application Data"
"2016-09-27 06:13:06.890648","95","Application Data"
"2016-09-27 06:13:07.154913","54","54817  >  443 [ACK] Seq=10925 Ack=10786 Win=27744 Len=0"
"2016-09-27 06:13:36.850403","54","54817  >  443 [ACK] Seq=10925 Ack=10827 Win=27744 Len=0"
"2016-09-27 06:13:36.850920","95","Application Data"
"2016-09-27 06:14:06.878247","95","Application Data"
"2016-09-27 06:14:07.135170","54","54817  >  443 [ACK] Seq=11007 Ack=10868 Win=27744 Len=0"
"2016-09-27 06:14:36.843677","54","54817  >  443 [ACK] Seq=11007 Ack=10909 Win=27744 Len=0"
"2016-09-27 06:14:36.843786","95","Application Data"
"2016-09-27 06:15:06.873234","95","Application Data"
"2016-09-27 06:15:07.134981","54","54817  >  443 [ACK] Seq=11089 Ack=10950 Win=27744 Len=0"
"2016-09-27 06:15:36.846906","54","54817  >  443 [ACK] Seq=11089 Ack=10991 Win=27744 Len=0"
"2016-09-27 06:15:36.847026","95","Application Data"
"2016-09-27 06:16:06.877303","95","Application Data"
"2016-09-27 06:16:07.330174","95","[TCP Spurious Retransmission] "
"2016-09-27 06:16:07.596156","54","54817  >  443 [ACK] Seq=11171 Ack=11032 Win=27744 Len=0"
"2016-09-27 06:16:36.846744","54","54817  >  443 [ACK] Seq=11171 Ack=11073 Win=27744 Len=0"
"2016-09-27 06:16:36.847317","95","Application Data"
"2016-09-27 06:17:06.877170","95","Application Data"
"2016-09-27 06:17:07.134590","54","54817  >  443 [ACK] Seq=11253 Ack=11114 Win=27744 Len=0"
"2016-09-27 06:17:36.849645","54","54817  >  443 [ACK] Seq=11253 Ack=11155 Win=27744 Len=0"
"2016-09-27 06:17:36.850206","95","Application Data"
"2016-09-27 06:18:06.880374","95","Application Data"
"2016-09-27 06:18:07.146082","54","54817  >  443 [ACK] Seq=11335 Ack=11196 Win=27744 Len=0"
"2016-09-27 06:18:36.858489","54","54817  >  443 [ACK] Seq=11335 Ack=11237 Win=27744 Len=0"
"2016-09-27 06:18:36.858605","95","Application Data"
"2016-09-27 06:19:06.888637","95","Application Data"
"2016-09-27 06:19:07.149853","54","54817  >  443 [ACK] Seq=11417 Ack=11278 Win=27744 Len=0"
"2016-09-27 06:19:25.610605","85","Encrypted Alert"
"2016-09-27 06:19:25.634231","54","54817  >  443 [FIN"
"2016-09-27 06:19:25.865167","54","54817  >  443 [RST] Seq=11448 Win=0 Len=0"
"2016-09-27 06:19:25.865277","54","54817  >  443 [RST] Seq=11449 Win=0 Len=0"
"2016-09-27 07:23:20.878198","74","36693  >  443 [SYN] Seq=0 Win=4380 Len=0 MSS=1460 SACK_PERM=1 TSval=59408305 TSecr=0 WS=16"
"2016-09-27 07:23:21.090100","54","36693  >  443 [ACK] Seq=1 Ack=1 Win=4384 Len=0"
"2016-09-27 07:23:21.221564","371","Client Hello"
"2016-09-27 07:23:21.443093","54","36693  >  443 [ACK] Seq=318 Ack=1461 Win=7312 Len=0"
"2016-09-27 07:23:21.445401","54","36693  >  443 [ACK] Seq=318 Ack=2921 Win=10224 Len=0"
"2016-09-27 07:23:21.445489","54","36693  >  443 [ACK] Seq=318 Ack=3294 Win=13152 Len=0"
"2016-09-27 07:23:21.471304","180","Client Key Exchange"
"2016-09-27 07:23:21.685315","54","36693  >  443 [ACK] Seq=444 Ack=3345 Win=13152 Len=0"
"2016-09-27 07:23:21.737867","1514","36693  >  443 [ACK] Seq=444 Ack=3345 Win=13152 Len=1460 [TCP segment of a reassembled PDU]"
"2016-09-27 07:23:21.737992","432","Application Data"
"2016-09-27 07:23:22.076931","54","36693  >  443 [ACK] Seq=2282 Ack=3887 Win=18992 Len=0"
"2016-09-27 07:23:22.156217","54","36693  >  443 [ACK] Seq=2282 Ack=4056 Win=21904 Len=0"
"2016-09-27 07:23:22.220902","261","Application Data"
"2016-09-27 07:23:22.237230","276","Application Data"
"2016-09-27 07:23:22.248339","546","Application Data"
"2016-09-27 07:23:22.253144","379","Application Data"
"2016-09-27 07:23:22.288912","189","Application Data"
"2016-09-27 07:23:22.298750","183","Application Data"
"2016-09-27 07:23:22.447235","147","Application Data"
"2016-09-27 07:23:22.447339","381","Application Data"
"2016-09-27 07:23:26.687896","54","36693  >  443 [ACK] Seq=4212 Ack=4097 Win=21904 Len=0"
"2016-09-27 07:23:26.688011","95","Application Data"
"2016-09-27 07:23:56.717970","95","Application Data"
"2016-09-27 07:23:57.563388","54","36693  >  443 [ACK] Seq=4294 Ack=4138 Win=21904 Len=0"
"2016-09-27 07:24:26.688491","54","36693  >  443 [ACK] Seq=4294 Ack=4179 Win=21904 Len=0"
"2016-09-27 07:24:26.688606","95","Application Data"
"2016-09-27 07:24:56.719179","95","Application Data"
"2016-09-27 07:24:56.968401","54","36693  >  443 [ACK] Seq=4376 Ack=4220 Win=21904 Len=0"
"2016-09-27 07:25:26.692127","54","36693  >  443 [ACK] Seq=4376 Ack=4261 Win=21904 Len=0"
"2016-09-27 07:25:26.692241","95","Application Data"
"2016-09-27 07:25:56.722301","95","Application Data"
"2016-09-27 07:25:56.975987","54","36693  >  443 [ACK] Seq=4458 Ack=4302 Win=21904 Len=0"
"2016-09-27 07:26:26.687630","54","36693  >  443 [ACK] Seq=4458 Ack=4343 Win=21904 Len=0"
"2016-09-27 07:26:26.687799","95","Application Data"
"2016-09-27 07:26:56.717957","95","Application Data"
"2016-09-27 07:26:56.967976","54","36693  >  443 [ACK] Seq=4540 Ack=4384 Win=21904 Len=0"
"2016-09-27 07:27:26.690883","54","36693  >  443 [ACK] Seq=4540 Ack=4425 Win=21904 Len=0"
"2016-09-27 07:27:26.691444","95","Application Data"
"2016-09-27 07:27:56.719709","95","Application Data"
"2016-09-27 07:27:56.976177","54","36693  >  443 [ACK] Seq=4622 Ack=4466 Win=21904 Len=0"
"2016-09-27 07:28:26.682817","54","36693  >  443 [ACK] Seq=4622 Ack=4507 Win=21904 Len=0"
"2016-09-27 07:28:26.683343","95","Application Data"
"2016-09-27 07:28:56.712692","95","Application Data"
"2016-09-27 07:28:57.416768","54","36693  >  443 [ACK] Seq=4704 Ack=4548 Win=21904 Len=0"
"2016-09-27 07:29:26.683098","54","36693  >  443 [ACK] Seq=4704 Ack=4589 Win=21904 Len=0"
"2016-09-27 07:29:26.683209","95","Application Data"
"2016-09-27 07:29:35.405011","54","36693  >  443 [ACK] Seq=4745 Ack=4960 Win=24832 Len=0"
"2016-09-27 07:29:35.831461","209","Application Data"
"2016-09-27 07:29:36.045978","54","36693  >  443 [ACK] Seq=4900 Ack=5131 Win=27744 Len=0"
"2016-09-27 07:29:37.905177","200","Application Data"
"2016-09-27 07:29:38.002131","337","Application Data"
"2016-09-27 07:30:08.057613","95","Application Data"
"2016-09-27 07:30:08.269016","54","36693  >  443 [ACK] Seq=5370 Ack=5172 Win=27744 Len=0"
"2016-09-27 07:30:26.690362","54","36693  >  443 [ACK] Seq=5370 Ack=5213 Win=27744 Len=0"
"2016-09-27 07:30:26.690913","95","Application Data"
"2016-09-27 07:30:56.717540","95","Application Data"
"2016-09-27 07:30:56.972256","54","36693  >  443 [ACK] Seq=5452 Ack=5254 Win=27744 Len=0"
"2016-09-27 07:31:26.687856","54","36693  >  443 [ACK] Seq=5452 Ack=5295 Win=27744 Len=0"
"2016-09-27 07:31:26.689590","95","Application Data"
"2016-09-27 07:31:56.717184","95","Application Data"
"2016-09-27 07:31:56.965481","54","36693  >  443 [ACK] Seq=5534 Ack=5336 Win=27744 Len=0"
"2016-09-27 07:32:26.955943","95","Application Data"
"2016-09-27 07:32:27.128438","54","36693  >  443 [ACK] Seq=5575 Ack=5377 Win=27744 Len=0"
"2016-09-27 07:32:27.128971","95","Application Data"
"2016-09-27 07:32:27.378612","54","36693  >  443 [ACK] Seq=5616 Ack=5418 Win=27744 Len=0"
"2016-09-27 07:32:57.370323","95","Application Data"
"2016-09-27 07:32:57.805376","95","[TCP Spurious Retransmission] "
"2016-09-27 07:32:58.046552","54","36693  >  443 [ACK] Seq=5657 Ack=5459 Win=27744 Len=0"
"2016-09-27 07:33:26.690749","54","36693  >  443 [ACK] Seq=5657 Ack=5500 Win=27744 Len=0"
"2016-09-27 07:33:26.691288","95","Application Data"
"2016-09-27 07:33:56.721326","95","Application Data"
"2016-09-27 07:33:56.975638","54","36693  >  443 [ACK] Seq=5739 Ack=5541 Win=27744 Len=0"
"2016-09-27 07:34:26.692305","54","36693  >  443 [ACK] Seq=5739 Ack=5582 Win=27744 Len=0"
"2016-09-27 07:34:26.692423","95","Application Data"
"2016-09-27 07:34:56.719177","95","Application Data"
"2016-09-27 07:34:56.967504","54","36693  >  443 [ACK] Seq=5821 Ack=5623 Win=27744 Len=0"
"2016-09-27 07:35:26.683336","54","36693  >  443 [ACK] Seq=5821 Ack=5664 Win=27744 Len=0"
"2016-09-27 07:35:26.683434","95","Application Data"
"2016-09-27 07:35:56.713092","95","Application Data"
"2016-09-27 07:35:56.959539","54","36693  >  443 [ACK] Seq=5903 Ack=5705 Win=27744 Len=0"
"2016-09-27 07:36:26.682408","54","36693  >  443 [ACK] Seq=5903 Ack=5746 Win=27744 Len=0"
"2016-09-27 07:36:26.683077","95","Application Data"
"2016-09-27 07:36:56.709721","95","Application Data"
"2016-09-27 07:36:56.959665","54","36693  >  443 [ACK] Seq=5985 Ack=5787 Win=27744 Len=0"
"2016-09-27 07:37:26.686673","54","36693  >  443 [ACK] Seq=5985 Ack=5828 Win=27744 Len=0"
"2016-09-27 07:37:26.686787","95","Application Data"
"2016-09-27 07:37:56.714855","95","Application Data"
"2016-09-27 07:37:56.966975","54","36693  >  443 [ACK] Seq=6067 Ack=5869 Win=27744 Len=0"
"2016-09-27 07:38:26.690970","54","36693  >  443 [ACK] Seq=6067 Ack=5910 Win=27744 Len=0"
"2016-09-27 07:38:26.691088","95","Application Data"
"2016-09-27 07:38:56.719055","95","Application Data"
"2016-09-27 07:38:57.427709","54","36693  >  443 [ACK] Seq=6149 Ack=5951 Win=27744 Len=0"
"2016-09-27 07:39:26.682717","54","36693  >  443 [ACK] Seq=6149 Ack=5992 Win=27744 Len=0"
"2016-09-27 07:39:26.682828","95","Application Data"
"2016-09-27 07:39:56.710969","95","Application Data"
"2016-09-27 07:39:56.966624","54","36693  >  443 [ACK] Seq=6231 Ack=6033 Win=27744 Len=0"
"2016-09-27 07:40:26.685633","54","36693  >  443 [ACK] Seq=6231 Ack=6074 Win=27744 Len=0"
"2016-09-27 07:40:26.686235","95","Application Data"
"2016-09-27 07:40:56.712663","95","Application Data"
"2016-09-27 07:40:56.962547","54","36693  >  443 [ACK] Seq=6313 Ack=6115 Win=27744 Len=0"
"2016-09-27 07:41:26.682626","54","36693  >  443 [ACK] Seq=6313 Ack=6156 Win=27744 Len=0"
"2016-09-27 07:41:26.682734","95","Application Data"
"2016-09-27 07:41:56.712447","95","Application Data"
"2016-09-27 07:41:56.970152","54","36693  >  443 [ACK] Seq=6395 Ack=6197 Win=27744 Len=0"
"2016-09-27 07:42:26.965845","95","Application Data"
"2016-09-27 07:42:27.138313","54","36693  >  443 [ACK] Seq=6436 Ack=6238 Win=27744 Len=0"
"2016-09-27 07:42:27.139458","95","Application Data"
"2016-09-27 07:42:27.388847","54","36693  >  443 [ACK] Seq=6477 Ack=6279 Win=27744 Len=0"
"2016-09-27 07:42:57.374015","95","Application Data"
"2016-09-27 07:42:57.591823","54","36693  >  443 [ACK] Seq=6518 Ack=6320 Win=27744 Len=0"
"2016-09-27 07:43:26.685003","54","36693  >  443 [ACK] Seq=6518 Ack=6361 Win=27744 Len=0"
"2016-09-27 07:43:26.685550","95","Application Data"
"2016-09-27 07:43:56.713992","95","Application Data"
"2016-09-27 07:43:56.962088","54","36693  >  443 [ACK] Seq=6600 Ack=6402 Win=27744 Len=0"
"2016-09-27 07:44:26.693448","54","36693  >  443 [ACK] Seq=6600 Ack=6443 Win=27744 Len=0"
"2016-09-27 07:44:26.693571","95","Application Data"
"2016-09-27 07:44:56.721970","95","Application Data"
"2016-09-27 07:44:56.977417","54","36693  >  443 [ACK] Seq=6682 Ack=6484 Win=27744 Len=0"
"2016-09-27 07:45:26.692558","54","36693  >  443 [ACK] Seq=6682 Ack=6525 Win=27744 Len=0"
"2016-09-27 07:45:26.693074","95","Application Data"
"2016-09-27 07:45:56.719899","95","Application Data"
"2016-09-27 07:45:56.970146","54","36693  >  443 [ACK] Seq=6764 Ack=6566 Win=27744 Len=0"
"2016-09-27 07:46:26.689934","54","36693  >  443 [ACK] Seq=6764 Ack=6607 Win=27744 Len=0"
"2016-09-27 07:46:26.690419","95","Application Data"
"2016-09-27 07:46:56.715677","95","Application Data"
"2016-09-27 07:46:56.973151","54","36693  >  443 [ACK] Seq=6846 Ack=6648 Win=27744 Len=0"
"2016-09-27 07:47:26.965269","95","Application Data"
"2016-09-27 07:47:27.157037","54","36693  >  443 [ACK] Seq=6887 Ack=6689 Win=27744 Len=0"
"2016-09-27 07:47:27.157601","95","Application Data"
"2016-09-27 07:47:27.430089","54","36693  >  443 [ACK] Seq=6928 Ack=6730 Win=27744 Len=0"
"2016-09-27 07:47:57.418659","95","Application Data"
"2016-09-27 07:47:57.625967","54","36693  >  443 [ACK] Seq=6969 Ack=6771 Win=27744 Len=0"
"2016-09-27 07:48:26.691919","54","36693  >  443 [ACK] Seq=6969 Ack=6812 Win=27744 Len=0"
"2016-09-27 07:48:26.692459","95","Application Data"
"2016-09-27 07:48:56.721698","95","Application Data"
"2016-09-27 07:48:56.972816","54","36693  >  443 [ACK] Seq=7051 Ack=6853 Win=27744 Len=0"
"2016-09-27 07:49:26.694229","54","36693  >  443 [ACK] Seq=7051 Ack=6894 Win=27744 Len=0"
"2016-09-27 07:49:26.694343","95","Application Data"
"2016-09-27 07:49:56.723925","95","Application Data"
"2016-09-27 07:49:56.984943","54","36693  >  443 [ACK] Seq=7133 Ack=6935 Win=27744 Len=0"
"2016-09-27 07:50:26.684502","54","36693  >  443 [ACK] Seq=7133 Ack=6976 Win=27744 Len=0"
"2016-09-27 07:50:26.684608","95","Application Data"
"2016-09-27 07:50:53.622492","224","Application Data"
"2016-09-27 07:51:23.648501","95","Application Data"
"2016-09-27 07:51:23.898132","54","36693  >  443 [ACK] Seq=7385 Ack=7017 Win=27744 Len=0"
"2016-09-27 07:51:26.684364","54","36693  >  443 [ACK] Seq=7385 Ack=7058 Win=27744 Len=0"
"2016-09-27 07:51:26.684467","95","Application Data"
"2016-09-27 07:51:56.712334","95","Application Data"
"2016-09-27 07:51:56.968447","54","36693  >  443 [ACK] Seq=7467 Ack=7099 Win=27744 Len=0"
"2016-09-27 07:52:26.694660","54","36693  >  443 [ACK] Seq=7467 Ack=7140 Win=27744 Len=0"
"2016-09-27 07:52:26.694764","95","Application Data"
"2016-09-27 07:52:56.719243","95","Application Data"
"2016-09-27 07:52:57.163565","95","[TCP Spurious Retransmission] "
"2016-09-27 07:52:57.435191","54","36693  >  443 [ACK] Seq=7549 Ack=7181 Win=27744 Len=0"
"2016-09-27 07:53:26.687198","54","36693  >  443 [ACK] Seq=7549 Ack=7222 Win=27744 Len=0"
"2016-09-27 07:53:26.687756","95","Application Data"
"2016-09-27 07:53:56.720281","95","Application Data"
"2016-09-27 07:53:56.979781","54","36693  >  443 [ACK] Seq=7631 Ack=7263 Win=27744 Len=0"
"2016-09-27 07:54:26.698682","54","36693  >  443 [ACK] Seq=7631 Ack=7304 Win=27744 Len=0"
"2016-09-27 07:54:26.700832","95","Application Data"
"2016-09-27 07:54:56.736042","95","Application Data"
"2016-09-27 07:54:57.437031","54","36693  >  443 [ACK] Seq=7713 Ack=7345 Win=27744 Len=0"
"2016-09-27 07:55:26.682845","54","36693  >  443 [ACK] Seq=7713 Ack=7386 Win=27744 Len=0"
"2016-09-27 07:55:26.684491","95","Application Data"
"2016-09-27 07:55:56.715330","95","Application Data"
"2016-09-27 07:55:56.986641","54","36693  >  443 [ACK] Seq=7795 Ack=7427 Win=27744 Len=0"
"2016-09-27 07:56:26.687518","54","36693  >  443 [ACK] Seq=7795 Ack=7468 Win=27744 Len=0"
"2016-09-27 07:56:26.687647","95","Application Data"
"2016-09-27 07:56:56.714741","95","Application Data"
"2016-09-27 07:56:56.967516","54","36693  >  443 [ACK] Seq=7877 Ack=7509 Win=27744 Len=0"
"2016-09-27 07:57:26.691140","54","36693  >  443 [ACK] Seq=7877 Ack=7550 Win=27744 Len=0"
"2016-09-27 07:57:26.691258","95","Application Data"
"2016-09-27 07:57:56.713744","95","Application Data"
"2016-09-27 07:57:56.959236","54","36693  >  443 [ACK] Seq=7959 Ack=7591 Win=27744 Len=0"
"2016-09-27 07:58:26.694064","54","36693  >  443 [ACK] Seq=7959 Ack=7632 Win=27744 Len=0"
"2016-09-27 07:58:26.694618","95","Application Data"
"2016-09-27 07:58:56.725439","95","Application Data"
"2016-09-27 07:58:56.978827","54","36693  >  443 [ACK] Seq=8041 Ack=7673 Win=27744 Len=0"
"2016-09-27 07:59:26.988076","95","Application Data"
"2016-09-27 07:59:27.151866","54","36693  >  443 [ACK] Seq=8082 Ack=7714 Win=27744 Len=0"
"2016-09-27 07:59:27.151971","95","Application Data"
"2016-09-27 07:59:27.401259","54","36693  >  443 [ACK] Seq=8123 Ack=7755 Win=27744 Len=0"
"2016-09-27 07:59:57.392249","95","Application Data"
"2016-09-27 07:59:57.608440","54","36693  >  443 [ACK] Seq=8164 Ack=7796 Win=27744 Len=0"
"2016-09-27 08:00:26.684202","54","36693  >  443 [ACK] Seq=8164 Ack=7837 Win=27744 Len=0"
"2016-09-27 08:00:26.684312","95","Application Data"
"2016-09-27 08:00:56.709646","95","Application Data"
"2016-09-27 08:00:56.968194","54","36693  >  443 [ACK] Seq=8246 Ack=7878 Win=27744 Len=0"
"2016-09-27 08:01:26.955644","95","Application Data"
"2016-09-27 08:01:27.396450","95","[TCP Spurious Retransmission] "
"2016-09-27 08:01:28.077493","54","36693  >  443 [ACK] Seq=8287 Ack=7919 Win=27744 Len=0"
"2016-09-27 08:01:28.088745","95","Application Data"
"2016-09-27 08:01:28.330366","54","36693  >  443 [ACK] Seq=8328 Ack=7960 Win=27744 Len=0"
"2016-09-27 08:01:58.320969","95","Application Data"
"2016-09-27 08:01:58.537956","54","36693  >  443 [ACK] Seq=8369 Ack=8001 Win=27744 Len=0"
"2016-09-27 08:02:26.690268","54","36693  >  443 [ACK] Seq=8369 Ack=8042 Win=27744 Len=0"
"2016-09-27 08:02:26.690851","95","Application Data"
"2016-09-27 08:02:56.721526","95","Application Data"
"2016-09-27 08:02:56.989333","54","36693  >  443 [ACK] Seq=8451 Ack=8083 Win=27744 Len=0"
"2016-09-27 08:03:26.685400","54","36693  >  443 [ACK] Seq=8451 Ack=8124 Win=27744 Len=0"
"2016-09-27 08:03:26.685948","95","Application Data"
"2016-09-27 08:03:56.712688","95","Application Data"
"2016-09-27 08:03:56.958479","54","36693  >  443 [ACK] Seq=8533 Ack=8165 Win=27744 Len=0"
"2016-09-27 08:04:26.690041","54","36693  >  443 [ACK] Seq=8533 Ack=8206 Win=27744 Len=0"
"2016-09-27 08:04:26.690148","95","Application Data"
"2016-09-27 08:04:56.718929","95","Application Data"
"2016-09-27 08:04:56.966278","54","36693  >  443 [ACK] Seq=8615 Ack=8247 Win=27744 Len=0"
"2016-09-27 08:05:26.691255","54","36693  >  443 [ACK] Seq=8615 Ack=8288 Win=27744 Len=0"
"2016-09-27 08:05:26.691353","95","Application Data"
"2016-09-27 08:05:56.719183","95","Application Data"
"2016-09-27 08:05:56.977604","54","36693  >  443 [ACK] Seq=8697 Ack=8329 Win=27744 Len=0"
"2016-09-27 08:06:26.685724","54","36693  >  443 [ACK] Seq=8697 Ack=8370 Win=27744 Len=0"
"2016-09-27 08:06:26.685841","95","Application Data"
"2016-09-27 08:06:56.719344","95","Application Data"
"2016-09-27 08:06:56.969728","54","36693  >  443 [ACK] Seq=8779 Ack=8411 Win=27744 Len=0"
"2016-09-27 08:07:26.685422","54","36693  >  443 [ACK] Seq=8779 Ack=8452 Win=27744 Len=0"
"2016-09-27 08:07:26.685535","95","Application Data"
"2016-09-27 08:07:56.715269","95","Application Data"
"2016-09-27 08:07:56.965600","54","36693  >  443 [ACK] Seq=8861 Ack=8493 Win=27744 Len=0"
"2016-09-27 08:08:26.704051","54","36693  >  443 [ACK] Seq=8861 Ack=8534 Win=27744 Len=0"
"2016-09-27 08:08:26.704581","95","Application Data"
"2016-09-27 08:08:56.731430","95","Application Data"
"2016-09-27 08:08:56.980974","54","36693  >  443 [ACK] Seq=8943 Ack=8575 Win=27744 Len=0"
"2016-09-27 08:09:26.692136","54","36693  >  443 [ACK] Seq=8943 Ack=8616 Win=27744 Len=0"
"2016-09-27 08:09:26.692677","95","Application Data"
"2016-09-27 08:09:56.722955","95","Application Data"
"2016-09-27 08:09:56.991926","54","36693  >  443 [ACK] Seq=9025 Ack=8657 Win=27744 Len=0"
"2016-09-27 08:10:26.692737","54","36693  >  443 [ACK] Seq=9025 Ack=8698 Win=27744 Len=0"
"2016-09-27 08:10:26.692852","95","Application Data"
"2016-09-27 08:10:56.725528","95","Application Data"
"2016-09-27 08:10:57.165799","95","[TCP Spurious Retransmission] "
"2016-09-27 08:10:57.446340","54","36693  >  443 [ACK] Seq=9107 Ack=8739 Win=27744 Len=0"
"2016-09-27 08:11:26.688013","54","36693  >  443 [ACK] Seq=9107 Ack=8780 Win=27744 Len=0"
"2016-09-27 08:11:26.689417","95","Application Data"
"2016-09-27 08:11:56.721519","95","Application Data"
"2016-09-27 08:11:56.972643","54","36693  >  443 [ACK] Seq=9189 Ack=8821 Win=27744 Len=0"
"2016-09-27 08:12:26.683852","54","36693  >  443 [ACK] Seq=9189 Ack=8862 Win=27744 Len=0"
"2016-09-27 08:12:26.684397","95","Application Data"
"2016-09-27 08:12:56.712807","95","Application Data"
"2016-09-27 08:12:57.160003","95","[TCP Spurious Retransmission] "
"2016-09-27 08:12:57.417836","54","36693  >  443 [ACK] Seq=9271 Ack=8903 Win=27744 Len=0"
"2016-09-27 08:13:26.686892","54","36693  >  443 [ACK] Seq=9271 Ack=8944 Win=27744 Len=0"
"2016-09-27 08:13:26.687415","95","Application Data"
"2016-09-27 08:13:56.727233","95","Application Data"
"2016-09-27 08:13:56.983414","54","36693  >  443 [ACK] Seq=9353 Ack=8985 Win=27744 Len=0"
"2016-09-27 08:14:26.683672","54","36693  >  443 [ACK] Seq=9353 Ack=9026 Win=27744 Len=0"
"2016-09-27 08:14:26.683781","95","Application Data"
"2016-09-27 08:14:56.710868","95","Application Data"
"2016-09-27 08:14:56.967631","54","36693  >  443 [ACK] Seq=9435 Ack=9067 Win=27744 Len=0"
"2016-09-27 08:15:26.959356","95","Application Data"
"2016-09-27 08:15:27.405092","95","[TCP Spurious Retransmission] "
"2016-09-27 08:15:28.061589","54","36693  >  443 [ACK] Seq=9476 Ack=9108 Win=27744 Len=0"
"2016-09-27 08:15:28.062120","95","Application Data"
"2016-09-27 08:15:28.312136","54","36693  >  443 [ACK] Seq=9517 Ack=9149 Win=27744 Len=0"
"2016-09-27 08:15:58.300965","95","Application Data"
"2016-09-27 08:15:58.512001","54","36693  >  443 [ACK] Seq=9558 Ack=9190 Win=27744 Len=0"
"2016-09-27 08:16:26.684650","54","36693  >  443 [ACK] Seq=9558 Ack=9231 Win=27744 Len=0"
"2016-09-27 08:16:26.684760","95","Application Data"
"2016-09-27 08:16:56.712192","95","Application Data"
"2016-09-27 08:16:56.961196","54","36693  >  443 [ACK] Seq=9640 Ack=9272 Win=27744 Len=0"
"2016-09-27 08:17:26.687743","54","36693  >  443 [ACK] Seq=9640 Ack=9313 Win=27744 Len=0"
"2016-09-27 08:17:26.687863","95","Application Data"
"2016-09-27 08:17:56.715443","95","Application Data"
"2016-09-27 08:17:57.155078","95","[TCP Spurious Retransmission] "
"2016-09-27 08:17:57.424100","54","36693  >  443 [ACK] Seq=9722 Ack=9354 Win=27744 Len=0"
"2016-09-27 08:18:26.682211","54","36693  >  443 [ACK] Seq=9722 Ack=9395 Win=27744 Len=0"
"2016-09-27 08:18:26.682766","95","Application Data"
"2016-09-27 08:18:56.713992","95","Application Data"
"2016-09-27 08:18:56.970848","54","36693  >  443 [ACK] Seq=9804 Ack=9436 Win=27744 Len=0"
"2016-09-27 08:19:26.961862","95","Application Data"
"2016-09-27 08:19:27.147056","54","36693  >  443 [ACK] Seq=9845 Ack=9477 Win=27744 Len=0"
"2016-09-27 08:19:27.147608","95","Application Data"
"2016-09-27 08:19:27.396568","54","36693  >  443 [ACK] Seq=9886 Ack=9518 Win=27744 Len=0"
"2016-09-27 08:19:57.388096","95","Application Data"
"2016-09-27 08:19:57.603836","54","36693  >  443 [ACK] Seq=9927 Ack=9559 Win=27744 Len=0"
"2016-09-27 08:20:26.689696","54","36693  >  443 [ACK] Seq=9927 Ack=9600 Win=27744 Len=0"
"2016-09-27 08:20:26.690222","95","Application Data"
"2016-09-27 08:20:56.716980","95","Application Data"
"2016-09-27 08:20:56.970520","54","36693  >  443 [ACK] Seq=10009 Ack=9641 Win=27744 Len=0"
"2016-09-27 08:21:26.686869","54","36693  >  443 [ACK] Seq=10009 Ack=9682 Win=27744 Len=0"
"2016-09-27 08:21:26.686979","95","Application Data"
"2016-09-27 08:21:56.718938","95","Application Data"
"2016-09-27 08:21:57.423433","54","36693  >  443 [ACK] Seq=10091 Ack=9723 Win=27744 Len=0"
"2016-09-27 08:22:26.705607","54","36693  >  443 [ACK] Seq=10091 Ack=9764 Win=27744 Len=0"
"2016-09-27 08:22:26.705726","95","Application Data"
"2016-09-27 08:22:56.733384","95","Application Data"
"2016-09-27 08:22:57.442787","54","36693  >  443 [ACK] Seq=10173 Ack=9805 Win=27744 Len=0"
"2016-09-27 08:23:26.689855","54","36693  >  443 [ACK] Seq=10173 Ack=9846 Win=27744 Len=0"
"2016-09-27 08:23:26.689969","95","Application Data"
"2016-09-27 08:23:56.719931","95","Application Data"
"2016-09-27 08:23:56.973890","54","36693  >  443 [ACK] Seq=10255 Ack=9887 Win=27744 Len=0"
"2016-09-27 08:24:26.685958","54","36693  >  443 [ACK] Seq=10255 Ack=9928 Win=27744 Len=0"
"2016-09-27 08:24:26.686060","95","Application Data"
"2016-09-27 08:24:56.713982","95","Application Data"
"2016-09-27 08:24:57.157637","95","[TCP Spurious Retransmission] "
"2016-09-27 08:24:57.415204","54","36693  >  443 [ACK] Seq=10337 Ack=9969 Win=27744 Len=0"
"2016-09-27 08:25:26.693381","54","36693  >  443 [ACK] Seq=10337 Ack=10010 Win=27744 Len=0"
"2016-09-27 08:25:26.693500","95","Application Data"
"2016-09-27 08:25:56.721909","95","Application Data"
"2016-09-27 08:25:56.977447","54","36693  >  443 [ACK] Seq=10419 Ack=10051 Win=27744 Len=0"
"2016-09-27 08:26:26.686072","54","36693  >  443 [ACK] Seq=10419 Ack=10092 Win=27744 Len=0"
"2016-09-27 08:26:26.686184","95","Application Data"
"2016-09-27 08:26:56.715687","95","Application Data"
"2016-09-27 08:26:56.961693","54","36693  >  443 [ACK] Seq=10501 Ack=10133 Win=27744 Len=0"
"2016-09-27 08:27:26.688427","54","36693  >  443 [ACK] Seq=10501 Ack=10174 Win=27744 Len=0"
"2016-09-27 08:27:26.689002","95","Application Data"
"2016-09-27 08:27:56.718337","95","Application Data"
"2016-09-27 08:27:56.966400","54","36693  >  443 [ACK] Seq=10583 Ack=10215 Win=27744 Len=0"
"2016-09-27 08:28:26.692166","54","36693  >  443 [ACK] Seq=10583 Ack=10256 Win=27744 Len=0"
"2016-09-27 08:28:26.692693","95","Application Data"
"2016-09-27 08:28:56.719570","95","Application Data"
"2016-09-27 08:28:56.973542","54","36693  >  443 [ACK] Seq=10665 Ack=10297 Win=27744 Len=0"
"2016-09-27 08:29:26.963338","95","Application Data"
"2016-09-27 08:29:27.402700","95","[TCP Spurious Retransmission] "
"2016-09-27 08:29:28.063070","54","36693  >  443 [ACK] Seq=10706 Ack=10338 Win=27744 Len=0"
"2016-09-27 08:29:28.064044","95","Application Data"
"2016-09-27 08:29:28.313061","54","36693  >  443 [ACK] Seq=10747 Ack=10379 Win=27744 Len=0"
"2016-09-27 08:29:38.321828","54","36693  >  443 [ACK] Seq=10747 Ack=10580 Win=27744 Len=0"
"2016-09-27 08:30:08.352960","95","Application Data"
"2016-09-27 08:30:08.789242","95","[TCP Spurious Retransmission] "
"2016-09-27 08:30:09.020207","54","36693  >  443 [ACK] Seq=10788 Ack=10621 Win=27744 Len=0"
"2016-09-27 08:30:26.688703","54","36693  >  443 [ACK] Seq=10788 Ack=10662 Win=27744 Len=0"
"2016-09-27 08:30:26.688828","95","Application Data"
"2016-09-27 08:30:56.715268","95","Application Data"
"2016-09-27 08:30:57.156430","95","[TCP Spurious Retransmission] "
"2016-09-27 08:30:57.422595","54","36693  >  443 [ACK] Seq=10870 Ack=10703 Win=27744 Len=0"
"2016-09-27 08:31:26.693660","54","36693  >  443 [ACK] Seq=10870 Ack=10744 Win=27744 Len=0"
"2016-09-27 08:31:26.693780","95","Application Data"
"2016-09-27 08:31:56.721337","95","Application Data"
"2016-09-27 08:31:56.972533","54","36693  >  443 [ACK] Seq=10952 Ack=10785 Win=27744 Len=0"
"2016-09-27 08:32:26.688487","54","36693  >  443 [ACK] Seq=10952 Ack=10826 Win=27744 Len=0"
"2016-09-27 08:32:26.688597","95","Application Data"
"2016-09-27 08:32:56.717251","95","Application Data"
"2016-09-27 08:32:56.977848","54","36693  >  443 [ACK] Seq=11034 Ack=10867 Win=27744 Len=0"
"2016-09-27 08:33:26.684171","54","36693  >  443 [ACK] Seq=11034 Ack=10908 Win=27744 Len=0"
"2016-09-27 08:33:26.684276","95","Application Data"
"2016-09-27 08:33:56.716110","95","Application Data"
"2016-09-27 08:33:56.964369","54","36693  >  443 [ACK] Seq=11116 Ack=10949 Win=27744 Len=0"
"2016-09-27 08:34:26.683919","54","36693  >  443 [ACK] Seq=11116 Ack=10990 Win=27744 Len=0"
"2016-09-27 08:34:26.684037","95","Application Data"
"2016-09-27 08:34:56.730671","95","Application Data"
"2016-09-27 08:34:56.987677","54","36693  >  443 [ACK] Seq=11198 Ack=11031 Win=27744 Len=0"
"2016-09-27 08:35:26.683277","54","36693  >  443 [ACK] Seq=11198 Ack=11072 Win=27744 Len=0"
"2016-09-27 08:35:26.683860","95","Application Data"
"2016-09-27 08:35:47.316212","85","Encrypted Alert"
"2016-09-27 08:35:47.345111","54","36693  >  443 [FIN"
"2016-09-27 08:35:47.531290","54","36693  >  443 [RST] Seq=11270 Win=0 Len=0"
"2016-09-27 08:35:47.554243","54","36693  >  443 [RST] Seq=11271 Win=0 Len=0"
"2016-09-27 13:24:35.342478","74","49594  >  443 [SYN] Seq=0 Win=4380 Len=0 MSS=1460 SACK_PERM=1 TSval=64956966 TSecr=0 WS=16"
"2016-09-27 13:24:35.573981","54","49594  >  443 [ACK] Seq=1 Ack=1 Win=4384 Len=0"
"2016-09-27 13:24:35.710891","371","Client Hello"
"2016-09-27 13:24:35.949442","54","49594  >  443 [ACK] Seq=318 Ack=1461 Win=7312 Len=0"
"2016-09-27 13:24:35.952692","54","49594  >  443 [ACK] Seq=318 Ack=2921 Win=10224 Len=0"
"2016-09-27 13:24:35.952788","54","49594  >  443 [ACK] Seq=318 Ack=3294 Win=13152 Len=0"
"2016-09-27 13:24:35.998446","180","Client Key Exchange"
"2016-09-27 13:24:36.220147","54","49594  >  443 [ACK] Seq=444 Ack=3345 Win=13152 Len=0"
"2016-09-27 13:24:36.274198","1514","49594  >  443 [ACK] Seq=444 Ack=3345 Win=13152 Len=1460 [TCP segment of a reassembled PDU]"
"2016-09-27 13:24:36.274316","429","Application Data"
"2016-09-27 13:24:36.594304","54","49594  >  443 [ACK] Seq=2279 Ack=3689 Win=16064 Len=0"
"2016-09-27 13:24:36.605228","54","49594  >  443 [ACK] Seq=2279 Ack=3887 Win=18992 Len=0"
"2016-09-27 13:24:36.664083","54","49594  >  443 [ACK] Seq=2279 Ack=4056 Win=21904 Len=0"
"2016-09-27 13:24:36.715987","206","Application Data"
"2016-09-27 13:24:36.751880","252","Application Data"
"2016-09-27 13:24:36.808521","275","Application Data"
"2016-09-27 13:24:36.811668","545","Application Data"
"2016-09-27 13:24:36.814853","380","Application Data"
"2016-09-27 13:24:36.820416","191","Application Data"
"2016-09-27 13:24:36.980338","182","Application Data"
"2016-09-27 13:24:36.981490","374","Application Data"
"2016-09-27 13:24:41.219042","54","49594  >  443 [ACK] Seq=4252 Ack=4097 Win=21904 Len=0"
"2016-09-27 13:24:41.219984","95","Application Data"
"2016-09-27 13:24:50.866673","54","49594  >  443 [ACK] Seq=4293 Ack=4468 Win=24832 Len=0"
"2016-09-27 13:24:51.276306","212","Application Data"
"2016-09-27 13:24:51.520326","54","49594  >  443 [ACK] Seq=4451 Ack=4640 Win=27744 Len=0"
"2016-09-27 13:24:53.611355","199","Application Data"
"2016-09-27 13:24:54.008772","338","Application Data"
"2016-09-27 13:25:24.047568","95","Application Data"
"2016-09-27 13:25:24.265861","54","49594  >  443 [ACK] Seq=4921 Ack=4681 Win=27744 Len=0"
"2016-09-27 13:25:41.219582","54","49594  >  443 [ACK] Seq=4921 Ack=4722 Win=27744 Len=0"
"2016-09-27 13:25:41.219694","95","Application Data"
"2016-09-27 13:26:11.248222","95","Application Data"
"2016-09-27 13:26:11.515033","54","49594  >  443 [ACK] Seq=5003 Ack=4763 Win=27744 Len=0"
"2016-09-27 13:26:41.506994","95","Application Data"
"2016-09-27 13:26:41.734039","54","[TCP Dup ACK 327600#1] 49594  >  443 [ACK] Seq=5044 Ack=4763 Win=27744 Len=0"
"2016-09-27 13:26:41.780988","54","49594  >  443 [ACK] Seq=5044 Ack=4845 Win=27744 Len=0"
"2016-09-27 13:26:41.781517","95","Application Data"
"2016-09-27 13:27:11.808402","95","Application Data"
"2016-09-27 13:27:13.198621","54","49594  >  443 [ACK] Seq=5126 Ack=4886 Win=27744 Len=0"
"2016-09-27 13:27:41.226712","54","49594  >  443 [ACK] Seq=5126 Ack=4927 Win=27744 Len=0"
"2016-09-27 13:27:41.226833","95","Application Data"
"2016-09-27 13:28:11.254331","95","Application Data"
"2016-09-27 13:28:11.511188","54","49594  >  443 [ACK] Seq=5208 Ack=4968 Win=27744 Len=0"
"2016-09-27 13:28:41.227944","54","49594  >  443 [ACK] Seq=5208 Ack=5009 Win=27744 Len=0"
"2016-09-27 13:28:41.228063","95","Application Data"
"2016-09-27 13:29:11.257453","95","Application Data"
"2016-09-27 13:29:11.518956","54","49594  >  443 [ACK] Seq=5290 Ack=5050 Win=27744 Len=0"
"2016-09-27 13:29:41.219885","54","49594  >  443 [ACK] Seq=5290 Ack=5091 Win=27744 Len=0"
"2016-09-27 13:29:41.219988","95","Application Data"
"2016-09-27 13:30:11.249909","95","Application Data"
"2016-09-27 13:30:11.511123","54","49594  >  443 [ACK] Seq=5372 Ack=5132 Win=27744 Len=0"
"2016-09-27 13:30:41.510792","95","Application Data"
"2016-09-27 13:30:41.679384","54","49594  >  443 [ACK] Seq=5413 Ack=5173 Win=27744 Len=0"
"2016-09-27 13:30:41.679912","95","Application Data"
"2016-09-27 13:30:41.940840","54","49594  >  443 [ACK] Seq=5454 Ack=5214 Win=27744 Len=0"
"2016-09-27 13:31:11.929810","95","Application Data"
"2016-09-27 13:31:12.152236","54","49594  >  443 [ACK] Seq=5495 Ack=5255 Win=27744 Len=0"
"2016-09-27 13:31:41.223306","54","49594  >  443 [ACK] Seq=5495 Ack=5296 Win=27744 Len=0"
"2016-09-27 13:31:41.223417","95","Application Data"
"2016-09-27 13:32:11.252036","95","Application Data"
"2016-09-27 13:32:11.511078","54","49594  >  443 [ACK] Seq=5577 Ack=5337 Win=27744 Len=0"
"2016-09-27 13:32:41.503027","95","Application Data"
"2016-09-27 13:32:41.671589","54","49594  >  443 [ACK] Seq=5618 Ack=5378 Win=27744 Len=0"
"2016-09-27 13:32:41.672124","95","Application Data"
"2016-09-27 13:32:41.932981","54","49594  >  443 [ACK] Seq=5659 Ack=5419 Win=27744 Len=0"
"2016-09-27 13:33:11.920098","95","Application Data"
"2016-09-27 13:33:12.148203","54","49594  >  443 [ACK] Seq=5700 Ack=5460 Win=27744 Len=0"
"2016-09-27 13:33:41.223085","54","49594  >  443 [ACK] Seq=5700 Ack=5501 Win=27744 Len=0"
"2016-09-27 13:33:41.223196","95","Application Data"
"2016-09-27 13:34:11.248933","95","Application Data"
"2016-09-27 13:34:11.512238","54","49594  >  443 [ACK] Seq=5782 Ack=5542 Win=27744 Len=0"
"2016-09-27 13:34:41.222334","54","49594  >  443 [ACK] Seq=5782 Ack=5583 Win=27744 Len=0"
"2016-09-27 13:34:41.222903","95","Application Data"
"2016-09-27 13:35:11.253090","95","Application Data"
"2016-09-27 13:35:11.712621","95","[TCP Spurious Retransmission] "
"2016-09-27 13:35:11.983728","54","49594  >  443 [ACK] Seq=5864 Ack=5624 Win=27744 Len=0"
"2016-09-27 13:35:41.227392","54","49594  >  443 [ACK] Seq=5864 Ack=5665 Win=27744 Len=0"
"2016-09-27 13:35:41.227500","95","Application Data"
"2016-09-27 13:36:11.252315","95","Application Data"
"2016-09-27 13:36:11.987707","54","49594  >  443 [ACK] Seq=5946 Ack=5706 Win=27744 Len=0"
"2016-09-27 13:36:41.227353","54","49594  >  443 [ACK] Seq=5946 Ack=5747 Win=27744 Len=0"
"2016-09-27 13:36:41.227898","95","Application Data"
"2016-09-27 13:37:11.258435","95","Application Data"
"2016-09-27 13:37:11.530757","54","49594  >  443 [ACK] Seq=6028 Ack=5788 Win=27744 Len=0"
"2016-09-27 13:37:41.522241","95","Application Data"
"2016-09-27 13:37:41.694837","54","49594  >  443 [ACK] Seq=6069 Ack=5829 Win=27744 Len=0"
"2016-09-27 13:37:41.695474","95","Application Data"
"2016-09-27 13:37:41.958126","54","49594  >  443 [ACK] Seq=6110 Ack=5870 Win=27744 Len=0"
"2016-09-27 13:38:11.948168","95","Application Data"
"2016-09-27 13:38:12.176352","54","49594  >  443 [ACK] Seq=6151 Ack=5911 Win=27744 Len=0"
"2016-09-27 13:38:41.230933","54","49594  >  443 [ACK] Seq=6151 Ack=5952 Win=27744 Len=0"
"2016-09-27 13:38:41.231049","95","Application Data"
"2016-09-27 13:39:11.260187","95","Application Data"
"2016-09-27 13:39:11.530652","54","49594  >  443 [ACK] Seq=6233 Ack=5993 Win=27744 Len=0"
"2016-09-27 13:39:41.226150","54","49594  >  443 [ACK] Seq=6233 Ack=6034 Win=27744 Len=0"
"2016-09-27 13:39:41.226710","95","Application Data"
"2016-09-27 13:40:11.258321","95","Application Data"
"2016-09-27 13:40:11.530608","54","49594  >  443 [ACK] Seq=6315 Ack=6075 Win=27744 Len=0"
"2016-09-27 13:40:41.230989","54","49594  >  443 [ACK] Seq=6315 Ack=6116 Win=27744 Len=0"
"2016-09-27 13:40:41.231108","95","Application Data"
"2016-09-27 13:41:11.257447","95","Application Data"
"2016-09-27 13:41:11.987701","54","49594  >  443 [ACK] Seq=6397 Ack=6157 Win=27744 Len=0"
"2016-09-27 13:41:41.228431","54","49594  >  443 [ACK] Seq=6397 Ack=6198 Win=27744 Len=0"
"2016-09-27 13:41:41.228540","95","Application Data"
"2016-09-27 13:42:11.257277","95","Application Data"
"2016-09-27 13:42:11.518792","54","49594  >  443 [ACK] Seq=6479 Ack=6239 Win=27744 Len=0"
"2016-09-27 13:42:41.230181","54","49594  >  443 [ACK] Seq=6479 Ack=6280 Win=27744 Len=0"
"2016-09-27 13:42:41.231865","95","Application Data"
"2016-09-27 13:43:11.263251","95","Application Data"
"2016-09-27 13:43:12.003141","54","49594  >  443 [ACK] Seq=6561 Ack=6321 Win=27744 Len=0"
"2016-09-27 13:43:42.004551","95","Application Data"
"2016-09-27 13:43:42.163351","54","49594  >  443 [ACK] Seq=6602 Ack=6362 Win=27744 Len=0"
"2016-09-27 13:43:42.164964","95","Application Data"
"2016-09-27 13:43:42.425043","54","49594  >  443 [ACK] Seq=6643 Ack=6403 Win=27744 Len=0"
"2016-09-27 13:44:12.413762","95","Application Data"
"2016-09-27 13:44:12.637460","54","49594  >  443 [ACK] Seq=6684 Ack=6444 Win=27744 Len=0"
"2016-09-27 13:44:41.231193","54","49594  >  443 [ACK] Seq=6684 Ack=6485 Win=27744 Len=0"
"2016-09-27 13:44:41.231308","95","Application Data"
"2016-09-27 13:45:11.259774","95","Application Data"
"2016-09-27 13:45:11.714193","95","[TCP Spurious Retransmission] "
"2016-09-27 13:45:11.987460","54","49594  >  443 [ACK] Seq=6766 Ack=6526 Win=27744 Len=0"
"2016-09-27 13:45:41.230709","54","49594  >  443 [ACK] Seq=6766 Ack=6567 Win=27744 Len=0"
"2016-09-27 13:45:41.230820","95","Application Data"
"2016-09-27 13:46:11.261445","95","Application Data"
"2016-09-27 13:46:11.522655","54","49594  >  443 [ACK] Seq=6848 Ack=6608 Win=27744 Len=0"
"2016-09-27 13:46:41.238794","54","49594  >  443 [ACK] Seq=6848 Ack=6649 Win=27744 Len=0"
"2016-09-27 13:46:41.238899","95","Application Data"
"2016-09-27 13:47:11.265325","95","Application Data"
"2016-09-27 13:47:12.017814","54","49594  >  443 [ACK] Seq=6930 Ack=6690 Win=27744 Len=0"
"2016-09-27 13:47:41.242439","54","49594  >  443 [ACK] Seq=6930 Ack=6731 Win=27744 Len=0"
"2016-09-27 13:47:41.242567","95","Application Data"
"2016-09-27 13:48:11.271909","95","Application Data"
"2016-09-27 13:48:11.562186","54","49594  >  443 [ACK] Seq=7012 Ack=6772 Win=27744 Len=0"
"2016-09-27 13:48:41.242453","54","49594  >  443 [ACK] Seq=7012 Ack=6813 Win=27744 Len=0"
"2016-09-27 13:48:41.242563","95","Application Data"
"2016-09-27 13:49:11.267853","95","Application Data"
"2016-09-27 13:49:11.546498","54","49594  >  443 [ACK] Seq=7094 Ack=6854 Win=27744 Len=0"
"2016-09-27 13:49:41.235588","54","49594  >  443 [ACK] Seq=7094 Ack=6895 Win=27744 Len=0"
"2016-09-27 13:49:41.235979","95","Application Data"
"2016-09-27 13:50:11.265603","95","Application Data"
"2016-09-27 13:50:11.730356","95","[TCP Spurious Retransmission] "
"2016-09-27 13:50:12.011354","54","49594  >  443 [ACK] Seq=7176 Ack=6936 Win=27744 Len=0"
"2016-09-27 13:50:42.018629","95","Application Data"
"2016-09-27 13:50:42.187974","54","49594  >  443 [ACK] Seq=7217 Ack=6977 Win=27744 Len=0"
"2016-09-27 13:50:42.188091","95","Application Data"
"2016-09-27 13:50:42.460471","54","49594  >  443 [ACK] Seq=7258 Ack=7018 Win=27744 Len=0"
"2016-09-27 13:50:53.621083","224","Application Data"
"2016-09-27 13:51:23.652348","95","Application Data"
"2016-09-27 13:51:23.871845","54","49594  >  443 [ACK] Seq=7469 Ack=7059 Win=27744 Len=0"
"2016-09-27 13:51:41.226475","54","49594  >  443 [ACK] Seq=7469 Ack=7100 Win=27744 Len=0"
"2016-09-27 13:51:41.227021","95","Application Data"
"2016-09-27 13:52:11.257735","95","Application Data"
"2016-09-27 13:52:11.995620","54","49594  >  443 [ACK] Seq=7551 Ack=7141 Win=27744 Len=0"
"2016-09-27 13:52:41.219607","54","49594  >  443 [ACK] Seq=7551 Ack=7182 Win=27744 Len=0"
"2016-09-27 13:52:41.219717","95","Application Data"
"2016-09-27 13:53:11.249948","95","Application Data"
"2016-09-27 13:53:11.507574","54","49594  >  443 [ACK] Seq=7633 Ack=7223 Win=27744 Len=0"
"2016-09-27 13:53:41.497148","95","Application Data"
"2016-09-27 13:53:41.691167","54","49594  >  443 [ACK] Seq=7674 Ack=7264 Win=27744 Len=0"
"2016-09-27 13:53:41.691682","95","Application Data"
"2016-09-27 13:53:41.964326","54","49594  >  443 [ACK] Seq=7715 Ack=7305 Win=27744 Len=0"
"2016-09-27 13:54:11.956084","95","Application Data"
"2016-09-27 13:54:12.176417","54","49594  >  443 [ACK] Seq=7756 Ack=7346 Win=27744 Len=0"
"2016-09-27 13:54:41.226370","54","49594  >  443 [ACK] Seq=7756 Ack=7387 Win=27744 Len=0"
"2016-09-27 13:54:41.226904","95","Application Data"
"2016-09-27 13:55:11.256491","95","Application Data"
"2016-09-27 13:55:11.979878","54","49594  >  443 [ACK] Seq=7838 Ack=7428 Win=27744 Len=0"
"2016-09-27 13:55:41.972608","95","Application Data"
"2016-09-27 13:55:42.155971","54","49594  >  443 [ACK] Seq=7879 Ack=7469 Win=27744 Len=0"
"2016-09-27 13:55:42.156480","95","Application Data"
"2016-09-27 13:55:42.417459","54","49594  >  443 [ACK] Seq=7920 Ack=7510 Win=27744 Len=0"
"2016-09-27 13:56:12.420565","95","Application Data"
"2016-09-27 13:56:12.648578","54","49594  >  443 [ACK] Seq=7961 Ack=7551 Win=27744 Len=0"
"2016-09-27 13:56:41.695720","54","49594  >  443 [ACK] Seq=7961 Ack=7592 Win=27744 Len=0"
"2016-09-27 13:56:41.695834","95","Application Data"
"2016-09-27 13:57:11.723708","95","Application Data"
"2016-09-27 13:57:12.179063","95","[TCP Spurious Retransmission] "
"2016-09-27 13:57:12.929087","54","49594  >  443 [ACK] Seq=8043 Ack=7633 Win=27744 Len=0"
"2016-09-27 13:57:41.234951","54","49594  >  443 [ACK] Seq=8043 Ack=7674 Win=27744 Len=0"
"2016-09-27 13:57:41.235072","95","Application Data"
"2016-09-27 13:58:11.270884","95","Application Data"
"2016-09-27 13:58:11.718206","95","[TCP Spurious Retransmission] "
"2016-09-27 13:58:11.995447","54","49594  >  443 [ACK] Seq=8125 Ack=7715 Win=27744 Len=0"
"2016-09-27 13:58:41.227078","54","49594  >  443 [ACK] Seq=8125 Ack=7756 Win=27744 Len=0"
"2016-09-27 13:58:41.227197","95","Application Data"
"2016-09-27 13:59:11.256878","95","Application Data"
"2016-09-27 13:59:11.714226","95","[TCP Spurious Retransmission] "
"2016-09-27 13:59:11.984691","54","49594  >  443 [ACK] Seq=8207 Ack=7797 Win=27744 Len=0"
"2016-09-27 13:59:41.233956","54","49594  >  443 [ACK] Seq=8207 Ack=7838 Win=27744 Len=0"
"2016-09-27 13:59:41.234494","95","Application Data"
"2016-09-27 14:00:11.261443","95","Application Data"
"2016-09-27 14:00:11.530514","54","49594  >  443 [ACK] Seq=8289 Ack=7879 Win=27744 Len=0"
"2016-09-27 14:00:41.227945","54","49594  >  443 [ACK] Seq=8289 Ack=7920 Win=27744 Len=0"
"2016-09-27 14:00:41.228052","95","Application Data"
"2016-09-27 14:01:11.258528","95","Application Data"
"2016-09-27 14:01:11.532892","54","49594  >  443 [ACK] Seq=8371 Ack=7961 Win=27744 Len=0"
"2016-09-27 14:01:41.520503","95","Application Data"
"2016-09-27 14:01:41.702615","54","49594  >  443 [ACK] Seq=8412 Ack=8002 Win=27744 Len=0"
"2016-09-27 14:01:41.703241","95","Application Data"
"2016-09-27 14:01:41.964259","54","49594  >  443 [ACK] Seq=8453 Ack=8043 Win=27744 Len=0"
"2016-09-27 14:02:11.955209","95","Application Data"
"2016-09-27 14:02:12.179460","54","49594  >  443 [ACK] Seq=8494 Ack=8084 Win=27744 Len=0"
"2016-09-27 14:02:41.234693","54","49594  >  443 [ACK] Seq=8494 Ack=8125 Win=27744 Len=0"
"2016-09-27 14:02:41.234807","95","Application Data"
"2016-09-27 14:03:11.263863","95","Application Data"
"2016-09-27 14:03:11.534307","54","49594  >  443 [ACK] Seq=8576 Ack=8166 Win=27744 Len=0"
"2016-09-27 14:03:41.230027","54","49594  >  443 [ACK] Seq=8576 Ack=8207 Win=27744 Len=0"
"2016-09-27 14:03:41.230626","95","Application Data"
"2016-09-27 14:04:11.252040","95","Application Data"
"2016-09-27 14:04:12.004352","54","49594  >  443 [ACK] Seq=8658 Ack=8248 Win=27744 Len=0"
"2016-09-27 14:04:41.226067","54","49594  >  443 [ACK] Seq=8658 Ack=8289 Win=27744 Len=0"
"2016-09-27 14:04:41.226678","95","Application Data"
"2016-09-27 14:05:11.257248","95","Application Data"
"2016-09-27 14:05:11.521487","54","49594  >  443 [ACK] Seq=8740 Ack=8330 Win=27744 Len=0"
"2016-09-27 14:05:41.230487","54","49594  >  443 [ACK] Seq=8740 Ack=8371 Win=27744 Len=0"
"2016-09-27 14:05:41.230607","95","Application Data"
"2016-09-27 14:06:11.256936","95","Application Data"
"2016-09-27 14:06:11.522525","54","49594  >  443 [ACK] Seq=8822 Ack=8412 Win=27744 Len=0"
"2016-09-27 14:06:41.234616","54","49594  >  443 [ACK] Seq=8822 Ack=8453 Win=27744 Len=0"
"2016-09-27 14:06:41.234713","95","Application Data"
"2016-09-27 14:07:11.265096","95","Application Data"
"2016-09-27 14:07:11.721980","95","[TCP Spurious Retransmission] "
"2016-09-27 14:07:12.016022","54","49594  >  443 [ACK] Seq=8904 Ack=8494 Win=27744 Len=0"
"2016-09-27 14:07:42.000441","95","Application Data"
"2016-09-27 14:07:42.182969","54","49594  >  443 [ACK] Seq=8945 Ack=8535 Win=27744 Len=0"
"2016-09-27 14:07:42.183494","95","Application Data"
"2016-09-27 14:07:42.456896","54","49594  >  443 [ACK] Seq=8986 Ack=8576 Win=27744 Len=0"
"2016-09-27 14:08:12.447208","95","Application Data"
"2016-09-27 14:08:12.671641","54","49594  >  443 [ACK] Seq=9027 Ack=8617 Win=27744 Len=0"
"2016-09-27 14:08:41.226031","54","49594  >  443 [ACK] Seq=9027 Ack=8658 Win=27744 Len=0"
"2016-09-27 14:08:41.226520","95","Application Data"
"2016-09-27 14:09:11.257367","95","Application Data"
"2016-09-27 14:09:11.526365","54","49594  >  443 [ACK] Seq=9109 Ack=8699 Win=27744 Len=0"
"2016-09-27 14:09:41.229750","54","49594  >  443 [ACK] Seq=9109 Ack=8740 Win=27744 Len=0"
"2016-09-27 14:09:41.230294","95","Application Data"
"2016-09-27 14:10:11.255639","95","Application Data"
"2016-09-27 14:10:11.526322","54","49594  >  443 [ACK] Seq=9191 Ack=8781 Win=27744 Len=0"
"2016-09-27 14:10:41.226657","54","49594  >  443 [ACK] Seq=9191 Ack=8822 Win=27744 Len=0"
"2016-09-27 14:10:41.226766","95","Application Data"
"2016-09-27 14:11:11.256350","95","Application Data"
"2016-09-27 14:11:11.526258","54","49594  >  443 [ACK] Seq=9273 Ack=8863 Win=27744 Len=0"
"2016-09-27 14:11:41.516918","95","Application Data"
"2016-09-27 14:11:41.702292","54","49594  >  443 [ACK] Seq=9314 Ack=8904 Win=27744 Len=0"
"2016-09-27 14:11:41.702818","95","Application Data"
"2016-09-27 14:11:41.963739","54","49594  >  443 [ACK] Seq=9355 Ack=8945 Win=27744 Len=0"
"2016-09-27 14:12:11.952328","95","Application Data"
"2016-09-27 14:12:12.179365","54","49594  >  443 [ACK] Seq=9396 Ack=8986 Win=27744 Len=0"
"2016-09-27 14:12:41.694515","54","49594  >  443 [ACK] Seq=9396 Ack=9027 Win=27744 Len=0"
"2016-09-27 14:12:41.695152","95","Application Data"
"2016-09-27 14:13:11.725563","95","Application Data"
"2016-09-27 14:13:11.995249","54","49594  >  443 [ACK] Seq=9478 Ack=9068 Win=27744 Len=0"
"2016-09-27 14:13:41.226574","54","49594  >  443 [ACK] Seq=9478 Ack=9109 Win=27744 Len=0"
"2016-09-27 14:13:41.226684","95","Application Data"
"2016-09-27 14:14:11.254316","95","Application Data"
"2016-09-27 14:14:11.518344","54","49594  >  443 [ACK] Seq=9560 Ack=9150 Win=27744 Len=0"
"2016-09-27 14:14:41.237551","54","49594  >  443 [ACK] Seq=9560 Ack=9191 Win=27744 Len=0"
"2016-09-27 14:14:41.237670","95","Application Data"
"2016-09-27 14:15:11.268015","95","Application Data"
"2016-09-27 14:15:11.533893","54","49594  >  443 [ACK] Seq=9642 Ack=9232 Win=27744 Len=0"
"2016-09-27 14:15:41.226469","54","49594  >  443 [ACK] Seq=9642 Ack=9273 Win=27744 Len=0"
"2016-09-27 14:15:41.226578","95","Application Data"
"2016-09-27 14:16:11.253102","95","Application Data"
"2016-09-27 14:16:11.709761","95","[TCP Spurious Retransmission] "
"2016-09-27 14:16:12.003301","54","49594  >  443 [ACK] Seq=9724 Ack=9314 Win=27744 Len=0"
"2016-09-27 14:16:41.231198","54","49594  >  443 [ACK] Seq=9724 Ack=9355 Win=27744 Len=0"
"2016-09-27 14:16:41.231304","95","Application Data"
"2016-09-27 14:17:11.262379","95","Application Data"
"2016-09-27 14:17:11.526100","54","49594  >  443 [ACK] Seq=9806 Ack=9396 Win=27744 Len=0"
"2016-09-27 14:17:41.229505","54","49594  >  443 [ACK] Seq=9806 Ack=9437 Win=27744 Len=0"
"2016-09-27 14:17:41.230029","95","Application Data"
"2016-09-27 14:18:11.262405","95","Application Data"
"2016-09-27 14:18:12.002734","54","49594  >  443 [ACK] Seq=9888 Ack=9478 Win=27744 Len=0"
"2016-09-27 14:18:41.226240","54","49594  >  443 [ACK] Seq=9888 Ack=9519 Win=27744 Len=0"
"2016-09-27 14:18:41.226348","95","Application Data"
"2016-09-27 14:19:11.253980","95","Application Data"
"2016-09-27 14:19:11.522039","54","49594  >  443 [ACK] Seq=9970 Ack=9560 Win=27744 Len=0"
"2016-09-27 14:19:41.231643","54","49594  >  443 [ACK] Seq=9970 Ack=9601 Win=27744 Len=0"
"2016-09-27 14:19:41.231751","95","Application Data"
"2016-09-27 14:20:11.257146","95","Application Data"
"2016-09-27 14:20:11.717366","95","[TCP Spurious Retransmission] "
"2016-09-27 14:20:11.986827","54","49594  >  443 [ACK] Seq=10052 Ack=9642 Win=27744 Len=0"
"2016-09-27 14:20:41.225652","54","49594  >  443 [ACK] Seq=10052 Ack=9683 Win=27744 Len=0"
"2016-09-27 14:20:41.226196","95","Application Data"
"2016-09-27 14:21:11.256542","95","Application Data"
"2016-09-27 14:21:11.995040","54","49594  >  443 [ACK] Seq=10134 Ack=9724 Win=27744 Len=0"
"2016-09-27 14:21:41.241777","54","49594  >  443 [ACK] Seq=10134 Ack=9765 Win=27744 Len=0"
"2016-09-27 14:21:41.241885","95","Application Data"
"2016-09-27 14:22:11.268439","95","Application Data"
"2016-09-27 14:22:11.729062","95","[TCP Spurious Retransmission] "
"2016-09-27 14:22:11.998572","54","49594  >  443 [ACK] Seq=10216 Ack=9806 Win=27744 Len=0"
"2016-09-27 14:22:41.235544","54","49594  >  443 [ACK] Seq=10216 Ack=9847 Win=27744 Len=0"
"2016-09-27 14:22:41.235650","95","Application Data"
"2016-09-27 14:23:11.260597","95","Application Data"
"2016-09-27 14:23:11.533694","54","49594  >  443 [ACK] Seq=10298 Ack=9888 Win=27744 Len=0"
"2016-09-27 14:23:41.225414","54","49594  >  443 [ACK] Seq=10298 Ack=9929 Win=27744 Len=0"
"2016-09-27 14:23:41.225936","95","Application Data"
"2016-09-27 14:24:11.254383","95","Application Data"
"2016-09-27 14:24:11.525774","54","49594  >  443 [ACK] Seq=10380 Ack=9970 Win=27744 Len=0"
"2016-09-27 14:24:41.233172","54","49594  >  443 [ACK] Seq=10380 Ack=10011 Win=27744 Len=0"
"2016-09-27 14:24:41.233711","95","Application Data"
"2016-09-27 14:24:54.431309","54","49594  >  443 [ACK] Seq=10421 Ack=10214 Win=27744 Len=0"
"2016-09-27 14:25:24.409895","95","Application Data"
"2016-09-27 14:25:24.643319","54","49594  >  443 [ACK] Seq=10462 Ack=10255 Win=27744 Len=0"
"2016-09-27 14:25:41.698656","54","49594  >  443 [ACK] Seq=10462 Ack=10296 Win=27744 Len=0"
"2016-09-27 14:25:41.698759","95","Application Data"
"2016-09-27 14:26:11.726002","95","Application Data"
"2016-09-27 14:26:11.994466","54","49594  >  443 [ACK] Seq=10544 Ack=10337 Win=27744 Len=0"
"2016-09-27 14:26:41.225324","54","49594  >  443 [ACK] Seq=10544 Ack=10378 Win=27744 Len=0"
"2016-09-27 14:26:41.225988","95","Application Data"
"2016-09-27 14:27:10.176545","85","Encrypted Alert"
"2016-09-27 14:27:10.191150","54","49594  >  443 [FIN"
"2016-09-27 14:27:10.401894","54","49594  >  443 [RST] Seq=10616 Win=0 Len=0"
"2016-09-27 14:27:10.428418","54","49594  >  443 [RST] Seq=10617 Win=0 Len=0"
"2016-09-27 19:13:37.876707","74","60973  >  443 [SYN] Seq=0 Win=4380 Len=0 MSS=1460 SACK_PERM=1 TSval=70318256 TSecr=0 WS=16"
"2016-09-27 19:13:38.086444","54","60973  >  443 [ACK] Seq=1 Ack=1 Win=4384 Len=0"
"2016-09-27 19:13:38.204939","371","Client Hello"
"2016-09-27 19:13:38.426728","54","60973  >  443 [ACK] Seq=318 Ack=1461 Win=7312 Len=0"
"2016-09-27 19:13:38.429363","54","60973  >  443 [ACK] Seq=318 Ack=2921 Win=10224 Len=0"
"2016-09-27 19:13:38.429461","54","60973  >  443 [ACK] Seq=318 Ack=3294 Win=13152 Len=0"
"2016-09-27 19:13:38.458875","180","Client Key Exchange"
"2016-09-27 19:13:38.673839","54","60973  >  443 [ACK] Seq=444 Ack=3345 Win=13152 Len=0"
"2016-09-27 19:13:38.706819","1514","60973  >  443 [ACK] Seq=444 Ack=3345 Win=13152 Len=1460 [TCP segment of a reassembled PDU]"
"2016-09-27 19:13:38.706938","432","Application Data"
"2016-09-27 19:13:39.028071","54","60973  >  443 [ACK] Seq=2282 Ack=3887 Win=18992 Len=0"
"2016-09-27 19:13:39.097681","54","60973  >  443 [ACK] Seq=2282 Ack=4056 Win=21904 Len=0"
"2016-09-27 19:13:39.178443","264","Application Data"
"2016-09-27 19:13:39.192791","274","Application Data"
"2016-09-27 19:13:39.200209","195","Application Data"
"2016-09-27 19:13:39.213947","559","Application Data"
"2016-09-27 19:13:39.219412","190","Application Data"
"2016-09-27 19:13:39.241256","379","Application Data"
"2016-09-27 19:13:39.400459","186","Application Data"
"2016-09-27 19:13:39.405099","385","Application Data"
"2016-09-27 19:13:43.668412","54","60973  >  443 [ACK] Seq=4282 Ack=4097 Win=21904 Len=0"
"2016-09-27 19:13:43.668917","95","Application Data"
"2016-09-27 19:14:13.695816","95","Application Data"
"2016-09-27 19:14:13.945382","54","60973  >  443 [ACK] Seq=4364 Ack=4138 Win=21904 Len=0"
"2016-09-27 19:14:43.940400","95","Application Data"
"2016-09-27 19:14:44.152709","54","[TCP Dup ACK 454096#1] 60973  >  443 [ACK] Seq=4405 Ack=4138 Win=21904 Len=0"
"2016-09-27 19:14:44.225056","54","60973  >  443 [ACK] Seq=4405 Ack=4220 Win=21904 Len=0"
"2016-09-27 19:14:44.225183","95","Application Data"
"2016-09-27 19:15:14.248367","95","Application Data"
"2016-09-27 19:15:14.503791","54","60973  >  443 [ACK] Seq=4487 Ack=4261 Win=21904 Len=0"
"2016-09-27 19:15:43.673820","54","60973  >  443 [ACK] Seq=4487 Ack=4302 Win=21904 Len=0"
"2016-09-27 19:15:43.673933","95","Application Data"
"2016-09-27 19:16:13.703767","95","Application Data"
"2016-09-27 19:16:13.949017","54","60973  >  443 [ACK] Seq=4569 Ack=4343 Win=21904 Len=0"
"2016-09-27 19:16:43.675794","54","60973  >  443 [ACK] Seq=4569 Ack=4384 Win=21904 Len=0"
"2016-09-27 19:16:43.676364","95","Application Data"
"2016-09-27 19:17:13.704006","95","Application Data"
"2016-09-27 19:17:13.953221","54","60973  >  443 [ACK] Seq=4651 Ack=4425 Win=21904 Len=0"
"2016-09-27 19:17:43.941312","95","Application Data"
"2016-09-27 19:17:44.148392","54","[TCP Dup ACK 454972#1] 60973  >  443 [ACK] Seq=4692 Ack=4425 Win=21904 Len=0"
"2016-09-27 19:17:44.163167","54","60973  >  443 [ACK] Seq=4692 Ack=4507 Win=21904 Len=0"
"2016-09-27 19:17:44.163268","95","Application Data"
"2016-09-27 19:18:14.187300","95","Application Data"
"2016-09-27 19:18:14.440851","54","60973  >  443 [ACK] Seq=4774 Ack=4548 Win=21904 Len=0"
"2016-09-27 19:18:43.671569","54","60973  >  443 [ACK] Seq=4774 Ack=4589 Win=21904 Len=0"
"2016-09-27 19:18:43.672146","95","Application Data"
"2016-09-27 19:19:13.700075","95","Application Data"
"2016-09-27 19:19:13.948519","54","60973  >  443 [ACK] Seq=4856 Ack=4630 Win=21904 Len=0"
"2016-09-27 19:19:43.676060","54","60973  >  443 [ACK] Seq=4856 Ack=4671 Win=21904 Len=0"
"2016-09-27 19:19:43.676179","95","Application Data"
"2016-09-27 19:20:13.704497","95","Application Data"
"2016-09-27 19:20:13.960013","54","60973  >  443 [ACK] Seq=4938 Ack=4712 Win=21904 Len=0"
"2016-09-27 19:20:43.671195","54","60973  >  443 [ACK] Seq=4938 Ack=4753 Win=21904 Len=0"
"2016-09-27 19:20:43.671738","95","Application Data"
"2016-09-27 19:21:11.510716","54","60973  >  443 [ACK] Seq=4979 Ack=5125 Win=24832 Len=0"
"2016-09-27 19:21:11.930714","211","Application Data"
"2016-09-27 19:21:12.144651","54","60973  >  443 [ACK] Seq=5136 Ack=5297 Win=27744 Len=0"
"2016-09-27 19:21:14.018903","360","Application Data"
"2016-09-27 19:21:14.153089","179","Application Data"
"2016-09-27 19:21:44.116288","54","60973  >  443 [ACK] Seq=5567 Ack=5338 Win=27744 Len=0"
"2016-09-27 19:21:44.116971","95","Application Data"
"2016-09-27 19:22:14.147036","95","Application Data"
"2016-09-27 19:22:14.393324","54","60973  >  443 [ACK] Seq=5649 Ack=5379 Win=27744 Len=0"
"2016-09-27 19:22:43.674771","54","60973  >  443 [ACK] Seq=5649 Ack=5420 Win=27744 Len=0"
"2016-09-27 19:22:43.675347","95","Application Data"
"2016-09-27 19:23:13.704664","95","Application Data"
"2016-09-27 19:23:13.955686","54","60973  >  443 [ACK] Seq=5731 Ack=5461 Win=27744 Len=0"
"2016-09-27 19:23:43.678940","54","60973  >  443 [ACK] Seq=5731 Ack=5502 Win=27744 Len=0"
"2016-09-27 19:23:43.679059","95","Application Data"
"2016-09-27 19:24:13.705888","95","Application Data"
"2016-09-27 19:24:13.955576","54","60973  >  443 [ACK] Seq=5813 Ack=5543 Win=27744 Len=0"
"2016-09-27 19:24:43.947228","95","Application Data"
"2016-09-27 19:24:44.123648","54","60973  >  443 [ACK] Seq=5854 Ack=5584 Win=27744 Len=0"
"2016-09-27 19:24:44.124126","95","Application Data"
"2016-09-27 19:24:44.373408","54","60973  >  443 [ACK] Seq=5895 Ack=5625 Win=27744 Len=0"
"2016-09-27 19:25:14.361902","95","Application Data"
"2016-09-27 19:25:14.573163","54","60973  >  443 [ACK] Seq=5936 Ack=5666 Win=27744 Len=0"
"2016-09-27 19:25:43.675356","54","60973  >  443 [ACK] Seq=5936 Ack=5707 Win=27744 Len=0"
"2016-09-27 19:25:43.675475","95","Application Data"
"2016-09-27 19:26:13.705511","95","Application Data"
"2016-09-27 19:26:13.959147","54","60973  >  443 [ACK] Seq=6018 Ack=5748 Win=27744 Len=0"
"2016-09-27 19:26:43.671790","54","60973  >  443 [ACK] Seq=6018 Ack=5789 Win=27744 Len=0"
"2016-09-27 19:26:43.671901","95","Application Data"
"2016-09-27 19:27:13.702065","95","Application Data"
"2016-09-27 19:27:13.947782","54","60973  >  443 [ACK] Seq=6100 Ack=5830 Win=27744 Len=0"
"2016-09-27 19:27:43.678623","54","60973  >  443 [ACK] Seq=6100 Ack=5871 Win=27744 Len=0"
"2016-09-27 19:27:43.678732","95","Application Data"
"2016-09-27 19:28:13.705271","95","Application Data"
"2016-09-27 19:28:13.951055","54","60973  >  443 [ACK] Seq=6182 Ack=5912 Win=27744 Len=0"
"2016-09-27 19:28:43.677753","54","60973  >  443 [ACK] Seq=6182 Ack=5953 Win=27744 Len=0"
"2016-09-27 19:28:43.678270","95","Application Data"
"2016-09-27 19:29:13.708528","95","Application Data"
"2016-09-27 19:29:13.962544","54","60973  >  443 [ACK] Seq=6264 Ack=5994 Win=27744 Len=0"
"2016-09-27 19:29:43.674707","54","60973  >  443 [ACK] Seq=6264 Ack=6035 Win=27744 Len=0"
"2016-09-27 19:29:43.674814","95","Application Data"
"2016-09-27 19:30:13.701086","95","Application Data"
"2016-09-27 19:30:13.950559","54","60973  >  443 [ACK] Seq=6346 Ack=6076 Win=27744 Len=0"
"2016-09-27 19:30:43.674928","54","60973  >  443 [ACK] Seq=6346 Ack=6117 Win=27744 Len=0"
"2016-09-27 19:30:43.675047","95","Application Data"
"2016-09-27 19:31:13.704584","95","Application Data"
"2016-09-27 19:31:13.954263","54","60973  >  443 [ACK] Seq=6428 Ack=6158 Win=27744 Len=0"
"2016-09-27 19:31:43.673231","54","60973  >  443 [ACK] Seq=6428 Ack=6199 Win=27744 Len=0"
"2016-09-27 19:31:43.673818","95","Application Data"
"2016-09-27 19:32:13.699324","95","Application Data"
"2016-09-27 19:32:13.946451","54","60973  >  443 [ACK] Seq=6510 Ack=6240 Win=27744 Len=0"
"2016-09-27 19:32:43.673079","54","60973  >  443 [ACK] Seq=6510 Ack=6281 Win=27744 Len=0"
"2016-09-27 19:32:43.673766","95","Application Data"
"2016-09-27 19:33:13.700855","95","Application Data"
"2016-09-27 19:33:13.953898","54","60973  >  443 [ACK] Seq=6592 Ack=6322 Win=27744 Len=0"
"2016-09-27 19:33:43.672945","54","60973  >  443 [ACK] Seq=6592 Ack=6363 Win=27744 Len=0"
"2016-09-27 19:33:43.673483","95","Application Data"
"2016-09-27 19:34:13.702085","95","Application Data"
"2016-09-27 19:34:13.951837","54","60973  >  443 [ACK] Seq=6674 Ack=6404 Win=27744 Len=0"
"2016-09-27 19:34:43.676706","54","60973  >  443 [ACK] Seq=6674 Ack=6445 Win=27744 Len=0"
"2016-09-27 19:34:43.677393","95","Application Data"
"2016-09-27 19:35:13.707870","95","Application Data"
"2016-09-27 19:35:13.961426","54","60973  >  443 [ACK] Seq=6756 Ack=6486 Win=27744 Len=0"
"2016-09-27 19:35:43.675153","54","60973  >  443 [ACK] Seq=6756 Ack=6527 Win=27744 Len=0"
"2016-09-27 19:35:43.675257","95","Application Data"
"2016-09-27 19:36:13.701560","95","Application Data"
"2016-09-27 19:36:13.950072","54","60973  >  443 [ACK] Seq=6838 Ack=6568 Win=27744 Len=0"
"2016-09-27 19:36:43.676838","54","60973  >  443 [ACK] Seq=6838 Ack=6609 Win=27744 Len=0"
"2016-09-27 19:36:43.676957","95","Application Data"
"2016-09-27 19:37:13.703336","95","Application Data"
"2016-09-27 19:37:13.957134","54","60973  >  443 [ACK] Seq=6920 Ack=6650 Win=27744 Len=0"
"2016-09-27 19:37:43.677473","54","60973  >  443 [ACK] Seq=6920 Ack=6691 Win=27744 Len=0"
"2016-09-27 19:37:43.677595","95","Application Data"
"2016-09-27 19:38:13.704783","95","Application Data"
"2016-09-27 19:38:13.953105","54","60973  >  443 [ACK] Seq=7002 Ack=6732 Win=27744 Len=0"
"2016-09-27 19:38:43.669049","54","60973  >  443 [ACK] Seq=7002 Ack=6773 Win=27744 Len=0"
"2016-09-27 19:38:43.669181","95","Application Data"
"2016-09-27 19:39:13.699482","95","Application Data"
"2016-09-27 19:39:13.949080","54","60973  >  443 [ACK] Seq=7084 Ack=6814 Win=27744 Len=0"
"2016-09-27 19:39:43.684395","54","60973  >  443 [ACK] Seq=7084 Ack=6855 Win=27744 Len=0"
"2016-09-27 19:39:43.684516","95","Application Data"
"2016-09-27 19:40:13.714517","95","Application Data"
"2016-09-27 19:40:13.972258","54","60973  >  443 [ACK] Seq=7166 Ack=6896 Win=27744 Len=0"
"2016-09-27 19:40:43.685224","54","60973  >  443 [ACK] Seq=7166 Ack=6937 Win=27744 Len=0"
"2016-09-27 19:40:43.685334","95","Application Data"
"2016-09-27 19:41:13.713507","95","Application Data"
"2016-09-27 19:41:13.972127","54","60973  >  443 [ACK] Seq=7248 Ack=6978 Win=27744 Len=0"
"2016-09-27 19:41:43.688205","54","60973  >  443 [ACK] Seq=7248 Ack=7019 Win=27744 Len=0"
"2016-09-27 19:41:43.688792","95","Application Data"
"2016-09-27 19:42:13.720550","95","Application Data"
"2016-09-27 19:42:13.979739","54","60973  >  443 [ACK] Seq=7330 Ack=7060 Win=27744 Len=0"
"2016-09-27 19:42:43.676415","54","60973  >  443 [ACK] Seq=7330 Ack=7101 Win=27744 Len=0"
"2016-09-27 19:42:43.676526","95","Application Data"
"2016-09-27 19:43:13.708186","95","Application Data"
"2016-09-27 19:43:14.151469","95","[TCP Spurious Retransmission] "
"2016-09-27 19:43:14.432636","54","60973  >  443 [ACK] Seq=7412 Ack=7142 Win=27744 Len=0"
"2016-09-27 19:43:43.675807","54","60973  >  443 [ACK] Seq=7412 Ack=7183 Win=27744 Len=0"
"2016-09-27 19:43:43.675923","95","Application Data"
"2016-09-27 19:44:13.703883","95","Application Data"
"2016-09-27 19:44:13.959811","54","60973  >  443 [ACK] Seq=7494 Ack=7224 Win=27744 Len=0"
"2016-09-27 19:44:43.950003","95","Application Data"
"2016-09-27 19:44:44.139743","54","60973  >  443 [ACK] Seq=7535 Ack=7265 Win=27744 Len=0"
"2016-09-27 19:44:44.140266","95","Application Data"
"2016-09-27 19:44:44.401172","54","60973  >  443 [ACK] Seq=7576 Ack=7306 Win=27744 Len=0"
"2016-09-27 19:45:14.403142","95","Application Data"
"2016-09-27 19:45:14.620715","54","60973  >  443 [ACK] Seq=7617 Ack=7347 Win=27744 Len=0"
"2016-09-27 19:45:43.678968","54","60973  >  443 [ACK] Seq=7617 Ack=7388 Win=27744 Len=0"
"2016-09-27 19:45:43.679516","95","Application Data"
"2016-09-27 19:46:13.708361","95","Application Data"
"2016-09-27 19:46:13.956046","54","60973  >  443 [ACK] Seq=7699 Ack=7429 Win=27744 Len=0"
"2016-09-27 19:46:43.674675","54","60973  >  443 [ACK] Seq=7699 Ack=7470 Win=27744 Len=0"
"2016-09-27 19:46:43.675479","95","Application Data"
"2016-09-27 19:47:13.702664","95","Application Data"
"2016-09-27 19:47:13.948467","54","60973  >  443 [ACK] Seq=7781 Ack=7511 Win=27744 Len=0"
"2016-09-27 19:47:43.679634","54","60973  >  443 [ACK] Seq=7781 Ack=7552 Win=27744 Len=0"
"2016-09-27 19:47:43.679743","95","Application Data"
"2016-09-27 19:48:13.706265","95","Application Data"
"2016-09-27 19:48:13.956975","54","60973  >  443 [ACK] Seq=7863 Ack=7593 Win=27744 Len=0"
"2016-09-27 19:48:43.679446","54","60973  >  443 [ACK] Seq=7863 Ack=7634 Win=27744 Len=0"
"2016-09-27 19:48:43.679563","95","Application Data"
"2016-09-27 19:49:13.709404","95","Application Data"
"2016-09-27 19:49:13.959389","54","60973  >  443 [ACK] Seq=7945 Ack=7675 Win=27744 Len=0"
"2016-09-27 19:49:43.671590","54","60973  >  443 [ACK] Seq=7945 Ack=7716 Win=27744 Len=0"
"2016-09-27 19:49:43.671708","95","Application Data"
"2016-09-27 19:50:13.701067","95","Application Data"
"2016-09-27 19:50:14.142814","95","[TCP Spurious Retransmission] "
"2016-09-27 19:50:14.412493","54","60973  >  443 [ACK] Seq=8027 Ack=7757 Win=27744 Len=0"
"2016-09-27 19:50:43.682893","54","60973  >  443 [ACK] Seq=8027 Ack=7798 Win=27744 Len=0"
"2016-09-27 19:50:43.683014","95","Application Data"
"2016-09-27 19:50:53.627838","223","Application Data"
"2016-09-27 19:51:23.658609","95","Application Data"
"2016-09-27 19:51:23.912121","54","60973  >  443 [ACK] Seq=8278 Ack=7839 Win=27744 Len=0"
"2016-09-27 19:51:44.135830","54","60973  >  443 [ACK] Seq=8278 Ack=7880 Win=27744 Len=0"
"2016-09-27 19:51:44.135938","95","Application Data"
"2016-09-27 19:52:14.161685","95","Application Data"
"2016-09-27 19:52:14.415897","54","60973  >  443 [ACK] Seq=8360 Ack=7921 Win=27744 Len=0"
"2016-09-27 19:52:43.687385","54","60973  >  443 [ACK] Seq=8360 Ack=7962 Win=27744 Len=0"
"2016-09-27 19:52:43.687505","95","Application Data"
"2016-09-27 19:53:13.718571","95","Application Data"
"2016-09-27 19:53:13.978146","54","60973  >  443 [ACK] Seq=8442 Ack=8003 Win=27744 Len=0"
"2016-09-27 19:53:43.685475","54","60973  >  443 [ACK] Seq=8442 Ack=8044 Win=27744 Len=0"
"2016-09-27 19:53:43.686015","95","Application Data"
"2016-09-27 19:54:13.715325","95","Application Data"
"2016-09-27 19:54:13.974085","54","60973  >  443 [ACK] Seq=8524 Ack=8085 Win=27744 Len=0"
"2016-09-27 19:54:43.669685","54","60973  >  443 [ACK] Seq=8524 Ack=8126 Win=27744 Len=0"
"2016-09-27 19:54:43.671186","95","Application Data"
"2016-09-27 19:55:13.700846","95","Application Data"
"2016-09-27 19:55:13.954424","54","60973  >  443 [ACK] Seq=8606 Ack=8167 Win=27744 Len=0"
"2016-09-27 19:55:43.675131","54","60973  >  443 [ACK] Seq=8606 Ack=8208 Win=27744 Len=0"
"2016-09-27 19:55:43.675257","95","Application Data"
"2016-09-27 19:56:13.704949","95","Application Data"
"2016-09-27 19:56:13.958166","54","60973  >  443 [ACK] Seq=8688 Ack=8249 Win=27744 Len=0"
"2016-09-27 19:56:43.677971","54","60973  >  443 [ACK] Seq=8688 Ack=8290 Win=27744 Len=0"
"2016-09-27 19:56:43.678082","95","Application Data"
"2016-09-27 19:57:13.704918","95","Application Data"
"2016-09-27 19:57:14.145479","95","[TCP Spurious Retransmission] "
"2016-09-27 19:57:14.403341","54","60973  >  443 [ACK] Seq=8770 Ack=8331 Win=27744 Len=0"
"2016-09-27 19:57:43.676906","54","60973  >  443 [ACK] Seq=8770 Ack=8372 Win=27744 Len=0"
"2016-09-27 19:57:43.677472","95","Application Data"
"2016-09-27 19:58:13.708805","95","Application Data"
"2016-09-27 19:58:13.961693","54","60973  >  443 [ACK] Seq=8852 Ack=8413 Win=27744 Len=0"
"2016-09-27 19:58:43.668918","54","60973  >  443 [ACK] Seq=8852 Ack=8454 Win=27744 Len=0"
"2016-09-27 19:58:43.669460","95","Application Data"
"2016-09-27 19:59:13.697140","95","Application Data"
"2016-09-27 19:59:13.945896","54","60973  >  443 [ACK] Seq=8934 Ack=8495 Win=27744 Len=0"
"2016-09-27 19:59:43.673663","54","60973  >  443 [ACK] Seq=8934 Ack=8536 Win=27744 Len=0"
"2016-09-27 19:59:43.673774","95","Application Data"
"2016-09-27 20:00:13.702342","95","Application Data"
"2016-09-27 20:00:13.956874","54","60973  >  443 [ACK] Seq=9016 Ack=8577 Win=27744 Len=0"
"2016-09-27 20:00:43.680700","54","60973  >  443 [ACK] Seq=9016 Ack=8618 Win=27744 Len=0"
"2016-09-27 20:00:43.680810","95","Application Data"
"2016-09-27 20:01:13.708033","95","Application Data"
"2016-09-27 20:01:13.961228","54","60973  >  443 [ACK] Seq=9098 Ack=8659 Win=27744 Len=0"
"2016-09-27 20:01:43.673593","54","60973  >  443 [ACK] Seq=9098 Ack=8700 Win=27744 Len=0"
"2016-09-27 20:01:43.673713","95","Application Data"
"2016-09-27 20:02:13.701389","95","Application Data"
"2016-09-27 20:02:13.953254","54","60973  >  443 [ACK] Seq=9180 Ack=8741 Win=27744 Len=0"
"2016-09-27 20:02:43.941905","95","Application Data"
"2016-09-27 20:02:44.130551","54","60973  >  443 [ACK] Seq=9221 Ack=8782 Win=27744 Len=0"
"2016-09-27 20:02:44.130655","95","Application Data"
"2016-09-27 20:02:44.378993","54","60973  >  443 [ACK] Seq=9262 Ack=8823 Win=27744 Len=0"
"2016-09-27 20:03:14.369275","95","Application Data"
"2016-09-27 20:03:14.582306","54","60973  >  443 [ACK] Seq=9303 Ack=8864 Win=27744 Len=0"
"2016-09-27 20:03:43.676017","54","60973  >  443 [ACK] Seq=9303 Ack=8905 Win=27744 Len=0"
"2016-09-27 20:03:43.676553","95","Application Data"
"2016-09-27 20:04:13.705992","95","Application Data"
"2016-09-27 20:04:13.960765","54","60973  >  443 [ACK] Seq=9385 Ack=8946 Win=27744 Len=0"
"2016-09-27 20:04:43.676988","54","60973  >  443 [ACK] Seq=9385 Ack=8987 Win=27744 Len=0"
"2016-09-27 20:04:43.677098","95","Application Data"
"2016-09-27 20:05:13.704657","95","Application Data"
"2016-09-27 20:05:13.956703","54","60973  >  443 [ACK] Seq=9467 Ack=9028 Win=27744 Len=0"
"2016-09-27 20:05:43.669642","54","60973  >  443 [ACK] Seq=9467 Ack=9069 Win=27744 Len=0"
"2016-09-27 20:05:43.669752","95","Application Data"
"2016-09-27 20:06:13.699914","95","Application Data"
"2016-09-27 20:06:13.944855","54","60973  >  443 [ACK] Seq=9549 Ack=9110 Win=27744 Len=0"
"2016-09-27 20:06:43.938295","95","Application Data"
"2016-09-27 20:06:44.128614","54","60973  >  443 [ACK] Seq=9590 Ack=9151 Win=27744 Len=0"
"2016-09-27 20:06:44.129165","95","Application Data"
"2016-09-27 20:06:44.378453","54","60973  >  443 [ACK] Seq=9631 Ack=9192 Win=27744 Len=0"
"2016-09-27 20:07:14.368331","95","Application Data"
"2016-09-27 20:07:15.046544","54","60973  >  443 [ACK] Seq=9672 Ack=9233 Win=27744 Len=0"
"2016-09-27 20:07:43.669014","54","60973  >  443 [ACK] Seq=9672 Ack=9274 Win=27744 Len=0"
"2016-09-27 20:07:43.669151","95","Application Data"
"2016-09-27 20:08:13.700550","95","Application Data"
"2016-09-27 20:08:13.952429","54","60973  >  443 [ACK] Seq=9754 Ack=9315 Win=27744 Len=0"
"2016-09-27 20:08:43.676989","54","60973  >  443 [ACK] Seq=9754 Ack=9356 Win=27744 Len=0"
"2016-09-27 20:08:43.677102","95","Application Data"
"2016-09-27 20:09:13.707261","95","Application Data"
"2016-09-27 20:09:13.956200","54","60973  >  443 [ACK] Seq=9836 Ack=9397 Win=27744 Len=0"
"2016-09-27 20:09:43.681206","54","60973  >  443 [ACK] Seq=9836 Ack=9438 Win=27744 Len=0"
"2016-09-27 20:09:43.681326","95","Application Data"
"2016-09-27 20:10:13.710740","95","Application Data"
"2016-09-27 20:10:13.956029","54","60973  >  443 [ACK] Seq=9918 Ack=9479 Win=27744 Len=0"
"2016-09-27 20:10:43.672474","54","60973  >  443 [ACK] Seq=9918 Ack=9520 Win=27744 Len=0"
"2016-09-27 20:10:43.672584","95","Application Data"
"2016-09-27 20:11:13.701424","95","Application Data"
"2016-09-27 20:11:13.952003","54","60973  >  443 [ACK] Seq=10000 Ack=9561 Win=27744 Len=0"
"2016-09-27 20:11:43.679462","54","60973  >  443 [ACK] Seq=10000 Ack=9602 Win=27744 Len=0"
"2016-09-27 20:11:43.679573","95","Application Data"
"2016-09-27 20:12:13.708605","95","Application Data"
"2016-09-27 20:12:13.966112","54","60973  >  443 [ACK] Seq=10082 Ack=9643 Win=27744 Len=0"
"2016-09-27 20:12:43.676748","54","60973  >  443 [ACK] Seq=10082 Ack=9684 Win=27744 Len=0"
"2016-09-27 20:12:43.676867","95","Application Data"
"2016-09-27 20:13:13.701386","95","Application Data"
"2016-09-27 20:13:13.947798","54","60973  >  443 [ACK] Seq=10164 Ack=9725 Win=27744 Len=0"
"2016-09-27 20:13:43.940585","95","Application Data"
"2016-09-27 20:13:44.129314","54","60973  >  443 [ACK] Seq=10205 Ack=9766 Win=27744 Len=0"
"2016-09-27 20:13:44.129429","95","Application Data"
"2016-09-27 20:13:44.377359","54","60973  >  443 [ACK] Seq=10246 Ack=9807 Win=27744 Len=0"
"2016-09-27 20:14:14.371004","95","Application Data"
"2016-09-27 20:14:14.585015","54","60973  >  443 [ACK] Seq=10287 Ack=9848 Win=27744 Len=0"
"2016-09-27 20:14:43.679013","54","60973  >  443 [ACK] Seq=10287 Ack=9889 Win=27744 Len=0"
"2016-09-27 20:14:43.679146","95","Application Data"
"2016-09-27 20:15:13.707866","95","Application Data"
"2016-09-27 20:15:13.963134","54","60973  >  443 [ACK] Seq=10369 Ack=9930 Win=27744 Len=0"
"2016-09-27 20:15:43.952784","95","Application Data"
"2016-09-27 20:15:44.132765","54","60973  >  443 [ACK] Seq=10410 Ack=9971 Win=27744 Len=0"
"2016-09-27 20:15:44.132878","95","Application Data"
"2016-09-27 20:15:44.381032","54","60973  >  443 [ACK] Seq=10451 Ack=10012 Win=27744 Len=0"
"2016-09-27 20:16:14.372000","95","Application Data"
"2016-09-27 20:16:14.585766","54","60973  >  443 [ACK] Seq=10492 Ack=10053 Win=27744 Len=0"
"2016-09-27 20:16:44.123887","54","60973  >  443 [ACK] Seq=10492 Ack=10094 Win=27744 Len=0"
"2016-09-27 20:16:44.124332","95","Application Data"
"2016-09-27 20:17:14.150675","95","Application Data"
"2016-09-27 20:17:14.396460","54","60973  >  443 [ACK] Seq=10574 Ack=10135 Win=27744 Len=0"
"2016-09-27 20:17:43.671509","54","60973  >  443 [ACK] Seq=10574 Ack=10176 Win=27744 Len=0"
"2016-09-27 20:17:43.671619","95","Application Data"
"2016-09-27 20:18:13.701591","95","Application Data"
"2016-09-27 20:18:14.404152","54","60973  >  443 [ACK] Seq=10656 Ack=10217 Win=27744 Len=0"
"2016-09-27 20:18:44.392625","95","Application Data"
"2016-09-27 20:18:44.583993","54","60973  >  443 [ACK] Seq=10697 Ack=10258 Win=27744 Len=0"
"2016-09-27 20:18:44.585265","95","Application Data"
"2016-09-27 20:18:44.833771","54","60973  >  443 [ACK] Seq=10738 Ack=10299 Win=27744 Len=0"
"2016-09-27 20:19:14.822432","95","Application Data"
"2016-09-27 20:19:15.034271","54","60973  >  443 [ACK] Seq=10779 Ack=10340 Win=27744 Len=0"
"2016-09-27 20:19:43.674316","54","60973  >  443 [ACK] Seq=10779 Ack=10381 Win=27744 Len=0"
"2016-09-27 20:19:43.675011","95","Application Data"
"2016-09-27 20:20:13.701486","95","Application Data"
"2016-09-27 20:20:13.954598","54","60973  >  443 [ACK] Seq=10861 Ack=10422 Win=27744 Len=0"
"2016-09-27 20:20:43.669758","54","60973  >  443 [ACK] Seq=10861 Ack=10463 Win=27744 Len=0"
"2016-09-27 20:20:43.670305","95","Application Data"
"2016-09-27 20:21:13.700701","95","Application Data"
"2016-09-27 20:21:13.964543","54","60973  >  443 [ACK] Seq=10943 Ack=10504 Win=27744 Len=0"
"2016-09-27 20:21:14.556343","54","60973  >  443 [ACK] Seq=10943 Ack=10706 Win=27744 Len=0"
"2016-09-27 20:21:43.670307","54","60973  >  443 [ACK] Seq=10943 Ack=10747 Win=27744 Len=0"
"2016-09-27 20:21:43.670421","95","Application Data"
"2016-09-27 20:22:13.698786","95","Application Data"
"2016-09-27 20:22:13.950412","54","60973  >  443 [ACK] Seq=11025 Ack=10788 Win=27744 Len=0"
"2016-09-27 20:22:43.677210","54","60973  >  443 [ACK] Seq=11025 Ack=10829 Win=27744 Len=0"
"2016-09-27 20:22:43.677754","95","Application Data"
"2016-09-27 20:23:13.707320","95","Application Data"
"2016-09-27 20:23:13.957919","54","60973  >  443 [ACK] Seq=11107 Ack=10870 Win=27744 Len=0"
"2016-09-27 20:23:43.677166","54","60973  >  443 [ACK] Seq=11107 Ack=10911 Win=27744 Len=0"
"2016-09-27 20:23:43.677699","95","Application Data"
"2016-09-27 20:24:13.714085","95","Application Data"
"2016-09-27 20:24:13.960342","54","60973  >  443 [ACK] Seq=11189 Ack=10952 Win=27744 Len=0"
"2016-09-27 20:24:43.676198","54","60973  >  443 [ACK] Seq=11189 Ack=10993 Win=27744 Len=0"
"2016-09-27 20:24:43.676318","95","Application Data"
"2016-09-27 20:25:13.703119","95","Application Data"
"2016-09-27 20:25:13.957208","54","60973  >  443 [ACK] Seq=11271 Ack=11034 Win=27744 Len=0"
"2016-09-27 20:25:43.668210","54","60973  >  443 [ACK] Seq=11271 Ack=11075 Win=27744 Len=0"
"2016-09-27 20:25:43.668314","95","Application Data"
"2016-09-27 20:26:13.695695","95","Application Data"
"2016-09-27 20:26:13.944472","54","60973  >  443 [ACK] Seq=11353 Ack=11116 Win=27744 Len=0"
"2016-09-27 20:26:43.672072","54","60973  >  443 [ACK] Seq=11353 Ack=11157 Win=27744 Len=0"
"2016-09-27 20:26:43.672184","95","Application Data"
"2016-09-27 20:27:13.698627","95","Application Data"
"2016-09-27 20:27:13.952074","54","60973  >  443 [ACK] Seq=11435 Ack=11198 Win=27744 Len=0"
"2016-09-27 20:27:43.675534","54","60973  >  443 [ACK] Seq=11435 Ack=11239 Win=27744 Len=0"
"2016-09-27 20:27:43.675642","95","Application Data"
"2016-09-27 20:28:13.704947","95","Application Data"
"2016-09-27 20:28:13.967406","54","60973  >  443 [ACK] Seq=11517 Ack=11280 Win=27744 Len=0"
"2016-09-27 20:28:43.675414","54","60973  >  443 [ACK] Seq=11517 Ack=11321 Win=27744 Len=0"
"2016-09-27 20:28:43.676228","95","Application Data"
"2016-09-27 20:29:13.702269","95","Application Data"
"2016-09-27 20:29:13.951792","54","60973  >  443 [ACK] Seq=11599 Ack=11362 Win=27744 Len=0"
"2016-09-27 20:29:43.674741","54","60973  >  443 [ACK] Seq=11599 Ack=11403 Win=27744 Len=0"
"2016-09-27 20:29:43.675290","95","Application Data"
"2016-09-27 20:30:13.702170","95","Application Data"
"2016-09-27 20:30:13.951648","54","60973  >  443 [ACK] Seq=11681 Ack=11444 Win=27744 Len=0"
"2016-09-27 20:30:43.679416","54","60973  >  443 [ACK] Seq=11681 Ack=11485 Win=27744 Len=0"
"2016-09-27 20:30:43.679528","95","Application Data"
"2016-09-27 20:30:53.451547","85","Encrypted Alert"
"2016-09-27 20:30:53.479678","54","60973  >  443 [FIN"
"2016-09-27 20:30:53.666939","54","60973  >  443 [RST] Seq=11753 Win=0 Len=0"
"2016-09-27 20:30:53.686463","54","60973  >  443 [RST] Seq=11754 Win=0 Len=0"
