"2016-09-26 23:00:22.123549","95","Application Data"
"2016-09-26 23:00:22.427169","54","58255  >  443 [ACK] Seq=42 Ack=42 Win=1369 Len=0"
"2016-09-26 23:00:52.105474","54","58255  >  443 [ACK] Seq=42 Ack=83 Win=1369 Len=0"
"2016-09-26 23:00:52.105583","95","Application Data"
"2016-09-26 23:01:22.132501","95","Application Data"
"2016-09-26 23:01:22.397448","54","58255  >  443 [ACK] Seq=124 Ack=124 Win=1369 Len=0"
"2016-09-26 23:01:52.101566","54","58255  >  443 [ACK] Seq=124 Ack=165 Win=1369 Len=0"
"2016-09-26 23:01:52.101677","95","Application Data"
"2016-09-26 23:02:22.129100","95","Application Data"
"2016-09-26 23:02:22.608191","95","[TCP Spurious Retransmission] "
"2016-09-26 23:02:23.056811","54","58255  >  443 [ACK] Seq=206 Ack=206 Win=1369 Len=0"
"2016-09-26 23:02:52.097803","54","58255  >  443 [ACK] Seq=206 Ack=247 Win=1369 Len=0"
"2016-09-26 23:02:52.097917","95","Application Data"
"2016-09-26 23:03:22.125635","95","Application Data"
"2016-09-26 23:03:22.397110","54","58255  >  443 [ACK] Seq=288 Ack=288 Win=1369 Len=0"
"2016-09-26 23:03:46.774209","54","58255  >  443 [ACK] Seq=288 Ack=659 Win=1552 Len=0"
"2016-09-26 23:03:47.219445","211","Application Data"
"2016-09-26 23:03:47.448059","54","58255  >  443 [ACK] Seq=445 Ack=829 Win=1734 Len=0"
"2016-09-26 23:03:49.450461","201","Application Data"
"2016-09-26 23:03:50.003466","335","Application Data"
"2016-09-26 23:03:52.135325","54","58255  >  443 [ACK] Seq=873 Ack=870 Win=1734 Len=0"
"2016-09-26 23:03:52.136071","95","Application Data"
"2016-09-26 23:04:22.166182","95","Application Data"
"2016-09-26 23:04:22.439832","54","58255  >  443 [ACK] Seq=955 Ack=911 Win=1734 Len=0"
"2016-09-26 23:04:52.088497","54","58255  >  443 [ACK] Seq=955 Ack=952 Win=1734 Len=0"
"2016-09-26 23:04:52.089038","95","Application Data"
"2016-09-26 23:05:22.115924","95","Application Data"
"2016-09-26 23:05:22.377138","54","58255  >  443 [ACK] Seq=1037 Ack=993 Win=1734 Len=0"
"2016-09-26 23:05:52.092204","54","58255  >  443 [ACK] Seq=1037 Ack=1034 Win=1734 Len=0"
"2016-09-26 23:05:52.092739","95","Application Data"
"2016-09-26 23:06:22.123096","95","Application Data"
"2016-09-26 23:06:22.576328","95","[TCP Spurious Retransmission] "
"2016-09-26 23:06:23.490368","95","[TCP Spurious Retransmission] "
"2016-09-26 23:06:23.834036","54","58255  >  443 [ACK] Seq=1119 Ack=1075 Win=1734 Len=0"
"2016-09-26 23:06:52.089015","54","58255  >  443 [ACK] Seq=1119 Ack=1116 Win=1734 Len=0"
"2016-09-26 23:06:52.089158","95","Application Data"
"2016-09-26 23:07:22.117124","95","Application Data"
"2016-09-26 23:07:22.392461","54","58255  >  443 [ACK] Seq=1201 Ack=1157 Win=1734 Len=0"
"2016-09-26 23:07:52.103636","54","58255  >  443 [ACK] Seq=1201 Ack=1198 Win=1734 Len=0"
"2016-09-26 23:07:52.104229","95","Application Data"
"2016-09-26 23:08:22.131332","95","Application Data"
"2016-09-26 23:08:22.393318","54","58255  >  443 [ACK] Seq=1283 Ack=1239 Win=1734 Len=0"
"2016-09-26 23:08:52.385390","95","Application Data"
"2016-09-26 23:08:52.552885","54","58255  >  443 [ACK] Seq=1324 Ack=1280 Win=1734 Len=0"
"2016-09-26 23:08:52.552990","95","Application Data"
"2016-09-26 23:08:52.814130","54","58255  >  443 [ACK] Seq=1365 Ack=1321 Win=1734 Len=0"
"2016-09-26 23:09:22.798481","95","Application Data"
"2016-09-26 23:09:23.041364","54","58255  >  443 [ACK] Seq=1406 Ack=1362 Win=1734 Len=0"
"2016-09-26 23:09:52.099397","54","58255  >  443 [ACK] Seq=1406 Ack=1403 Win=1734 Len=0"
"2016-09-26 23:09:52.100086","95","Application Data"
"2016-09-26 23:10:22.129078","95","Application Data"
"2016-09-26 23:10:22.415456","54","58255  >  443 [ACK] Seq=1488 Ack=1444 Win=1734 Len=0"
"2016-09-26 23:10:52.084460","54","58255  >  443 [ACK] Seq=1488 Ack=1485 Win=1734 Len=0"
"2016-09-26 23:10:52.084579","95","Application Data"
"2016-09-26 23:11:22.113227","95","Application Data"
"2016-09-26 23:11:22.376150","54","58255  >  443 [ACK] Seq=1570 Ack=1526 Win=1734 Len=0"
"2016-09-26 23:11:52.368704","95","Application Data"
"2016-09-26 23:11:52.829274","95","[TCP Spurious Retransmission] "
"2016-09-26 23:11:53.517017","54","58255  >  443 [ACK] Seq=1611 Ack=1567 Win=1734 Len=0"
"2016-09-26 23:11:53.517298","95","Application Data"
"2016-09-26 23:11:53.778514","54","58255  >  443 [ACK] Seq=1652 Ack=1608 Win=1734 Len=0"
"2016-09-26 23:12:23.770577","95","Application Data"
"2016-09-26 23:12:23.990074","54","58255  >  443 [ACK] Seq=1693 Ack=1649 Win=1734 Len=0"
"2016-09-26 23:12:52.079468","54","58255  >  443 [ACK] Seq=1693 Ack=1690 Win=1734 Len=0"
"2016-09-26 23:12:52.080037","95","Application Data"
"2016-09-26 23:13:22.110449","95","Application Data"
"2016-09-26 23:13:22.386822","54","58255  >  443 [ACK] Seq=1775 Ack=1731 Win=1734 Len=0"
"2016-09-26 23:13:52.364465","95","Application Data"
"2016-09-26 23:13:52.563708","54","58255  >  443 [ACK] Seq=1816 Ack=1772 Win=1734 Len=0"
"2016-09-26 23:13:52.563981","95","Application Data"
"2016-09-26 23:13:52.829899","54","58255  >  443 [ACK] Seq=1857 Ack=1813 Win=1734 Len=0"
"2016-09-26 23:14:22.815105","95","Application Data"
"2016-09-26 23:14:23.517438","54","58255  >  443 [ACK] Seq=1898 Ack=1854 Win=1734 Len=0"
"2016-09-26 23:14:52.087486","54","58255  >  443 [ACK] Seq=1898 Ack=1895 Win=1734 Len=0"
"2016-09-26 23:14:52.087592","95","Application Data"
"2016-09-26 23:15:22.115394","95","Application Data"
"2016-09-26 23:15:22.375491","54","58255  >  443 [ACK] Seq=1980 Ack=1936 Win=1734 Len=0"
"2016-09-26 23:15:52.079626","54","58255  >  443 [ACK] Seq=1980 Ack=1977 Win=1734 Len=0"
"2016-09-26 23:15:52.079739","95","Application Data"
"2016-09-26 23:16:22.109543","95","Application Data"
"2016-09-26 23:16:22.371441","54","58255  >  443 [ACK] Seq=2062 Ack=2018 Win=1734 Len=0"
"2016-09-26 23:16:52.082577","54","58255  >  443 [ACK] Seq=2062 Ack=2059 Win=1734 Len=0"
"2016-09-26 23:16:52.083106","95","Application Data"
"2016-09-26 23:17:22.110463","95","Application Data"
"2016-09-26 23:17:22.562754","95","[TCP Spurious Retransmission] "
"2016-09-26 23:17:22.840734","54","58255  >  443 [ACK] Seq=2144 Ack=2100 Win=1734 Len=0"
"2016-09-26 23:17:52.079490","54","58255  >  443 [ACK] Seq=2144 Ack=2141 Win=1734 Len=0"
"2016-09-26 23:17:52.079609","95","Application Data"
"2016-09-26 23:18:22.109850","95","Application Data"
"2016-09-26 23:18:22.367191","54","58255  >  443 [ACK] Seq=2226 Ack=2182 Win=1734 Len=0"
"2016-09-26 23:18:52.362325","95","Application Data"
"2016-09-26 23:18:52.812470","95","[TCP Spurious Retransmission] "
"2016-09-26 23:18:53.496351","54","58255  >  443 [ACK] Seq=2267 Ack=2223 Win=1734 Len=0"
"2016-09-26 23:18:53.496891","95","Application Data"
"2016-09-26 23:18:53.757699","54","58255  >  443 [ACK] Seq=2308 Ack=2264 Win=1734 Len=0"
"2016-09-26 23:19:23.746705","95","Application Data"
"2016-09-26 23:19:23.973182","54","58255  >  443 [ACK] Seq=2349 Ack=2305 Win=1734 Len=0"
"2016-09-26 23:19:52.078390","54","58255  >  443 [ACK] Seq=2349 Ack=2346 Win=1734 Len=0"
"2016-09-26 23:19:52.078496","95","Application Data"
"2016-09-26 23:20:22.105471","95","Application Data"
"2016-09-26 23:20:22.378112","54","58255  >  443 [ACK] Seq=2431 Ack=2387 Win=1734 Len=0"
"2016-09-26 23:20:52.085883","54","58255  >  443 [ACK] Seq=2431 Ack=2428 Win=1734 Len=0"
"2016-09-26 23:20:52.086514","95","Application Data"
"2016-09-26 23:21:22.116758","95","Application Data"
"2016-09-26 23:21:22.374458","54","58255  >  443 [ACK] Seq=2513 Ack=2469 Win=1734 Len=0"
"2016-09-26 23:21:52.365027","95","Application Data"
"2016-09-26 23:21:52.554393","54","58255  >  443 [ACK] Seq=2554 Ack=2510 Win=1734 Len=0"
"2016-09-26 23:21:52.555862","95","Application Data"
"2016-09-26 23:21:52.815783","54","58255  >  443 [ACK] Seq=2595 Ack=2551 Win=1734 Len=0"
"2016-09-26 23:22:22.804430","95","Application Data"
"2016-09-26 23:22:23.027169","54","58255  >  443 [ACK] Seq=2636 Ack=2592 Win=1734 Len=0"
"2016-09-26 23:22:52.085502","54","58255  >  443 [ACK] Seq=2636 Ack=2633 Win=1734 Len=0"
"2016-09-26 23:22:52.086060","95","Application Data"
"2016-09-26 23:23:22.112854","95","Application Data"
"2016-09-26 23:23:22.370271","54","58255  >  443 [ACK] Seq=2718 Ack=2674 Win=1734 Len=0"
"2016-09-26 23:23:52.361094","95","Application Data"
"2016-09-26 23:23:52.550194","54","58255  >  443 [ACK] Seq=2759 Ack=2715 Win=1734 Len=0"
"2016-09-26 23:23:52.550724","95","Application Data"
"2016-09-26 23:23:52.811604","54","58255  >  443 [ACK] Seq=2800 Ack=2756 Win=1734 Len=0"
"2016-09-26 23:24:22.801689","95","Application Data"
"2016-09-26 23:24:23.031133","54","58255  >  443 [ACK] Seq=2841 Ack=2797 Win=1734 Len=0"
"2016-09-26 23:24:52.085157","54","58255  >  443 [ACK] Seq=2841 Ack=2838 Win=1734 Len=0"
"2016-09-26 23:24:52.085693","95","Application Data"
"2016-09-26 23:25:22.116069","95","Application Data"
"2016-09-26 23:25:22.373865","54","58255  >  443 [ACK] Seq=2923 Ack=2879 Win=1734 Len=0"
"2016-09-26 23:25:52.092793","54","58255  >  443 [ACK] Seq=2923 Ack=2920 Win=1734 Len=0"
"2016-09-26 23:25:52.096239","95","Application Data"
"2016-09-26 23:26:22.124512","95","Application Data"
"2016-09-26 23:26:22.389275","54","58255  >  443 [ACK] Seq=3005 Ack=2961 Win=1734 Len=0"
"2016-09-26 23:26:52.080969","54","58255  >  443 [ACK] Seq=3005 Ack=3002 Win=1734 Len=0"
"2016-09-26 23:26:52.081513","95","Application Data"
"2016-09-26 23:27:22.110622","95","Application Data"
"2016-09-26 23:27:22.392182","54","58255  >  443 [ACK] Seq=3087 Ack=3043 Win=1734 Len=0"
"2016-09-26 23:27:52.089502","54","58255  >  443 [ACK] Seq=3087 Ack=3084 Win=1734 Len=0"
"2016-09-26 23:27:52.089627","95","Application Data"
"2016-09-26 23:28:22.114751","95","Application Data"
"2016-09-26 23:28:22.840737","54","58255  >  443 [ACK] Seq=3169 Ack=3125 Win=1734 Len=0"
"2016-09-26 23:28:52.826570","95","Application Data"
"2016-09-26 23:28:53.023100","54","58255  >  443 [ACK] Seq=3210 Ack=3166 Win=1734 Len=0"
"2016-09-26 23:28:53.023201","95","Application Data"
"2016-09-26 23:28:53.283772","54","58255  >  443 [ACK] Seq=3251 Ack=3207 Win=1734 Len=0"
"2016-09-26 23:29:23.273772","95","Application Data"
"2016-09-26 23:29:23.502971","54","58255  >  443 [ACK] Seq=3292 Ack=3248 Win=1734 Len=0"
"2016-09-26 23:29:52.088208","54","58255  >  443 [ACK] Seq=3292 Ack=3289 Win=1734 Len=0"
"2016-09-26 23:29:52.088757","95","Application Data"
"2016-09-26 23:30:22.119235","95","Application Data"
"2016-09-26 23:30:22.380862","54","58255  >  443 [ACK] Seq=3374 Ack=3330 Win=1734 Len=0"
"2016-09-26 23:30:52.088704","54","58255  >  443 [ACK] Seq=3374 Ack=3371 Win=1734 Len=0"
"2016-09-26 23:30:52.088814","95","Application Data"
"2016-09-26 23:31:22.116305","95","Application Data"
"2016-09-26 23:31:22.384564","54","58255  >  443 [ACK] Seq=3456 Ack=3412 Win=1734 Len=0"
"2016-09-26 23:31:52.081856","54","58255  >  443 [ACK] Seq=3456 Ack=3453 Win=1734 Len=0"
"2016-09-26 23:31:52.081984","95","Application Data"
"2016-09-26 23:32:22.110173","95","Application Data"
"2016-09-26 23:32:22.369300","54","58255  >  443 [ACK] Seq=3538 Ack=3494 Win=1734 Len=0"
"2016-09-26 23:32:52.361719","95","Application Data"
"2016-09-26 23:32:52.822698","95","[TCP Spurious Retransmission] "
"2016-09-26 23:32:53.506632","54","58255  >  443 [ACK] Seq=3579 Ack=3535 Win=1734 Len=0"
"2016-09-26 23:32:53.506753","95","Application Data"
"2016-09-26 23:32:53.765684","54","58255  >  443 [ACK] Seq=3620 Ack=3576 Win=1734 Len=0"
"2016-09-26 23:33:23.762878","95","Application Data"
"2016-09-26 23:33:23.988438","54","58255  >  443 [ACK] Seq=3661 Ack=3617 Win=1734 Len=0"
"2016-09-26 23:33:52.078782","54","58255  >  443 [ACK] Seq=3661 Ack=3658 Win=1734 Len=0"
"2016-09-26 23:33:52.078897","95","Application Data"
"2016-09-26 23:34:22.108848","95","Application Data"
"2016-09-26 23:34:22.370983","54","58255  >  443 [ACK] Seq=3743 Ack=3699 Win=1734 Len=0"
"2016-09-26 23:34:52.079924","54","58255  >  443 [ACK] Seq=3743 Ack=3740 Win=1734 Len=0"
"2016-09-26 23:34:52.080038","95","Application Data"
"2016-09-26 23:35:22.107339","95","Application Data"
"2016-09-26 23:35:22.835309","54","58255  >  443 [ACK] Seq=3825 Ack=3781 Win=1734 Len=0"
"2016-09-26 23:35:52.090110","54","58255  >  443 [ACK] Seq=3825 Ack=3822 Win=1734 Len=0"
"2016-09-26 23:35:52.090289","95","Application Data"
"2016-09-26 23:36:22.116962","95","Application Data"
"2016-09-26 23:36:22.378174","54","58255  >  443 [ACK] Seq=3907 Ack=3863 Win=1734 Len=0"
"2016-09-26 23:36:52.082388","54","58255  >  443 [ACK] Seq=3907 Ack=3904 Win=1734 Len=0"
"2016-09-26 23:36:52.082533","95","Application Data"
"2016-09-26 23:37:22.109176","95","Application Data"
"2016-09-26 23:37:22.565633","95","[TCP Spurious Retransmission] "
"2016-09-26 23:37:22.843020","54","58255  >  443 [ACK] Seq=3989 Ack=3945 Win=1734 Len=0"
"2016-09-26 23:37:52.831574","95","Application Data"
"2016-09-26 23:37:53.018782","54","58255  >  443 [ACK] Seq=4030 Ack=3986 Win=1734 Len=0"
"2016-09-26 23:37:53.021719","95","Application Data"
"2016-09-26 23:37:53.280251","54","58255  >  443 [ACK] Seq=4071 Ack=4027 Win=1734 Len=0"
"2016-09-26 23:38:23.270364","95","Application Data"
"2016-09-26 23:38:23.725508","95","[TCP Spurious Retransmission] "
"2016-09-26 23:38:23.995414","54","58255  >  443 [ACK] Seq=4112 Ack=4068 Win=1734 Len=0"
"2016-09-26 23:38:53.030521","54","58255  >  443 [ACK] Seq=4112 Ack=4109 Win=1734 Len=0"
"2016-09-26 23:38:53.031073","95","Application Data"
"2016-09-26 23:39:23.061659","95","Application Data"
"2016-09-26 23:39:23.397170","54","58255  >  443 [ACK] Seq=4194 Ack=4150 Win=1734 Len=0"
"2016-09-26 23:39:52.159153","54","58255  >  443 [ACK] Seq=4194 Ack=4191 Win=1734 Len=0"
"2016-09-26 23:39:52.159694","95","Application Data"
"2016-09-26 23:40:22.198090","95","Application Data"
"2016-09-26 23:40:22.533729","54","58255  >  443 [ACK] Seq=4276 Ack=4232 Win=1734 Len=0"
"2016-09-26 23:40:52.174537","54","58255  >  443 [ACK] Seq=4276 Ack=4273 Win=1734 Len=0"
"2016-09-26 23:40:52.176239","95","Application Data"
"2016-09-26 23:41:22.205859","95","Application Data"
"2016-09-26 23:41:23.053089","54","58255  >  443 [ACK] Seq=4358 Ack=4314 Win=1734 Len=0"
"2016-09-26 23:41:53.045411","95","Application Data"
"2016-09-26 23:41:53.170305","54","58255  >  443 [ACK] Seq=4399 Ack=4355 Win=1734 Len=0"
"2016-09-26 23:41:53.170993","95","Application Data"
"2016-09-26 23:41:53.526088","54","58255  >  443 [ACK] Seq=4440 Ack=4396 Win=1734 Len=0"
"2016-09-26 23:42:23.516352","95","Application Data"
"2016-09-26 23:42:23.836538","54","58255  >  443 [ACK] Seq=4481 Ack=4437 Win=1734 Len=0"
"2016-09-26 23:42:52.182826","54","58255  >  443 [ACK] Seq=4481 Ack=4478 Win=1734 Len=0"
"2016-09-26 23:42:52.182935","95","Application Data"
"2016-09-26 23:43:22.206815","95","Application Data"
"2016-09-26 23:43:22.556909","54","58255  >  443 [ACK] Seq=4563 Ack=4519 Win=1734 Len=0"
"2016-09-26 23:43:52.141165","54","58255  >  443 [ACK] Seq=4563 Ack=4560 Win=1734 Len=0"
"2016-09-26 23:43:52.141266","95","Application Data"
"2016-09-26 23:44:22.170320","95","Application Data"
"2016-09-26 23:44:22.459290","54","58255  >  443 [ACK] Seq=4645 Ack=4601 Win=1734 Len=0"
"2016-09-26 23:44:52.103360","54","58255  >  443 [ACK] Seq=4645 Ack=4642 Win=1734 Len=0"
"2016-09-26 23:44:52.104085","95","Application Data"
"2016-09-26 23:45:22.126113","95","Application Data"
"2016-09-26 23:45:22.634465","95","[TCP Spurious Retransmission] "
"2016-09-26 23:45:22.900018","54","58255  >  443 [ACK] Seq=4727 Ack=4683 Win=1734 Len=0"
"2016-09-26 23:45:52.088600","54","58255  >  443 [ACK] Seq=4727 Ack=4724 Win=1734 Len=0"
"2016-09-26 23:45:52.088721","95","Application Data"
"2016-09-26 23:46:22.118008","95","Application Data"
"2016-09-26 23:46:22.618656","95","[TCP Spurious Retransmission] "
"2016-09-26 23:46:22.876447","54","58255  >  443 [ACK] Seq=4809 Ack=4765 Win=1734 Len=0"
"2016-09-26 23:46:52.107141","54","58255  >  443 [ACK] Seq=4809 Ack=4806 Win=1734 Len=0"
"2016-09-26 23:46:52.107696","95","Application Data"
"2016-09-26 23:47:22.134571","95","Application Data"
"2016-09-26 23:47:22.395818","54","58255  >  443 [ACK] Seq=4891 Ack=4847 Win=1734 Len=0"
"2016-09-26 23:47:52.093201","54","58255  >  443 [ACK] Seq=4891 Ack=4888 Win=1734 Len=0"
"2016-09-26 23:47:52.093309","95","Application Data"
"2016-09-26 23:48:22.122287","95","Application Data"
"2016-09-26 23:48:22.399750","54","58255  >  443 [ACK] Seq=4973 Ack=4929 Win=1734 Len=0"
"2016-09-26 23:48:52.083290","54","58255  >  443 [ACK] Seq=4973 Ack=4970 Win=1734 Len=0"
"2016-09-26 23:48:52.083947","95","Application Data"
"2016-09-26 23:49:22.110999","95","Application Data"
"2016-09-26 23:49:22.375531","54","58255  >  443 [ACK] Seq=5055 Ack=5011 Win=1734 Len=0"
"2016-09-26 23:49:52.087056","54","58255  >  443 [ACK] Seq=5055 Ack=5052 Win=1734 Len=0"
"2016-09-26 23:49:52.087661","95","Application Data"
"2016-09-26 23:50:22.116059","95","Application Data"
"2016-09-26 23:50:22.384272","54","58255  >  443 [ACK] Seq=5137 Ack=5093 Win=1734 Len=0"
"2016-09-26 23:50:52.082969","54","58255  >  443 [ACK] Seq=5137 Ack=5134 Win=1734 Len=0"
"2016-09-26 23:50:52.083499","95","Application Data"
"2016-09-26 23:50:53.624459","219","Application Data"
"2016-09-26 23:51:23.653379","95","Application Data"
"2016-09-26 23:51:24.121948","95","[TCP Spurious Retransmission] "
"2016-09-26 23:51:25.059856","95","[TCP Spurious Retransmission] "
"2016-09-26 23:51:25.357597","54","58255  >  443 [ACK] Seq=5384 Ack=5175 Win=1734 Len=0"
"2016-09-26 23:51:52.087589","54","58255  >  443 [ACK] Seq=5384 Ack=5216 Win=1734 Len=0"
"2016-09-26 23:51:52.087699","95","Application Data"
"2016-09-26 23:52:22.117906","95","Application Data"
"2016-09-26 23:52:22.848305","54","58255  >  443 [ACK] Seq=5466 Ack=5257 Win=1734 Len=0"
"2016-09-26 23:52:52.087356","54","58255  >  443 [ACK] Seq=5466 Ack=5298 Win=1734 Len=0"
"2016-09-26 23:52:52.087477","95","Application Data"
"2016-09-26 23:53:22.117185","95","Application Data"
"2016-09-26 23:53:22.851849","54","58255  >  443 [ACK] Seq=5548 Ack=5339 Win=1734 Len=0"
"2016-09-26 23:53:52.102006","54","58255  >  443 [ACK] Seq=5548 Ack=5380 Win=1734 Len=0"
"2016-09-26 23:53:52.102130","95","Application Data"
"2016-09-26 23:54:22.111454","95","Application Data"
"2016-09-26 23:54:22.374910","54","58255  >  443 [ACK] Seq=5630 Ack=5421 Win=1734 Len=0"
"2016-09-26 23:54:52.082380","54","58255  >  443 [ACK] Seq=5630 Ack=5462 Win=1734 Len=0"
"2016-09-26 23:54:52.082927","95","Application Data"
"2016-09-26 23:55:22.111476","95","Application Data"
"2016-09-26 23:55:22.570349","95","[TCP Spurious Retransmission] "
"2016-09-26 23:55:22.843598","54","58255  >  443 [ACK] Seq=5712 Ack=5503 Win=1734 Len=0"
"2016-09-26 23:55:52.083851","54","58255  >  443 [ACK] Seq=5712 Ack=5544 Win=1734 Len=0"
"2016-09-26 23:55:52.083970","95","Application Data"
"2016-09-26 23:56:22.111880","95","Application Data"
"2016-09-26 23:56:22.570125","95","[TCP Spurious Retransmission] "
"2016-09-26 23:56:22.835631","54","58255  >  443 [ACK] Seq=5794 Ack=5585 Win=1734 Len=0"
"2016-09-26 23:56:52.078853","54","58255  >  443 [ACK] Seq=5794 Ack=5626 Win=1734 Len=0"
"2016-09-26 23:56:52.078967","95","Application Data"
"2016-09-26 23:57:22.105473","95","Application Data"
"2016-09-26 23:57:22.851159","54","58255  >  443 [ACK] Seq=5876 Ack=5667 Win=1734 Len=0"
"2016-09-26 23:57:52.086251","54","58255  >  443 [ACK] Seq=5876 Ack=5708 Win=1734 Len=0"
"2016-09-26 23:57:52.086823","95","Application Data"
"2016-09-26 23:58:22.117358","95","Application Data"
"2016-09-26 23:58:22.577615","95","[TCP Spurious Retransmission] "
"2016-09-26 23:58:22.839237","54","58255  >  443 [ACK] Seq=5958 Ack=5749 Win=1734 Len=0"
"2016-09-26 23:58:52.085492","54","58255  >  443 [ACK] Seq=5958 Ack=5790 Win=1734 Len=0"
"2016-09-26 23:58:52.086032","95","Application Data"
"2016-09-26 23:59:22.115180","95","Application Data"
"2016-09-26 23:59:22.573436","95","[TCP Spurious Retransmission] "
"2016-09-26 23:59:22.831281","54","58255  >  443 [ACK] Seq=6040 Ack=5831 Win=1734 Len=0"
"2016-09-26 23:59:52.077483","54","58255  >  443 [ACK] Seq=6040 Ack=5872 Win=1734 Len=0"
"2016-09-26 23:59:52.078011","95","Application Data"
"2016-09-27 00:00:22.106169","95","Application Data"
"2016-09-27 00:00:22.370114","54","58255  >  443 [ACK] Seq=6122 Ack=5913 Win=1734 Len=0"
"2016-09-27 00:00:52.104633","54","58255  >  443 [ACK] Seq=6122 Ack=5954 Win=1734 Len=0"
"2016-09-27 00:00:52.104742","95","Application Data"
"2016-09-27 00:01:22.116370","95","Application Data"
"2016-09-27 00:01:22.580968","95","[TCP Spurious Retransmission] "
"2016-09-27 00:01:22.838698","54","58255  >  443 [ACK] Seq=6204 Ack=5995 Win=1734 Len=0"
"2016-09-27 00:01:52.081108","54","58255  >  443 [ACK] Seq=6204 Ack=6036 Win=1734 Len=0"
"2016-09-27 00:01:52.081642","95","Application Data"
"2016-09-27 00:02:22.112610","95","Application Data"
"2016-09-27 00:02:22.377573","54","58255  >  443 [ACK] Seq=6286 Ack=6077 Win=1734 Len=0"
"2016-09-27 00:02:52.078299","54","58255  >  443 [ACK] Seq=6286 Ack=6118 Win=1734 Len=0"
"2016-09-27 00:02:52.078405","95","Application Data"
"2016-09-27 00:03:22.108816","95","Application Data"
"2016-09-27 00:03:22.373616","54","58255  >  443 [ACK] Seq=6368 Ack=6159 Win=1734 Len=0"
"2016-09-27 00:03:50.418584","54","58255  >  443 [ACK] Seq=6368 Ack=6362 Win=1734 Len=0"
"2016-09-27 00:03:52.081516","54","58255  >  443 [ACK] Seq=6368 Ack=6403 Win=1734 Len=0"
"2016-09-27 00:03:52.081620","95","Application Data"
"2016-09-27 00:04:22.109760","95","Application Data"
"2016-09-27 00:04:22.369417","54","58255  >  443 [ACK] Seq=6450 Ack=6444 Win=1734 Len=0"
"2016-09-27 00:04:52.084431","54","58255  >  443 [ACK] Seq=6450 Ack=6485 Win=1734 Len=0"
"2016-09-27 00:04:52.084957","95","Application Data"
"2016-09-27 00:05:22.114025","95","Application Data"
"2016-09-27 00:05:22.377315","54","58255  >  443 [ACK] Seq=6532 Ack=6526 Win=1734 Len=0"
"2016-09-27 00:05:52.083771","54","58255  >  443 [ACK] Seq=6532 Ack=6567 Win=1734 Len=0"
"2016-09-27 00:05:52.083878","95","Application Data"
"2016-09-27 00:06:22.110099","95","Application Data"
"2016-09-27 00:06:22.372969","54","58255  >  443 [ACK] Seq=6614 Ack=6608 Win=1734 Len=0"
"2016-09-27 00:06:52.364062","95","Application Data"
"2016-09-27 00:06:52.552818","54","58255  >  443 [ACK] Seq=6655 Ack=6649 Win=1734 Len=0"
"2016-09-27 00:06:52.553328","95","Application Data"
"2016-09-27 00:06:52.814255","54","58255  >  443 [ACK] Seq=6696 Ack=6690 Win=1734 Len=0"
"2016-09-27 00:07:22.810265","95","Application Data"
"2016-09-27 00:07:23.029708","54","58255  >  443 [ACK] Seq=6737 Ack=6731 Win=1734 Len=0"
"2016-09-27 00:07:52.107271","54","58255  >  443 [ACK] Seq=6737 Ack=6772 Win=1734 Len=0"
"2016-09-27 00:07:52.107387","95","Application Data"
"2016-09-27 00:08:22.114432","95","Application Data"
"2016-09-27 00:08:22.377387","54","58255  >  443 [ACK] Seq=6819 Ack=6813 Win=1734 Len=0"
"2016-09-27 00:08:52.080701","54","58255  >  443 [ACK] Seq=6819 Ack=6854 Win=1734 Len=0"
"2016-09-27 00:08:52.080808","95","Application Data"
"2016-09-27 00:09:22.109707","95","Application Data"
"2016-09-27 00:09:22.372541","54","58255  >  443 [ACK] Seq=6901 Ack=6895 Win=1734 Len=0"
"2016-09-27 00:09:52.083586","54","58255  >  443 [ACK] Seq=6901 Ack=6936 Win=1734 Len=0"
"2016-09-27 00:09:52.084122","95","Application Data"
"2016-09-27 00:10:22.114528","95","Application Data"
"2016-09-27 00:10:22.372097","54","58255  >  443 [ACK] Seq=6983 Ack=6977 Win=1734 Len=0"
"2016-09-27 00:10:41.188229","85","Encrypted Alert"
"2016-09-27 00:10:41.201859","54","58255  >  443 [FIN"
"2016-09-27 00:10:41.408834","54","58255  >  443 [RST] Seq=7014 Win=0 Len=0"
"2016-09-27 00:10:41.419300","54","58255  >  443 [RST] Seq=7015 Win=0 Len=0"
"2016-09-27 03:51:51.020060","74","52728  >  443 [SYN] Seq=0 Win=4380 Len=0 MSS=1460 SACK_PERM=1 TSval=56159700 TSecr=0 WS=16"
"2016-09-27 03:51:51.229042","54","52728  >  443 [ACK] Seq=1 Ack=1 Win=4384 Len=0"
"2016-09-27 03:51:51.345525","371","Client Hello"
"2016-09-27 03:51:51.569216","54","52728  >  443 [ACK] Seq=318 Ack=1461 Win=7312 Len=0"
"2016-09-27 03:51:51.570862","54","52728  >  443 [ACK] Seq=318 Ack=2921 Win=10224 Len=0"
"2016-09-27 03:51:51.572384","54","52728  >  443 [ACK] Seq=318 Ack=3294 Win=13152 Len=0"
"2016-09-27 03:51:51.597821","180","Client Key Exchange"
"2016-09-27 03:51:51.812070","54","52728  >  443 [ACK] Seq=444 Ack=3345 Win=13152 Len=0"
"2016-09-27 03:51:51.872143","1514","52728  >  443 [ACK] Seq=444 Ack=3345 Win=13152 Len=1460 [TCP segment of a reassembled PDU]"
"2016-09-27 03:51:51.872269","430","Application Data"
"2016-09-27 03:51:52.195787","54","52728  >  443 [ACK] Seq=2280 Ack=3886 Win=18992 Len=0"
"2016-09-27 03:51:52.279527","54","52728  >  443 [ACK] Seq=2280 Ack=4055 Win=21904 Len=0"
"2016-09-27 03:51:52.317748","264","Application Data"
"2016-09-27 03:51:52.365202","276","Application Data"
"2016-09-27 03:51:52.368988","545","Application Data"
"2016-09-27 03:51:52.393517","380","Application Data"
"2016-09-27 03:51:52.414826","190","Application Data"
"2016-09-27 03:51:52.424178","183","Application Data"
"2016-09-27 03:51:52.570377","148","Application Data"
"2016-09-27 03:51:52.572693","381","Application Data"
"2016-09-27 03:51:56.814900","54","52728  >  443 [ACK] Seq=4215 Ack=4096 Win=21904 Len=0"
"2016-09-27 03:51:56.815400","95","Application Data"
"2016-09-27 03:52:26.841532","95","Application Data"
"2016-09-27 03:52:27.338866","95","[TCP Spurious Retransmission] "
"2016-09-27 03:52:27.693417","54","52728  >  443 [ACK] Seq=4297 Ack=4137 Win=21904 Len=0"
"2016-09-27 03:52:38.931669","54","52728  >  443 [ACK] Seq=4297 Ack=4510 Win=24832 Len=0"
"2016-09-27 03:52:39.387484","209","Application Data"
"2016-09-27 03:52:39.609167","54","52728  >  443 [ACK] Seq=4452 Ack=4682 Win=27744 Len=0"
"2016-09-27 03:52:41.867445","201","Application Data"
"2016-09-27 03:52:42.007271","335","Application Data"
"2016-09-27 03:52:56.819341","54","52728  >  443 [ACK] Seq=4880 Ack=4723 Win=27744 Len=0"
"2016-09-27 03:52:56.819457","95","Application Data"
"2016-09-27 03:53:26.848194","95","Application Data"
"2016-09-27 03:53:27.099462","54","52728  >  443 [ACK] Seq=4962 Ack=4764 Win=27744 Len=0"
"2016-09-27 03:53:57.088992","95","Application Data"
"2016-09-27 03:53:57.306720","54","[TCP Dup ACK 96077#1] 52728  >  443 [ACK] Seq=5003 Ack=4764 Win=27744 Len=0"
"2016-09-27 03:53:57.353602","54","52728  >  443 [ACK] Seq=5003 Ack=4846 Win=27744 Len=0"
"2016-09-27 03:53:57.354156","95","Application Data"
"2016-09-27 03:54:27.384359","95","Application Data"
"2016-09-27 03:54:27.638363","54","52728  >  443 [ACK] Seq=5085 Ack=4887 Win=27744 Len=0"
"2016-09-27 03:54:56.818237","54","52728  >  443 [ACK] Seq=5085 Ack=4928 Win=27744 Len=0"
"2016-09-27 03:54:56.818767","95","Application Data"
"2016-09-27 03:55:26.844305","95","Application Data"
"2016-09-27 03:55:27.106981","54","52728  >  443 [ACK] Seq=5167 Ack=4969 Win=27744 Len=0"
"2016-09-27 03:55:56.818621","54","52728  >  443 [ACK] Seq=5167 Ack=5010 Win=27744 Len=0"
"2016-09-27 03:55:56.818736","95","Application Data"
"2016-09-27 03:56:26.849212","95","Application Data"
"2016-09-27 03:56:27.110599","54","52728  >  443 [ACK] Seq=5249 Ack=5051 Win=27744 Len=0"
"2016-09-27 03:56:56.810099","54","52728  >  443 [ACK] Seq=5249 Ack=5092 Win=27744 Len=0"
"2016-09-27 03:56:56.810653","95","Application Data"
"2016-09-27 03:57:26.842275","95","Application Data"
"2016-09-27 03:57:27.100111","54","52728  >  443 [ACK] Seq=5331 Ack=5133 Win=27744 Len=0"
"2016-09-27 03:57:56.810519","54","52728  >  443 [ACK] Seq=5331 Ack=5174 Win=27744 Len=0"
"2016-09-27 03:57:56.810628","95","Application Data"
"2016-09-27 03:58:26.837979","95","Application Data"
"2016-09-27 03:58:27.087138","54","52728  >  443 [ACK] Seq=5413 Ack=5215 Win=27744 Len=0"
"2016-09-27 03:58:56.809686","54","52728  >  443 [ACK] Seq=5413 Ack=5256 Win=27744 Len=0"
"2016-09-27 03:58:56.810225","95","Application Data"
"2016-09-27 03:59:26.837317","95","Application Data"
"2016-09-27 03:59:27.094391","54","52728  >  443 [ACK] Seq=5495 Ack=5297 Win=27744 Len=0"
"2016-09-27 03:59:57.083728","95","Application Data"
"2016-09-27 03:59:57.293551","54","52728  >  443 [ACK] Seq=5536 Ack=5338 Win=27744 Len=0"
"2016-09-27 03:59:57.293669","95","Application Data"
"2016-09-27 03:59:57.547438","54","52728  >  443 [ACK] Seq=5577 Ack=5379 Win=27744 Len=0"
"2016-09-27 04:00:27.537626","95","Application Data"
"2016-09-27 04:00:27.755198","54","52728  >  443 [ACK] Seq=5618 Ack=5420 Win=27744 Len=0"
"2016-09-27 04:00:56.817749","54","52728  >  443 [ACK] Seq=5618 Ack=5461 Win=27744 Len=0"
"2016-09-27 04:00:56.817859","95","Application Data"
"2016-09-27 04:01:26.847491","95","Application Data"
"2016-09-27 04:01:27.097954","54","52728  >  443 [ACK] Seq=5700 Ack=5502 Win=27744 Len=0"
"2016-09-27 04:01:56.816912","54","52728  >  443 [ACK] Seq=5700 Ack=5543 Win=27744 Len=0"
"2016-09-27 04:01:56.817485","95","Application Data"
"2016-09-27 04:02:26.844476","95","Application Data"
"2016-09-27 04:02:27.094902","54","52728  >  443 [ACK] Seq=5782 Ack=5584 Win=27744 Len=0"
"2016-09-27 04:02:57.085393","95","Application Data"
"2016-09-27 04:02:57.266429","54","52728  >  443 [ACK] Seq=5823 Ack=5625 Win=27744 Len=0"
"2016-09-27 04:02:57.266535","95","Application Data"
"2016-09-27 04:02:57.515599","54","52728  >  443 [ACK] Seq=5864 Ack=5666 Win=27744 Len=0"
"2016-09-27 04:03:27.508115","95","Application Data"
"2016-09-27 04:03:27.719276","54","52728  >  443 [ACK] Seq=5905 Ack=5707 Win=27744 Len=0"
"2016-09-27 04:03:56.816524","54","52728  >  443 [ACK] Seq=5905 Ack=5748 Win=27744 Len=0"
"2016-09-27 04:03:56.817150","95","Application Data"
"2016-09-27 04:04:26.845256","95","Application Data"
"2016-09-27 04:04:27.093475","54","52728  >  443 [ACK] Seq=5987 Ack=5789 Win=27744 Len=0"
"2016-09-27 04:04:56.813057","54","52728  >  443 [ACK] Seq=5987 Ack=5830 Win=27744 Len=0"
"2016-09-27 04:04:56.814455","95","Application Data"
"2016-09-27 04:05:26.841980","95","Application Data"
"2016-09-27 04:05:27.093288","54","52728  >  443 [ACK] Seq=6069 Ack=5871 Win=27744 Len=0"
"2016-09-27 04:05:56.812229","54","52728  >  443 [ACK] Seq=6069 Ack=5912 Win=27744 Len=0"
"2016-09-27 04:05:56.812786","95","Application Data"
"2016-09-27 04:06:26.844360","95","Application Data"
"2016-09-27 04:06:27.280659","95","[TCP Spurious Retransmission] "
"2016-09-27 04:06:27.554001","54","52728  >  443 [ACK] Seq=6151 Ack=5953 Win=27744 Len=0"
"2016-09-27 04:06:56.811956","54","52728  >  443 [ACK] Seq=6151 Ack=5994 Win=27744 Len=0"
"2016-09-27 04:06:56.812484","95","Application Data"
"2016-09-27 04:07:26.839376","95","Application Data"
"2016-09-27 04:07:27.085038","54","52728  >  443 [ACK] Seq=6233 Ack=6035 Win=27744 Len=0"
"2016-09-27 04:07:56.812901","54","52728  >  443 [ACK] Seq=6233 Ack=6076 Win=27744 Len=0"
"2016-09-27 04:07:56.813008","95","Application Data"
"2016-09-27 04:08:26.843056","95","Application Data"
"2016-09-27 04:08:27.096602","54","52728  >  443 [ACK] Seq=6315 Ack=6117 Win=27744 Len=0"
"2016-09-27 04:08:56.812435","54","52728  >  443 [ACK] Seq=6315 Ack=6158 Win=27744 Len=0"
"2016-09-27 04:08:56.812880","95","Application Data"
"2016-09-27 04:09:26.840503","95","Application Data"
"2016-09-27 04:09:27.283954","95","[TCP Spurious Retransmission] "
"2016-09-27 04:09:27.549496","54","52728  >  443 [ACK] Seq=6397 Ack=6199 Win=27744 Len=0"
"2016-09-27 04:09:56.816043","54","52728  >  443 [ACK] Seq=6397 Ack=6240 Win=27744 Len=0"
"2016-09-27 04:09:56.816158","95","Application Data"
"2016-09-27 04:10:26.846426","95","Application Data"
"2016-09-27 04:10:27.096180","54","52728  >  443 [ACK] Seq=6479 Ack=6281 Win=27744 Len=0"
"2016-09-27 04:10:56.815160","54","52728  >  443 [ACK] Seq=6479 Ack=6322 Win=27744 Len=0"
"2016-09-27 04:10:56.815713","95","Application Data"
"2016-09-27 04:11:26.844818","95","Application Data"
"2016-09-27 04:11:27.092349","54","52728  >  443 [ACK] Seq=6561 Ack=6363 Win=27744 Len=0"
"2016-09-27 04:11:56.814943","54","52728  >  443 [ACK] Seq=6561 Ack=6404 Win=27744 Len=0"
"2016-09-27 04:11:56.815509","95","Application Data"
"2016-09-27 04:12:26.845094","95","Application Data"
"2016-09-27 04:12:27.544956","54","52728  >  443 [ACK] Seq=6643 Ack=6445 Win=27744 Len=0"
"2016-09-27 04:12:56.811579","54","52728  >  443 [ACK] Seq=6643 Ack=6486 Win=27744 Len=0"
"2016-09-27 04:12:56.811700","95","Application Data"
"2016-09-27 04:13:26.839880","95","Application Data"
"2016-09-27 04:13:27.087769","54","52728  >  443 [ACK] Seq=6725 Ack=6527 Win=27744 Len=0"
"2016-09-27 04:13:56.819564","54","52728  >  443 [ACK] Seq=6725 Ack=6568 Win=27744 Len=0"
"2016-09-27 04:13:56.819686","95","Application Data"
"2016-09-27 04:14:26.849749","95","Application Data"
"2016-09-27 04:14:27.099374","54","52728  >  443 [ACK] Seq=6807 Ack=6609 Win=27744 Len=0"
"2016-09-27 04:14:56.838348","54","52728  >  443 [ACK] Seq=6807 Ack=6650 Win=27744 Len=0"
"2016-09-27 04:14:56.859767","95","Application Data"
"2016-09-27 04:15:26.843201","95","Application Data"
"2016-09-27 04:15:27.091389","54","52728  >  443 [ACK] Seq=6889 Ack=6691 Win=27744 Len=0"
"2016-09-27 04:15:56.811600","54","52728  >  443 [ACK] Seq=6889 Ack=6732 Win=27744 Len=0"
"2016-09-27 04:15:56.812051","95","Application Data"
"2016-09-27 04:16:26.843044","95","Application Data"
"2016-09-27 04:16:27.290446","95","[TCP Spurious Retransmission] "
"2016-09-27 04:16:27.555836","54","52728  >  443 [ACK] Seq=6971 Ack=6773 Win=27744 Len=0"
"2016-09-27 04:16:56.817898","54","52728  >  443 [ACK] Seq=6971 Ack=6814 Win=27744 Len=0"
"2016-09-27 04:16:56.818415","95","Application Data"
"2016-09-27 04:17:26.847158","95","Application Data"
"2016-09-27 04:17:27.102686","54","52728  >  443 [ACK] Seq=7053 Ack=6855 Win=27744 Len=0"
"2016-09-27 04:17:56.814579","54","52728  >  443 [ACK] Seq=7053 Ack=6896 Win=27744 Len=0"
"2016-09-27 04:17:56.814698","95","Application Data"
"2016-09-27 04:18:26.841168","95","Application Data"
"2016-09-27 04:18:27.289985","95","[TCP Spurious Retransmission] "
"2016-09-27 04:18:27.547712","54","52728  >  443 [ACK] Seq=7135 Ack=6937 Win=27744 Len=0"
"2016-09-27 04:18:56.810535","54","52728  >  443 [ACK] Seq=7135 Ack=6978 Win=27744 Len=0"
"2016-09-27 04:18:56.810646","95","Application Data"
"2016-09-27 04:19:26.837930","95","Application Data"
"2016-09-27 04:19:27.090481","54","52728  >  443 [ACK] Seq=7217 Ack=7019 Win=27744 Len=0"
"2016-09-27 04:19:56.818086","54","52728  >  443 [ACK] Seq=7217 Ack=7060 Win=27744 Len=0"
"2016-09-27 04:19:56.818205","95","Application Data"
"2016-09-27 04:20:26.845309","95","Application Data"
"2016-09-27 04:20:27.098154","54","52728  >  443 [ACK] Seq=7299 Ack=7101 Win=27744 Len=0"
"2016-09-27 04:20:56.813192","54","52728  >  443 [ACK] Seq=7299 Ack=7142 Win=27744 Len=0"
"2016-09-27 04:20:56.813736","95","Application Data"
"2016-09-27 04:21:26.840422","95","Application Data"
"2016-09-27 04:21:27.093986","54","52728  >  443 [ACK] Seq=7381 Ack=7183 Win=27744 Len=0"
"2016-09-27 04:21:56.812951","54","52728  >  443 [ACK] Seq=7381 Ack=7224 Win=27744 Len=0"
"2016-09-27 04:21:56.813512","95","Application Data"
"2016-09-27 04:22:26.840328","95","Application Data"
"2016-09-27 04:22:27.093824","54","52728  >  443 [ACK] Seq=7463 Ack=7265 Win=27744 Len=0"
"2016-09-27 04:22:56.813507","54","52728  >  443 [ACK] Seq=7463 Ack=7306 Win=27744 Len=0"
"2016-09-27 04:22:56.813616","95","Application Data"
"2016-09-27 04:23:26.844308","95","Application Data"
"2016-09-27 04:23:27.550675","54","52728  >  443 [ACK] Seq=7545 Ack=7347 Win=27744 Len=0"
"2016-09-27 04:23:56.813155","54","52728  >  443 [ACK] Seq=7545 Ack=7388 Win=27744 Len=0"
"2016-09-27 04:23:56.813272","95","Application Data"
"2016-09-27 04:24:26.842352","95","Application Data"
"2016-09-27 04:24:27.093493","54","52728  >  443 [ACK] Seq=7627 Ack=7429 Win=27744 Len=0"
"2016-09-27 04:24:56.820189","54","52728  >  443 [ACK] Seq=7627 Ack=7470 Win=27744 Len=0"
"2016-09-27 04:24:56.820739","95","Application Data"
"2016-09-27 04:25:26.851997","95","Application Data"
"2016-09-27 04:25:27.101044","54","52728  >  443 [ACK] Seq=7709 Ack=7511 Win=27744 Len=0"
"2016-09-27 04:25:56.816855","54","52728  >  443 [ACK] Seq=7709 Ack=7552 Win=27744 Len=0"
"2016-09-27 04:25:56.816974","95","Application Data"
"2016-09-27 04:26:26.845511","95","Application Data"
"2016-09-27 04:26:27.096919","54","52728  >  443 [ACK] Seq=7791 Ack=7593 Win=27744 Len=0"
"2016-09-27 04:26:56.819837","54","52728  >  443 [ACK] Seq=7791 Ack=7634 Win=27744 Len=0"
"2016-09-27 04:26:56.820387","95","Application Data"
"2016-09-27 04:27:26.847045","95","Application Data"
"2016-09-27 04:27:27.098779","54","52728  >  443 [ACK] Seq=7873 Ack=7675 Win=27744 Len=0"
"2016-09-27 04:27:57.088307","95","Application Data"
"2016-09-27 04:27:57.272683","54","52728  >  443 [ACK] Seq=7914 Ack=7716 Win=27744 Len=0"
"2016-09-27 04:27:57.273215","95","Application Data"
"2016-09-27 04:27:57.522408","54","52728  >  443 [ACK] Seq=7955 Ack=7757 Win=27744 Len=0"
"2016-09-27 04:28:27.513396","95","Application Data"
"2016-09-27 04:28:27.729901","54","52728  >  443 [ACK] Seq=7996 Ack=7798 Win=27744 Len=0"
"2016-09-27 04:28:57.272354","54","52728  >  443 [ACK] Seq=7996 Ack=7839 Win=27744 Len=0"
"2016-09-27 04:28:57.273149","95","Application Data"
"2016-09-27 04:29:27.303249","95","Application Data"
"2016-09-27 04:29:27.557423","54","52728  >  443 [ACK] Seq=8078 Ack=7880 Win=27744 Len=0"
"2016-09-27 04:29:56.812157","54","52728  >  443 [ACK] Seq=8078 Ack=7921 Win=27744 Len=0"
"2016-09-27 04:29:56.812266","95","Application Data"
"2016-09-27 04:30:26.835168","95","Application Data"
"2016-09-27 04:30:27.104730","54","52728  >  443 [ACK] Seq=8160 Ack=7962 Win=27744 Len=0"
"2016-09-27 04:30:57.074994","95","Application Data"
"2016-09-27 04:30:57.279940","54","52728  >  443 [ACK] Seq=8201 Ack=8003 Win=27744 Len=0"
"2016-09-27 04:30:57.280438","95","Application Data"
"2016-09-27 04:30:57.529596","54","52728  >  443 [ACK] Seq=8242 Ack=8044 Win=27744 Len=0"
"2016-09-27 04:31:27.518293","95","Application Data"
"2016-09-27 04:31:27.729257","54","52728  >  443 [ACK] Seq=8283 Ack=8085 Win=27744 Len=0"
"2016-09-27 04:31:56.815884","54","52728  >  443 [ACK] Seq=8283 Ack=8126 Win=27744 Len=0"
"2016-09-27 04:31:56.815987","95","Application Data"
"2016-09-27 04:32:26.844499","95","Application Data"
"2016-09-27 04:32:27.096567","54","52728  >  443 [ACK] Seq=8365 Ack=8167 Win=27744 Len=0"
"2016-09-27 04:32:56.811480","54","52728  >  443 [ACK] Seq=8365 Ack=8208 Win=27744 Len=0"
"2016-09-27 04:32:56.811600","95","Application Data"
"2016-09-27 04:33:26.838486","95","Application Data"
"2016-09-27 04:33:27.095585","54","52728  >  443 [ACK] Seq=8447 Ack=8249 Win=27744 Len=0"
"2016-09-27 04:33:57.094719","95","Application Data"
"2016-09-27 04:33:57.273069","54","52728  >  443 [ACK] Seq=8488 Ack=8290 Win=27744 Len=0"
"2016-09-27 04:33:57.273588","95","Application Data"
"2016-09-27 04:33:57.522845","54","52728  >  443 [ACK] Seq=8529 Ack=8331 Win=27744 Len=0"
"2016-09-27 04:34:27.514860","95","Application Data"
"2016-09-27 04:34:27.738273","54","52728  >  443 [ACK] Seq=8570 Ack=8372 Win=27744 Len=0"
"2016-09-27 04:34:56.812177","54","52728  >  443 [ACK] Seq=8570 Ack=8413 Win=27744 Len=0"
"2016-09-27 04:34:56.812711","95","Application Data"
"2016-09-27 04:35:26.844213","95","Application Data"
"2016-09-27 04:35:27.092840","54","52728  >  443 [ACK] Seq=8652 Ack=8454 Win=27744 Len=0"
"2016-09-27 04:35:56.815949","54","52728  >  443 [ACK] Seq=8652 Ack=8495 Win=27744 Len=0"
"2016-09-27 04:35:56.816062","95","Application Data"
"2016-09-27 04:36:26.843128","95","Application Data"
"2016-09-27 04:36:27.096620","54","52728  >  443 [ACK] Seq=8734 Ack=8536 Win=27744 Len=0"
"2016-09-27 04:36:56.815665","54","52728  >  443 [ACK] Seq=8734 Ack=8577 Win=27744 Len=0"
"2016-09-27 04:36:56.816187","95","Application Data"
"2016-09-27 04:37:26.841615","95","Application Data"
"2016-09-27 04:37:27.107363","54","52728  >  443 [ACK] Seq=8816 Ack=8618 Win=27744 Len=0"
"2016-09-27 04:37:57.111018","95","Application Data"
"2016-09-27 04:37:57.284923","54","52728  >  443 [ACK] Seq=8857 Ack=8659 Win=27744 Len=0"
"2016-09-27 04:37:57.285039","95","Application Data"
"2016-09-27 04:37:57.533756","54","52728  >  443 [ACK] Seq=8898 Ack=8700 Win=27744 Len=0"
"2016-09-27 04:38:27.525679","95","Application Data"
"2016-09-27 04:38:27.745153","54","52728  >  443 [ACK] Seq=8939 Ack=8741 Win=27744 Len=0"
"2016-09-27 04:38:56.812108","54","52728  >  443 [ACK] Seq=8939 Ack=8782 Win=27744 Len=0"
"2016-09-27 04:38:56.812218","95","Application Data"
"2016-09-27 04:39:26.841533","95","Application Data"
"2016-09-27 04:39:27.107718","54","52728  >  443 [ACK] Seq=9021 Ack=8823 Win=27744 Len=0"
"2016-09-27 04:39:57.100215","95","Application Data"
"2016-09-27 04:39:57.275808","54","52728  >  443 [ACK] Seq=9062 Ack=8864 Win=27744 Len=0"
"2016-09-27 04:39:57.277302","95","Application Data"
"2016-09-27 04:39:57.537303","54","52728  >  443 [ACK] Seq=9103 Ack=8905 Win=27744 Len=0"
"2016-09-27 04:40:27.529134","95","Application Data"
"2016-09-27 04:40:27.740869","54","52728  >  443 [ACK] Seq=9144 Ack=8946 Win=27744 Len=0"
"2016-09-27 04:40:56.815673","54","52728  >  443 [ACK] Seq=9144 Ack=8987 Win=27744 Len=0"
"2016-09-27 04:40:56.815791","95","Application Data"
"2016-09-27 04:41:26.845956","95","Application Data"
"2016-09-27 04:41:27.099500","54","52728  >  443 [ACK] Seq=9226 Ack=9028 Win=27744 Len=0"
"2016-09-27 04:41:56.814766","54","52728  >  443 [ACK] Seq=9226 Ack=9069 Win=27744 Len=0"
"2016-09-27 04:41:56.814883","95","Application Data"
"2016-09-27 04:42:26.838537","95","Application Data"
"2016-09-27 04:42:27.095352","54","52728  >  443 [ACK] Seq=9308 Ack=9110 Win=27744 Len=0"
"2016-09-27 04:42:56.818892","54","52728  >  443 [ACK] Seq=9308 Ack=9151 Win=27744 Len=0"
"2016-09-27 04:42:56.819008","95","Application Data"
"2016-09-27 04:43:26.845557","95","Application Data"
"2016-09-27 04:43:27.091905","54","52728  >  443 [ACK] Seq=9390 Ack=9192 Win=27744 Len=0"
"2016-09-27 04:43:56.818924","54","52728  >  443 [ACK] Seq=9390 Ack=9233 Win=27744 Len=0"
"2016-09-27 04:43:56.819497","95","Application Data"
"2016-09-27 04:44:26.850770","95","Application Data"
"2016-09-27 04:44:27.109970","54","52728  >  443 [ACK] Seq=9472 Ack=9274 Win=27744 Len=0"
"2016-09-27 04:44:56.810497","54","52728  >  443 [ACK] Seq=9472 Ack=9315 Win=27744 Len=0"
"2016-09-27 04:44:56.810602","95","Application Data"
"2016-09-27 04:45:26.841053","95","Application Data"
"2016-09-27 04:45:27.094924","54","52728  >  443 [ACK] Seq=9554 Ack=9356 Win=27744 Len=0"
"2016-09-27 04:45:57.087124","95","Application Data"
"2016-09-27 04:45:57.279022","54","52728  >  443 [ACK] Seq=9595 Ack=9397 Win=27744 Len=0"
"2016-09-27 04:45:57.279150","95","Application Data"
"2016-09-27 04:45:57.528659","54","52728  >  443 [ACK] Seq=9636 Ack=9438 Win=27744 Len=0"
"2016-09-27 04:46:27.517865","95","Application Data"
"2016-09-27 04:46:27.731897","54","52728  >  443 [ACK] Seq=9677 Ack=9479 Win=27744 Len=0"
"2016-09-27 04:46:56.813522","54","52728  >  443 [ACK] Seq=9677 Ack=9520 Win=27744 Len=0"
"2016-09-27 04:46:56.814970","95","Application Data"
"2016-09-27 04:47:26.844758","95","Application Data"
"2016-09-27 04:47:27.102229","54","52728  >  443 [ACK] Seq=9759 Ack=9561 Win=27744 Len=0"
"2016-09-27 04:47:56.817398","54","52728  >  443 [ACK] Seq=9759 Ack=9602 Win=27744 Len=0"
"2016-09-27 04:47:56.817519","95","Application Data"
"2016-09-27 04:48:26.846020","95","Application Data"
"2016-09-27 04:48:27.102011","54","52728  >  443 [ACK] Seq=9841 Ack=9643 Win=27744 Len=0"
"2016-09-27 04:48:57.092733","95","Application Data"
"2016-09-27 04:48:57.278004","54","52728  >  443 [ACK] Seq=9882 Ack=9684 Win=27744 Len=0"
"2016-09-27 04:48:57.278534","95","Application Data"
"2016-09-27 04:48:57.527730","54","52728  >  443 [ACK] Seq=9923 Ack=9725 Win=27744 Len=0"
"2016-09-27 04:49:27.520760","95","Application Data"
"2016-09-27 04:49:28.199764","54","52728  >  443 [ACK] Seq=9964 Ack=9766 Win=27744 Len=0"
"2016-09-27 04:49:57.009409","54","52728  >  443 [ACK] Seq=9964 Ack=9807 Win=27744 Len=0"
"2016-09-27 04:49:57.009522","95","Application Data"
"2016-09-27 04:50:27.038489","95","Application Data"
"2016-09-27 04:50:27.476692","95","[TCP Spurious Retransmission] "
"2016-09-27 04:50:27.753971","54","52728  >  443 [ACK] Seq=10046 Ack=9848 Win=27744 Len=0"
"2016-09-27 04:50:53.622088","222","Application Data"
"2016-09-27 04:50:56.816771","54","52728  >  443 [ACK] Seq=10214 Ack=9889 Win=27744 Len=0"
"2016-09-27 04:50:56.817306","95","Application Data"
"2016-09-27 04:51:26.846484","95","Application Data"
"2016-09-27 04:51:27.285074","95","[TCP Spurious Retransmission] "
"2016-09-27 04:51:27.550612","54","52728  >  443 [ACK] Seq=10296 Ack=9930 Win=27744 Len=0"
"2016-09-27 04:51:56.816470","54","52728  >  443 [ACK] Seq=10296 Ack=9971 Win=27744 Len=0"
"2016-09-27 04:51:56.817023","95","Application Data"
"2016-09-27 04:52:26.844935","95","Application Data"
"2016-09-27 04:52:27.093431","54","52728  >  443 [ACK] Seq=10378 Ack=10012 Win=27744 Len=0"
"2016-09-27 04:52:42.398234","54","52728  >  443 [ACK] Seq=10378 Ack=10213 Win=27744 Len=0"
"2016-09-27 04:52:56.813357","54","52728  >  443 [ACK] Seq=10378 Ack=10254 Win=27744 Len=0"
"2016-09-27 04:52:56.813950","95","Application Data"
"2016-09-27 04:53:26.843572","95","Application Data"
"2016-09-27 04:53:27.284749","95","[TCP Spurious Retransmission] "
"2016-09-27 04:53:27.554134","54","52728  >  443 [ACK] Seq=10460 Ack=10295 Win=27744 Len=0"
"2016-09-27 04:53:56.926203","54","52728  >  443 [ACK] Seq=10460 Ack=10336 Win=27744 Len=0"
"2016-09-27 04:53:56.926320","95","Application Data"
"2016-09-27 04:54:26.954287","95","Application Data"
"2016-09-27 04:54:27.202407","54","52728  >  443 [ACK] Seq=10542 Ack=10377 Win=27744 Len=0"
"2016-09-27 04:54:56.816729","54","52728  >  443 [ACK] Seq=10542 Ack=10418 Win=27744 Len=0"
"2016-09-27 04:54:56.816838","95","Application Data"
"2016-09-27 04:55:26.846184","95","Application Data"
"2016-09-27 04:55:27.542037","54","52728  >  443 [ACK] Seq=10624 Ack=10459 Win=27744 Len=0"
"2016-09-27 04:55:56.813056","54","52728  >  443 [ACK] Seq=10624 Ack=10500 Win=27744 Len=0"
"2016-09-27 04:55:56.813167","95","Application Data"
"2016-09-27 04:56:26.842975","95","Application Data"
"2016-09-27 04:56:27.095077","54","52728  >  443 [ACK] Seq=10706 Ack=10541 Win=27744 Len=0"
"2016-09-27 04:56:56.827229","54","52728  >  443 [ACK] Seq=10706 Ack=10582 Win=27744 Len=0"
"2016-09-27 04:56:56.827749","95","Application Data"
"2016-09-27 04:57:26.854480","95","Application Data"
"2016-09-27 04:57:27.108110","54","52728  >  443 [ACK] Seq=10788 Ack=10623 Win=27744 Len=0"
"2016-09-27 04:57:56.815823","54","52728  >  443 [ACK] Seq=10788 Ack=10664 Win=27744 Len=0"
"2016-09-27 04:57:56.815932","95","Application Data"
"2016-09-27 04:58:26.845828","95","Application Data"
"2016-09-27 04:58:27.115116","54","52728  >  443 [ACK] Seq=10870 Ack=10705 Win=27744 Len=0"
"2016-09-27 04:58:56.819842","54","52728  >  443 [ACK] Seq=10870 Ack=10746 Win=27744 Len=0"
"2016-09-27 04:58:56.819963","95","Application Data"
"2016-09-27 04:59:26.848407","95","Application Data"
"2016-09-27 04:59:27.099911","54","52728  >  443 [ACK] Seq=10952 Ack=10787 Win=27744 Len=0"
"2016-09-27 04:59:56.818753","54","52728  >  443 [ACK] Seq=10952 Ack=10828 Win=27744 Len=0"
"2016-09-27 04:59:56.819301","95","Application Data"
"2016-09-27 05:00:26.848161","95","Application Data"
"2016-09-27 05:00:27.095800","54","52728  >  443 [ACK] Seq=11034 Ack=10869 Win=27744 Len=0"
"2016-09-27 05:00:57.085925","95","Application Data"
"2016-09-27 05:00:57.279332","54","52728  >  443 [ACK] Seq=11075 Ack=10910 Win=27744 Len=0"
"2016-09-27 05:00:57.280064","95","Application Data"
"2016-09-27 05:00:57.531014","54","52728  >  443 [ACK] Seq=11116 Ack=10951 Win=27744 Len=0"
"2016-09-27 05:01:27.516971","95","Application Data"
"2016-09-27 05:01:27.733854","54","52728  >  443 [ACK] Seq=11157 Ack=10992 Win=27744 Len=0"
"2016-09-27 05:01:56.811345","54","52728  >  443 [ACK] Seq=11157 Ack=11033 Win=27744 Len=0"
"2016-09-27 05:01:56.812404","95","Application Data"
"2016-09-27 05:02:26.842910","95","Application Data"
"2016-09-27 05:02:27.095387","54","52728  >  443 [ACK] Seq=11239 Ack=11074 Win=27744 Len=0"
"2016-09-27 05:02:56.815050","54","52728  >  443 [ACK] Seq=11239 Ack=11115 Win=27744 Len=0"
"2016-09-27 05:02:56.815158","95","Application Data"
"2016-09-27 05:03:26.844334","95","Application Data"
"2016-09-27 05:03:27.099041","54","52728  >  443 [ACK] Seq=11321 Ack=11156 Win=27744 Len=0"
"2016-09-27 05:03:30.661474","85","Encrypted Alert"
"2016-09-27 05:03:30.675661","54","52728  >  443 [FIN"
"2016-09-27 05:03:30.869080","54","52728  >  443 [RST] Seq=11352 Win=0 Len=0"
"2016-09-27 05:03:30.884489","54","52728  >  443 [RST] Seq=11353 Win=0 Len=0"
"2016-09-27 14:27:10.522315","74","45689  >  443 [SYN] Seq=0 Win=4380 Len=0 MSS=1460 SACK_PERM=1 TSval=65918294 TSecr=0 WS=16"
"2016-09-27 14:27:10.750071","54","45689  >  443 [ACK] Seq=1 Ack=1 Win=4384 Len=0"
"2016-09-27 14:27:10.870765","371","Client Hello"
"2016-09-27 14:27:11.108408","54","45689  >  443 [ACK] Seq=318 Ack=1461 Win=7312 Len=0"
"2016-09-27 14:27:11.111138","54","45689  >  443 [ACK] Seq=318 Ack=2921 Win=10224 Len=0"
"2016-09-27 14:27:11.111240","54","45689  >  443 [ACK] Seq=318 Ack=3294 Win=13152 Len=0"
"2016-09-27 14:27:11.153191","180","Client Key Exchange"
"2016-09-27 14:27:11.391083","54","45689  >  443 [ACK] Seq=444 Ack=3345 Win=13152 Len=0"
"2016-09-27 14:27:11.442209","1514","45689  >  443 [ACK] Seq=444 Ack=3345 Win=13152 Len=1460 [TCP segment of a reassembled PDU]"
"2016-09-27 14:27:11.448416","432","Application Data"
"2016-09-27 14:27:11.783993","54","45689  >  443 [ACK] Seq=2282 Ack=3690 Win=16064 Len=0"
"2016-09-27 14:27:11.784803","54","45689  >  443 [ACK] Seq=2282 Ack=3888 Win=18992 Len=0"
"2016-09-27 14:27:11.842610","54","45689  >  443 [ACK] Seq=2282 Ack=4057 Win=21904 Len=0"
"2016-09-27 14:27:11.882713","207","Application Data"
"2016-09-27 14:27:11.956556","252","Application Data"
"2016-09-27 14:27:11.960828","274","Application Data"
"2016-09-27 14:27:11.965039","546","Application Data"
"2016-09-27 14:27:11.986170","380","Application Data"
"2016-09-27 14:27:11.988868","191","Application Data"
"2016-09-27 14:27:12.149482","186","Application Data"
"2016-09-27 14:27:12.150139","374","Application Data"
"2016-09-27 14:27:16.389238","54","45689  >  443 [ACK] Seq=4260 Ack=4098 Win=21904 Len=0"
"2016-09-27 14:27:16.389501","95","Application Data"
"2016-09-27 14:27:46.419048","95","Application Data"
"2016-09-27 14:27:46.685799","54","45689  >  443 [ACK] Seq=4342 Ack=4139 Win=21904 Len=0"
"2016-09-27 14:28:16.390050","54","45689  >  443 [ACK] Seq=4342 Ack=4180 Win=21904 Len=0"
"2016-09-27 14:28:16.390167","95","Application Data"
"2016-09-27 14:28:46.417553","95","Application Data"
"2016-09-27 14:28:46.689599","54","45689  >  443 [ACK] Seq=4424 Ack=4221 Win=21904 Len=0"
"2016-09-27 14:29:16.385846","54","45689  >  443 [ACK] Seq=4424 Ack=4262 Win=21904 Len=0"
"2016-09-27 14:29:16.385954","95","Application Data"
"2016-09-27 14:29:30.170108","54","45689  >  443 [ACK] Seq=4465 Ack=4633 Win=24832 Len=0"
"2016-09-27 14:29:30.590125","212","Application Data"
"2016-09-27 14:29:30.819630","54","45689  >  443 [ACK] Seq=4623 Ack=4806 Win=27744 Len=0"
"2016-09-27 14:29:32.580911","200","Application Data"
"2016-09-27 14:29:33.007473","334","Application Data"
"2016-09-27 14:30:03.063830","95","Application Data"
"2016-09-27 14:30:03.287922","54","45689  >  443 [ACK] Seq=5090 Ack=4847 Win=27744 Len=0"
"2016-09-27 14:30:16.389970","54","45689  >  443 [ACK] Seq=5090 Ack=4888 Win=27744 Len=0"
"2016-09-27 14:30:16.390083","95","Application Data"
"2016-09-27 14:30:46.418110","95","Application Data"
"2016-09-27 14:30:46.686721","54","45689  >  443 [ACK] Seq=5172 Ack=4929 Win=27744 Len=0"
"2016-09-27 14:31:16.389922","54","45689  >  443 [ACK] Seq=5172 Ack=4970 Win=27744 Len=0"
"2016-09-27 14:31:16.390033","95","Application Data"
"2016-09-27 14:31:46.421257","95","Application Data"
"2016-09-27 14:31:46.694148","54","45689  >  443 [ACK] Seq=5254 Ack=5011 Win=27744 Len=0"
"2016-09-27 14:32:16.390036","54","45689  >  443 [ACK] Seq=5254 Ack=5052 Win=27744 Len=0"
"2016-09-27 14:32:16.390157","95","Application Data"
"2016-09-27 14:32:46.419625","95","Application Data"
"2016-09-27 14:32:46.690710","54","45689  >  443 [ACK] Seq=5336 Ack=5093 Win=27744 Len=0"
"2016-09-27 14:33:16.390538","54","45689  >  443 [ACK] Seq=5336 Ack=5134 Win=27744 Len=0"
"2016-09-27 14:33:16.390654","95","Application Data"
"2016-09-27 14:33:46.434821","95","Application Data"
"2016-09-27 14:33:46.701150","54","45689  >  443 [ACK] Seq=5418 Ack=5175 Win=27744 Len=0"
"2016-09-27 14:34:16.385665","54","45689  >  443 [ACK] Seq=5418 Ack=5216 Win=27744 Len=0"
"2016-09-27 14:34:16.385777","95","Application Data"
"2016-09-27 14:34:46.415316","95","Application Data"
"2016-09-27 14:34:46.685424","54","45689  >  443 [ACK] Seq=5500 Ack=5257 Win=27744 Len=0"
"2016-09-27 14:35:16.385397","54","45689  >  443 [ACK] Seq=5500 Ack=5298 Win=27744 Len=0"
"2016-09-27 14:35:16.387839","95","Application Data"
"2016-09-27 14:35:46.412484","95","Application Data"
"2016-09-27 14:35:46.686875","54","45689  >  443 [ACK] Seq=5582 Ack=5339 Win=27744 Len=0"
"2016-09-27 14:36:16.384641","54","45689  >  443 [ACK] Seq=5582 Ack=5380 Win=27744 Len=0"
"2016-09-27 14:36:16.384752","95","Application Data"
"2016-09-27 14:36:46.415644","95","Application Data"
"2016-09-27 14:36:46.685362","54","45689  >  443 [ACK] Seq=5664 Ack=5421 Win=27744 Len=0"
"2016-09-27 14:37:16.384547","54","45689  >  443 [ACK] Seq=5664 Ack=5462 Win=27744 Len=0"
"2016-09-27 14:37:16.385087","95","Application Data"
"2016-09-27 14:37:46.417174","95","Application Data"
"2016-09-27 14:37:46.688872","54","45689  >  443 [ACK] Seq=5746 Ack=5503 Win=27744 Len=0"
"2016-09-27 14:38:16.381187","54","45689  >  443 [ACK] Seq=5746 Ack=5544 Win=27744 Len=0"
"2016-09-27 14:38:16.382116","95","Application Data"
"2016-09-27 14:38:46.410124","95","Application Data"
"2016-09-27 14:38:46.681019","54","45689  >  443 [ACK] Seq=5828 Ack=5585 Win=27744 Len=0"
"2016-09-27 14:39:16.388402","54","45689  >  443 [ACK] Seq=5828 Ack=5626 Win=27744 Len=0"
"2016-09-27 14:39:16.388965","95","Application Data"
"2016-09-27 14:39:46.414877","95","Application Data"
"2016-09-27 14:39:46.684882","54","45689  >  443 [ACK] Seq=5910 Ack=5667 Win=27744 Len=0"
"2016-09-27 14:40:16.389168","54","45689  >  443 [ACK] Seq=5910 Ack=5708 Win=27744 Len=0"
"2016-09-27 14:40:16.389280","95","Application Data"
"2016-09-27 14:40:46.426227","95","Application Data"
"2016-09-27 14:40:46.696489","54","45689  >  443 [ACK] Seq=5992 Ack=5749 Win=27744 Len=0"
"2016-09-27 14:41:16.380391","54","45689  >  443 [ACK] Seq=5992 Ack=5790 Win=27744 Len=0"
"2016-09-27 14:41:16.380898","95","Application Data"
"2016-09-27 14:41:46.404780","95","Application Data"
"2016-09-27 14:41:46.684755","54","45689  >  443 [ACK] Seq=6074 Ack=5831 Win=27744 Len=0"
"2016-09-27 14:42:16.387941","54","45689  >  443 [ACK] Seq=6074 Ack=5872 Win=27744 Len=0"
"2016-09-27 14:42:16.388691","95","Application Data"
"2016-09-27 14:42:46.419314","95","Application Data"
"2016-09-27 14:42:46.688576","54","45689  >  443 [ACK] Seq=6156 Ack=5913 Win=27744 Len=0"
"2016-09-27 14:43:16.381064","54","45689  >  443 [ACK] Seq=6156 Ack=5954 Win=27744 Len=0"
"2016-09-27 14:43:16.381172","95","Application Data"
"2016-09-27 14:43:46.410947","95","Application Data"
"2016-09-27 14:43:46.676875","54","45689  >  443 [ACK] Seq=6238 Ack=5995 Win=27744 Len=0"
"2016-09-27 14:44:16.388164","54","45689  >  443 [ACK] Seq=6238 Ack=6036 Win=27744 Len=0"
"2016-09-27 14:44:16.388709","95","Application Data"
"2016-09-27 14:44:46.412725","95","Application Data"
"2016-09-27 14:44:46.875989","95","[TCP Spurious Retransmission] "
"2016-09-27 14:44:47.153367","54","45689  >  443 [ACK] Seq=6320 Ack=6077 Win=27744 Len=0"
"2016-09-27 14:45:17.147139","95","Application Data"
"2016-09-27 14:45:17.347691","54","45689  >  443 [ACK] Seq=6361 Ack=6118 Win=27744 Len=0"
"2016-09-27 14:45:17.347810","95","Application Data"
"2016-09-27 14:45:17.618118","54","45689  >  443 [ACK] Seq=6402 Ack=6159 Win=27744 Len=0"
"2016-09-27 14:45:47.607793","95","Application Data"
"2016-09-27 14:45:47.837268","54","45689  >  443 [ACK] Seq=6443 Ack=6200 Win=27744 Len=0"
"2016-09-27 14:46:16.387928","54","45689  >  443 [ACK] Seq=6443 Ack=6241 Win=27744 Len=0"
"2016-09-27 14:46:16.388508","95","Application Data"
"2016-09-27 14:46:46.415413","95","Application Data"
"2016-09-27 14:46:46.688323","54","45689  >  443 [ACK] Seq=6525 Ack=6282 Win=27744 Len=0"
"2016-09-27 14:47:16.387817","54","45689  >  443 [ACK] Seq=6525 Ack=6323 Win=27744 Len=0"
"2016-09-27 14:47:16.388362","95","Application Data"
"2016-09-27 14:47:46.415270","95","Application Data"
"2016-09-27 14:47:46.879752","95","[TCP Spurious Retransmission] "
"2016-09-27 14:47:47.193020","54","45689  >  443 [ACK] Seq=6607 Ack=6364 Win=27744 Len=0"
"2016-09-27 14:48:16.379943","54","45689  >  443 [ACK] Seq=6607 Ack=6405 Win=27744 Len=0"
"2016-09-27 14:48:16.380483","95","Application Data"
"2016-09-27 14:48:46.409266","95","Application Data"
"2016-09-27 14:48:46.688271","54","45689  >  443 [ACK] Seq=6689 Ack=6446 Win=27744 Len=0"
"2016-09-27 14:49:16.381253","54","45689  >  443 [ACK] Seq=6689 Ack=6487 Win=27744 Len=0"
"2016-09-27 14:49:16.381361","95","Application Data"
"2016-09-27 14:49:46.411500","95","Application Data"
"2016-09-27 14:49:46.684259","54","45689  >  443 [ACK] Seq=6771 Ack=6528 Win=27744 Len=0"
"2016-09-27 14:50:16.387886","54","45689  >  443 [ACK] Seq=6771 Ack=6569 Win=27744 Len=0"
"2016-09-27 14:50:16.388463","95","Application Data"
"2016-09-27 14:50:46.420219","95","Application Data"
"2016-09-27 14:50:46.692028","54","45689  >  443 [ACK] Seq=6853 Ack=6610 Win=27744 Len=0"
"2016-09-27 14:50:53.629496","220","Application Data"
"2016-09-27 14:51:16.384343","54","45689  >  443 [ACK] Seq=7019 Ack=6651 Win=27744 Len=0"
"2016-09-27 14:51:16.384450","95","Application Data"
"2016-09-27 14:51:46.409127","95","Application Data"
"2016-09-27 14:51:46.680376","54","45689  >  443 [ACK] Seq=7101 Ack=6692 Win=27744 Len=0"
"2016-09-27 14:52:16.387499","54","45689  >  443 [ACK] Seq=7101 Ack=6733 Win=27744 Len=0"
"2016-09-27 14:52:16.388060","95","Application Data"
"2016-09-27 14:52:46.417025","95","Application Data"
"2016-09-27 14:52:46.680220","54","45689  >  443 [ACK] Seq=7183 Ack=6774 Win=27744 Len=0"
"2016-09-27 14:53:16.381088","54","45689  >  443 [ACK] Seq=7183 Ack=6815 Win=27744 Len=0"
"2016-09-27 14:53:16.381194","95","Application Data"
"2016-09-27 14:53:46.405484","95","Application Data"
"2016-09-27 14:53:46.677274","54","45689  >  443 [ACK] Seq=7265 Ack=6856 Win=27744 Len=0"
"2016-09-27 14:54:16.391465","54","45689  >  443 [ACK] Seq=7265 Ack=6897 Win=27744 Len=0"
"2016-09-27 14:54:16.392142","95","Application Data"
"2016-09-27 14:54:46.431543","95","Application Data"
"2016-09-27 14:54:46.695674","54","45689  >  443 [ACK] Seq=7347 Ack=6938 Win=27744 Len=0"
"2016-09-27 14:55:16.689378","95","Application Data"
"2016-09-27 14:55:16.883532","54","45689  >  443 [ACK] Seq=7388 Ack=6979 Win=27744 Len=0"
"2016-09-27 14:55:16.883982","95","Application Data"
"2016-09-27 14:55:17.150217","54","45689  >  443 [ACK] Seq=7429 Ack=7020 Win=27744 Len=0"
"2016-09-27 14:55:47.141376","95","Application Data"
"2016-09-27 14:55:47.368969","54","45689  >  443 [ACK] Seq=7470 Ack=7061 Win=27744 Len=0"
"2016-09-27 14:56:16.383343","54","45689  >  443 [ACK] Seq=7470 Ack=7102 Win=27744 Len=0"
"2016-09-27 14:56:16.383926","95","Application Data"
"2016-09-27 14:56:46.412006","95","Application Data"
"2016-09-27 14:56:47.160393","54","45689  >  443 [ACK] Seq=7552 Ack=7143 Win=27744 Len=0"
"2016-09-27 14:57:16.387949","54","45689  >  443 [ACK] Seq=7552 Ack=7184 Win=27744 Len=0"
"2016-09-27 14:57:16.388054","95","Application Data"
"2016-09-27 14:57:46.417303","95","Application Data"
"2016-09-27 14:57:46.687844","54","45689  >  443 [ACK] Seq=7634 Ack=7225 Win=27744 Len=0"
"2016-09-27 14:58:16.387966","54","45689  >  443 [ACK] Seq=7634 Ack=7266 Win=27744 Len=0"
"2016-09-27 14:58:16.388085","95","Application Data"
"2016-09-27 14:58:46.417381","95","Application Data"
"2016-09-27 14:58:46.683694","54","45689  >  443 [ACK] Seq=7716 Ack=7307 Win=27744 Len=0"
"2016-09-27 14:59:16.673981","95","Application Data"
"2016-09-27 14:59:16.855900","54","45689  >  443 [ACK] Seq=7757 Ack=7348 Win=27744 Len=0"
"2016-09-27 14:59:16.856452","95","Application Data"
"2016-09-27 14:59:17.128950","54","45689  >  443 [ACK] Seq=7798 Ack=7389 Win=27744 Len=0"
"2016-09-27 14:59:47.121429","95","Application Data"
"2016-09-27 14:59:47.348121","54","45689  >  443 [ACK] Seq=7839 Ack=7430 Win=27744 Len=0"
"2016-09-27 15:00:16.383732","54","45689  >  443 [ACK] Seq=7839 Ack=7471 Win=27744 Len=0"
"2016-09-27 15:00:16.384632","95","Application Data"
"2016-09-27 15:00:46.411698","95","Application Data"
"2016-09-27 15:00:46.679625","54","45689  >  443 [ACK] Seq=7921 Ack=7512 Win=27744 Len=0"
"2016-09-27 15:01:16.672011","95","Application Data"
"2016-09-27 15:01:16.851729","54","45689  >  443 [ACK] Seq=7962 Ack=7553 Win=27744 Len=0"
"2016-09-27 15:01:16.853235","95","Application Data"
"2016-09-27 15:01:17.124882","54","45689  >  443 [ACK] Seq=8003 Ack=7594 Win=27744 Len=0"
"2016-09-27 15:01:47.117113","95","Application Data"
"2016-09-27 15:01:47.352130","54","45689  >  443 [ACK] Seq=8044 Ack=7635 Win=27744 Len=0"
"2016-09-27 15:02:16.386932","54","45689  >  443 [ACK] Seq=8044 Ack=7676 Win=27744 Len=0"
"2016-09-27 15:02:16.387400","95","Application Data"
"2016-09-27 15:02:46.416973","95","Application Data"
"2016-09-27 15:02:46.695194","54","45689  >  443 [ACK] Seq=8126 Ack=7717 Win=27744 Len=0"
"2016-09-27 15:03:16.384885","54","45689  >  443 [ACK] Seq=8126 Ack=7758 Win=27744 Len=0"
"2016-09-27 15:03:16.385000","95","Application Data"
"2016-09-27 15:03:46.408651","95","Application Data"
"2016-09-27 15:03:46.679475","54","45689  >  443 [ACK] Seq=8208 Ack=7799 Win=27744 Len=0"
"2016-09-27 15:04:16.375889","54","45689  >  443 [ACK] Seq=8208 Ack=7840 Win=27744 Len=0"
"2016-09-27 15:04:16.375997","95","Application Data"
"2016-09-27 15:04:46.404529","95","Application Data"
"2016-09-27 15:04:46.659892","54","45689  >  443 [ACK] Seq=8290 Ack=7881 Win=27744 Len=0"
"2016-09-27 15:05:16.379655","54","45689  >  443 [ACK] Seq=8290 Ack=7922 Win=27744 Len=0"
"2016-09-27 15:05:16.379768","95","Application Data"
"2016-09-27 15:05:46.407935","95","Application Data"
"2016-09-27 15:05:46.667619","54","45689  >  443 [ACK] Seq=8372 Ack=7963 Win=27744 Len=0"
"2016-09-27 15:06:16.660149","95","Application Data"
"2016-09-27 15:06:16.851568","54","45689  >  443 [ACK] Seq=8413 Ack=8004 Win=27744 Len=0"
"2016-09-27 15:06:16.851683","95","Application Data"
"2016-09-27 15:06:17.112934","54","45689  >  443 [ACK] Seq=8454 Ack=8045 Win=27744 Len=0"
"2016-09-27 15:06:47.101466","95","Application Data"
"2016-09-27 15:06:47.329928","54","45689  >  443 [ACK] Seq=8495 Ack=8086 Win=27744 Len=0"
"2016-09-27 15:07:16.382598","54","45689  >  443 [ACK] Seq=8495 Ack=8127 Win=27744 Len=0"
"2016-09-27 15:07:16.384081","95","Application Data"
"2016-09-27 15:07:46.415015","95","Application Data"
"2016-09-27 15:07:46.679372","54","45689  >  443 [ACK] Seq=8577 Ack=8168 Win=27744 Len=0"
"2016-09-27 15:08:16.374823","54","45689  >  443 [ACK] Seq=8577 Ack=8209 Win=27744 Len=0"
"2016-09-27 15:08:16.375377","95","Application Data"
"2016-09-27 15:08:46.404257","95","Application Data"
"2016-09-27 15:08:46.667385","54","45689  >  443 [ACK] Seq=8659 Ack=8250 Win=27744 Len=0"
"2016-09-27 15:09:16.382500","54","45689  >  443 [ACK] Seq=8659 Ack=8291 Win=27744 Len=0"
"2016-09-27 15:09:16.384333","95","Application Data"
"2016-09-27 15:09:46.413865","95","Application Data"
"2016-09-27 15:09:46.698590","54","45689  >  443 [ACK] Seq=8741 Ack=8332 Win=27744 Len=0"
"2016-09-27 15:10:16.378839","54","45689  >  443 [ACK] Seq=8741 Ack=8373 Win=27744 Len=0"
"2016-09-27 15:10:16.379377","95","Application Data"
"2016-09-27 15:10:46.408284","95","Application Data"
"2016-09-27 15:10:46.675004","54","45689  >  443 [ACK] Seq=8823 Ack=8414 Win=27744 Len=0"
"2016-09-27 15:11:16.374788","54","45689  >  443 [ACK] Seq=8823 Ack=8455 Win=27744 Len=0"
"2016-09-27 15:11:16.375330","95","Application Data"
"2016-09-27 15:11:46.405773","95","Application Data"
"2016-09-27 15:11:46.663236","54","45689  >  443 [ACK] Seq=8905 Ack=8496 Win=27744 Len=0"
"2016-09-27 15:12:16.374431","54","45689  >  443 [ACK] Seq=8905 Ack=8537 Win=27744 Len=0"
"2016-09-27 15:12:16.375813","95","Application Data"
"2016-09-27 15:12:46.403034","95","Application Data"
"2016-09-27 15:12:46.663196","54","45689  >  443 [ACK] Seq=8987 Ack=8578 Win=27744 Len=0"
"2016-09-27 15:13:16.378999","54","45689  >  443 [ACK] Seq=8987 Ack=8619 Win=27744 Len=0"
"2016-09-27 15:13:16.379141","95","Application Data"
"2016-09-27 15:13:46.405701","95","Application Data"
"2016-09-27 15:13:46.670887","54","45689  >  443 [ACK] Seq=9069 Ack=8660 Win=27744 Len=0"
"2016-09-27 15:14:16.662601","95","Application Data"
"2016-09-27 15:14:16.863149","54","45689  >  443 [ACK] Seq=9110 Ack=8701 Win=27744 Len=0"
"2016-09-27 15:14:16.863279","95","Application Data"
"2016-09-27 15:14:17.124068","54","45689  >  443 [ACK] Seq=9151 Ack=8742 Win=27744 Len=0"
"2016-09-27 15:14:47.117594","95","Application Data"
"2016-09-27 15:14:47.343379","54","45689  >  443 [ACK] Seq=9192 Ack=8783 Win=27744 Len=0"
"2016-09-27 15:15:16.378965","54","45689  >  443 [ACK] Seq=9192 Ack=8824 Win=27744 Len=0"
"2016-09-27 15:15:16.379074","95","Application Data"
"2016-09-27 15:15:46.405681","95","Application Data"
"2016-09-27 15:15:46.672469","54","45689  >  443 [ACK] Seq=9274 Ack=8865 Win=27744 Len=0"
"2016-09-27 15:16:16.382765","54","45689  >  443 [ACK] Seq=9274 Ack=8906 Win=27744 Len=0"
"2016-09-27 15:16:16.382875","95","Application Data"
"2016-09-27 15:16:46.413842","95","Application Data"
"2016-09-27 15:16:46.694166","54","45689  >  443 [ACK] Seq=9356 Ack=8947 Win=27744 Len=0"
"2016-09-27 15:17:16.374827","54","45689  >  443 [ACK] Seq=9356 Ack=8988 Win=27744 Len=0"
"2016-09-27 15:17:16.374932","95","Application Data"
"2016-09-27 15:17:46.403026","95","Application Data"
"2016-09-27 15:17:46.662879","54","45689  >  443 [ACK] Seq=9438 Ack=9029 Win=27744 Len=0"
"2016-09-27 15:18:16.651453","95","Application Data"
"2016-09-27 15:18:16.854518","54","45689  >  443 [ACK] Seq=9479 Ack=9070 Win=27744 Len=0"
"2016-09-27 15:18:16.855023","95","Application Data"
"2016-09-27 15:18:17.115936","54","45689  >  443 [ACK] Seq=9520 Ack=9111 Win=27744 Len=0"
"2016-09-27 15:18:47.101630","95","Application Data"
"2016-09-27 15:18:47.319870","54","45689  >  443 [ACK] Seq=9561 Ack=9152 Win=27744 Len=0"
"2016-09-27 15:19:16.382618","54","45689  >  443 [ACK] Seq=9561 Ack=9193 Win=27744 Len=0"
"2016-09-27 15:19:16.382735","95","Application Data"
"2016-09-27 15:19:46.409199","95","Application Data"
"2016-09-27 15:19:46.674518","54","45689  >  443 [ACK] Seq=9643 Ack=9234 Win=27744 Len=0"
"2016-09-27 15:20:16.382562","54","45689  >  443 [ACK] Seq=9643 Ack=9275 Win=27744 Len=0"
"2016-09-27 15:20:16.382678","95","Application Data"
"2016-09-27 15:20:46.410158","95","Application Data"
"2016-09-27 15:20:46.678244","54","45689  >  443 [ACK] Seq=9725 Ack=9316 Win=27744 Len=0"
"2016-09-27 15:21:16.374780","54","45689  >  443 [ACK] Seq=9725 Ack=9357 Win=27744 Len=0"
"2016-09-27 15:21:16.374894","95","Application Data"
"2016-09-27 15:21:46.404895","95","Application Data"
"2016-09-27 15:21:46.857830","95","[TCP Spurious Retransmission] "
"2016-09-27 15:21:47.131136","54","45689  >  443 [ACK] Seq=9807 Ack=9398 Win=27744 Len=0"
"2016-09-27 15:22:16.381279","54","45689  >  443 [ACK] Seq=9807 Ack=9439 Win=27744 Len=0"
"2016-09-27 15:22:16.381388","95","Application Data"
"2016-09-27 15:22:46.403802","95","Application Data"
"2016-09-27 15:22:46.857781","95","[TCP Spurious Retransmission] "
"2016-09-27 15:22:47.155555","54","45689  >  443 [ACK] Seq=9889 Ack=9480 Win=27744 Len=0"
"2016-09-27 15:23:16.378710","54","45689  >  443 [ACK] Seq=9889 Ack=9521 Win=27744 Len=0"
"2016-09-27 15:23:16.378819","95","Application Data"
"2016-09-27 15:23:46.405822","95","Application Data"
"2016-09-27 15:23:46.866219","95","[TCP Spurious Retransmission] "
"2016-09-27 15:23:47.127201","54","45689  >  443 [ACK] Seq=9971 Ack=9562 Win=27744 Len=0"
"2016-09-27 15:24:16.373563","54","45689  >  443 [ACK] Seq=9971 Ack=9603 Win=27744 Len=0"
"2016-09-27 15:24:16.375039","95","Application Data"
"2016-09-27 15:24:46.405321","95","Application Data"
"2016-09-27 15:24:46.662313","54","45689  >  443 [ACK] Seq=10053 Ack=9644 Win=27744 Len=0"
"2016-09-27 15:25:16.374570","54","45689  >  443 [ACK] Seq=10053 Ack=9685 Win=27744 Len=0"
"2016-09-27 15:25:16.374681","95","Application Data"
"2016-09-27 15:25:46.403555","95","Application Data"
"2016-09-27 15:25:46.857601","95","[TCP Spurious Retransmission] "
"2016-09-27 15:25:47.127102","54","45689  >  443 [ACK] Seq=10135 Ack=9726 Win=27744 Len=0"
"2016-09-27 15:26:16.373384","54","45689  >  443 [ACK] Seq=10135 Ack=9767 Win=27744 Len=0"
"2016-09-27 15:26:16.373947","95","Application Data"
"2016-09-27 15:26:46.403619","95","Application Data"
"2016-09-27 15:26:46.861447","95","[TCP Spurious Retransmission] "
"2016-09-27 15:26:47.123105","54","45689  >  443 [ACK] Seq=10217 Ack=9808 Win=27744 Len=0"
"2016-09-27 15:27:16.381141","54","45689  >  443 [ACK] Seq=10217 Ack=9849 Win=27744 Len=0"
"2016-09-27 15:27:16.381682","95","Application Data"
"2016-09-27 15:27:46.410401","95","Application Data"
"2016-09-27 15:27:46.872940","95","[TCP Spurious Retransmission] "
"2016-09-27 15:27:47.130230","54","45689  >  443 [ACK] Seq=10299 Ack=9890 Win=27744 Len=0"
"2016-09-27 15:28:17.123253","95","Application Data"
"2016-09-27 15:28:17.307050","54","45689  >  443 [ACK] Seq=10340 Ack=9931 Win=27744 Len=0"
"2016-09-27 15:28:17.307552","95","Application Data"
"2016-09-27 15:28:17.568381","54","45689  >  443 [ACK] Seq=10381 Ack=9972 Win=27744 Len=0"
"2016-09-27 15:28:47.555434","95","Application Data"
"2016-09-27 15:28:47.776150","54","45689  >  443 [ACK] Seq=10422 Ack=10013 Win=27744 Len=0"
"2016-09-27 15:29:16.374473","54","45689  >  443 [ACK] Seq=10422 Ack=10054 Win=27744 Len=0"
"2016-09-27 15:29:16.374586","95","Application Data"
"2016-09-27 15:29:33.466754","54","45689  >  443 [ACK] Seq=10463 Ack=10255 Win=27744 Len=0"
"2016-09-27 15:30:03.459183","95","Application Data"
"2016-09-27 15:30:03.682126","54","45689  >  443 [ACK] Seq=10504 Ack=10296 Win=27744 Len=0"
"2016-09-27 15:30:16.374374","54","45689  >  443 [ACK] Seq=10504 Ack=10337 Win=27744 Len=0"
"2016-09-27 15:30:16.374480","95","Application Data"
"2016-09-27 15:30:46.403999","95","Application Data"
"2016-09-27 15:30:46.666295","54","45689  >  443 [ACK] Seq=10586 Ack=10378 Win=27744 Len=0"
"2016-09-27 15:31:16.657555","95","Application Data"
"2016-09-27 15:31:16.840653","54","45689  >  443 [ACK] Seq=10627 Ack=10419 Win=27744 Len=0"
"2016-09-27 15:31:16.840769","95","Application Data"
"2016-09-27 15:31:17.099911","54","45689  >  443 [ACK] Seq=10668 Ack=10460 Win=27744 Len=0"
"2016-09-27 15:31:47.088479","95","Application Data"
"2016-09-27 15:31:47.775902","54","45689  >  443 [ACK] Seq=10709 Ack=10501 Win=27744 Len=0"
"2016-09-27 15:32:16.385946","54","45689  >  443 [ACK] Seq=10709 Ack=10542 Win=27744 Len=0"
"2016-09-27 15:32:16.386065","95","Application Data"
"2016-09-27 15:32:46.415446","95","Application Data"
"2016-09-27 15:32:46.865522","95","[TCP Spurious Retransmission] "
"2016-09-27 15:32:47.134953","54","45689  >  443 [ACK] Seq=10791 Ack=10583 Win=27744 Len=0"
"2016-09-27 15:33:16.379647","54","45689  >  443 [ACK] Seq=10791 Ack=10624 Win=27744 Len=0"
"2016-09-27 15:33:16.379753","95","Application Data"
"2016-09-27 15:33:46.404654","95","Application Data"
"2016-09-27 15:33:46.671343","54","45689  >  443 [ACK] Seq=10873 Ack=10665 Win=27744 Len=0"
"2016-09-27 15:34:16.381924","54","45689  >  443 [ACK] Seq=10873 Ack=10706 Win=27744 Len=0"
"2016-09-27 15:34:16.382033","95","Application Data"
"2016-09-27 15:34:46.409737","95","Application Data"
"2016-09-27 15:34:46.665934","54","45689  >  443 [ACK] Seq=10955 Ack=10747 Win=27744 Len=0"
"2016-09-27 15:35:16.381889","54","45689  >  443 [ACK] Seq=10955 Ack=10788 Win=27744 Len=0"
"2016-09-27 15:35:16.382010","95","Application Data"
"2016-09-27 15:35:46.412839","95","Application Data"
"2016-09-27 15:35:46.865170","95","[TCP Spurious Retransmission] "
"2016-09-27 15:35:47.140864","54","45689  >  443 [ACK] Seq=11037 Ack=10829 Win=27744 Len=0"
"2016-09-27 15:36:17.130110","95","Application Data"
"2016-09-27 15:36:17.314579","54","45689  >  443 [ACK] Seq=11078 Ack=10870 Win=27744 Len=0"
"2016-09-27 15:36:17.316091","95","Application Data"
"2016-09-27 15:36:17.575975","54","45689  >  443 [ACK] Seq=11119 Ack=10911 Win=27744 Len=0"
"2016-09-27 15:36:32.232374","85","Encrypted Alert"
"2016-09-27 15:36:32.251203","54","45689  >  443 [FIN"
"2016-09-27 15:36:32.467176","54","45689  >  443 [RST] Seq=11150 Win=0 Len=0"
"2016-09-27 15:36:32.470821","54","45689  >  443 [RST] Seq=11151 Win=0 Len=0"
