"2016-09-26 23:50:51.017067","74","60205  >  443 [SYN] Seq=0 Win=4380 Len=0 MSS=1460 SACK_PERM=1 TSval=52457940 TSecr=0 WS=16"
"2016-09-26 23:50:51.231240","54","60205  >  443 [ACK] Seq=1 Ack=1 Win=4384 Len=0"
"2016-09-26 23:50:51.363366","571","Client Hello"
"2016-09-26 23:50:51.580393","54","60205  >  443 [ACK] Seq=518 Ack=1461 Win=7312 Len=0"
"2016-09-26 23:50:51.580508","54","60205  >  443 [ACK] Seq=518 Ack=2921 Win=10224 Len=0"
"2016-09-26 23:50:51.580967","54","60205  >  443 [ACK] Seq=518 Ack=2976 Win=10224 Len=0"
"2016-09-26 23:50:51.593770","380","Client Key Exchange"
"2016-09-26 23:50:51.782250","54","[TCP Dup ACK 16042#1] 60205  >  443 [ACK] Seq=844 Ack=2976 Win=10224 Len=0"
"2016-09-26 23:50:51.785977","54","[TCP Dup ACK 16042#2] 60205  >  443 [ACK] Seq=844 Ack=2976 Win=10224 Len=0"
"2016-09-26 23:50:51.813708","54","60205  >  443 [ACK] Seq=844 Ack=2982 Win=10224 Len=0"
"2016-09-26 23:50:51.816594","54","60205  >  443 [ACK] Seq=844 Ack=3035 Win=10224 Len=0"
"2016-09-26 23:50:51.816690","1514","Application Data"
"2016-09-26 23:50:51.817122","396","Application Data"
"2016-09-26 23:50:52.024522","368","Application Data"
"2016-09-26 23:50:52.286309","54","60205  >  443 [ACK] Seq=2960 Ack=3200 Win=13152 Len=0"
"2016-09-26 23:50:53.348687","54","60205  >  443 [ACK] Seq=2960 Ack=3237 Win=13152 Len=0"
"2016-09-26 23:50:53.387373","54","60205  >  443 [ACK] Seq=2960 Ack=3238 Win=13152 Len=0"
"2016-09-27 00:35:50.997787","74","57408  >  443 [SYN] Seq=0 Win=4380 Len=0 MSS=1460 SACK_PERM=1 TSval=53149137 TSecr=0 WS=16"
"2016-09-27 00:35:51.208221","54","57408  >  443 [ACK] Seq=1 Ack=1 Win=4384 Len=0"
"2016-09-27 00:35:51.345609","571","Client Hello"
"2016-09-27 00:35:51.560199","54","57408  >  443 [ACK] Seq=518 Ack=1461 Win=7312 Len=0"
"2016-09-27 00:35:51.561760","54","57408  >  443 [ACK] Seq=518 Ack=2921 Win=10224 Len=0"
"2016-09-27 00:35:51.561849","54","57408  >  443 [ACK] Seq=518 Ack=2976 Win=10224 Len=0"
"2016-09-27 00:35:51.589241","380","Client Key Exchange"
"2016-09-27 00:35:51.806526","54","57408  >  443 [ACK] Seq=844 Ack=3035 Win=10224 Len=0"
"2016-09-27 00:35:51.814554","1514","Application Data"
"2016-09-27 00:35:51.814656","396","Application Data"
"2016-09-27 00:35:52.028490","368","Application Data"
"2016-09-27 00:35:52.290911","54","57408  >  443 [ACK] Seq=2960 Ack=3200 Win=13152 Len=0"
"2016-09-27 00:35:53.552135","54","57408  >  443 [ACK] Seq=2960 Ack=3237 Win=13152 Len=0"
"2016-09-27 00:35:53.590607","54","57408  >  443 [ACK] Seq=2960 Ack=3238 Win=13152 Len=0"
"2016-09-27 01:05:50.997887","74","46699  >  443 [SYN] Seq=0 Win=4380 Len=0 MSS=1460 SACK_PERM=1 TSval=53609936 TSecr=0 WS=16"
"2016-09-27 01:05:51.208441","54","46699  >  443 [ACK] Seq=1 Ack=1 Win=4384 Len=0"
"2016-09-27 01:05:51.348887","571","Client Hello"
"2016-09-27 01:05:51.560454","54","46699  >  443 [ACK] Seq=518 Ack=1461 Win=7312 Len=0"
"2016-09-27 01:05:51.562690","54","46699  >  443 [ACK] Seq=518 Ack=2921 Win=10224 Len=0"
"2016-09-27 01:05:51.563192","54","46699  >  443 [ACK] Seq=518 Ack=2976 Win=10224 Len=0"
"2016-09-27 01:05:51.574926","380","Client Key Exchange"
"2016-09-27 01:05:51.795185","54","46699  >  443 [ACK] Seq=844 Ack=3035 Win=10224 Len=0"
"2016-09-27 01:05:51.804559","1514","Application Data"
"2016-09-27 01:05:51.804661","396","Application Data"
"2016-09-27 01:05:52.017060","368","Application Data"
"2016-09-27 01:05:52.290984","54","46699  >  443 [ACK] Seq=2960 Ack=3200 Win=13152 Len=0"
"2016-09-27 01:05:53.353774","54","46699  >  443 [ACK] Seq=2960 Ack=3237 Win=13152 Len=0"
"2016-09-27 01:05:53.391725","54","46699  >  443 [ACK] Seq=2960 Ack=3238 Win=13152 Len=0"
"2016-09-27 01:20:51.061687","74","50670  >  443 [SYN] Seq=0 Win=4380 Len=0 MSS=1460 SACK_PERM=1 TSval=53840353 TSecr=0 WS=16"
"2016-09-27 01:20:51.284249","54","50670  >  443 [ACK] Seq=1 Ack=1 Win=4384 Len=0"
"2016-09-27 01:20:51.421867","571","Client Hello"
"2016-09-27 01:20:51.635883","54","50670  >  443 [ACK] Seq=518 Ack=1461 Win=7312 Len=0"
"2016-09-27 01:20:51.637468","54","50670  >  443 [ACK] Seq=518 Ack=2921 Win=10224 Len=0"
"2016-09-27 01:20:51.637556","54","50670  >  443 [ACK] Seq=518 Ack=2976 Win=10224 Len=0"
"2016-09-27 01:20:51.658775","380","Client Key Exchange"
"2016-09-27 01:20:51.884634","54","50670  >  443 [ACK] Seq=844 Ack=3035 Win=10224 Len=0"
"2016-09-27 01:20:51.884760","1514","Application Data"
"2016-09-27 01:20:51.884830","396","Application Data"
"2016-09-27 01:20:52.105080","368","Application Data"
"2016-09-27 01:20:52.366312","54","50670  >  443 [ACK] Seq=2960 Ack=3200 Win=13152 Len=0"
"2016-09-27 01:20:53.440212","54","50670  >  443 [ACK] Seq=2960 Ack=3237 Win=13152 Len=0"
"2016-09-27 01:20:53.479603","54","50670  >  443 [ACK] Seq=2960 Ack=3238 Win=13152 Len=0"
"2016-09-27 01:35:51.008975","74","43106  >  443 [SYN] Seq=0 Win=4380 Len=0 MSS=1460 SACK_PERM=1 TSval=54070740 TSecr=0 WS=16"
"2016-09-27 01:35:51.230376","54","43106  >  443 [ACK] Seq=1 Ack=1 Win=4384 Len=0"
"2016-09-27 01:35:51.377852","571","Client Hello"
"2016-09-27 01:35:51.605824","54","43106  >  443 [ACK] Seq=518 Ack=1461 Win=7312 Len=0"
"2016-09-27 01:35:51.605941","54","43106  >  443 [ACK] Seq=518 Ack=2921 Win=10224 Len=0"
"2016-09-27 01:35:51.606342","54","43106  >  443 [ACK] Seq=518 Ack=2976 Win=10224 Len=0"
"2016-09-27 01:35:51.621022","380","Client Key Exchange"
"2016-09-27 01:35:51.852251","54","43106  >  443 [ACK] Seq=844 Ack=3035 Win=10224 Len=0"
"2016-09-27 01:35:51.854619","1514","Application Data"
"2016-09-27 01:35:51.854714","396","Application Data"
"2016-09-27 01:35:52.081933","368","Application Data"
"2016-09-27 01:35:52.371619","54","43106  >  443 [ACK] Seq=2960 Ack=3200 Win=13152 Len=0"
"2016-09-27 01:35:53.558724","54","43106  >  443 [ACK] Seq=2960 Ack=3237 Win=13152 Len=0"
"2016-09-27 01:35:53.597178","54","43106  >  443 [ACK] Seq=2960 Ack=3238 Win=13152 Len=0"
"2016-09-27 02:05:51.129851","74","40624  >  443 [SYN] Seq=0 Win=4380 Len=0 MSS=1460 SACK_PERM=1 TSval=54531571 TSecr=0 WS=16"
"2016-09-27 02:05:51.352034","54","40624  >  443 [ACK] Seq=1 Ack=1 Win=4384 Len=0"
"2016-09-27 02:05:51.476735","571","Client Hello"
"2016-09-27 02:05:51.704088","54","40624  >  443 [ACK] Seq=518 Ack=1461 Win=7312 Len=0"
"2016-09-27 02:05:51.704191","54","40624  >  443 [ACK] Seq=518 Ack=2921 Win=10224 Len=0"
"2016-09-27 02:05:51.704639","54","40624  >  443 [ACK] Seq=518 Ack=2976 Win=10224 Len=0"
"2016-09-27 02:05:51.725420","380","Client Key Exchange"
"2016-09-27 02:05:51.958906","54","40624  >  443 [ACK] Seq=844 Ack=3035 Win=10224 Len=0"
"2016-09-27 02:05:51.963013","1514","Application Data"
"2016-09-27 02:05:51.963284","396","Application Data"
"2016-09-27 02:05:52.192064","368","Application Data"
"2016-09-27 02:05:52.468821","54","40624  >  443 [ACK] Seq=2960 Ack=3200 Win=13152 Len=0"
"2016-09-27 02:05:53.539541","54","40624  >  443 [ACK] Seq=2960 Ack=3237 Win=13152 Len=0"
"2016-09-27 02:05:53.578286","54","40624  >  443 [ACK] Seq=2960 Ack=3238 Win=13152 Len=0"
"2016-09-27 02:20:50.838910","91","Encrypted Alert"
"2016-09-27 02:20:50.856751","54","40624  >  443 [RST"
"2016-09-27 02:20:51.087117","74","60676  >  443 [SYN] Seq=0 Win=4380 Len=0 MSS=1460 SACK_PERM=1 TSval=54761959 TSecr=0 WS=16"
"2016-09-27 02:20:51.309300","54","60676  >  443 [ACK] Seq=1 Ack=1 Win=4384 Len=0"
"2016-09-27 02:20:51.432628","571","Client Hello"
"2016-09-27 02:20:51.661748","54","60676  >  443 [ACK] Seq=518 Ack=1461 Win=7312 Len=0"
"2016-09-27 02:20:51.664570","54","60676  >  443 [ACK] Seq=518 Ack=2921 Win=10224 Len=0"
"2016-09-27 02:20:51.664678","54","60676  >  443 [ACK] Seq=518 Ack=2976 Win=10224 Len=0"
"2016-09-27 02:20:51.678965","380","Client Key Exchange"
"2016-09-27 02:20:51.907772","54","60676  >  443 [ACK] Seq=844 Ack=3035 Win=10224 Len=0"
"2016-09-27 02:20:51.916157","1514","Application Data"
"2016-09-27 02:20:51.916259","396","Application Data"
"2016-09-27 02:20:52.168715","368","Application Data"
"2016-09-27 02:20:52.441788","54","60676  >  443 [ACK] Seq=2960 Ack=3200 Win=13152 Len=0"
"2016-09-27 02:20:53.504949","54","60676  >  443 [ACK] Seq=2960 Ack=3237 Win=13152 Len=0"
"2016-09-27 02:20:53.556801","54","60676  >  443 [ACK] Seq=2960 Ack=3238 Win=13152 Len=0"
"2016-09-27 03:05:51.018813","74","56883  >  443 [SYN] Seq=0 Win=4380 Len=0 MSS=1460 SACK_PERM=1 TSval=55453143 TSecr=0 WS=16"
"2016-09-27 03:05:51.238243","54","56883  >  443 [ACK] Seq=1 Ack=1 Win=4384 Len=0"
"2016-09-27 03:05:51.385482","571","Client Hello"
"2016-09-27 03:05:51.615157","54","56883  >  443 [ACK] Seq=518 Ack=1461 Win=7312 Len=0"
"2016-09-27 03:05:51.616960","54","56883  >  443 [ACK] Seq=518 Ack=2921 Win=10224 Len=0"
"2016-09-27 03:05:51.617049","54","56883  >  443 [ACK] Seq=518 Ack=2976 Win=10224 Len=0"
"2016-09-27 03:05:51.627896","380","Client Key Exchange"
"2016-09-27 03:05:51.860082","54","56883  >  443 [ACK] Seq=844 Ack=3035 Win=10224 Len=0"
"2016-09-27 03:05:51.862719","1514","Application Data"
"2016-09-27 03:05:51.862814","396","Application Data"
"2016-09-27 03:05:52.082114","368","Application Data"
"2016-09-27 03:05:52.355074","54","56883  >  443 [ACK] Seq=2960 Ack=3200 Win=13152 Len=0"
"2016-09-27 03:05:53.617254","54","56883  >  443 [ACK] Seq=2960 Ack=3237 Win=13152 Len=0"
"2016-09-27 03:05:53.655872","54","56883  >  443 [ACK] Seq=2960 Ack=3238 Win=13152 Len=0"
"2016-09-27 03:35:54.314493","74","60780  >  443 [SYN] Seq=0 Win=4380 Len=0 MSS=1460 SACK_PERM=1 TSval=55914783 TSecr=0 WS=16"
"2016-09-27 03:35:54.536843","54","60780  >  443 [ACK] Seq=1 Ack=1 Win=4384 Len=0"
"2016-09-27 03:35:54.660441","571","Client Hello"
"2016-09-27 03:35:54.889094","54","60780  >  443 [ACK] Seq=518 Ack=1461 Win=7312 Len=0"
"2016-09-27 03:35:54.889229","54","60780  >  443 [ACK] Seq=518 Ack=2921 Win=10224 Len=0"
"2016-09-27 03:35:54.889294","54","60780  >  443 [ACK] Seq=518 Ack=2976 Win=10224 Len=0"
"2016-09-27 03:35:54.906210","380","Client Key Exchange"
"2016-09-27 03:35:55.135222","54","60780  >  443 [ACK] Seq=844 Ack=3035 Win=10224 Len=0"
"2016-09-27 03:35:55.143225","1514","Application Data"
"2016-09-27 03:35:55.143346","396","Application Data"
"2016-09-27 03:35:55.368859","368","Application Data"
"2016-09-27 03:35:55.794302","54","60780  >  443 [ACK] Seq=2960 Ack=3200 Win=13152 Len=0"
"2016-09-27 03:35:57.141153","54","60780  >  443 [ACK] Seq=2960 Ack=3237 Win=13152 Len=0"
"2016-09-27 03:35:57.177042","54","60780  >  443 [ACK] Seq=2960 Ack=3238 Win=13152 Len=0"
"2016-09-27 04:05:51.023679","74","42042  >  443 [SYN] Seq=0 Win=4380 Len=0 MSS=1460 SACK_PERM=1 TSval=56374742 TSecr=0 WS=16"
"2016-09-27 04:05:51.234110","54","42042  >  443 [ACK] Seq=1 Ack=1 Win=4384 Len=0"
"2016-09-27 04:05:51.374000","571","Client Hello"
"2016-09-27 04:05:51.586170","54","42042  >  443 [ACK] Seq=518 Ack=1461 Win=7312 Len=0"
"2016-09-27 04:05:51.589441","54","42042  >  443 [ACK] Seq=518 Ack=2921 Win=10224 Len=0"
"2016-09-27 04:05:51.589538","54","42042  >  443 [ACK] Seq=518 Ack=2976 Win=10224 Len=0"
"2016-09-27 04:05:51.598309","380","Client Key Exchange"
"2016-09-27 04:05:51.823080","54","42042  >  443 [ACK] Seq=844 Ack=3035 Win=10224 Len=0"
"2016-09-27 04:05:51.823196","1514","Application Data"
"2016-09-27 04:05:51.823265","396","Application Data"
"2016-09-27 04:05:52.031200","368","Application Data"
"2016-09-27 04:05:52.292416","54","42042  >  443 [ACK] Seq=2960 Ack=3200 Win=13152 Len=0"
"2016-09-27 04:05:53.297521","54","42042  >  443 [ACK] Seq=2960 Ack=3237 Win=13152 Len=0"
"2016-09-27 04:05:53.335347","54","42042  >  443 [ACK] Seq=2960 Ack=3238 Win=13152 Len=0"
"2016-09-27 04:35:54.019351","74","45751  >  443 [SYN] Seq=0 Win=4380 Len=0 MSS=1460 SACK_PERM=1 TSval=56836309 TSecr=0 WS=16"
"2016-09-27 04:35:54.241547","54","45751  >  443 [ACK] Seq=1 Ack=1 Win=4384 Len=0"
"2016-09-27 04:35:54.383810","571","Client Hello"
"2016-09-27 04:35:54.605275","54","45751  >  443 [ACK] Seq=518 Ack=1461 Win=7312 Len=0"
"2016-09-27 04:35:54.608584","54","45751  >  443 [ACK] Seq=518 Ack=2921 Win=10224 Len=0"
"2016-09-27 04:35:54.608673","54","45751  >  443 [ACK] Seq=518 Ack=2976 Win=10224 Len=0"
"2016-09-27 04:35:54.625607","380","Client Key Exchange"
"2016-09-27 04:35:54.864245","54","45751  >  443 [ACK] Seq=844 Ack=3035 Win=10224 Len=0"
"2016-09-27 04:35:54.865435","1514","Application Data"
"2016-09-27 04:35:54.865531","396","Application Data"
"2016-09-27 04:35:55.093156","368","Application Data"
"2016-09-27 04:35:55.377883","54","45751  >  443 [ACK] Seq=2960 Ack=3200 Win=13152 Len=0"
"2016-09-27 04:35:56.417385","54","45751  >  443 [ACK] Seq=2960 Ack=3237 Win=13152 Len=0"
"2016-09-27 04:35:56.456087","54","45751  >  443 [ACK] Seq=2960 Ack=3238 Win=13152 Len=0"
"2016-09-27 04:50:51.039922","74","59447  >  443 [SYN] Seq=0 Win=4380 Len=0 MSS=1460 SACK_PERM=1 TSval=57065947 TSecr=0 WS=16"
"2016-09-27 04:50:51.250335","54","59447  >  443 [ACK] Seq=1 Ack=1 Win=4384 Len=0"
"2016-09-27 04:50:51.412324","571","Client Hello"
"2016-09-27 04:50:51.625795","54","59447  >  443 [ACK] Seq=518 Ack=1461 Win=7312 Len=0"
"2016-09-27 04:50:51.626328","54","59447  >  443 [ACK] Seq=518 Ack=2921 Win=10224 Len=0"
"2016-09-27 04:50:51.629263","54","59447  >  443 [ACK] Seq=518 Ack=2976 Win=10224 Len=0"
"2016-09-27 04:50:51.653631","380","Client Key Exchange"
"2016-09-27 04:50:51.872235","54","59447  >  443 [ACK] Seq=844 Ack=3035 Win=10224 Len=0"
"2016-09-27 04:50:51.890409","1514","Application Data"
"2016-09-27 04:50:51.890529","396","Application Data"
"2016-09-27 04:50:52.117521","368","Application Data"
"2016-09-27 04:50:52.390756","54","59447  >  443 [ACK] Seq=2960 Ack=3200 Win=13152 Len=0"
"2016-09-27 04:50:53.652722","54","59447  >  443 [ACK] Seq=2960 Ack=3237 Win=13152 Len=0"
"2016-09-27 04:50:53.691359","54","59447  >  443 [ACK] Seq=2960 Ack=3238 Win=13152 Len=0"
"2016-09-27 05:05:51.021293","74","55112  >  443 [SYN] Seq=0 Win=4380 Len=0 MSS=1460 SACK_PERM=1 TSval=57296343 TSecr=0 WS=16"
"2016-09-27 05:05:51.243476","54","55112  >  443 [ACK] Seq=1 Ack=1 Win=4384 Len=0"
"2016-09-27 05:05:51.379694","571","Client Hello"
"2016-09-27 05:05:51.632714","54","55112  >  443 [ACK] Seq=518 Ack=1461 Win=7312 Len=0"
"2016-09-27 05:05:51.632832","54","55112  >  443 [ACK] Seq=518 Ack=2921 Win=10224 Len=0"
"2016-09-27 05:05:51.632897","54","55112  >  443 [ACK] Seq=518 Ack=2976 Win=10224 Len=0"
"2016-09-27 05:05:51.645849","380","Client Key Exchange"
"2016-09-27 05:05:51.877875","54","55112  >  443 [ACK] Seq=844 Ack=3035 Win=10224 Len=0"
"2016-09-27 05:05:51.882056","1514","Application Data"
"2016-09-27 05:05:51.882163","396","Application Data"
"2016-09-27 05:05:52.110856","368","Application Data"
"2016-09-27 05:05:52.383954","54","55112  >  443 [ACK] Seq=2960 Ack=3200 Win=13152 Len=0"
"2016-09-27 05:05:53.552165","54","55112  >  443 [ACK] Seq=2960 Ack=3237 Win=13152 Len=0"
"2016-09-27 05:05:53.590744","54","55112  >  443 [ACK] Seq=2960 Ack=3238 Win=13152 Len=0"
"2016-09-27 05:35:51.039690","74","51853  >  443 [SYN] Seq=0 Win=4380 Len=0 MSS=1460 SACK_PERM=1 TSval=57757147 TSecr=0 WS=16"
"2016-09-27 05:35:51.254123","54","51853  >  443 [ACK] Seq=1 Ack=1 Win=4384 Len=0"
"2016-09-27 05:35:51.393211","571","Client Hello"
"2016-09-27 05:35:51.606832","54","51853  >  443 [ACK] Seq=518 Ack=1461 Win=7312 Len=0"
"2016-09-27 05:35:51.607509","54","51853  >  443 [ACK] Seq=518 Ack=2921 Win=10224 Len=0"
"2016-09-27 05:35:51.607600","54","51853  >  443 [ACK] Seq=518 Ack=2976 Win=10224 Len=0"
"2016-09-27 05:35:51.619206","380","Client Key Exchange"
"2016-09-27 05:35:51.852640","54","51853  >  443 [ACK] Seq=844 Ack=3035 Win=10224 Len=0"
"2016-09-27 05:35:51.858754","1514","Application Data"
"2016-09-27 05:35:51.858865","396","Application Data"
"2016-09-27 05:35:52.074448","368","Application Data"
"2016-09-27 05:35:52.360206","54","51853  >  443 [ACK] Seq=2960 Ack=3200 Win=13152 Len=0"
"2016-09-27 05:35:53.340374","54","51853  >  443 [ACK] Seq=2960 Ack=3237 Win=13152 Len=0"
"2016-09-27 05:35:53.380637","54","51853  >  443 [ACK] Seq=2960 Ack=3238 Win=13152 Len=0"
"2016-09-27 05:50:55.263360","74","39007  >  443 [SYN] Seq=0 Win=4380 Len=0 MSS=1460 SACK_PERM=1 TSval=57988630 TSecr=0 WS=16"
"2016-09-27 05:50:55.486220","54","39007  >  443 [ACK] Seq=1 Ack=1 Win=4384 Len=0"
"2016-09-27 05:50:55.613240","571","Client Hello"
"2016-09-27 05:50:55.842398","54","39007  >  443 [ACK] Seq=518 Ack=1461 Win=7312 Len=0"
"2016-09-27 05:50:55.842515","54","39007  >  443 [ACK] Seq=518 Ack=2921 Win=10224 Len=0"
"2016-09-27 05:50:55.842579","54","39007  >  443 [ACK] Seq=518 Ack=2976 Win=10224 Len=0"
"2016-09-27 05:50:55.855341","380","Client Key Exchange"
"2016-09-27 05:50:56.095885","54","39007  >  443 [ACK] Seq=844 Ack=3035 Win=10224 Len=0"
"2016-09-27 05:50:56.111543","1514","Application Data"
"2016-09-27 05:50:56.111651","396","Application Data"
"2016-09-27 05:50:56.329381","368","Application Data"
"2016-09-27 05:50:56.614816","54","39007  >  443 [ACK] Seq=2960 Ack=3200 Win=13152 Len=0"
"2016-09-27 05:50:57.630195","54","39007  >  443 [ACK] Seq=2960 Ack=3237 Win=13152 Len=0"
"2016-09-27 05:50:57.668605","54","39007  >  443 [ACK] Seq=2960 Ack=3238 Win=13152 Len=0"
"2016-09-27 08:05:54.954960","74","38576  >  443 [SYN] Seq=0 Win=4380 Len=0 MSS=1460 SACK_PERM=1 TSval=60062150 TSecr=0 WS=16"
"2016-09-27 08:05:55.165591","54","38576  >  443 [ACK] Seq=1 Ack=1 Win=4384 Len=0"
"2016-09-27 08:05:55.289344","571","Client Hello"
"2016-09-27 08:05:55.506201","54","38576  >  443 [ACK] Seq=518 Ack=1461 Win=7312 Len=0"
"2016-09-27 08:05:55.507833","54","38576  >  443 [ACK] Seq=518 Ack=2921 Win=10224 Len=0"
"2016-09-27 08:05:55.507927","54","38576  >  443 [ACK] Seq=518 Ack=2976 Win=10224 Len=0"
"2016-09-27 08:05:55.530268","380","Client Key Exchange"
"2016-09-27 08:05:55.712291","54","[TCP Dup ACK 184883#1] 38576  >  443 [ACK] Seq=844 Ack=2976 Win=10224 Len=0"
"2016-09-27 08:05:55.716365","54","[TCP Dup ACK 184883#2] 38576  >  443 [ACK] Seq=844 Ack=2976 Win=10224 Len=0"
"2016-09-27 08:05:55.716475","54","[TCP Dup ACK 184883#3] 38576  >  443 [ACK] Seq=844 Ack=2976 Win=10224 Len=0"
"2016-09-27 08:05:55.757521","54","38576  >  443 [ACK] Seq=844 Ack=2982 Win=10224 Len=0"
"2016-09-27 08:05:55.757638","54","38576  >  443 [ACK] Seq=844 Ack=3035 Win=10224 Len=0"
"2016-09-27 08:05:55.767114","1514","Application Data"
"2016-09-27 08:05:55.767215","396","Application Data"
"2016-09-27 08:05:55.977964","368","Application Data"
"2016-09-27 08:05:56.239363","54","38576  >  443 [ACK] Seq=2960 Ack=3200 Win=13152 Len=0"
"2016-09-27 08:05:57.466847","54","38576  >  443 [ACK] Seq=2960 Ack=3237 Win=13152 Len=0"
"2016-09-27 08:05:57.505385","54","38576  >  443 [ACK] Seq=2960 Ack=3238 Win=13152 Len=0"
"2016-09-27 08:20:51.100175","74","55260  >  443 [SYN] Seq=0 Win=4380 Len=0 MSS=1460 SACK_PERM=1 TSval=60291561 TSecr=0 WS=16"
"2016-09-27 08:20:51.312945","54","55260  >  443 [ACK] Seq=1 Ack=1 Win=4384 Len=0"
"2016-09-27 08:20:51.434143","571","Client Hello"
"2016-09-27 08:20:51.651537","54","55260  >  443 [ACK] Seq=518 Ack=1461 Win=7312 Len=0"
"2016-09-27 08:20:51.651654","54","55260  >  443 [ACK] Seq=518 Ack=2921 Win=10224 Len=0"
"2016-09-27 08:20:51.652178","54","55260  >  443 [ACK] Seq=518 Ack=2976 Win=10224 Len=0"
"2016-09-27 08:20:51.666497","380","Client Key Exchange"
"2016-09-27 08:20:51.898450","54","55260  >  443 [ACK] Seq=844 Ack=3035 Win=10224 Len=0"
"2016-09-27 08:20:51.900403","1514","Application Data"
"2016-09-27 08:20:51.900516","396","Application Data"
"2016-09-27 08:20:52.119972","368","Application Data"
"2016-09-27 08:20:52.377359","54","55260  >  443 [ACK] Seq=2960 Ack=3200 Win=13152 Len=0"
"2016-09-27 08:20:53.546295","54","55260  >  443 [ACK] Seq=2960 Ack=3237 Win=13152 Len=0"
"2016-09-27 08:20:53.596152","54","55260  >  443 [ACK] Seq=2960 Ack=3238 Win=13152 Len=0"
"2016-09-27 08:35:51.069866","74","39441  >  443 [SYN] Seq=0 Win=4380 Len=0 MSS=1460 SACK_PERM=1 TSval=60521953 TSecr=0 WS=16"
"2016-09-27 08:35:51.280634","54","39441  >  443 [ACK] Seq=1 Ack=1 Win=4384 Len=0"
"2016-09-27 08:35:51.430232","571","Client Hello"
"2016-09-27 08:35:51.640704","54","39441  >  443 [ACK] Seq=518 Ack=1461 Win=7312 Len=0"
"2016-09-27 08:35:51.643924","54","39441  >  443 [ACK] Seq=518 Ack=2921 Win=10224 Len=0"
"2016-09-27 08:35:51.644008","54","39441  >  443 [ACK] Seq=518 Ack=2976 Win=10224 Len=0"
"2016-09-27 08:35:51.670344","380","Client Key Exchange"
"2016-09-27 08:35:51.898749","54","39441  >  443 [ACK] Seq=844 Ack=3035 Win=10224 Len=0"
"2016-09-27 08:35:51.903497","1514","Application Data"
"2016-09-27 08:35:51.903613","396","Application Data"
"2016-09-27 08:35:52.120864","368","Application Data"
"2016-09-27 08:35:52.390412","54","39441  >  443 [ACK] Seq=2960 Ack=3200 Win=13152 Len=0"
"2016-09-27 08:35:53.546549","54","39441  >  443 [ACK] Seq=2960 Ack=3237 Win=13152 Len=0"
"2016-09-27 08:35:53.585201","54","39441  >  443 [ACK] Seq=2960 Ack=3238 Win=13152 Len=0"
"2016-09-27 09:35:50.894537","74","35705  >  443 [SYN] Seq=0 Win=4380 Len=0 MSS=1460 SACK_PERM=1 TSval=61443509 TSecr=0 WS=16"
"2016-09-27 09:35:51.138757","54","35705  >  443 [ACK] Seq=1 Ack=1 Win=4384 Len=0"
"2016-09-27 09:35:51.281720","571","Client Hello"
"2016-09-27 09:35:51.505613","54","35705  >  443 [ACK] Seq=518 Ack=1461 Win=7312 Len=0"
"2016-09-27 09:35:51.513148","54","35705  >  443 [ACK] Seq=518 Ack=2921 Win=10224 Len=0"
"2016-09-27 09:35:51.514045","54","35705  >  443 [ACK] Seq=518 Ack=2976 Win=10224 Len=0"
"2016-09-27 09:35:51.527318","380","Client Key Exchange"
"2016-09-27 09:35:51.755549","54","35705  >  443 [ACK] Seq=844 Ack=3035 Win=10224 Len=0"
"2016-09-27 09:35:51.757846","1514","Application Data"
"2016-09-27 09:35:51.757947","396","Application Data"
"2016-09-27 09:35:51.977414","368","Application Data"
"2016-09-27 09:35:52.251080","54","35705  >  443 [ACK] Seq=2960 Ack=3200 Win=13152 Len=0"
"2016-09-27 09:35:53.395600","54","35705  >  443 [ACK] Seq=2960 Ack=3237 Win=13152 Len=0"
"2016-09-27 09:35:53.434140","54","35705  >  443 [ACK] Seq=2960 Ack=3238 Win=13152 Len=0"
"2016-09-27 10:20:51.126570","74","56944  >  443 [SYN] Seq=0 Win=4380 Len=0 MSS=1460 SACK_PERM=1 TSval=62134767 TSecr=0 WS=16"
"2016-09-27 10:20:51.360717","54","56944  >  443 [ACK] Seq=1 Ack=1 Win=4384 Len=0"
"2016-09-27 10:20:51.487700","571","Client Hello"
"2016-09-27 10:20:51.747812","54","56944  >  443 [ACK] Seq=518 Ack=1461 Win=7312 Len=0"
"2016-09-27 10:20:51.747928","54","56944  >  443 [ACK] Seq=518 Ack=2921 Win=10224 Len=0"
"2016-09-27 10:20:51.747993","54","56944  >  443 [ACK] Seq=518 Ack=2976 Win=10224 Len=0"
"2016-09-27 10:20:51.758820","380","Client Key Exchange"
"2016-09-27 10:20:52.018835","54","56944  >  443 [ACK] Seq=844 Ack=3035 Win=10224 Len=0"
"2016-09-27 10:20:52.019863","1514","Application Data"
"2016-09-27 10:20:52.019975","396","Application Data"
"2016-09-27 10:20:52.258991","368","Application Data"
"2016-09-27 10:20:52.555513","54","56944  >  443 [ACK] Seq=2960 Ack=3200 Win=13152 Len=0"
"2016-09-27 10:20:53.585066","54","56944  >  443 [ACK] Seq=2960 Ack=3237 Win=13152 Len=0"
"2016-09-27 10:20:53.621946","54","56944  >  443 [ACK] Seq=2960 Ack=3238 Win=13152 Len=0"
"2016-09-27 10:50:51.066543","74","57117  >  443 [SYN] Seq=0 Win=4380 Len=0 MSS=1460 SACK_PERM=1 TSval=62595551 TSecr=0 WS=16"
"2016-09-27 10:50:51.284866","54","57117  >  443 [ACK] Seq=1 Ack=1 Win=4384 Len=0"
"2016-09-27 10:50:51.417952","571","Client Hello"
"2016-09-27 10:50:51.629351","54","57117  >  443 [ACK] Seq=518 Ack=1461 Win=7312 Len=0"
"2016-09-27 10:50:51.632415","54","57117  >  443 [ACK] Seq=518 Ack=2921 Win=10224 Len=0"
"2016-09-27 10:50:51.632503","54","57117  >  443 [ACK] Seq=518 Ack=2976 Win=10224 Len=0"
"2016-09-27 10:50:51.642632","380","Client Key Exchange"
"2016-09-27 10:50:51.863949","54","57117  >  443 [ACK] Seq=844 Ack=3035 Win=10224 Len=0"
"2016-09-27 10:50:51.868435","1514","Application Data"
"2016-09-27 10:50:51.868548","396","Application Data"
"2016-09-27 10:50:52.085729","368","Application Data"
"2016-09-27 10:50:52.347494","54","57117  >  443 [ACK] Seq=2960 Ack=3200 Win=13152 Len=0"
"2016-09-27 10:50:53.504799","54","57117  >  443 [ACK] Seq=2960 Ack=3237 Win=13152 Len=0"
"2016-09-27 10:50:53.551204","54","57117  >  443 [ACK] Seq=2960 Ack=3238 Win=13152 Len=0"
"2016-09-27 11:05:50.869683","91","Encrypted Alert"
"2016-09-27 11:05:50.890364","54","57117  >  443 [RST"
"2016-09-27 14:05:50.898290","74","40728  >  443 [SYN] Seq=0 Win=4380 Len=0 MSS=1460 SACK_PERM=1 TSval=65590710 TSecr=0 WS=16"
"2016-09-27 14:05:51.124205","54","40728  >  443 [ACK] Seq=1 Ack=1 Win=4384 Len=0"
"2016-09-27 14:05:51.229490","571","Client Hello"
"2016-09-27 14:05:51.449179","54","40728  >  443 [ACK] Seq=518 Ack=1461 Win=7312 Len=0"
"2016-09-27 14:05:51.449286","54","40728  >  443 [ACK] Seq=518 Ack=2921 Win=10224 Len=0"
"2016-09-27 14:05:51.449352","54","40728  >  443 [ACK] Seq=518 Ack=2976 Win=10224 Len=0"
"2016-09-27 14:05:51.474939","380","Client Key Exchange"
"2016-09-27 14:05:51.712997","54","40728  >  443 [ACK] Seq=844 Ack=3035 Win=10224 Len=0"
"2016-09-27 14:05:51.725196","1514","Application Data"
"2016-09-27 14:05:51.725660","396","Application Data"
"2016-09-27 14:05:51.964339","368","Application Data"
"2016-09-27 14:05:52.247458","54","40728  >  443 [ACK] Seq=2960 Ack=3200 Win=13152 Len=0"
"2016-09-27 14:05:53.354960","54","40728  >  443 [ACK] Seq=2960 Ack=3237 Win=13152 Len=0"
"2016-09-27 14:05:53.393688","54","40728  >  443 [ACK] Seq=2960 Ack=3238 Win=13152 Len=0"
"2016-09-27 14:20:50.905268","74","53274  >  443 [SYN] Seq=0 Win=4380 Len=0 MSS=1460 SACK_PERM=1 TSval=65821111 TSecr=0 WS=16"
"2016-09-27 14:20:51.125978","54","53274  >  443 [ACK] Seq=1 Ack=1 Win=4384 Len=0"
"2016-09-27 14:20:51.242974","571","Client Hello"
"2016-09-27 14:20:51.461650","54","53274  >  443 [ACK] Seq=518 Ack=1461 Win=7312 Len=0"
"2016-09-27 14:20:51.461759","54","53274  >  443 [ACK] Seq=518 Ack=2921 Win=10224 Len=0"
"2016-09-27 14:20:51.461822","54","53274  >  443 [ACK] Seq=518 Ack=2976 Win=10224 Len=0"
"2016-09-27 14:20:51.473644","380","Client Key Exchange"
"2016-09-27 14:20:51.670797","54","[TCP Dup ACK 350440#1] 53274  >  443 [ACK] Seq=844 Ack=2976 Win=10224 Len=0"
"2016-09-27 14:20:51.694401","54","53274  >  443 [ACK] Seq=844 Ack=2982 Win=10224 Len=0"
"2016-09-27 14:20:51.754369","54","53274  >  443 [ACK] Seq=844 Ack=3035 Win=10224 Len=0"
"2016-09-27 14:20:51.756572","1514","Application Data"
"2016-09-27 14:20:51.756664","396","Application Data"
"2016-09-27 14:20:51.967388","368","Application Data"
"2016-09-27 14:20:52.229926","54","53274  >  443 [ACK] Seq=2960 Ack=3200 Win=13152 Len=0"
"2016-09-27 14:20:53.442477","54","53274  >  443 [ACK] Seq=2960 Ack=3237 Win=13152 Len=0"
"2016-09-27 14:20:53.479346","54","53274  >  443 [ACK] Seq=2960 Ack=3238 Win=13152 Len=0"
"2016-09-27 15:35:51.121521","74","45104  >  443 [SYN] Seq=0 Win=4380 Len=0 MSS=1460 SACK_PERM=1 TSval=66973165 TSecr=0 WS=16"
"2016-09-27 15:35:51.332358","54","45104  >  443 [ACK] Seq=1 Ack=1 Win=4384 Len=0"
"2016-09-27 15:35:51.457597","571","Client Hello"
"2016-09-27 15:35:51.670844","54","45104  >  443 [ACK] Seq=518 Ack=1461 Win=7312 Len=0"
"2016-09-27 15:35:51.670960","54","45104  >  443 [ACK] Seq=518 Ack=2921 Win=10224 Len=0"
"2016-09-27 15:35:51.671423","54","45104  >  443 [ACK] Seq=518 Ack=2976 Win=10224 Len=0"
"2016-09-27 15:35:51.689297","380","Client Key Exchange"
"2016-09-27 15:35:51.909728","54","45104  >  443 [ACK] Seq=844 Ack=3035 Win=10224 Len=0"
"2016-09-27 15:35:51.927798","1514","Application Data"
"2016-09-27 15:35:51.927915","396","Application Data"
"2016-09-27 15:35:52.141054","368","Application Data"
"2016-09-27 15:35:52.402496","54","45104  >  443 [ACK] Seq=2960 Ack=3200 Win=13152 Len=0"
"2016-09-27 15:35:53.556932","54","45104  >  443 [ACK] Seq=2960 Ack=3237 Win=13152 Len=0"
"2016-09-27 15:35:53.595583","54","45104  >  443 [ACK] Seq=2960 Ack=3238 Win=13152 Len=0"
"2016-09-27 15:50:50.881884","91","Encrypted Alert"
"2016-09-27 15:50:50.901093","54","45104  >  443 [RST"
"2016-09-27 15:50:51.079757","74","39131  >  443 [SYN] Seq=0 Win=4380 Len=0 MSS=1460 SACK_PERM=1 TSval=67203555 TSecr=0 WS=16"
"2016-09-27 15:50:51.313422","54","39131  >  443 [ACK] Seq=1 Ack=1 Win=4384 Len=0"
"2016-09-27 15:50:51.439674","571","Client Hello"
"2016-09-27 15:50:51.665695","54","39131  >  443 [ACK] Seq=518 Ack=1461 Win=7312 Len=0"
"2016-09-27 15:50:51.665808","54","39131  >  443 [ACK] Seq=518 Ack=2921 Win=10224 Len=0"
"2016-09-27 15:50:51.665870","54","39131  >  443 [ACK] Seq=518 Ack=2976 Win=10224 Len=0"
"2016-09-27 15:50:51.678795","380","Client Key Exchange"
"2016-09-27 15:50:51.911845","54","39131  >  443 [ACK] Seq=844 Ack=3035 Win=10224 Len=0"
"2016-09-27 15:50:51.914107","1514","Application Data"
"2016-09-27 15:50:51.914204","396","Application Data"
"2016-09-27 15:50:52.138997","368","Application Data"
"2016-09-27 15:50:52.420771","54","39131  >  443 [ACK] Seq=2960 Ack=3200 Win=13152 Len=0"
"2016-09-27 15:50:53.610417","54","39131  >  443 [ACK] Seq=2960 Ack=3237 Win=13152 Len=0"
"2016-09-27 15:50:53.651374","54","39131  >  443 [ACK] Seq=2960 Ack=3238 Win=13152 Len=0"
"2016-09-27 16:05:50.884472","91","Encrypted Alert"
"2016-09-27 16:05:50.902675","54","39131  >  443 [RST"
"2016-09-27 16:05:51.057597","74","32880  >  443 [SYN] Seq=0 Win=4380 Len=0 MSS=1460 SACK_PERM=1 TSval=67433951 TSecr=0 WS=16"
"2016-09-27 16:05:51.279819","54","32880  >  443 [ACK] Seq=1 Ack=1 Win=4384 Len=0"
"2016-09-27 16:05:51.425567","571","Client Hello"
"2016-09-27 16:05:51.647294","54","32880  >  443 [ACK] Seq=518 Ack=1461 Win=7312 Len=0"
"2016-09-27 16:05:51.647397","54","32880  >  443 [ACK] Seq=518 Ack=2921 Win=10224 Len=0"
"2016-09-27 16:05:51.647781","54","32880  >  443 [ACK] Seq=518 Ack=2976 Win=10224 Len=0"
"2016-09-27 16:05:51.675047","380","Client Key Exchange"
"2016-09-27 16:05:51.901673","54","32880  >  443 [ACK] Seq=844 Ack=3035 Win=10224 Len=0"
"2016-09-27 16:05:51.903823","1514","Application Data"
"2016-09-27 16:05:51.903916","396","Application Data"
"2016-09-27 16:05:52.123628","368","Application Data"
"2016-09-27 16:05:52.396703","54","32880  >  443 [ACK] Seq=2960 Ack=3200 Win=13152 Len=0"
"2016-09-27 16:05:53.541574","54","32880  >  443 [ACK] Seq=2960 Ack=3237 Win=13152 Len=0"
"2016-09-27 16:05:53.584256","54","32880  >  443 [ACK] Seq=2960 Ack=3238 Win=13152 Len=0"
"2016-09-27 16:50:55.310237","74","50534  >  443 [SYN] Seq=0 Win=4380 Len=0 MSS=1460 SACK_PERM=1 TSval=68126238 TSecr=0 WS=16"
"2016-09-27 16:50:55.530483","54","50534  >  443 [ACK] Seq=1 Ack=1 Win=4384 Len=0"
"2016-09-27 16:50:55.653439","571","Client Hello"
"2016-09-27 16:50:55.882767","54","50534  >  443 [ACK] Seq=518 Ack=1461 Win=7312 Len=0"
"2016-09-27 16:50:55.882870","54","50534  >  443 [ACK] Seq=518 Ack=2921 Win=10224 Len=0"
"2016-09-27 16:50:55.882933","54","50534  >  443 [ACK] Seq=518 Ack=2976 Win=10224 Len=0"
"2016-09-27 16:50:55.896823","380","Client Key Exchange"
"2016-09-27 16:50:56.129041","54","50534  >  443 [ACK] Seq=844 Ack=3035 Win=10224 Len=0"
"2016-09-27 16:50:56.131375","1514","Application Data"
"2016-09-27 16:50:56.131475","396","Application Data"
"2016-09-27 16:50:56.350812","368","Application Data"
"2016-09-27 16:50:56.624050","54","50534  >  443 [ACK] Seq=2960 Ack=3200 Win=13152 Len=0"
"2016-09-27 16:50:57.733987","54","50534  >  443 [ACK] Seq=2960 Ack=3237 Win=13152 Len=0"
"2016-09-27 16:50:57.786741","54","50534  >  443 [ACK] Seq=2960 Ack=3238 Win=13152 Len=0"
"2016-09-27 17:05:51.091601","74","49861  >  443 [SYN] Seq=0 Win=4380 Len=0 MSS=1460 SACK_PERM=1 TSval=68355559 TSecr=0 WS=16"
"2016-09-27 17:05:51.301855","54","49861  >  443 [ACK] Seq=1 Ack=1 Win=4384 Len=0"
"2016-09-27 17:05:51.425796","571","Client Hello"
"2016-09-27 17:05:51.642448","54","49861  >  443 [ACK] Seq=518 Ack=1461 Win=7312 Len=0"
"2016-09-27 17:05:51.642564","54","49861  >  443 [ACK] Seq=518 Ack=2921 Win=10224 Len=0"
"2016-09-27 17:05:51.642627","54","49861  >  443 [ACK] Seq=518 Ack=2976 Win=10224 Len=0"
"2016-09-27 17:05:51.653405","380","Client Key Exchange"
"2016-09-27 17:05:51.876810","54","49861  >  443 [ACK] Seq=844 Ack=3035 Win=10224 Len=0"
"2016-09-27 17:05:51.879471","1514","Application Data"
"2016-09-27 17:05:51.879577","396","Application Data"
"2016-09-27 17:05:52.098724","368","Application Data"
"2016-09-27 17:05:52.381003","54","49861  >  443 [ACK] Seq=2960 Ack=3200 Win=13152 Len=0"
"2016-09-27 17:05:53.634360","54","49861  >  443 [ACK] Seq=2960 Ack=3237 Win=13152 Len=0"
"2016-09-27 17:05:53.672572","54","49861  >  443 [ACK] Seq=2960 Ack=3238 Win=13152 Len=0"
"2016-09-27 17:20:51.083186","74","35260  >  443 [SYN] Seq=0 Win=4380 Len=0 MSS=1460 SACK_PERM=1 TSval=68585956 TSecr=0 WS=16"
"2016-09-27 17:20:51.305355","54","35260  >  443 [ACK] Seq=1 Ack=1 Win=4384 Len=0"
"2016-09-27 17:20:51.428723","571","Client Hello"
"2016-09-27 17:20:51.657323","54","35260  >  443 [ACK] Seq=518 Ack=1461 Win=7312 Len=0"
"2016-09-27 17:20:51.657929","54","35260  >  443 [ACK] Seq=518 Ack=2921 Win=10224 Len=0"
"2016-09-27 17:20:51.658018","54","35260  >  443 [ACK] Seq=518 Ack=2976 Win=10224 Len=0"
"2016-09-27 17:20:51.671942","380","Client Key Exchange"
"2016-09-27 17:20:51.905832","54","35260  >  443 [ACK] Seq=844 Ack=3035 Win=10224 Len=0"
"2016-09-27 17:20:51.908620","1514","Application Data"
"2016-09-27 17:20:51.908715","396","Application Data"
"2016-09-27 17:20:52.125726","368","Application Data"
"2016-09-27 17:20:52.398790","54","35260  >  443 [ACK] Seq=2960 Ack=3200 Win=13152 Len=0"
"2016-09-27 17:20:53.392251","54","35260  >  443 [ACK] Seq=2960 Ack=3237 Win=13152 Len=0"
"2016-09-27 17:20:53.430086","54","35260  >  443 [ACK] Seq=2960 Ack=3238 Win=13152 Len=0"
"2016-09-27 17:35:50.948108","74","54628  >  443 [SYN] Seq=0 Win=4380 Len=0 MSS=1460 SACK_PERM=1 TSval=68816322 TSecr=0 WS=16"
"2016-09-27 17:35:51.158475","54","54628  >  443 [ACK] Seq=1 Ack=1 Win=4384 Len=0"
"2016-09-27 17:35:51.284562","571","Client Hello"
"2016-09-27 17:35:51.498916","54","54628  >  443 [ACK] Seq=518 Ack=1461 Win=7312 Len=0"
"2016-09-27 17:35:51.502229","54","54628  >  443 [ACK] Seq=518 Ack=2921 Win=10224 Len=0"
"2016-09-27 17:35:51.502343","54","54628  >  443 [ACK] Seq=518 Ack=2976 Win=10224 Len=0"
"2016-09-27 17:35:51.512483","380","Client Key Exchange"
"2016-09-27 17:35:51.733443","54","54628  >  443 [ACK] Seq=844 Ack=3035 Win=10224 Len=0"
"2016-09-27 17:35:51.737909","1514","Application Data"
"2016-09-27 17:35:51.738364","396","Application Data"
"2016-09-27 17:35:51.955392","368","Application Data"
"2016-09-27 17:35:52.218857","54","54628  >  443 [ACK] Seq=2960 Ack=3200 Win=13152 Len=0"
"2016-09-27 17:35:53.431767","54","54628  >  443 [ACK] Seq=2960 Ack=3237 Win=13152 Len=0"
"2016-09-27 17:35:53.470662","54","54628  >  443 [ACK] Seq=2960 Ack=3238 Win=13152 Len=0"
"2016-09-27 17:50:51.101968","74","54524  >  443 [SYN] Seq=0 Win=4380 Len=0 MSS=1460 SACK_PERM=1 TSval=69046762 TSecr=0 WS=16"
"2016-09-27 17:50:51.325664","54","54524  >  443 [ACK] Seq=1 Ack=1 Win=4384 Len=0"
"2016-09-27 17:50:51.450175","571","Client Hello"
"2016-09-27 17:50:51.664396","54","54524  >  443 [ACK] Seq=518 Ack=1461 Win=7312 Len=0"
"2016-09-27 17:50:51.664509","54","54524  >  443 [ACK] Seq=518 Ack=2921 Win=10224 Len=0"
"2016-09-27 17:50:51.664662","54","54524  >  443 [ACK] Seq=518 Ack=2976 Win=10224 Len=0"
"2016-09-27 17:50:51.693386","380","Client Key Exchange"
"2016-09-27 17:50:51.918469","54","54524  >  443 [ACK] Seq=844 Ack=3035 Win=10224 Len=0"
"2016-09-27 17:50:51.921000","1514","Application Data"
"2016-09-27 17:50:51.921099","396","Application Data"
"2016-09-27 17:50:52.140408","368","Application Data"
"2016-09-27 17:50:52.401861","54","54524  >  443 [ACK] Seq=2960 Ack=3200 Win=13152 Len=0"
"2016-09-27 17:50:53.464685","54","54524  >  443 [ACK] Seq=2960 Ack=3237 Win=13152 Len=0"
"2016-09-27 17:50:53.504447","54","54524  >  443 [ACK] Seq=2960 Ack=3238 Win=13152 Len=0"
"2016-09-27 18:05:51.068150","74","56451  >  443 [SYN] Seq=0 Win=4380 Len=0 MSS=1460 SACK_PERM=1 TSval=69277152 TSecr=0 WS=16"
"2016-09-27 18:05:51.278602","54","56451  >  443 [ACK] Seq=1 Ack=1 Win=4384 Len=0"
"2016-09-27 18:05:51.429838","571","Client Hello"
"2016-09-27 18:05:51.642361","54","56451  >  443 [ACK] Seq=518 Ack=1461 Win=7312 Len=0"
"2016-09-27 18:05:51.645572","54","56451  >  443 [ACK] Seq=518 Ack=2921 Win=10224 Len=0"
"2016-09-27 18:05:51.645661","54","56451  >  443 [ACK] Seq=518 Ack=2976 Win=10224 Len=0"
"2016-09-27 18:05:51.663018","380","Client Key Exchange"
"2016-09-27 18:05:51.877082","54","56451  >  443 [ACK] Seq=844 Ack=3035 Win=10224 Len=0"
"2016-09-27 18:05:51.880239","1514","Application Data"
"2016-09-27 18:05:51.886844","396","Application Data"
"2016-09-27 18:05:52.098930","368","Application Data"
"2016-09-27 18:05:52.360322","54","56451  >  443 [ACK] Seq=2960 Ack=3200 Win=13152 Len=0"
"2016-09-27 18:05:53.575513","54","56451  >  443 [ACK] Seq=2960 Ack=3237 Win=13152 Len=0"
"2016-09-27 18:05:53.614259","54","56451  >  443 [ACK] Seq=2960 Ack=3238 Win=13152 Len=0"
"2016-09-27 18:20:51.101253","74","53070  >  443 [SYN] Seq=0 Win=4380 Len=0 MSS=1460 SACK_PERM=1 TSval=69507561 TSecr=0 WS=16"
"2016-09-27 18:20:51.323448","54","53070  >  443 [ACK] Seq=1 Ack=1 Win=4384 Len=0"
"2016-09-27 18:20:51.448956","571","Client Hello"
"2016-09-27 18:20:51.663986","54","53070  >  443 [ACK] Seq=518 Ack=1461 Win=7312 Len=0"
"2016-09-27 18:20:51.664092","54","53070  >  443 [ACK] Seq=518 Ack=2921 Win=10224 Len=0"
"2016-09-27 18:20:51.664155","54","53070  >  443 [ACK] Seq=518 Ack=2976 Win=10224 Len=0"
"2016-09-27 18:20:51.682601","380","Client Key Exchange"
"2016-09-27 18:20:51.898422","54","53070  >  443 [ACK] Seq=844 Ack=3035 Win=10224 Len=0"
"2016-09-27 18:20:51.918459","1514","Application Data"
"2016-09-27 18:20:51.918574","396","Application Data"
"2016-09-27 18:20:52.132144","368","Application Data"
"2016-09-27 18:20:52.393600","54","53070  >  443 [ACK] Seq=2960 Ack=3200 Win=13152 Len=0"
"2016-09-27 18:20:53.714763","54","53070  >  443 [ACK] Seq=2960 Ack=3237 Win=13152 Len=0"
"2016-09-27 18:20:53.756794","54","53070  >  443 [ACK] Seq=2960 Ack=3238 Win=13152 Len=0"
"2016-09-27 18:50:51.101373","74","41918  >  443 [SYN] Seq=0 Win=4380 Len=0 MSS=1460 SACK_PERM=1 TSval=69968362 TSecr=0 WS=16"
"2016-09-27 18:50:51.311863","54","41918  >  443 [ACK] Seq=1 Ack=1 Win=4384 Len=0"
"2016-09-27 18:50:51.438190","571","Client Hello"
"2016-09-27 18:50:51.652185","54","41918  >  443 [ACK] Seq=518 Ack=1461 Win=7312 Len=0"
"2016-09-27 18:50:51.654202","54","41918  >  443 [ACK] Seq=518 Ack=2921 Win=10224 Len=0"
"2016-09-27 18:50:51.654292","54","41918  >  443 [ACK] Seq=518 Ack=2976 Win=10224 Len=0"
"2016-09-27 18:50:51.671376","380","Client Key Exchange"
"2016-09-27 18:50:51.898572","54","41918  >  443 [ACK] Seq=844 Ack=3035 Win=10224 Len=0"
"2016-09-27 18:50:51.907275","1514","Application Data"
"2016-09-27 18:50:51.907390","396","Application Data"
"2016-09-27 18:50:52.120479","368","Application Data"
"2016-09-27 18:50:52.382765","54","41918  >  443 [ACK] Seq=2960 Ack=3200 Win=13152 Len=0"
"2016-09-27 18:50:53.634127","54","41918  >  443 [ACK] Seq=2960 Ack=3237 Win=13152 Len=0"
"2016-09-27 18:50:53.670923","54","41918  >  443 [ACK] Seq=2960 Ack=3238 Win=13152 Len=0"
"2016-09-27 19:05:51.092213","74","49705  >  443 [SYN] Seq=0 Win=4380 Len=0 MSS=1460 SACK_PERM=1 TSval=70198759 TSecr=0 WS=16"
"2016-09-27 19:05:51.314292","54","49705  >  443 [ACK] Seq=1 Ack=1 Win=4384 Len=0"
"2016-09-27 19:05:51.440264","571","Client Hello"
"2016-09-27 19:05:51.666594","54","49705  >  443 [ACK] Seq=518 Ack=1461 Win=7312 Len=0"
"2016-09-27 19:05:51.666703","54","49705  >  443 [ACK] Seq=518 Ack=2921 Win=10224 Len=0"
"2016-09-27 19:05:51.666767","54","49705  >  443 [ACK] Seq=518 Ack=2976 Win=10224 Len=0"
"2016-09-27 19:05:51.682681","380","Client Key Exchange"
"2016-09-27 19:05:51.925450","54","49705  >  443 [ACK] Seq=844 Ack=3035 Win=10224 Len=0"
"2016-09-27 19:05:51.936609","1514","Application Data"
"2016-09-27 19:05:51.936726","396","Application Data"
"2016-09-27 19:05:52.158027","368","Application Data"
"2016-09-27 19:05:52.431353","54","49705  >  443 [ACK] Seq=2960 Ack=3200 Win=13152 Len=0"
"2016-09-27 19:05:53.493981","54","49705  >  443 [ACK] Seq=2960 Ack=3237 Win=13152 Len=0"
"2016-09-27 19:05:53.538854","54","49705  >  443 [ACK] Seq=2960 Ack=3238 Win=13152 Len=0"
"2016-09-27 19:20:51.152172","74","32934  >  443 [SYN] Seq=0 Win=4380 Len=0 MSS=1460 SACK_PERM=1 TSval=70429175 TSecr=0 WS=16"
"2016-09-27 19:20:51.374337","54","32934  >  443 [ACK] Seq=1 Ack=1 Win=4384 Len=0"
"2016-09-27 19:20:51.498989","571","Client Hello"
"2016-09-27 19:20:51.726465","54","32934  >  443 [ACK] Seq=518 Ack=1461 Win=7312 Len=0"
"2016-09-27 19:20:51.730355","54","32934  >  443 [ACK] Seq=518 Ack=2921 Win=10224 Len=0"
"2016-09-27 19:20:51.730451","54","32934  >  443 [ACK] Seq=518 Ack=2976 Win=10224 Len=0"
"2016-09-27 19:20:51.739927","380","Client Key Exchange"
"2016-09-27 19:20:51.972668","54","32934  >  443 [ACK] Seq=844 Ack=3035 Win=10224 Len=0"
"2016-09-27 19:20:51.977397","1514","Application Data"
"2016-09-27 19:20:51.977488","396","Application Data"
"2016-09-27 19:20:52.194702","368","Application Data"
"2016-09-27 19:20:52.471571","54","32934  >  443 [ACK] Seq=2960 Ack=3200 Win=13152 Len=0"
"2016-09-27 19:20:53.812195","54","32934  >  443 [ACK] Seq=2960 Ack=3237 Win=13152 Len=0"
"2016-09-27 19:20:53.850678","54","32934  >  443 [ACK] Seq=2960 Ack=3238 Win=13152 Len=0"
"2016-09-27 20:35:51.094957","74","53700  >  443 [SYN] Seq=0 Win=4380 Len=0 MSS=1460 SACK_PERM=1 TSval=71581158 TSecr=0 WS=16"
"2016-09-27 20:35:51.302905","54","53700  >  443 [ACK] Seq=1 Ack=1 Win=4384 Len=0"
"2016-09-27 20:35:51.445057","571","Client Hello"
"2016-09-27 20:35:51.657232","54","53700  >  443 [ACK] Seq=518 Ack=1461 Win=7312 Len=0"
"2016-09-27 20:35:51.657335","54","53700  >  443 [ACK] Seq=518 Ack=2921 Win=10224 Len=0"
"2016-09-27 20:35:51.657397","54","53700  >  443 [ACK] Seq=518 Ack=2976 Win=10224 Len=0"
"2016-09-27 20:35:51.683828","380","Client Key Exchange"
"2016-09-27 20:35:51.865288","54","[TCP Dup ACK 480278#1] 53700  >  443 [ACK] Seq=844 Ack=2976 Win=10224 Len=0"
"2016-09-27 20:35:51.900643","54","53700  >  443 [ACK] Seq=844 Ack=2982 Win=10224 Len=0"
"2016-09-27 20:35:51.903539","54","53700  >  443 [ACK] Seq=844 Ack=3035 Win=10224 Len=0"
"2016-09-27 20:35:51.903641","1514","Application Data"
"2016-09-27 20:35:51.904109","396","Application Data"
"2016-09-27 20:35:52.111416","368","Application Data"
"2016-09-27 20:35:52.374074","54","53700  >  443 [ACK] Seq=2960 Ack=3200 Win=13152 Len=0"
"2016-09-27 20:35:53.529389","54","53700  >  443 [ACK] Seq=2960 Ack=3237 Win=13152 Len=0"
"2016-09-27 20:35:53.568041","54","53700  >  443 [ACK] Seq=2960 Ack=3238 Win=13152 Len=0"
"2016-09-27 21:05:51.100846","74","38772  >  443 [SYN] Seq=0 Win=4380 Len=0 MSS=1460 SACK_PERM=1 TSval=72041961 TSecr=0 WS=16"
"2016-09-27 21:05:51.323055","54","38772  >  443 [ACK] Seq=1 Ack=1 Win=4384 Len=0"
"2016-09-27 21:05:51.446231","571","Client Hello"
"2016-09-27 21:05:51.675034","54","38772  >  443 [ACK] Seq=518 Ack=1461 Win=7312 Len=0"
"2016-09-27 21:05:51.678870","54","38772  >  443 [ACK] Seq=518 Ack=2921 Win=10224 Len=0"
"2016-09-27 21:05:51.678959","54","38772  >  443 [ACK] Seq=518 Ack=2976 Win=10224 Len=0"
"2016-09-27 21:05:51.691770","380","Client Key Exchange"
"2016-09-27 21:05:51.921573","54","38772  >  443 [ACK] Seq=844 Ack=3035 Win=10224 Len=0"
"2016-09-27 21:05:51.924804","1514","Application Data"
"2016-09-27 21:05:51.926667","396","Application Data"
"2016-09-27 21:05:52.143360","368","Application Data"
"2016-09-27 21:05:52.416655","54","38772  >  443 [ACK] Seq=2960 Ack=3200 Win=13152 Len=0"
"2016-09-27 21:05:53.661241","54","38772  >  443 [ACK] Seq=2960 Ack=3237 Win=13152 Len=0"
"2016-09-27 21:05:53.706491","54","38772  >  443 [ACK] Seq=2960 Ack=3238 Win=13152 Len=0"
"2016-09-27 21:20:51.090964","74","43040  >  443 [SYN] Seq=0 Win=4380 Len=0 MSS=1460 SACK_PERM=1 TSval=72272359 TSecr=0 WS=16"
"2016-09-27 21:20:51.301257","54","43040  >  443 [ACK] Seq=1 Ack=1 Win=4384 Len=0"
"2016-09-27 21:20:51.427852","571","Client Hello"
"2016-09-27 21:20:51.641586","54","43040  >  443 [ACK] Seq=518 Ack=1461 Win=7312 Len=0"
"2016-09-27 21:20:51.643534","54","43040  >  443 [ACK] Seq=518 Ack=2921 Win=10224 Len=0"
"2016-09-27 21:20:51.643628","54","43040  >  443 [ACK] Seq=518 Ack=2976 Win=10224 Len=0"
"2016-09-27 21:20:51.653072","380","Client Key Exchange"
"2016-09-27 21:20:51.876217","54","43040  >  443 [ACK] Seq=844 Ack=3035 Win=10224 Len=0"
"2016-09-27 21:20:51.878797","1514","Application Data"
"2016-09-27 21:20:51.878891","396","Application Data"
"2016-09-27 21:20:52.098146","368","Application Data"
"2016-09-27 21:20:52.360197","54","43040  >  443 [ACK] Seq=2960 Ack=3200 Win=13152 Len=0"
"2016-09-27 21:20:53.352053","54","43040  >  443 [ACK] Seq=2960 Ack=3237 Win=13152 Len=0"
"2016-09-27 21:20:53.390792","54","43040  >  443 [ACK] Seq=2960 Ack=3238 Win=13152 Len=0"
"2016-09-27 21:35:50.895450","91","Encrypted Alert"
"2016-09-27 21:35:50.914300","54","43040  >  443 [RST"
"2016-09-27 21:50:50.933681","74","53480  >  443 [SYN] Seq=0 Win=4380 Len=0 MSS=1460 SACK_PERM=1 TSval=72733120 TSecr=0 WS=16"
"2016-09-27 21:50:51.156024","54","53480  >  443 [ACK] Seq=1 Ack=1 Win=4384 Len=0"
"2016-09-27 21:50:51.285336","571","Client Hello"
"2016-09-27 21:50:51.508773","54","53480  >  443 [ACK] Seq=518 Ack=1461 Win=7312 Len=0"
"2016-09-27 21:50:51.509478","54","53480  >  443 [ACK] Seq=518 Ack=2921 Win=10224 Len=0"
"2016-09-27 21:50:51.509571","54","53480  >  443 [ACK] Seq=518 Ack=2976 Win=10224 Len=0"
"2016-09-27 21:50:51.522496","380","Client Key Exchange"
"2016-09-27 21:50:51.754488","54","53480  >  443 [ACK] Seq=844 Ack=3035 Win=10224 Len=0"
"2016-09-27 21:50:51.758549","1514","Application Data"
"2016-09-27 21:50:51.758660","396","Application Data"
"2016-09-27 21:50:51.976349","368","Application Data"
"2016-09-27 21:50:52.249524","54","53480  >  443 [ACK] Seq=2960 Ack=3200 Win=13152 Len=0"
"2016-09-27 21:50:53.335754","54","53480  >  443 [ACK] Seq=2960 Ack=3237 Win=13152 Len=0"
"2016-09-27 21:50:53.374458","54","53480  >  443 [ACK] Seq=2960 Ack=3238 Win=13152 Len=0"
"2016-09-27 22:50:51.115198","74","59647  >  443 [SYN] Seq=0 Win=4380 Len=0 MSS=1460 SACK_PERM=1 TSval=73654765 TSecr=0 WS=16"
"2016-09-27 22:50:51.337413","54","59647  >  443 [ACK] Seq=1 Ack=1 Win=4384 Len=0"
"2016-09-27 22:50:51.472657","571","Client Hello"
"2016-09-27 22:50:51.703617","54","59647  >  443 [ACK] Seq=518 Ack=1461 Win=7312 Len=0"
"2016-09-27 22:50:51.703727","54","59647  >  443 [ACK] Seq=518 Ack=2921 Win=10224 Len=0"
"2016-09-27 22:50:51.708646","54","59647  >  443 [ACK] Seq=518 Ack=2976 Win=10224 Len=0"
"2016-09-27 22:50:51.717798","380","Client Key Exchange"
"2016-09-27 22:50:51.955447","54","59647  >  443 [ACK] Seq=844 Ack=3035 Win=10224 Len=0"
"2016-09-27 22:50:51.957882","1514","Application Data"
"2016-09-27 22:50:51.957991","396","Application Data"
"2016-09-27 22:50:52.181182","368","Application Data"
"2016-09-27 22:50:52.454218","54","59647  >  443 [ACK] Seq=2960 Ack=3200 Win=13152 Len=0"
"2016-09-27 22:50:53.554569","54","59647  >  443 [ACK] Seq=2960 Ack=3237 Win=13152 Len=0"
"2016-09-27 22:50:53.590969","54","59647  >  443 [ACK] Seq=2960 Ack=3238 Win=13152 Len=0"
