"2016-09-27 00:05:51.034896","74","53709  >  443 [SYN] Seq=0 Win=4380 Len=0 MSS=1460 SACK_PERM=1 TSval=52688345 TSecr=0 WS=16"
"2016-09-27 00:05:51.264255","54","53709  >  443 [ACK] Seq=1 Ack=1 Win=4384 Len=0"
"2016-09-27 00:05:51.419196","571","Client Hello"
"2016-09-27 00:05:51.644212","54","53709  >  443 [ACK] Seq=518 Ack=1461 Win=7312 Len=0"
"2016-09-27 00:05:51.646687","54","53709  >  443 [ACK] Seq=518 Ack=2921 Win=10224 Len=0"
"2016-09-27 00:05:51.646775","54","53709  >  443 [ACK] Seq=518 Ack=2976 Win=10224 Len=0"
"2016-09-27 00:05:51.657282","380","Client Key Exchange"
"2016-09-27 00:05:51.882967","54","53709  >  443 [ACK] Seq=844 Ack=3035 Win=10224 Len=0"
"2016-09-27 00:05:51.893867","1514","Application Data"
"2016-09-27 00:05:51.893983","396","Application Data"
"2016-09-27 00:05:52.115589","368","Application Data"
"2016-09-27 00:05:52.380975","54","53709  >  443 [ACK] Seq=2960 Ack=3200 Win=13152 Len=0"
"2016-09-27 00:05:53.588542","54","53709  >  443 [ACK] Seq=2960 Ack=3237 Win=13152 Len=0"
"2016-09-27 00:05:53.626963","54","53709  >  443 [ACK] Seq=2960 Ack=3238 Win=13152 Len=0"
"2016-09-27 00:20:51.012260","74","42467  >  443 [SYN] Seq=0 Win=4380 Len=0 MSS=1460 SACK_PERM=1 TSval=52918740 TSecr=0 WS=16"
"2016-09-27 00:20:51.234484","54","42467  >  443 [ACK] Seq=1 Ack=1 Win=4384 Len=0"
"2016-09-27 00:20:51.383715","571","Client Hello"
"2016-09-27 00:20:51.609825","54","42467  >  443 [ACK] Seq=518 Ack=1461 Win=7312 Len=0"
"2016-09-27 00:20:51.612961","54","42467  >  443 [ACK] Seq=518 Ack=2921 Win=10224 Len=0"
"2016-09-27 00:20:51.613062","54","42467  >  443 [ACK] Seq=518 Ack=2976 Win=10224 Len=0"
"2016-09-27 00:20:51.623894","380","Client Key Exchange"
"2016-09-27 00:20:51.808501","54","[TCP Dup ACK 27422#1] 42467  >  443 [ACK] Seq=844 Ack=2976 Win=10224 Len=0"
"2016-09-27 00:20:51.832919","54","[TCP Dup ACK 27422#2] 42467  >  443 [ACK] Seq=844 Ack=2976 Win=10224 Len=0"
"2016-09-27 00:20:51.833019","54","[TCP Dup ACK 27422#3] 42467  >  443 [ACK] Seq=844 Ack=2976 Win=10224 Len=0"
"2016-09-27 00:20:51.864943","54","42467  >  443 [ACK] Seq=844 Ack=2982 Win=10224 Len=0"
"2016-09-27 00:20:51.865047","54","42467  >  443 [ACK] Seq=844 Ack=3035 Win=10224 Len=0"
"2016-09-27 00:20:51.870655","1514","Application Data"
"2016-09-27 00:20:51.870753","396","Application Data"
"2016-09-27 00:20:52.097613","368","Application Data"
"2016-09-27 00:20:52.371440","54","42467  >  443 [ACK] Seq=2960 Ack=3200 Win=13152 Len=0"
"2016-09-27 00:20:53.339834","54","42467  >  443 [ACK] Seq=2960 Ack=3237 Win=13152 Len=0"
"2016-09-27 00:20:53.378465","54","42467  >  443 [ACK] Seq=2960 Ack=3238 Win=13152 Len=0"
"2016-09-27 00:35:50.822215","91","Encrypted Alert"
"2016-09-27 00:35:50.839555","54","42467  >  443 [RST"
"2016-09-27 02:35:51.002337","74","59871  >  443 [SYN] Seq=0 Win=4380 Len=0 MSS=1460 SACK_PERM=1 TSval=54992338 TSecr=0 WS=16"
"2016-09-27 02:35:51.224375","54","59871  >  443 [ACK] Seq=1 Ack=1 Win=4384 Len=0"
"2016-09-27 02:35:51.381618","571","Client Hello"
"2016-09-27 02:35:51.611789","54","59871  >  443 [ACK] Seq=518 Ack=1461 Win=7312 Len=0"
"2016-09-27 02:35:51.611896","54","59871  >  443 [ACK] Seq=518 Ack=2921 Win=10224 Len=0"
"2016-09-27 02:35:51.611961","54","59871  >  443 [ACK] Seq=518 Ack=2976 Win=10224 Len=0"
"2016-09-27 02:35:51.634534","380","Client Key Exchange"
"2016-09-27 02:35:51.869957","54","59871  >  443 [ACK] Seq=844 Ack=3035 Win=10224 Len=0"
"2016-09-27 02:35:51.872324","1514","Application Data"
"2016-09-27 02:35:51.873008","396","Application Data"
"2016-09-27 02:35:52.103362","368","Application Data"
"2016-09-27 02:35:52.412169","54","59871  >  443 [ACK] Seq=2960 Ack=3200 Win=13152 Len=0"
"2016-09-27 02:35:53.650143","54","59871  >  443 [ACK] Seq=2960 Ack=3237 Win=13152 Len=0"
"2016-09-27 02:35:53.688878","54","59871  >  443 [ACK] Seq=2960 Ack=3238 Win=13152 Len=0"
"2016-09-27 03:50:51.030805","74","54668  >  443 [SYN] Seq=0 Win=4380 Len=0 MSS=1460 SACK_PERM=1 TSval=56144343 TSecr=0 WS=16"
"2016-09-27 03:50:51.241737","54","54668  >  443 [ACK] Seq=1 Ack=1 Win=4384 Len=0"
"2016-09-27 03:50:51.381665","571","Client Hello"
"2016-09-27 03:50:51.593458","54","54668  >  443 [ACK] Seq=518 Ack=1461 Win=7312 Len=0"
"2016-09-27 03:50:51.593702","54","54668  >  443 [ACK] Seq=518 Ack=2921 Win=10224 Len=0"
"2016-09-27 03:50:51.594210","54","54668  >  443 [ACK] Seq=518 Ack=2976 Win=10224 Len=0"
"2016-09-27 03:50:51.621965","380","Client Key Exchange"
"2016-09-27 03:50:51.839383","54","54668  >  443 [ACK] Seq=844 Ack=3035 Win=10224 Len=0"
"2016-09-27 03:50:51.841745","1514","Application Data"
"2016-09-27 03:50:51.841870","396","Application Data"
"2016-09-27 03:50:52.049586","368","Application Data"
"2016-09-27 03:50:52.310937","54","54668  >  443 [ACK] Seq=2960 Ack=3200 Win=13152 Len=0"
"2016-09-27 03:50:53.408861","54","54668  >  443 [ACK] Seq=2960 Ack=3237 Win=13152 Len=0"
"2016-09-27 03:50:53.447625","54","54668  >  443 [ACK] Seq=2960 Ack=3238 Win=13152 Len=0"
"2016-09-27 04:05:50.822228","91","Encrypted Alert"
"2016-09-27 04:05:50.840749","54","54668  >  443 [RST"
"2016-09-27 06:05:53.689978","74","32920  >  443 [SYN] Seq=0 Win=4380 Len=0 MSS=1460 SACK_PERM=1 TSval=58218628 TSecr=0 WS=16"
"2016-09-27 06:05:53.913424","54","32920  >  443 [ACK] Seq=1 Ack=1 Win=4384 Len=0"
"2016-09-27 06:05:54.034674","571","Client Hello"
"2016-09-27 06:05:54.264348","54","32920  >  443 [ACK] Seq=518 Ack=1461 Win=7312 Len=0"
"2016-09-27 06:05:54.264460","54","32920  >  443 [ACK] Seq=518 Ack=2921 Win=10224 Len=0"
"2016-09-27 06:05:54.264819","54","32920  >  443 [ACK] Seq=518 Ack=2976 Win=10224 Len=0"
"2016-09-27 06:05:54.283480","380","Client Key Exchange"
"2016-09-27 06:05:54.522493","54","32920  >  443 [ACK] Seq=844 Ack=3035 Win=10224 Len=0"
"2016-09-27 06:05:54.546368","1514","Application Data"
"2016-09-27 06:05:54.546488","396","Application Data"
"2016-09-27 06:05:54.767856","368","Application Data"
"2016-09-27 06:05:55.052661","54","32920  >  443 [ACK] Seq=2960 Ack=3200 Win=13152 Len=0"
"2016-09-27 06:05:56.045230","54","32920  >  443 [ACK] Seq=2960 Ack=3237 Win=13152 Len=0"
"2016-09-27 06:05:56.083953","54","32920  >  443 [ACK] Seq=2960 Ack=3238 Win=13152 Len=0"
"2016-09-27 06:35:51.030198","74","33435  >  443 [SYN] Seq=0 Win=4380 Len=0 MSS=1460 SACK_PERM=1 TSval=58678745 TSecr=0 WS=16"
"2016-09-27 06:35:51.252438","54","33435  >  443 [ACK] Seq=1 Ack=1 Win=4384 Len=0"
"2016-09-27 06:35:51.394705","571","Client Hello"
"2016-09-27 06:35:51.616092","54","33435  >  443 [ACK] Seq=518 Ack=1461 Win=7312 Len=0"
"2016-09-27 06:35:51.617519","54","33435  >  443 [ACK] Seq=518 Ack=2921 Win=10224 Len=0"
"2016-09-27 06:35:51.619143","54","33435  >  443 [ACK] Seq=518 Ack=2976 Win=10224 Len=0"
"2016-09-27 06:35:51.629519","380","Client Key Exchange"
"2016-09-27 06:35:51.863521","54","33435  >  443 [ACK] Seq=844 Ack=3035 Win=10224 Len=0"
"2016-09-27 06:35:51.867003","1514","Application Data"
"2016-09-27 06:35:51.867117","396","Application Data"
"2016-09-27 06:35:52.096041","368","Application Data"
"2016-09-27 06:35:52.373546","54","33435  >  443 [ACK] Seq=2960 Ack=3200 Win=13152 Len=0"
"2016-09-27 06:35:53.490606","54","33435  >  443 [ACK] Seq=2960 Ack=3237 Win=13152 Len=0"
"2016-09-27 06:35:53.529387","54","33435  >  443 [ACK] Seq=2960 Ack=3238 Win=13152 Len=0"
"2016-09-27 07:50:55.293583","74","48269  >  443 [SYN] Seq=0 Win=4380 Len=0 MSS=1460 SACK_PERM=1 TSval=59831836 TSecr=0 WS=16"
"2016-09-27 07:50:55.504088","54","48269  >  443 [ACK] Seq=1 Ack=1 Win=4384 Len=0"
"2016-09-27 07:50:55.629784","571","Client Hello"
"2016-09-27 07:50:55.844405","54","48269  >  443 [ACK] Seq=518 Ack=1461 Win=7312 Len=0"
"2016-09-27 07:50:55.847612","54","48269  >  443 [ACK] Seq=518 Ack=2921 Win=10224 Len=0"
"2016-09-27 07:50:55.847700","54","48269  >  443 [ACK] Seq=518 Ack=2976 Win=10224 Len=0"
"2016-09-27 07:50:55.868555","380","Client Key Exchange"
"2016-09-27 07:50:56.090714","54","48269  >  443 [ACK] Seq=844 Ack=3035 Win=10224 Len=0"
"2016-09-27 07:50:56.106786","1514","Application Data"
"2016-09-27 07:50:56.107782","396","Application Data"
"2016-09-27 07:50:56.324777","368","Application Data"
"2016-09-27 07:50:56.590272","54","48269  >  443 [ACK] Seq=2960 Ack=3200 Win=13152 Len=0"
"2016-09-27 07:50:57.754267","54","48269  >  443 [ACK] Seq=2960 Ack=3237 Win=13152 Len=0"
"2016-09-27 07:50:57.792783","54","48269  >  443 [ACK] Seq=2960 Ack=3238 Win=13152 Len=0"
"2016-09-27 08:05:50.849865","91","Encrypted Alert"
"2016-09-27 08:05:50.868023","54","48269  >  443 [RST"
"2016-09-27 08:50:51.068270","74","42873  >  443 [SYN] Seq=0 Win=4380 Len=0 MSS=1460 SACK_PERM=1 TSval=60752354 TSecr=0 WS=16"
"2016-09-27 08:50:51.278775","54","42873  >  443 [ACK] Seq=1 Ack=1 Win=4384 Len=0"
"2016-09-27 08:50:51.416035","571","Client Hello"
"2016-09-27 08:50:51.631542","54","42873  >  443 [ACK] Seq=518 Ack=1461 Win=7312 Len=0"
"2016-09-27 08:50:51.631655","54","42873  >  443 [ACK] Seq=518 Ack=2921 Win=10224 Len=0"
"2016-09-27 08:50:51.635996","54","42873  >  443 [ACK] Seq=518 Ack=2976 Win=10224 Len=0"
"2016-09-27 08:50:51.647050","380","Client Key Exchange"
"2016-09-27 08:50:51.876744","54","42873  >  443 [ACK] Seq=844 Ack=3035 Win=10224 Len=0"
"2016-09-27 08:50:51.876871","1514","Application Data"
"2016-09-27 08:50:51.876939","396","Application Data"
"2016-09-27 08:50:52.087744","368","Application Data"
"2016-09-27 08:50:52.345222","54","42873  >  443 [ACK] Seq=2960 Ack=3200 Win=13152 Len=0"
"2016-09-27 08:50:53.603328","54","42873  >  443 [ACK] Seq=2960 Ack=3237 Win=13152 Len=0"
"2016-09-27 08:50:53.641820","54","42873  >  443 [ACK] Seq=2960 Ack=3238 Win=13152 Len=0"
"2016-09-27 09:05:50.855538","91","Encrypted Alert"
"2016-09-27 09:05:50.886767","54","42873  >  443 [RST"
"2016-09-27 09:20:51.105065","74","37933  >  443 [SYN] Seq=0 Win=4380 Len=0 MSS=1460 SACK_PERM=1 TSval=61213163 TSecr=0 WS=16"
"2016-09-27 09:20:51.326786","54","37933  >  443 [ACK] Seq=1 Ack=1 Win=4384 Len=0"
"2016-09-27 09:20:51.453107","571","Client Hello"
"2016-09-27 09:20:51.669548","54","37933  >  443 [ACK] Seq=518 Ack=1461 Win=7312 Len=0"
"2016-09-27 09:20:51.669779","54","37933  >  443 [ACK] Seq=518 Ack=2921 Win=10224 Len=0"
"2016-09-27 09:20:51.669868","54","37933  >  443 [ACK] Seq=518 Ack=2976 Win=10224 Len=0"
"2016-09-27 09:20:51.685257","380","Client Key Exchange"
"2016-09-27 09:20:51.915198","54","37933  >  443 [ACK] Seq=844 Ack=3035 Win=10224 Len=0"
"2016-09-27 09:20:51.916707","1514","Application Data"
"2016-09-27 09:20:51.918652","396","Application Data"
"2016-09-27 09:20:52.135442","368","Application Data"
"2016-09-27 09:20:52.398039","54","37933  >  443 [ACK] Seq=2960 Ack=3200 Win=13152 Len=0"
"2016-09-27 09:20:53.752786","54","37933  >  443 [ACK] Seq=2960 Ack=3237 Win=13152 Len=0"
"2016-09-27 09:20:53.764135","54","37933  >  443 [ACK] Seq=2960 Ack=3238 Win=13152 Len=0"
"2016-09-27 09:35:50.862785","91","Encrypted Alert"
"2016-09-27 09:35:50.881681","54","37933  >  443 [RST"
"2016-09-27 10:35:51.073398","74","51521  >  443 [SYN] Seq=0 Win=4380 Len=0 MSS=1460 SACK_PERM=1 TSval=62365153 TSecr=0 WS=16"
"2016-09-27 10:35:51.283899","54","51521  >  443 [ACK] Seq=1 Ack=1 Win=4384 Len=0"
"2016-09-27 10:35:51.429199","571","Client Hello"
"2016-09-27 10:35:51.647459","54","51521  >  443 [ACK] Seq=518 Ack=1461 Win=7312 Len=0"
"2016-09-27 10:35:51.651870","54","51521  >  443 [ACK] Seq=518 Ack=2921 Win=10224 Len=0"
"2016-09-27 10:35:51.651978","54","51521  >  443 [ACK] Seq=518 Ack=2976 Win=10224 Len=0"
"2016-09-27 10:35:51.678055","380","Client Key Exchange"
"2016-09-27 10:35:51.858496","54","[TCP Dup ACK 252829#1] 51521  >  443 [ACK] Seq=844 Ack=2976 Win=10224 Len=0"
"2016-09-27 10:35:51.858685","54","[TCP Dup ACK 252829#2] 51521  >  443 [ACK] Seq=844 Ack=2976 Win=10224 Len=0"
"2016-09-27 10:35:51.858780","54","[TCP Dup ACK 252829#3] 51521  >  443 [ACK] Seq=844 Ack=2976 Win=10224 Len=0"
"2016-09-27 10:35:51.905344","54","51521  >  443 [ACK] Seq=844 Ack=2982 Win=10224 Len=0"
"2016-09-27 10:35:51.907944","54","51521  >  443 [ACK] Seq=844 Ack=3035 Win=10224 Len=0"
"2016-09-27 10:35:51.908056","1514","Application Data"
"2016-09-27 10:35:51.908504","396","Application Data"
"2016-09-27 10:35:52.115812","368","Application Data"
"2016-09-27 10:35:52.377199","54","51521  >  443 [ACK] Seq=2960 Ack=3200 Win=13152 Len=0"
"2016-09-27 10:35:53.381667","54","51521  >  443 [ACK] Seq=2960 Ack=3237 Win=13152 Len=0"
"2016-09-27 10:35:53.420104","54","51521  >  443 [ACK] Seq=2960 Ack=3238 Win=13152 Len=0"
"2016-09-27 10:50:50.874007","91","Encrypted Alert"
"2016-09-27 10:50:50.908581","54","51521  >  443 [RST"
"2016-09-27 11:35:51.135953","74","42523  >  443 [SYN] Seq=0 Win=4380 Len=0 MSS=1460 SACK_PERM=1 TSval=63286768 TSecr=0 WS=16"
"2016-09-27 11:35:51.373278","54","42523  >  443 [ACK] Seq=1 Ack=1 Win=4384 Len=0"
"2016-09-27 11:35:51.488414","571","Client Hello"
"2016-09-27 11:35:51.709715","54","42523  >  443 [ACK] Seq=518 Ack=1461 Win=7312 Len=0"
"2016-09-27 11:35:51.711297","54","42523  >  443 [ACK] Seq=518 Ack=2921 Win=10224 Len=0"
"2016-09-27 11:35:51.711386","54","42523  >  443 [ACK] Seq=518 Ack=2976 Win=10224 Len=0"
"2016-09-27 11:35:51.722684","380","Client Key Exchange"
"2016-09-27 11:35:51.968686","54","42523  >  443 [ACK] Seq=844 Ack=3035 Win=10224 Len=0"
"2016-09-27 11:35:51.987716","1514","Application Data"
"2016-09-27 11:35:51.987834","396","Application Data"
"2016-09-27 11:35:52.214031","368","Application Data"
"2016-09-27 11:35:52.486262","54","42523  >  443 [ACK] Seq=2960 Ack=3200 Win=13152 Len=0"
"2016-09-27 11:35:53.607785","54","42523  >  443 [ACK] Seq=2960 Ack=3237 Win=13152 Len=0"
"2016-09-27 11:35:53.647976","54","42523  >  443 [ACK] Seq=2960 Ack=3238 Win=13152 Len=0"
"2016-09-27 11:50:50.879547","91","Encrypted Alert"
"2016-09-27 11:50:50.898470","54","42523  >  443 [RST"
"2016-09-27 12:35:51.139992","74","46935  >  443 [SYN] Seq=0 Win=4380 Len=0 MSS=1460 SACK_PERM=1 TSval=64208369 TSecr=0 WS=16"
"2016-09-27 12:35:51.352156","54","46935  >  443 [ACK] Seq=1 Ack=1 Win=4384 Len=0"
"2016-09-27 12:35:51.490200","571","Client Hello"
"2016-09-27 12:35:51.702198","54","46935  >  443 [ACK] Seq=518 Ack=1461 Win=7312 Len=0"
"2016-09-27 12:35:51.704508","54","46935  >  443 [ACK] Seq=518 Ack=2921 Win=10224 Len=0"
"2016-09-27 12:35:51.704613","54","46935  >  443 [ACK] Seq=518 Ack=2976 Win=10224 Len=0"
"2016-09-27 12:35:51.723049","380","Client Key Exchange"
"2016-09-27 12:35:51.948835","54","46935  >  443 [ACK] Seq=844 Ack=3035 Win=10224 Len=0"
"2016-09-27 12:35:51.950910","1514","Application Data"
"2016-09-27 12:35:51.951010","396","Application Data"
"2016-09-27 12:35:52.159641","368","Application Data"
"2016-09-27 12:35:52.431962","54","46935  >  443 [ACK] Seq=2960 Ack=3200 Win=13152 Len=0"
"2016-09-27 12:35:53.401015","54","46935  >  443 [ACK] Seq=2960 Ack=3237 Win=13152 Len=0"
"2016-09-27 12:35:53.439732","54","46935  >  443 [ACK] Seq=2960 Ack=3238 Win=13152 Len=0"
"2016-09-27 13:35:50.929769","74","38539  >  443 [SYN] Seq=0 Win=4380 Len=0 MSS=1460 SACK_PERM=1 TSval=65129917 TSecr=0 WS=16"
"2016-09-27 13:35:51.153873","54","38539  >  443 [ACK] Seq=1 Ack=1 Win=4384 Len=0"
"2016-09-27 13:35:51.284632","571","Client Hello"
"2016-09-27 13:35:51.552451","54","38539  >  443 [ACK] Seq=518 Ack=1461 Win=7312 Len=0"
"2016-09-27 13:35:51.553515","54","38539  >  443 [ACK] Seq=518 Ack=2921 Win=10224 Len=0"
"2016-09-27 13:35:51.553604","54","38539  >  443 [ACK] Seq=518 Ack=2976 Win=10224 Len=0"
"2016-09-27 13:35:51.565321","380","Client Key Exchange"
"2016-09-27 13:35:51.797277","54","38539  >  443 [ACK] Seq=844 Ack=3035 Win=10224 Len=0"
"2016-09-27 13:35:51.802487","1514","Application Data"
"2016-09-27 13:35:51.802609","396","Application Data"
"2016-09-27 13:35:52.030975","368","Application Data"
"2016-09-27 13:35:52.312796","54","38539  >  443 [ACK] Seq=2960 Ack=3200 Win=13152 Len=0"
"2016-09-27 13:35:53.659932","54","38539  >  443 [ACK] Seq=2960 Ack=3237 Win=13152 Len=0"
"2016-09-27 13:35:53.712862","54","38539  >  443 [ACK] Seq=2960 Ack=3238 Win=13152 Len=0"
"2016-09-27 13:50:50.870646","91","Encrypted Alert"
"2016-09-27 13:50:50.887700","54","38539  >  443 [RST"
"2016-09-27 14:35:51.205744","74","42691  >  443 [SYN] Seq=0 Win=4380 Len=0 MSS=1460 SACK_PERM=1 TSval=66051589 TSecr=0 WS=16"
"2016-09-27 14:35:51.427904","54","42691  >  443 [ACK] Seq=1 Ack=1 Win=4384 Len=0"
"2016-09-27 14:35:51.590941","571","Client Hello"
"2016-09-27 14:35:51.850245","54","42691  >  443 [ACK] Seq=518 Ack=1461 Win=7312 Len=0"
"2016-09-27 14:35:51.862215","54","42691  >  443 [ACK] Seq=518 Ack=2921 Win=10224 Len=0"
"2016-09-27 14:35:51.867883","54","42691  >  443 [ACK] Seq=518 Ack=2976 Win=10224 Len=0"
"2016-09-27 14:35:51.890775","380","Client Key Exchange"
"2016-09-27 14:35:53.403765","54","42691  >  443 [FIN"
"2016-09-27 14:35:53.632989","54","42691  >  443 [ACK] Seq=845 Ack=2984 Win=10224 Len=0"
"2016-09-27 14:36:03.446096","74","42692  >  443 [SYN] Seq=0 Win=4380 Len=0 MSS=1460 SACK_PERM=1 TSval=66054721 TSecr=0 WS=16"
"2016-09-27 14:36:03.662752","54","42692  >  443 [ACK] Seq=1 Ack=1 Win=4384 Len=0"
"2016-09-27 14:36:03.787942","571","Client Hello"
"2016-09-27 14:36:04.003166","54","42692  >  443 [ACK] Seq=518 Ack=1461 Win=7312 Len=0"
"2016-09-27 14:36:04.006277","54","42692  >  443 [ACK] Seq=518 Ack=2921 Win=10224 Len=0"
"2016-09-27 14:36:04.006367","54","42692  >  443 [ACK] Seq=518 Ack=2976 Win=10224 Len=0"
"2016-09-27 14:36:04.022682","380","Client Key Exchange"
"2016-09-27 14:36:04.241758","54","42692  >  443 [ACK] Seq=844 Ack=3035 Win=10224 Len=0"
"2016-09-27 14:36:04.245299","1514","Application Data"
"2016-09-27 14:36:04.245406","396","Application Data"
"2016-09-27 14:36:04.460958","368","Application Data"
"2016-09-27 14:36:04.721708","54","42692  >  443 [ACK] Seq=2960 Ack=3200 Win=13152 Len=0"
"2016-09-27 14:36:06.031191","54","42692  >  443 [ACK] Seq=2960 Ack=3237 Win=13152 Len=0"
"2016-09-27 14:36:06.069812","54","42692  >  443 [ACK] Seq=2960 Ack=3238 Win=13152 Len=0"
"2016-09-27 14:50:50.896324","91","Encrypted Alert"
"2016-09-27 14:50:50.914590","54","42692  >  443 [RST"
"2016-09-27 14:50:50.934365","74","38203  >  443 [SYN] Seq=0 Win=4380 Len=0 MSS=1460 SACK_PERM=1 TSval=66281917 TSecr=0 WS=16"
"2016-09-27 14:50:51.145399","54","38203  >  443 [ACK] Seq=1 Ack=1 Win=4384 Len=0"
"2016-09-27 14:50:51.271305","571","Client Hello"
"2016-09-27 14:50:51.486311","54","38203  >  443 [ACK] Seq=518 Ack=1461 Win=7312 Len=0"
"2016-09-27 14:50:51.486416","54","38203  >  443 [ACK] Seq=518 Ack=2921 Win=10224 Len=0"
"2016-09-27 14:50:51.486480","54","38203  >  443 [ACK] Seq=518 Ack=2976 Win=10224 Len=0"
"2016-09-27 14:50:51.503791","380","Client Key Exchange"
"2016-09-27 14:50:51.722459","54","38203  >  443 [ACK] Seq=844 Ack=3035 Win=10224 Len=0"
"2016-09-27 14:50:51.727639","1514","Application Data"
"2016-09-27 14:50:51.729275","396","Application Data"
"2016-09-27 14:50:51.954091","368","Application Data"
"2016-09-27 14:50:52.221640","54","38203  >  443 [ACK] Seq=2960 Ack=3200 Win=13152 Len=0"
"2016-09-27 14:50:53.290126","54","38203  >  443 [ACK] Seq=2960 Ack=3237 Win=13152 Len=0"
"2016-09-27 14:50:53.341721","54","38203  >  443 [ACK] Seq=2960 Ack=3238 Win=13152 Len=0"
"2016-09-27 15:05:50.878921","91","Encrypted Alert"
"2016-09-27 15:05:50.897223","54","38203  >  443 [RST"
"2016-09-27 15:05:50.920349","74","40083  >  443 [SYN] Seq=0 Win=4380 Len=0 MSS=1460 SACK_PERM=1 TSval=66512313 TSecr=0 WS=16"
"2016-09-27 15:05:51.144477","54","40083  >  443 [ACK] Seq=1 Ack=1 Win=4384 Len=0"
"2016-09-27 15:05:51.275174","571","Client Hello"
"2016-09-27 15:05:51.496862","54","40083  >  443 [ACK] Seq=518 Ack=1461 Win=7312 Len=0"
"2016-09-27 15:05:51.496953","54","40083  >  443 [ACK] Seq=518 Ack=2921 Win=10224 Len=0"
"2016-09-27 15:05:51.497019","54","40083  >  443 [ACK] Seq=518 Ack=2976 Win=10224 Len=0"
"2016-09-27 15:05:51.527303","380","Client Key Exchange"
"2016-09-27 15:05:51.755964","54","40083  >  443 [ACK] Seq=844 Ack=3035 Win=10224 Len=0"
"2016-09-27 15:05:51.761416","1514","Application Data"
"2016-09-27 15:05:51.761518","396","Application Data"
"2016-09-27 15:05:51.976679","368","Application Data"
"2016-09-27 15:05:52.240289","54","40083  >  443 [ACK] Seq=2960 Ack=3200 Win=13152 Len=0"
"2016-09-27 15:05:53.232495","54","40083  >  443 [ACK] Seq=2960 Ack=3237 Win=13152 Len=0"
"2016-09-27 15:05:53.269123","54","40083  >  443 [ACK] Seq=2960 Ack=3238 Win=13152 Len=0"
"2016-09-27 15:20:50.888305","91","Encrypted Alert"
"2016-09-27 15:20:50.907892","54","40083  >  443 [RST"
"2016-09-27 15:20:50.917217","74","53811  >  443 [SYN] Seq=0 Win=4380 Len=0 MSS=1460 SACK_PERM=1 TSval=66742713 TSecr=0 WS=16"
"2016-09-27 15:20:51.127748","54","53811  >  443 [ACK] Seq=1 Ack=1 Win=4384 Len=0"
"2016-09-27 15:20:51.253688","571","Client Hello"
"2016-09-27 15:20:51.469028","54","53811  >  443 [ACK] Seq=518 Ack=1461 Win=7312 Len=0"
"2016-09-27 15:20:51.469170","54","53811  >  443 [ACK] Seq=518 Ack=2921 Win=10224 Len=0"
"2016-09-27 15:20:51.469241","54","53811  >  443 [ACK] Seq=518 Ack=2976 Win=10224 Len=0"
"2016-09-27 15:20:51.482526","380","Client Key Exchange"
"2016-09-27 15:20:51.704096","54","53811  >  443 [ACK] Seq=844 Ack=3035 Win=10224 Len=0"
"2016-09-27 15:20:51.707207","1514","Application Data"
"2016-09-27 15:20:51.707631","396","Application Data"
"2016-09-27 15:20:51.927891","368","Application Data"
"2016-09-27 15:20:52.186073","54","53811  >  443 [ACK] Seq=2960 Ack=3200 Win=13152 Len=0"
"2016-09-27 15:20:53.390232","54","53811  >  443 [ACK] Seq=2960 Ack=3237 Win=13152 Len=0"
"2016-09-27 15:20:53.428604","54","53811  >  443 [ACK] Seq=2960 Ack=3238 Win=13152 Len=0"
"2016-09-27 15:35:50.866095","91","Encrypted Alert"
"2016-09-27 15:35:50.896904","54","53811  >  443 [RST"
"2016-09-27 16:35:51.095254","74","40351  >  443 [SYN] Seq=0 Win=4380 Len=0 MSS=1460 SACK_PERM=1 TSval=67894759 TSecr=0 WS=16"
"2016-09-27 16:35:51.306404","54","40351  >  443 [ACK] Seq=1 Ack=1 Win=4384 Len=0"
"2016-09-27 16:35:51.467734","571","Client Hello"
"2016-09-27 16:35:51.683081","54","40351  >  443 [ACK] Seq=518 Ack=1461 Win=7312 Len=0"
"2016-09-27 16:35:51.683198","54","40351  >  443 [ACK] Seq=518 Ack=2921 Win=10224 Len=0"
"2016-09-27 16:35:51.684581","54","40351  >  443 [ACK] Seq=518 Ack=2976 Win=10224 Len=0"
"2016-09-27 16:35:51.719805","380","Client Key Exchange"
"2016-09-27 16:35:51.943429","54","40351  >  443 [ACK] Seq=844 Ack=3035 Win=10224 Len=0"
"2016-09-27 16:35:51.944638","1514","Application Data"
"2016-09-27 16:35:51.944737","396","Application Data"
"2016-09-27 16:35:52.161253","368","Application Data"
"2016-09-27 16:35:52.422572","54","40351  >  443 [ACK] Seq=2960 Ack=3200 Win=13152 Len=0"
"2016-09-27 16:35:53.766714","54","40351  >  443 [ACK] Seq=2960 Ack=3237 Win=13152 Len=0"
"2016-09-27 16:35:53.805391","54","40351  >  443 [ACK] Seq=2960 Ack=3238 Win=13152 Len=0"
"2016-09-27 16:50:50.890252","91","Encrypted Alert"
"2016-09-27 16:50:50.908453","54","40351  >  443 [RST"
"2016-09-27 19:35:51.076427","74","43229  >  443 [SYN] Seq=0 Win=4380 Len=0 MSS=1460 SACK_PERM=1 TSval=70659556 TSecr=0 WS=16"
"2016-09-27 19:35:51.287532","54","43229  >  443 [ACK] Seq=1 Ack=1 Win=4384 Len=0"
"2016-09-27 19:35:51.427632","571","Client Hello"
"2016-09-27 19:35:51.673181","54","43229  >  443 [ACK] Seq=518 Ack=1461 Win=7312 Len=0"
"2016-09-27 19:35:51.673292","54","43229  >  443 [ACK] Seq=518 Ack=2921 Win=10224 Len=0"
"2016-09-27 19:35:51.673357","54","43229  >  443 [ACK] Seq=518 Ack=2976 Win=10224 Len=0"
"2016-09-27 19:35:51.686375","380","Client Key Exchange"
"2016-09-27 19:35:51.899685","54","43229  >  443 [ACK] Seq=844 Ack=3035 Win=10224 Len=0"
"2016-09-27 19:35:51.902202","1514","Application Data"
"2016-09-27 19:35:51.902295","396","Application Data"
"2016-09-27 19:35:52.117880","368","Application Data"
"2016-09-27 19:35:52.391451","54","43229  >  443 [ACK] Seq=2960 Ack=3200 Win=13152 Len=0"
"2016-09-27 19:35:53.360292","54","43229  >  443 [ACK] Seq=2960 Ack=3237 Win=13152 Len=0"
"2016-09-27 19:35:53.398819","54","43229  >  443 [ACK] Seq=2960 Ack=3238 Win=13152 Len=0"
"2016-09-27 19:50:50.922112","91","Encrypted Alert"
"2016-09-27 19:50:50.938709","54","43229  >  443 [RST"
"2016-09-27 19:50:51.112201","74","42277  >  443 [SYN] Seq=0 Win=4380 Len=0 MSS=1460 SACK_PERM=1 TSval=70889963 TSecr=0 WS=16"
"2016-09-27 19:50:51.334698","54","42277  >  443 [ACK] Seq=1 Ack=1 Win=4384 Len=0"
"2016-09-27 19:50:51.463758","571","Client Hello"
"2016-09-27 19:50:51.674768","54","42277  >  443 [ACK] Seq=518 Ack=1461 Win=7312 Len=0"
"2016-09-27 19:50:51.678010","54","42277  >  443 [ACK] Seq=518 Ack=2921 Win=10224 Len=0"
"2016-09-27 19:50:51.678097","54","42277  >  443 [ACK] Seq=518 Ack=2976 Win=10224 Len=0"
"2016-09-27 19:50:51.694787","380","Client Key Exchange"
"2016-09-27 19:50:51.921069","54","42277  >  443 [ACK] Seq=844 Ack=3035 Win=10224 Len=0"
"2016-09-27 19:50:51.932134","1514","Application Data"
"2016-09-27 19:50:51.932246","396","Application Data"
"2016-09-27 19:50:52.143044","368","Application Data"
"2016-09-27 19:50:52.405724","54","42277  >  443 [ACK] Seq=2960 Ack=3200 Win=13152 Len=0"
"2016-09-27 19:50:53.373572","54","42277  >  443 [ACK] Seq=2960 Ack=3237 Win=13152 Len=0"
"2016-09-27 19:50:53.413021","54","42277  >  443 [ACK] Seq=2960 Ack=3238 Win=13152 Len=0"
"2016-09-27 20:05:50.901174","91","Encrypted Alert"
"2016-09-27 20:05:50.936503","54","42277  >  443 [RST"
"2016-09-27 22:35:51.111838","74","59779  >  443 [SYN] Seq=0 Win=4380 Len=0 MSS=1460 SACK_PERM=1 TSval=73424365 TSecr=0 WS=16"
"2016-09-27 22:35:51.322891","54","59779  >  443 [ACK] Seq=1 Ack=1 Win=4384 Len=0"
"2016-09-27 22:35:51.448752","571","Client Hello"
"2016-09-27 22:35:51.662877","54","59779  >  443 [ACK] Seq=518 Ack=1461 Win=7312 Len=0"
"2016-09-27 22:35:51.662994","54","59779  >  443 [ACK] Seq=518 Ack=2921 Win=10224 Len=0"
"2016-09-27 22:35:51.663059","54","59779  >  443 [ACK] Seq=518 Ack=2976 Win=10224 Len=0"
"2016-09-27 22:35:51.691956","380","Client Key Exchange"
"2016-09-27 22:35:51.909003","54","59779  >  443 [ACK] Seq=844 Ack=3035 Win=10224 Len=0"
"2016-09-27 22:35:51.915130","1514","Application Data"
"2016-09-27 22:35:51.915597","396","Application Data"
"2016-09-27 22:35:52.130984","368","Application Data"
"2016-09-27 22:35:52.392346","54","59779  >  443 [ACK] Seq=2960 Ack=3200 Win=13152 Len=0"
"2016-09-27 22:35:53.666197","54","59779  >  443 [ACK] Seq=2960 Ack=3237 Win=13152 Len=0"
"2016-09-27 22:35:53.704820","54","59779  >  443 [ACK] Seq=2960 Ack=3238 Win=13152 Len=0"
"2016-09-27 22:50:50.928700","91","Encrypted Alert"
"2016-09-27 22:50:50.948168","54","59779  >  443 [RST"
