"2016-09-26 23:03:47.478139","97","Encrypted Alert"
"2016-09-26 23:03:47.501118","66","45417  >  443 [FIN"
"2016-09-26 23:03:47.918245","74","39830  >  443 [SYN] Seq=0 Win=4380 Len=0 MSS=1460 SACK_PERM=1 TSval=51735228 TSecr=0 WS=16"
"2016-09-26 23:03:48.139505","66","39830  >  443 [ACK] Seq=1 Ack=1 Win=4384 Len=0 TSval=51735285 TSecr=1177814475"
"2016-09-26 23:03:48.179456","97","[TCP Retransmission] 45417  >  443 [FIN"
"2016-09-26 23:03:48.242853","583","Client Hello"
"2016-09-26 23:03:48.470810","66","39830  >  443 [ACK] Seq=518 Ack=1419 Win=7216 Len=0 TSval=51735369 TSecr=1177814800"
"2016-09-26 23:03:48.470929","66","39830  >  443 [ACK] Seq=518 Ack=2837 Win=10064 Len=0 TSval=51735369 TSecr=1177814800"
"2016-09-26 23:03:48.470993","66","39830  >  443 [ACK] Seq=518 Ack=4097 Win=12896 Len=0 TSval=51735369 TSecr=1177814800"
"2016-09-26 23:03:48.693893","66","39830  >  443 [ACK] Seq=518 Ack=4720 Win=15728 Len=0 TSval=51735426 TSecr=1177815027"
"2016-09-26 23:03:48.716067","192","Client Key Exchange"
"2016-09-26 23:03:48.937866","158","Application Data"
"2016-09-26 23:03:49.455590","66","39830  >  443 [ACK] Seq=736 Ack=5529 Win=18560 Len=0 TSval=51735622 TSecr=1177815758"
"2016-09-26 23:03:49.588382","97","[TCP Retransmission] 45417  >  443 [FIN"
"2016-09-26 23:03:52.408734","97","[TCP Retransmission] 45417  >  443 [FIN"
"2016-09-26 23:03:58.041590","97","[TCP Retransmission] 45417  >  443 [FIN"
"2016-09-26 23:04:09.307177","97","[TCP Retransmission] 45417  >  443 [FIN"
"2016-09-26 23:04:31.869627","97","[TCP Retransmission] 45417  >  443 [FIN"
"2016-09-26 23:05:16.932852","97","[TCP Retransmission] 45417  >  443 [FIN"
"2016-09-26 23:07:49.997934","66","39830  >  443 [ACK] Seq=736 Ack=5530 Win=18560 Len=0 TSval=51797201 TSecr=1178056302"
"2016-09-27 00:17:39.090068","97","Encrypted Alert"
"2016-09-27 00:17:39.123864","66","39830  >  443 [FIN"
"2016-09-27 00:17:39.512828","74","49711  >  443 [SYN] Seq=0 Win=4380 Len=0 MSS=1460 SACK_PERM=1 TSval=52869716 TSecr=0 WS=16"
"2016-09-27 00:17:39.677438","97","[TCP Retransmission] 39830  >  443 [FIN"
"2016-09-27 00:17:39.723097","66","49711  >  443 [ACK] Seq=1 Ack=1 Win=4384 Len=0 TSval=52869770 TSecr=1366913488"
"2016-09-27 00:17:39.842226","583","Client Hello"
"2016-09-27 00:17:40.063568","66","49711  >  443 [ACK] Seq=518 Ack=1419 Win=7216 Len=0 TSval=52869857 TSecr=1366913819"
"2016-09-27 00:17:40.063672","66","49711  >  443 [ACK] Seq=518 Ack=2837 Win=10064 Len=0 TSval=52869857 TSecr=1366913819"
"2016-09-27 00:17:40.064133","66","49711  >  443 [ACK] Seq=518 Ack=4097 Win=12896 Len=0 TSval=52869857 TSecr=1366913819"
"2016-09-27 00:17:40.277485","66","49711  >  443 [ACK] Seq=518 Ack=4720 Win=15728 Len=0 TSval=52869911 TSecr=1366914039"
"2016-09-27 00:17:40.303808","192","Client Key Exchange"
"2016-09-27 00:17:40.521418","158","Application Data"
"2016-09-27 00:17:40.851741","97","[TCP Retransmission] 39830  >  443 [FIN"
"2016-09-27 00:17:41.168111","66","49711  >  443 [ACK] Seq=736 Ack=5529 Win=18560 Len=0 TSval=52870140 TSecr=1366914889"
"2016-09-27 00:17:43.199400","97","[TCP Retransmission] 39830  >  443 [FIN"
"2016-09-27 00:17:47.902499","97","[TCP Retransmission] 39830  >  443 [FIN"
"2016-09-27 00:17:57.308794","97","[TCP Retransmission] 39830  >  443 [FIN"
"2016-09-27 00:18:16.121277","97","[TCP Retransmission] 39830  >  443 [FIN"
"2016-09-27 00:18:53.683650","97","[TCP Retransmission] 39830  >  443 [FIN"
"2016-09-27 00:21:41.171393","66","49711  >  443 [ACK] Seq=736 Ack=5530 Win=18560 Len=0 TSval=52931581 TSecr=1367154889"
"2016-09-27 01:33:40.548518","97","Encrypted Alert"
"2016-09-27 01:33:40.570734","66","49711  >  443 [FIN"
"2016-09-27 01:33:40.718104","74","45635  >  443 [SYN] Seq=0 Win=4380 Len=0 MSS=1460 SACK_PERM=1 TSval=54037385 TSecr=0 WS=16"
"2016-09-27 01:33:40.937808","66","45635  >  443 [ACK] Seq=1 Ack=1 Win=4384 Len=0 TSval=54037442 TSecr=2106890619"
"2016-09-27 01:33:41.054918","583","Client Hello"
"2016-09-27 01:33:41.113351","97","[TCP Retransmission] 49711  >  443 [FIN"
"2016-09-27 01:33:41.278247","66","45635  >  443 [ACK] Seq=518 Ack=1419 Win=7216 Len=0 TSval=54037529 TSecr=2106890957"
"2016-09-27 01:33:41.278891","66","45635  >  443 [ACK] Seq=518 Ack=2837 Win=10064 Len=0 TSval=54037529 TSecr=2106890957"
"2016-09-27 01:33:41.278984","66","45635  >  443 [ACK] Seq=518 Ack=4097 Win=12896 Len=0 TSval=54037529 TSecr=2106890957"
"2016-09-27 01:33:41.500296","66","45635  >  443 [ACK] Seq=518 Ack=4720 Win=15728 Len=0 TSval=54037586 TSecr=2106891179"
"2016-09-27 01:33:41.541322","192","Client Key Exchange"
"2016-09-27 01:33:41.759643","66","45635  >  443 [ACK] Seq=644 Ack=4771 Win=15728 Len=0 TSval=54037652 TSecr=2106891443"
"2016-09-27 01:33:41.761011","158","Application Data"
"2016-09-27 01:33:42.189093","66","45635  >  443 [ACK] Seq=736 Ack=5529 Win=18560 Len=0 TSval=54037761 TSecr=2106891827"
"2016-09-27 01:33:42.250898","97","[TCP Retransmission] 49711  >  443 [FIN"
"2016-09-27 01:33:44.523394","97","[TCP Retransmission] 49711  >  443 [FIN"
"2016-09-27 01:33:49.070408","97","[TCP Retransmission] 49711  >  443 [FIN"
"2016-09-27 01:33:58.149386","97","[TCP Retransmission] 49711  >  443 [FIN"
"2016-09-27 01:34:16.305074","97","[TCP Retransmission] 49711  >  443 [FIN"
"2016-09-27 01:34:52.679513","97","[TCP Retransmission] 49711  >  443 [FIN"
"2016-09-27 01:37:42.714225","66","45635  >  443 [ACK] Seq=736 Ack=5530 Win=18560 Len=0 TSval=54099337 TSecr=2107132363"
"2016-09-27 02:46:26.920823","97","Encrypted Alert"
"2016-09-27 02:46:26.935248","66","45635  >  443 [FIN"
"2016-09-27 02:46:27.340336","74","35462  >  443 [SYN] Seq=0 Win=4380 Len=0 MSS=1460 SACK_PERM=1 TSval=55155241 TSecr=0 WS=16"
"2016-09-27 02:46:27.503387","97","[TCP Retransmission] 45635  >  443 [FIN"
"2016-09-27 02:46:27.562215","66","35462  >  443 [ACK] Seq=1 Ack=1 Win=4384 Len=0 TSval=55155298 TSecr=1104707662"
"2016-09-27 02:46:27.676739","583","Client Hello"
"2016-09-27 02:46:27.891347","66","35462  >  443 [ACK] Seq=518 Ack=1419 Win=7216 Len=0 TSval=55155382 TSecr=1104708000"
"2016-09-27 02:46:27.891453","66","35462  >  443 [ACK] Seq=518 Ack=2837 Win=10064 Len=0 TSval=55155382 TSecr=1104708000"
"2016-09-27 02:46:27.891515","66","35462  >  443 [ACK] Seq=518 Ack=4097 Win=12896 Len=0 TSval=55155382 TSecr=1104708000"
"2016-09-27 02:46:28.116689","66","35462  >  443 [ACK] Seq=518 Ack=4720 Win=15728 Len=0 TSval=55155439 TSecr=1104708213"
"2016-09-27 02:46:28.140518","192","Client Key Exchange"
"2016-09-27 02:46:28.360697","158","Application Data"
"2016-09-27 02:46:28.679063","97","[TCP Retransmission] 45635  >  443 [FIN"
"2016-09-27 02:46:28.867177","66","35462  >  443 [ACK] Seq=736 Ack=5529 Win=18560 Len=0 TSval=55155632 TSecr=1104708934"
"2016-09-27 02:46:31.030813","97","[TCP Retransmission] 45635  >  443 [FIN"
"2016-09-27 02:46:35.726082","97","[TCP Retransmission] 45635  >  443 [FIN"
"2016-09-27 02:46:45.116550","97","[TCP Retransmission] 45635  >  443 [FIN"
"2016-09-27 02:47:03.929120","97","[TCP Retransmission] 45635  >  443 [FIN"
"2016-09-27 02:47:41.554879","97","[TCP Retransmission] 45635  >  443 [FIN"
"2016-09-27 02:50:28.881499","66","35462  >  443 [ACK] Seq=736 Ack=5530 Win=18560 Len=0 TSval=55217076 TSecr=1104948942"
"2016-09-27 03:52:39.648540","97","Encrypted Alert"
"2016-09-27 03:52:39.677134","66","35462  >  443 [FIN"
"2016-09-27 03:52:40.066053","74","47830  >  443 [SYN] Seq=0 Win=4380 Len=0 MSS=1460 SACK_PERM=1 TSval=56172256 TSecr=0 WS=16"
"2016-09-27 03:52:40.236418","97","[TCP Retransmission] 35462  >  443 [FIN"
"2016-09-27 03:52:40.275763","66","47830  >  443 [ACK] Seq=1 Ack=1 Win=4384 Len=0 TSval=56172310 TSecr=2135905057"
"2016-09-27 03:52:40.396103","583","Client Hello"
"2016-09-27 03:52:40.616217","66","47830  >  443 [ACK] Seq=518 Ack=1419 Win=7216 Len=0 TSval=56172397 TSecr=2135905388"
"2016-09-27 03:52:40.616682","66","47830  >  443 [ACK] Seq=518 Ack=2837 Win=10064 Len=0 TSval=56172397 TSecr=2135905388"
"2016-09-27 03:52:40.616772","66","47830  >  443 [ACK] Seq=518 Ack=4097 Win=12896 Len=0 TSval=56172397 TSecr=2135905388"
"2016-09-27 03:52:40.827297","66","47830  >  443 [ACK] Seq=518 Ack=4720 Win=15728 Len=0 TSval=56172451 TSecr=2135905607"
"2016-09-27 03:52:40.870361","192","Client Key Exchange"
"2016-09-27 03:52:41.085391","66","47830  >  443 [ACK] Seq=644 Ack=4771 Win=15728 Len=0 TSval=56172517 TSecr=2135905862"
"2016-09-27 03:52:41.086313","158","Application Data"
"2016-09-27 03:52:41.419995","97","[TCP Retransmission] 35462  >  443 [FIN"
"2016-09-27 03:52:41.890884","66","47830  >  443 [ACK] Seq=736 Ack=5529 Win=18560 Len=0 TSval=56172722 TSecr=2135906621"
"2016-09-27 03:52:43.783321","97","[TCP Retransmission] 35462  >  443 [FIN"
"2016-09-27 03:52:48.517569","97","[TCP Retransmission] 35462  >  443 [FIN"
"2016-09-27 03:52:57.979694","97","[TCP Retransmission] 35462  >  443 [FIN"
"2016-09-27 03:53:16.879801","97","[TCP Retransmission] 35462  >  443 [FIN"
"2016-09-27 03:53:54.691362","97","[TCP Retransmission] 35462  >  443 [FIN"
"2016-09-27 03:56:42.399701","66","47830  >  443 [ACK] Seq=736 Ack=5530 Win=18560 Len=0 TSval=56234294 TSecr=2136147140"
"2016-09-27 05:08:12.799361","97","Encrypted Alert"
"2016-09-27 05:08:12.818733","66","47830  >  443 [FIN"
"2016-09-27 05:08:13.188884","74","52157  >  443 [SYN] Seq=0 Win=4380 Len=0 MSS=1460 SACK_PERM=1 TSval=57332738 TSecr=0 WS=16"
"2016-09-27 05:08:13.359891","97","[TCP Retransmission] 47830  >  443 [FIN"
"2016-09-27 05:08:13.410906","66","52157  >  443 [ACK] Seq=1 Ack=1 Win=4384 Len=0 TSval=57332795 TSecr=1473156256"
"2016-09-27 05:08:13.533304","583","Client Hello"
"2016-09-27 05:08:13.751330","66","52157  >  443 [ACK] Seq=518 Ack=1419 Win=7216 Len=0 TSval=57332882 TSecr=1473156602"
"2016-09-27 05:08:13.752161","66","52157  >  443 [ACK] Seq=518 Ack=2837 Win=10064 Len=0 TSval=57332882 TSecr=1473156602"
"2016-09-27 05:08:13.752252","66","52157  >  443 [ACK] Seq=518 Ack=4097 Win=12896 Len=0 TSval=57332882 TSecr=1473156602"
"2016-09-27 05:08:13.976444","66","52157  >  443 [ACK] Seq=518 Ack=4720 Win=15728 Len=0 TSval=57332939 TSecr=1473156818"
"2016-09-27 05:08:14.011579","192","Client Key Exchange"
"2016-09-27 05:08:14.232719","158","Application Data"
"2016-09-27 05:08:14.489033","97","[TCP Retransmission] 47830  >  443 [FIN"
"2016-09-27 05:08:14.857031","66","52157  >  443 [ACK] Seq=736 Ack=5529 Win=18560 Len=0 TSval=57333165 TSecr=1473157666"
"2016-09-27 05:08:16.742837","97","[TCP Retransmission] 47830  >  443 [FIN"
"2016-09-27 05:08:21.258462","97","[TCP Retransmission] 47830  >  443 [FIN"
"2016-09-27 05:08:30.273978","97","[TCP Retransmission] 47830  >  443 [FIN"
"2016-09-27 05:08:48.305148","97","[TCP Retransmission] 47830  >  443 [FIN"
"2016-09-27 05:09:24.429930","97","[TCP Retransmission] 47830  >  443 [FIN"
"2016-09-27 05:12:15.395853","66","52157  >  443 [ACK] Seq=736 Ack=5530 Win=18560 Len=0 TSval=57394743 TSecr=1473398205"
"2016-09-27 06:19:53.765565","97","Encrypted Alert"
"2016-09-27 06:19:53.800132","66","52157  >  443 [FIN"
"2016-09-27 06:19:54.224888","74","56181  >  443 [SYN] Seq=0 Win=4380 Len=0 MSS=1460 SACK_PERM=1 TSval=58433802 TSecr=0 WS=16"
"2016-09-27 06:19:54.354588","97","[TCP Retransmission] 52157  >  443 [FIN"
"2016-09-27 06:19:54.447047","66","56181  >  443 [ACK] Seq=1 Ack=1 Win=4384 Len=0 TSval=58433859 TSecr=1451726940"
"2016-09-27 06:19:54.578447","583","Client Hello"
"2016-09-27 06:19:54.798955","66","56181  >  443 [ACK] Seq=518 Ack=1419 Win=7216 Len=0 TSval=58433949 TSecr=1451727295"
"2016-09-27 06:19:54.799969","66","56181  >  443 [ACK] Seq=518 Ack=2837 Win=10064 Len=0 TSval=58433949 TSecr=1451727295"
"2016-09-27 06:19:54.800065","66","56181  >  443 [ACK] Seq=518 Ack=4097 Win=12896 Len=0 TSval=58433949 TSecr=1451727295"
"2016-09-27 06:19:55.022822","66","56181  >  443 [ACK] Seq=518 Ack=4720 Win=15728 Len=0 TSval=58434006 TSecr=1451727514"
"2016-09-27 06:19:55.049057","192","Client Key Exchange"
"2016-09-27 06:19:55.269242","158","Application Data"
"2016-09-27 06:19:55.536492","97","[TCP Retransmission] 52157  >  443 [FIN"
"2016-09-27 06:19:55.693229","66","56181  >  443 [ACK] Seq=736 Ack=5529 Win=18560 Len=0 TSval=58434178 TSecr=1451728148"
"2016-09-27 06:19:57.903678","97","[TCP Retransmission] 52157  >  443 [FIN"
"2016-09-27 06:20:02.638015","97","[TCP Retransmission] 52157  >  443 [FIN"
"2016-09-27 06:20:12.091180","97","[TCP Retransmission] 52157  >  443 [FIN"
"2016-09-27 06:20:30.998142","97","[TCP Retransmission] 52157  >  443 [FIN"
"2016-09-27 06:21:08.809955","97","[TCP Retransmission] 52157  >  443 [FIN"
"2016-09-27 06:23:55.691798","66","56181  >  443 [ACK] Seq=736 Ack=5530 Win=18560 Len=0 TSval=58495618 TSecr=1451968149"
"2016-09-27 07:29:36.069715","97","Encrypted Alert"
"2016-09-27 07:29:36.083830","66","56181  >  443 [FIN"
"2016-09-27 07:29:36.480177","74","49260  >  443 [SYN] Seq=0 Win=4380 Len=0 MSS=1460 SACK_PERM=1 TSval=59504460 TSecr=0 WS=16"
"2016-09-27 07:29:36.655056","97","[TCP Retransmission] 56181  >  443 [FIN"
"2016-09-27 07:29:36.702170","66","49260  >  443 [ACK] Seq=1 Ack=1 Win=4384 Len=0 TSval=59504517 TSecr=1556395392"
"2016-09-27 07:29:36.821455","583","Client Hello"
"2016-09-27 07:29:37.042603","66","49260  >  443 [ACK] Seq=518 Ack=1419 Win=7216 Len=0 TSval=59504604 TSecr=1556395734"
"2016-09-27 07:29:37.043190","66","49260  >  443 [ACK] Seq=518 Ack=2837 Win=10064 Len=0 TSval=59504604 TSecr=1556395734"
"2016-09-27 07:29:37.043279","66","49260  >  443 [ACK] Seq=518 Ack=4097 Win=12896 Len=0 TSval=59504604 TSecr=1556395734"
"2016-09-27 07:29:37.256582","66","49260  >  443 [ACK] Seq=518 Ack=4720 Win=15728 Len=0 TSval=59504658 TSecr=1556395954"
"2016-09-27 07:29:37.295580","192","Client Key Exchange"
"2016-09-27 07:29:37.512295","66","49260  >  443 [ACK] Seq=644 Ack=4771 Win=15728 Len=0 TSval=59504724 TSecr=1556396207"
"2016-09-27 07:29:37.512447","158","Application Data"
"2016-09-27 07:29:37.830822","97","[TCP Retransmission] 56181  >  443 [FIN"
"2016-09-27 07:29:37.924653","66","49260  >  443 [ACK] Seq=736 Ack=5529 Win=18560 Len=0 TSval=59504830 TSecr=1556396584"
"2016-09-27 07:29:40.182373","97","[TCP Retransmission] 56181  >  443 [FIN"
"2016-09-27 07:29:44.885400","97","[TCP Retransmission] 56181  >  443 [FIN"
"2016-09-27 07:29:54.276837","97","[TCP Retransmission] 56181  >  443 [FIN"
"2016-09-27 07:30:13.057532","97","[TCP Retransmission] 56181  >  443 [FIN"
"2016-09-27 07:30:50.682473","97","[TCP Retransmission] 56181  >  443 [FIN"
"2016-09-27 07:33:37.925136","66","49260  >  443 [ACK] Seq=736 Ack=5530 Win=18560 Len=0 TSval=59566269 TSecr=1556636587"
"2016-09-27 08:38:50.388209","97","Encrypted Alert"
"2016-09-27 08:38:50.417942","66","49260  >  443 [FIN"
"2016-09-27 08:38:50.906070","74","40097  >  443 [SYN] Seq=0 Win=4380 Len=0 MSS=1460 SACK_PERM=1 TSval=60567992 TSecr=0 WS=16"
"2016-09-27 08:38:50.976184","97","[TCP Retransmission] 49260  >  443 [FIN"
"2016-09-27 08:38:51.128321","66","40097  >  443 [ACK] Seq=1 Ack=1 Win=4384 Len=0 TSval=60568049 TSecr=1572243402"
"2016-09-27 08:38:51.232171","583","Client Hello"
"2016-09-27 08:38:51.448588","66","40097  >  443 [ACK] Seq=518 Ack=1419 Win=7216 Len=0 TSval=60568131 TSecr=1572243730"
"2016-09-27 08:38:51.449301","66","40097  >  443 [ACK] Seq=518 Ack=2837 Win=10064 Len=0 TSval=60568131 TSecr=1572243730"
"2016-09-27 08:38:51.449394","66","40097  >  443 [ACK] Seq=518 Ack=4097 Win=12896 Len=0 TSval=60568131 TSecr=1572243730"
"2016-09-27 08:38:51.663811","66","40097  >  443 [ACK] Seq=518 Ack=4720 Win=15728 Len=0 TSval=60568186 TSecr=1572243945"
"2016-09-27 08:38:51.690926","192","Client Key Exchange"
"2016-09-27 08:38:51.910721","158","Application Data"
"2016-09-27 08:38:52.158983","97","[TCP Retransmission] 49260  >  443 [FIN"
"2016-09-27 08:38:52.627762","66","40097  >  443 [ACK] Seq=736 Ack=5529 Win=18560 Len=0 TSval=60568433 TSecr=1572244865"
"2016-09-27 08:38:54.522307","97","[TCP Retransmission] 49260  >  443 [FIN"
"2016-09-27 08:38:59.248845","97","[TCP Retransmission] 49260  >  443 [FIN"
"2016-09-27 08:39:08.718341","97","[TCP Retransmission] 49260  >  443 [FIN"
"2016-09-27 08:39:27.623721","97","[TCP Retransmission] 49260  >  443 [FIN"
"2016-09-27 08:40:05.436754","97","[TCP Retransmission] 49260  >  443 [FIN"
"2016-09-27 08:42:52.624221","66","40097  >  443 [ACK] Seq=736 Ack=5530 Win=18560 Len=0 TSval=60629872 TSecr=1572484865"
"2016-09-27 09:58:03.657890","97","Encrypted Alert"
"2016-09-27 09:58:03.690266","66","40097  >  443 [FIN"
"2016-09-27 09:58:04.096189","74","38260  >  443 [SYN] Seq=0 Win=4380 Len=0 MSS=1460 SACK_PERM=1 TSval=61784808 TSecr=0 WS=16"
"2016-09-27 09:58:04.244667","97","[TCP Retransmission] 40097  >  443 [FIN"
"2016-09-27 09:58:04.317217","66","38260  >  443 [ACK] Seq=1 Ack=1 Win=4384 Len=0 TSval=61784865 TSecr=2133539900"
"2016-09-27 09:58:04.450029","583","Client Hello"
"2016-09-27 09:58:04.669450","66","38260  >  443 [ACK] Seq=518 Ack=1419 Win=7216 Len=0 TSval=61784955 TSecr=2133540254"
"2016-09-27 09:58:04.669564","66","38260  >  443 [ACK] Seq=518 Ack=2837 Win=10064 Len=0 TSval=61784955 TSecr=2133540254"
"2016-09-27 09:58:04.670024","66","38260  >  443 [ACK] Seq=518 Ack=4097 Win=12896 Len=0 TSval=61784955 TSecr=2133540254"
"2016-09-27 09:58:04.895270","66","38260  >  443 [ACK] Seq=518 Ack=4720 Win=15728 Len=0 TSval=61785012 TSecr=2133540473"
"2016-09-27 09:58:04.932383","192","Client Key Exchange"
"2016-09-27 09:58:05.150938","66","38260  >  443 [ACK] Seq=644 Ack=4771 Win=15728 Len=0 TSval=61785078 TSecr=2133540736"
"2016-09-27 09:58:05.151045","158","Application Data"
"2016-09-27 09:58:05.418562","97","[TCP Retransmission] 40097  >  443 [FIN"
"2016-09-27 09:58:05.786318","66","38260  >  443 [ACK] Seq=736 Ack=5529 Win=18560 Len=0 TSval=61785241 TSecr=2133541328"
"2016-09-27 09:58:07.766128","97","[TCP Retransmission] 40097  >  443 [FIN"
"2016-09-27 09:58:12.469327","97","[TCP Retransmission] 40097  >  443 [FIN"
"2016-09-27 09:58:21.875586","97","[TCP Retransmission] 40097  >  443 [FIN"
"2016-09-27 09:58:40.688063","97","[TCP Retransmission] 40097  >  443 [FIN"
"2016-09-27 09:59:18.313048","97","[TCP Retransmission] 40097  >  443 [FIN"
"2016-09-27 10:02:05.789499","66","38260  >  443 [ACK] Seq=736 Ack=5530 Win=18560 Len=0 TSval=61846682 TSecr=2133781335"
"2016-09-27 11:04:29.478993","97","Encrypted Alert"
"2016-09-27 11:04:29.506584","66","38260  >  443 [FIN"
"2016-09-27 11:04:29.691307","74","46613  >  443 [SYN] Seq=0 Win=4380 Len=0 MSS=1460 SACK_PERM=1 TSval=62805119 TSecr=0 WS=16"
"2016-09-27 11:04:29.913245","66","46613  >  443 [ACK] Seq=1 Ack=1 Win=4384 Len=0 TSval=62805176 TSecr=1321621752"
"2016-09-27 11:04:30.045760","583","Client Hello"
"2016-09-27 11:04:30.061573","97","[TCP Retransmission] 38260  >  443 [FIN"
"2016-09-27 11:04:30.265564","66","46613  >  443 [ACK] Seq=518 Ack=1419 Win=7216 Len=0 TSval=62805266 TSecr=1321622108"
"2016-09-27 11:04:30.265802","66","46613  >  443 [ACK] Seq=518 Ack=2837 Win=10064 Len=0 TSval=62805266 TSecr=1321622108"
"2016-09-27 11:04:30.266781","66","46613  >  443 [ACK] Seq=518 Ack=4097 Win=12896 Len=0 TSval=62805266 TSecr=1321622108"
"2016-09-27 11:04:30.491863","66","46613  >  443 [ACK] Seq=518 Ack=4720 Win=15728 Len=0 TSval=62805323 TSecr=1321622326"
"2016-09-27 11:04:30.529262","192","Client Key Exchange"
"2016-09-27 11:04:30.747271","66","46613  >  443 [ACK] Seq=644 Ack=4771 Win=15728 Len=0 TSval=62805389 TSecr=1321622591"
"2016-09-27 11:04:30.747376","158","Application Data"
"2016-09-27 11:04:31.229505","66","46613  >  443 [ACK] Seq=736 Ack=5529 Win=18560 Len=0 TSval=62805513 TSecr=1321623034"
"2016-09-27 11:04:31.237375","97","[TCP Retransmission] 38260  >  443 [FIN"
"2016-09-27 11:04:33.584941","97","[TCP Retransmission] 38260  >  443 [FIN"
"2016-09-27 11:04:38.288056","97","[TCP Retransmission] 38260  >  443 [FIN"
"2016-09-27 11:04:47.695487","97","[TCP Retransmission] 38260  >  443 [FIN"
"2016-09-27 11:05:06.507263","97","[TCP Retransmission] 38260  >  443 [FIN"
"2016-09-27 11:05:44.069539","97","[TCP Retransmission] 38260  >  443 [FIN"
"2016-09-27 11:08:31.225885","66","46613  >  443 [ACK] Seq=736 Ack=5530 Win=18560 Len=0 TSval=62866952 TSecr=1321863034"
"2016-09-27 12:17:31.498467","97","Encrypted Alert"
"2016-09-27 12:17:31.527787","66","46613  >  443 [FIN"
"2016-09-27 12:17:31.677898","74","56240  >  443 [SYN] Seq=0 Win=4380 Len=0 MSS=1460 SACK_PERM=1 TSval=63926908 TSecr=0 WS=16"
"2016-09-27 12:17:31.899849","66","56240  >  443 [ACK] Seq=1 Ack=1 Win=4384 Len=0 TSval=63926965 TSecr=2134088712"
"2016-09-27 12:17:32.019013","583","Client Hello"
"2016-09-27 12:17:32.083311","97","[TCP Retransmission] 46613  >  443 [FIN"
"2016-09-27 12:17:32.240739","66","56240  >  443 [ACK] Seq=518 Ack=1419 Win=7216 Len=0 TSval=63927052 TSecr=2134089053"
"2016-09-27 12:17:32.240857","66","56240  >  443 [ACK] Seq=518 Ack=2837 Win=10064 Len=0 TSval=63927052 TSecr=2134089053"
"2016-09-27 12:17:32.240919","66","56240  >  443 [ACK] Seq=518 Ack=4097 Win=12896 Len=0 TSval=63927052 TSecr=2134089053"
"2016-09-27 12:17:32.483313","66","56240  >  443 [ACK] Seq=518 Ack=4720 Win=15728 Len=0 TSval=63927109 TSecr=2134089274"
"2016-09-27 12:17:32.500273","192","Client Key Exchange"
"2016-09-27 12:17:32.721673","158","Application Data"
"2016-09-27 12:17:33.259139","97","[TCP Retransmission] 46613  >  443 [FIN"
"2016-09-27 12:17:33.344854","66","56240  >  443 [ACK] Seq=736 Ack=5529 Win=18560 Len=0 TSval=63927335 TSecr=2134090126"
"2016-09-27 12:17:35.606552","97","[TCP Retransmission] 46613  >  443 [FIN"
"2016-09-27 12:17:40.313351","97","[TCP Retransmission] 46613  >  443 [FIN"
"2016-09-27 12:17:49.692545","97","[TCP Retransmission] 46613  >  443 [FIN"
"2016-09-27 12:18:08.505355","97","[TCP Retransmission] 46613  >  443 [FIN"
"2016-09-27 12:18:46.067598","97","[TCP Retransmission] 46613  >  443 [FIN"
"2016-09-27 12:21:33.354299","66","56240  >  443 [ACK] Seq=736 Ack=5530 Win=18560 Len=0 TSval=63988777 TSecr=2134330132"
"2016-09-27 13:24:51.551837","97","Encrypted Alert"
"2016-09-27 13:24:51.567654","66","56240  >  443 [FIN"
"2016-09-27 13:24:51.930110","74","38299  >  443 [SYN] Seq=0 Win=4380 Len=0 MSS=1460 SACK_PERM=1 TSval=64961213 TSecr=0 WS=16"
"2016-09-27 13:24:52.136640","97","[TCP Retransmission] 56240  >  443 [FIN"
"2016-09-27 13:24:52.152049","66","38299  >  443 [ACK] Seq=1 Ack=1 Win=4384 Len=0 TSval=64961270 TSecr=2167830707"
"2016-09-27 13:24:52.277266","583","Client Hello"
"2016-09-27 13:24:52.492896","66","38299  >  443 [ACK] Seq=518 Ack=1419 Win=7216 Len=0 TSval=64961357 TSecr=2167831055"
"2016-09-27 13:24:52.492995","66","38299  >  443 [ACK] Seq=518 Ack=2837 Win=10064 Len=0 TSval=64961357 TSecr=2167831055"
"2016-09-27 13:24:52.493057","66","38299  >  443 [ACK] Seq=518 Ack=4097 Win=12896 Len=0 TSval=64961357 TSecr=2167831055"
"2016-09-27 13:24:52.711533","66","38299  >  443 [ACK] Seq=518 Ack=4720 Win=15728 Len=0 TSval=64961413 TSecr=2167831269"
"2016-09-27 13:24:52.751351","192","Client Key Exchange"
"2016-09-27 13:24:52.970192","66","38299  >  443 [ACK] Seq=644 Ack=4771 Win=15728 Len=0 TSval=64961479 TSecr=2167831528"
"2016-09-27 13:24:52.970310","158","Application Data"
"2016-09-27 13:24:53.313592","97","[TCP Retransmission] 56240  >  443 [FIN"
"2016-09-27 13:24:53.628512","66","38299  >  443 [ACK] Seq=736 Ack=5529 Win=18560 Len=0 TSval=64961648 TSecr=2167832143"
"2016-09-27 13:24:55.659633","97","[TCP Retransmission] 56240  >  443 [FIN"
"2016-09-27 13:25:00.362726","97","[TCP Retransmission] 56240  >  443 [FIN"
"2016-09-27 13:25:09.753417","97","[TCP Retransmission] 56240  >  443 [FIN"
"2016-09-27 13:25:28.568496","97","[TCP Retransmission] 56240  >  443 [FIN"
"2016-09-27 13:26:06.192685","97","[TCP Retransmission] 56240  >  443 [FIN"
"2016-09-27 13:28:53.624502","66","38299  >  443 [ACK] Seq=736 Ack=5530 Win=18560 Len=0 TSval=65023087 TSecr=2168072144"
"2016-09-27 14:29:30.841199","97","Encrypted Alert"
"2016-09-27 14:29:30.857567","66","38299  >  443 [FIN"
"2016-09-27 14:29:31.012583","74","58570  >  443 [SYN] Seq=0 Win=4380 Len=0 MSS=1460 SACK_PERM=1 TSval=65954259 TSecr=0 WS=16"
"2016-09-27 14:29:31.244782","66","58570  >  443 [ACK] Seq=1 Ack=1 Win=4384 Len=0 TSval=65954319 TSecr=2175349751"
"2016-09-27 14:29:31.364167","583","Client Hello"
"2016-09-27 14:29:31.424007","97","[TCP Retransmission] 38299  >  443 [FIN"
"2016-09-27 14:29:31.596757","66","58570  >  443 [ACK] Seq=518 Ack=1419 Win=7216 Len=0 TSval=65954409 TSecr=2175350104"
"2016-09-27 14:29:31.597435","66","58570  >  443 [ACK] Seq=518 Ack=2837 Win=10064 Len=0 TSval=65954409 TSecr=2175350104"
"2016-09-27 14:29:31.597531","66","58570  >  443 [ACK] Seq=518 Ack=4097 Win=12896 Len=0 TSval=65954409 TSecr=2175350104"
"2016-09-27 14:29:31.831550","66","58570  >  443 [ACK] Seq=518 Ack=4720 Win=15728 Len=0 TSval=65954468 TSecr=2175350335"
"2016-09-27 14:29:31.866867","192","Client Key Exchange"
"2016-09-27 14:29:32.097746","66","58570  >  443 [ACK] Seq=644 Ack=4771 Win=15728 Len=0 TSval=65954537 TSecr=2175350606"
"2016-09-27 14:29:32.099095","158","Application Data"
"2016-09-27 14:29:32.592881","66","58570  >  443 [ACK] Seq=736 Ack=5529 Win=18560 Len=0 TSval=65954664 TSecr=2175351052"
"2016-09-27 14:29:32.599861","97","[TCP Retransmission] 38299  >  443 [FIN"
"2016-09-27 14:29:34.952217","97","[TCP Retransmission] 38299  >  443 [FIN"
"2016-09-27 14:29:39.654512","97","[TCP Retransmission] 38299  >  443 [FIN"
"2016-09-27 14:29:49.060797","97","[TCP Retransmission] 38299  >  443 [FIN"
"2016-09-27 14:30:07.873989","97","[TCP Retransmission] 38299  >  443 [FIN"
"2016-09-27 14:30:45.435704","97","[TCP Retransmission] 38299  >  443 [FIN"
"2016-09-27 14:33:32.576436","66","58570  >  443 [ACK] Seq=736 Ack=5530 Win=18560 Len=0 TSval=66016100 TSecr=2175591047"
"2016-09-27 15:42:43.852282","97","Encrypted Alert"
"2016-09-27 15:42:43.884783","66","58570  >  443 [FIN"
"2016-09-27 15:42:44.287563","74","60014  >  443 [SYN] Seq=0 Win=4380 Len=0 MSS=1460 SACK_PERM=1 TSval=67078936 TSecr=0 WS=16"
"2016-09-27 15:42:44.470127","97","[TCP Retransmission] 58570  >  443 [FIN"
"2016-09-27 15:42:44.509475","66","60014  >  443 [ACK] Seq=1 Ack=1 Win=4384 Len=0 TSval=67078993 TSecr=2179103121"
"2016-09-27 15:42:44.627530","583","Client Hello"
"2016-09-27 15:42:44.873966","66","60014  >  443 [ACK] Seq=518 Ack=1419 Win=7216 Len=0 TSval=67079086 TSecr=2179103462"
"2016-09-27 15:42:44.874092","66","60014  >  443 [ACK] Seq=518 Ack=2837 Win=10064 Len=0 TSval=67079086 TSecr=2179103462"
"2016-09-27 15:42:44.874158","66","60014  >  443 [ACK] Seq=518 Ack=4097 Win=12896 Len=0 TSval=67079086 TSecr=2179103462"
"2016-09-27 15:42:45.094679","66","60014  >  443 [ACK] Seq=518 Ack=4720 Win=15728 Len=0 TSval=67079142 TSecr=2179103708"
"2016-09-27 15:42:45.119866","192","Client Key Exchange"
"2016-09-27 15:42:45.339039","158","Application Data"
"2016-09-27 15:42:45.718210","97","[TCP Retransmission] 58570  >  443 [FIN"
"2016-09-27 15:42:45.868482","66","60014  >  443 [ACK] Seq=736 Ack=5529 Win=18560 Len=0 TSval=67079341 TSecr=2179104443"
"2016-09-27 15:42:48.208374","97","[TCP Retransmission] 58570  >  443 [FIN"
"2016-09-27 15:42:53.192932","97","[TCP Retransmission] 58570  >  443 [FIN"
"2016-09-27 15:43:03.161505","97","[TCP Retransmission] 58570  >  443 [FIN"
"2016-09-27 15:43:23.069883","97","[TCP Retransmission] 58570  >  443 [FIN"
"2016-09-27 15:44:02.944666","97","[TCP Retransmission] 58570  >  443 [FIN"
"2016-09-27 15:46:45.864273","66","60014  >  443 [ACK] Seq=736 Ack=5530 Win=18560 Len=0 TSval=67140780 TSecr=2179344445"
"2016-09-27 16:57:29.626699","97","Encrypted Alert"
"2016-09-27 16:57:29.657885","66","60014  >  443 [FIN"
"2016-09-27 16:57:30.027180","74","50679  >  443 [SYN] Seq=0 Win=4380 Len=0 MSS=1460 SACK_PERM=1 TSval=68227286 TSecr=0 WS=16"
"2016-09-27 16:57:30.224506","97","[TCP Retransmission] 60014  >  443 [FIN"
"2016-09-27 16:57:30.291252","66","50679  >  443 [ACK] Seq=1 Ack=1 Win=4384 Len=0 TSval=68227354 TSecr=1487627100"
"2016-09-27 16:57:30.414677","583","Client Hello"
"2016-09-27 16:57:30.679378","66","50679  >  443 [ACK] Seq=518 Ack=1419 Win=7216 Len=0 TSval=68227453 TSecr=1487627488"
"2016-09-27 16:57:30.679484","66","50679  >  443 [ACK] Seq=518 Ack=2837 Win=10064 Len=0 TSval=68227453 TSecr=1487627488"
"2016-09-27 16:57:30.679549","66","50679  >  443 [ACK] Seq=518 Ack=4097 Win=12896 Len=0 TSval=68227453 TSecr=1487627488"
"2016-09-27 16:57:30.937730","66","50679  >  443 [ACK] Seq=518 Ack=4720 Win=15728 Len=0 TSval=68227519 TSecr=1487627752"
"2016-09-27 16:57:30.976689","192","Client Key Exchange"
"2016-09-27 16:57:31.242302","66","50679  >  443 [ACK] Seq=644 Ack=4771 Win=15728 Len=0 TSval=68227597 TSecr=1487628050"
"2016-09-27 16:57:31.242404","158","Application Data"
"2016-09-27 16:57:31.396495","97","[TCP Retransmission] 60014  >  443 [FIN"
"2016-09-27 16:57:31.795675","66","50679  >  443 [ACK] Seq=736 Ack=5529 Win=18560 Len=0 TSval=68227739 TSecr=1487628560"
"2016-09-27 16:57:33.759793","97","[TCP Retransmission] 60014  >  443 [FIN"
"2016-09-27 16:57:38.486341","97","[TCP Retransmission] 60014  >  443 [FIN"
"2016-09-27 16:57:47.939512","97","[TCP Retransmission] 60014  >  443 [FIN"
"2016-09-27 16:58:06.878102","97","[TCP Retransmission] 60014  >  443 [FIN"
"2016-09-27 16:58:44.689584","97","[TCP Retransmission] 60014  >  443 [FIN"
"2016-09-27 17:01:32.411508","66","50679  >  443 [ACK] Seq=736 Ack=5530 Win=18560 Len=0 TSval=68289337 TSecr=1487869187"
"2016-09-27 18:12:07.168038","97","Encrypted Alert"
"2016-09-27 18:12:07.199251","66","50679  >  443 [FIN"
"2016-09-27 18:12:07.602466","74","56212  >  443 [SYN] Seq=0 Win=4380 Len=0 MSS=1460 SACK_PERM=1 TSval=69373545 TSecr=0 WS=16"
"2016-09-27 18:12:07.812810","66","56212  >  443 [ACK] Seq=1 Ack=1 Win=4384 Len=0 TSval=69373599 TSecr=1496800686"
"2016-09-27 18:12:07.863371","97","[TCP Retransmission] 50679  >  443 [FIN"
"2016-09-27 18:12:07.933596","583","Client Hello"
"2016-09-27 18:12:08.153435","66","56212  >  443 [ACK] Seq=518 Ack=1419 Win=7216 Len=0 TSval=69373686 TSecr=1496801018"
"2016-09-27 18:12:08.153906","66","56212  >  443 [ACK] Seq=518 Ack=2837 Win=10064 Len=0 TSval=69373686 TSecr=1496801018"
"2016-09-27 18:12:08.153992","66","56212  >  443 [ACK] Seq=518 Ack=4097 Win=12896 Len=0 TSval=69373686 TSecr=1496801018"
"2016-09-27 18:12:08.367151","66","56212  >  443 [ACK] Seq=518 Ack=4720 Win=15728 Len=0 TSval=69373740 TSecr=1496801237"
"2016-09-27 18:12:08.417010","192","Client Key Exchange"
"2016-09-27 18:12:08.635070","66","56212  >  443 [ACK] Seq=644 Ack=4771 Win=15728 Len=0 TSval=69373809 TSecr=1496801501"
"2016-09-27 18:12:08.635580","158","Application Data"
"2016-09-27 18:12:09.257869","97","[TCP Retransmission] 50679  >  443 [FIN"
"2016-09-27 18:12:09.480628","66","56212  >  443 [ACK] Seq=736 Ack=5529 Win=18560 Len=0 TSval=69374026 TSecr=1496802312"
"2016-09-27 18:12:12.043041","97","[TCP Retransmission] 50679  >  443 [FIN"
"2016-09-27 18:12:17.613347","97","[TCP Retransmission] 50679  >  443 [FIN"
"2016-09-27 18:12:28.753929","97","[TCP Retransmission] 50679  >  443 [FIN"
"2016-09-27 18:12:51.067244","97","[TCP Retransmission] 50679  >  443 [FIN"
"2016-09-27 18:13:35.691672","97","[TCP Retransmission] 50679  >  443 [FIN"
"2016-09-27 18:16:09.488032","66","56212  >  443 [ACK] Seq=736 Ack=5530 Win=18560 Len=0 TSval=69435468 TSecr=1497042313"
"2016-09-27 19:21:12.180149","97","Encrypted Alert"
"2016-09-27 19:21:12.210888","66","56212  >  443 [FIN"
"2016-09-27 19:21:12.605348","74","34297  >  443 [SYN] Seq=0 Win=4380 Len=0 MSS=1460 SACK_PERM=1 TSval=70434667 TSecr=0 WS=16"
"2016-09-27 19:21:12.749019","97","[TCP Retransmission] 56212  >  443 [FIN"
"2016-09-27 19:21:12.831087","66","34297  >  443 [ACK] Seq=1 Ack=1 Win=4384 Len=0 TSval=70434724 TSecr=1084964821"
"2016-09-27 19:21:12.947552","583","Client Hello"
"2016-09-27 19:21:13.168641","66","34297  >  443 [ACK] Seq=518 Ack=1419 Win=7216 Len=0 TSval=70434811 TSecr=1084965164"
"2016-09-27 19:21:13.169425","66","34297  >  443 [ACK] Seq=518 Ack=2837 Win=10064 Len=0 TSval=70434811 TSecr=1084965164"
"2016-09-27 19:21:13.169520","66","34297  >  443 [ACK] Seq=518 Ack=4097 Win=12896 Len=0 TSval=70434811 TSecr=1084965164"
"2016-09-27 19:21:13.393481","66","34297  >  443 [ACK] Seq=518 Ack=4720 Win=15728 Len=0 TSval=70434868 TSecr=1084965384"
"2016-09-27 19:21:13.436914","192","Client Key Exchange"
"2016-09-27 19:21:13.661472","66","34297  >  443 [ACK] Seq=644 Ack=4771 Win=15728 Len=0 TSval=70434937 TSecr=1084965655"
"2016-09-27 19:21:13.661600","158","Application Data"
"2016-09-27 19:21:13.893582","97","[TCP Retransmission] 56212  >  443 [FIN"
"2016-09-27 19:21:14.178772","66","34297  >  443 [ACK] Seq=736 Ack=5529 Win=18560 Len=0 TSval=70435070 TSecr=1084966141"
"2016-09-27 19:21:16.178727","97","[TCP Retransmission] 56212  >  443 [FIN"
"2016-09-27 19:21:20.748984","97","[TCP Retransmission] 56212  >  443 [FIN"
"2016-09-27 19:21:29.905166","97","[TCP Retransmission] 56212  >  443 [FIN"
"2016-09-27 19:21:48.186380","97","[TCP Retransmission] 56212  >  443 [FIN"
"2016-09-27 19:22:24.811619","97","[TCP Retransmission] 56212  >  443 [FIN"
"2016-09-27 19:25:14.177782","66","34297  >  443 [ACK] Seq=736 Ack=5530 Win=18560 Len=0 TSval=70496510 TSecr=1085206141"
"2016-09-27 20:38:06.607824","97","Encrypted Alert"
"2016-09-27 20:38:06.637921","66","34297  >  443 [FIN"
"2016-09-27 20:38:07.058110","74","58781  >  443 [SYN] Seq=0 Win=4380 Len=0 MSS=1460 SACK_PERM=1 TSval=71615965 TSecr=0 WS=16"
"2016-09-27 20:38:07.188898","97","[TCP Retransmission] 34297  >  443 [FIN"
"2016-09-27 20:38:07.314289","66","58781  >  443 [ACK] Seq=1 Ack=1 Win=4384 Len=0 TSval=71616031 TSecr=2193233005"
"2016-09-27 20:38:07.431926","583","Client Hello"
"2016-09-27 20:38:07.693301","66","58781  >  443 [ACK] Seq=518 Ack=1419 Win=7216 Len=0 TSval=71616128 TSecr=2193233380"
"2016-09-27 20:38:07.694542","66","58781  >  443 [ACK] Seq=518 Ack=2837 Win=10064 Len=0 TSval=71616128 TSecr=2193233380"
"2016-09-27 20:38:07.694659","66","58781  >  443 [ACK] Seq=518 Ack=4097 Win=12896 Len=0 TSval=71616128 TSecr=2193233380"
"2016-09-27 20:38:07.956111","66","58781  >  443 [ACK] Seq=518 Ack=4720 Win=15728 Len=0 TSval=71616195 TSecr=2193233640"
"2016-09-27 20:38:07.983095","192","Client Key Exchange"
"2016-09-27 20:38:08.271122","158","Application Data"
"2016-09-27 20:38:08.356968","97","[TCP Retransmission] 34297  >  443 [FIN"
"2016-09-27 20:38:09.106818","66","58781  >  443 [ACK] Seq=736 Ack=5529 Win=18560 Len=0 TSval=71616490 TSecr=2193234754"
"2016-09-27 20:38:10.692786","97","[TCP Retransmission] 34297  >  443 [FIN"
"2016-09-27 20:38:15.364589","97","[TCP Retransmission] 34297  >  443 [FIN"
"2016-09-27 20:38:24.692741","97","[TCP Retransmission] 34297  >  443 [FIN"
"2016-09-27 20:38:43.380224","97","[TCP Retransmission] 34297  >  443 [FIN"
"2016-09-27 20:39:20.692574","97","[TCP Retransmission] 34297  >  443 [FIN"
"2016-09-27 20:42:09.118014","66","58781  >  443 [ACK] Seq=736 Ack=5530 Win=18560 Len=0 TSval=71677933 TSecr=2193474755"
"2016-09-27 22:00:43.383380","97","Encrypted Alert"
"2016-09-27 22:00:43.414962","66","58781  >  443 [FIN"
"2016-09-27 22:00:44.020030","74","58415  >  443 [SYN] Seq=0 Win=4380 Len=0 MSS=1460 SACK_PERM=1 TSval=72884948 TSecr=0 WS=16"
"2016-09-27 22:00:44.073809","97","[TCP Retransmission] 58781  >  443 [FIN"
"2016-09-27 22:00:44.242037","66","58415  >  443 [ACK] Seq=1 Ack=1 Win=4384 Len=0 TSval=72885005 TSecr=1171613098"
"2016-09-27 22:00:44.370144","583","Client Hello"
"2016-09-27 22:00:44.594325","66","58415  >  443 [ACK] Seq=518 Ack=1419 Win=7216 Len=0 TSval=72885095 TSecr=1171613449"
"2016-09-27 22:00:44.595427","66","58415  >  443 [ACK] Seq=518 Ack=2837 Win=10064 Len=0 TSval=72885095 TSecr=1171613449"
"2016-09-27 22:00:44.595844","66","58415  >  443 [ACK] Seq=518 Ack=4097 Win=12896 Len=0 TSval=72885095 TSecr=1171613449"
"2016-09-27 22:00:44.819803","66","58415  >  443 [ACK] Seq=518 Ack=4720 Win=15728 Len=0 TSval=72885152 TSecr=1171613672"
"2016-09-27 22:00:44.859811","192","Client Key Exchange"
"2016-09-27 22:00:45.075840","66","58415  >  443 [ACK] Seq=644 Ack=4771 Win=15728 Len=0 TSval=72885218 TSecr=1171613938"
"2016-09-27 22:00:45.075940","158","Application Data"
"2016-09-27 22:00:45.460497","97","[TCP Retransmission] 58781  >  443 [FIN"
"2016-09-27 22:00:45.816336","66","58415  >  443 [ACK] Seq=736 Ack=5529 Win=18560 Len=0 TSval=72885408 TSecr=1171614636"
"2016-09-27 22:00:48.230084","97","[TCP Retransmission] 58781  >  443 [FIN"
"2016-09-27 22:00:53.769227","97","[TCP Retransmission] 58781  >  443 [FIN"
"2016-09-27 22:01:04.847288","97","[TCP Retransmission] 58781  >  443 [FIN"
"2016-09-27 22:01:27.003390","97","[TCP Retransmission] 58781  >  443 [FIN"
"2016-09-27 22:02:11.315779","97","[TCP Retransmission] 58781  >  443 [FIN"
"2016-09-27 22:04:45.819166","66","58415  >  443 [ACK] Seq=736 Ack=5530 Win=18560 Len=0 TSval=72946849 TSecr=1171854636"
