"2016-09-26 23:04:46.914644","74","45598  >  80 [SYN] Seq=0 Win=4380 Len=0 MSS=1460 SACK_PERM=1 TSval=51750331 TSecr=0 WS=16"
"2016-09-26 23:04:47.061227","66","45598  >  80 [ACK] Seq=1 Ack=1 Win=4384 Len=0 TSval=51750369 TSecr=2697398980"
"2016-09-26 23:04:47.061861","66","45598  >  80 [FIN"
"2016-09-26 23:04:47.078944","74","45599  >  80 [SYN] Seq=0 Win=4380 Len=0 MSS=1460 SACK_PERM=1 TSval=51750373 TSecr=0 WS=16"
"2016-09-26 23:04:47.213538","66","45598  >  80 [ACK] Seq=2 Ack=2 Win=4384 Len=0 TSval=51750408 TSecr=2697399016"
"2016-09-26 23:04:47.225210","66","45599  >  80 [ACK] Seq=1 Ack=1 Win=4384 Len=0 TSval=51750411 TSecr=2676210185"
"2016-09-26 23:04:47.225827","66","45599  >  80 [FIN"
"2016-09-26 23:04:47.244340","74","45600  >  80 [SYN] Seq=0 Win=4380 Len=0 MSS=1460 SACK_PERM=1 TSval=51750415 TSecr=0 WS=16"
"2016-09-26 23:04:47.377565","66","45599  >  80 [ACK] Seq=2 Ack=2 Win=4384 Len=0 TSval=51750450 TSecr=2676210222"
"2016-09-26 23:04:47.389281","66","45600  >  80 [ACK] Seq=1 Ack=1 Win=4384 Len=0 TSval=51750453 TSecr=3206798565"
"2016-09-26 23:04:47.389674","66","45600  >  80 [FIN"
"2016-09-26 23:04:47.544027","66","45600  >  80 [ACK] Seq=2 Ack=2 Win=4384 Len=0 TSval=51750492 TSecr=3206798601"
"2016-09-26 23:09:46.906819","74","40812  >  80 [SYN] Seq=0 Win=4380 Len=0 MSS=1460 SACK_PERM=1 TSval=51827129 TSecr=0 WS=16"
"2016-09-26 23:09:47.056471","66","40812  >  80 [ACK] Seq=1 Ack=1 Win=4384 Len=0 TSval=51827168 TSecr=2674810696"
"2016-09-26 23:09:47.057073","66","40812  >  80 [FIN"
"2016-09-26 23:09:47.082726","74","40813  >  80 [SYN] Seq=0 Win=4380 Len=0 MSS=1460 SACK_PERM=1 TSval=51827174 TSecr=0 WS=16"
"2016-09-26 23:09:47.208855","66","40812  >  80 [ACK] Seq=2 Ack=2 Win=4384 Len=0 TSval=51827207 TSecr=2674810733"
"2016-09-26 23:09:47.232157","66","40813  >  80 [ACK] Seq=1 Ack=1 Win=4384 Len=0 TSval=51827213 TSecr=2674810740"
"2016-09-26 23:09:47.232755","66","40813  >  80 [FIN"
"2016-09-26 23:09:47.259856","74","40814  >  80 [SYN] Seq=0 Win=4380 Len=0 MSS=1460 SACK_PERM=1 TSval=51827220 TSecr=0 WS=16"
"2016-09-26 23:09:47.388500","66","40813  >  80 [ACK] Seq=2 Ack=2 Win=4384 Len=0 TSval=51827253 TSecr=2674810777"
"2016-09-26 23:09:47.412509","66","40814  >  80 [ACK] Seq=1 Ack=1 Win=4384 Len=0 TSval=51827259 TSecr=2676277363"
"2016-09-26 23:09:47.412643","66","40814  >  80 [FIN"
"2016-09-26 23:09:47.564303","66","40814  >  80 [ACK] Seq=2 Ack=2 Win=4384 Len=0 TSval=51827298 TSecr=2676277401"
"2016-09-26 23:14:47.921708","74","47283  >  80 [SYN] Seq=0 Win=4380 Len=0 MSS=1460 SACK_PERM=1 TSval=51904189 TSecr=0 WS=16"
"2016-09-26 23:14:48.068046","66","47283  >  80 [ACK] Seq=1 Ack=1 Win=4384 Len=0 TSval=51904227 TSecr=2136456331"
"2016-09-26 23:14:48.068170","66","47283  >  80 [FIN"
"2016-09-26 23:14:48.098565","74","47284  >  80 [SYN] Seq=0 Win=4380 Len=0 MSS=1460 SACK_PERM=1 TSval=51904235 TSecr=0 WS=16"
"2016-09-26 23:14:48.219665","66","47283  >  80 [ACK] Seq=2 Ack=2 Win=4384 Len=0 TSval=51904266 TSecr=2136456367"
"2016-09-26 23:14:48.255035","66","47284  >  80 [ACK] Seq=1 Ack=1 Win=4384 Len=0 TSval=51904275 TSecr=2677194007"
"2016-09-26 23:14:48.255160","66","47284  >  80 [FIN"
"2016-09-26 23:14:48.281771","74","47285  >  80 [SYN] Seq=0 Win=4380 Len=0 MSS=1460 SACK_PERM=1 TSval=51904281 TSecr=0 WS=16"
"2016-09-26 23:14:48.406944","66","47284  >  80 [ACK] Seq=2 Ack=2 Win=4384 Len=0 TSval=51904314 TSecr=2677194046"
"2016-09-26 23:14:48.430617","66","47285  >  80 [ACK] Seq=1 Ack=1 Win=4384 Len=0 TSval=51904320 TSecr=494509281"
"2016-09-26 23:14:48.430748","66","47285  >  80 [FIN"
"2016-09-26 23:14:48.582946","66","47285  >  80 [ACK] Seq=2 Ack=2 Win=4384 Len=0 TSval=51904359 TSecr=494509318"
"2016-09-26 23:19:46.925552","74","40511  >  80 [SYN] Seq=0 Win=4380 Len=0 MSS=1460 SACK_PERM=1 TSval=51980734 TSecr=0 WS=16"
"2016-09-26 23:19:47.070369","66","40511  >  80 [ACK] Seq=1 Ack=1 Win=4384 Len=0 TSval=51980772 TSecr=2676427275"
"2016-09-26 23:19:47.070981","66","40511  >  80 [FIN"
"2016-09-26 23:19:47.089286","74","40512  >  80 [SYN] Seq=0 Win=4380 Len=0 MSS=1460 SACK_PERM=1 TSval=51980776 TSecr=0 WS=16"
"2016-09-26 23:19:47.222739","66","40511  >  80 [ACK] Seq=2 Ack=2 Win=4384 Len=0 TSval=51980811 TSecr=2676427312"
"2016-09-26 23:19:47.246054","66","40512  >  80 [ACK] Seq=1 Ack=1 Win=4384 Len=0 TSval=51980817 TSecr=2175581484"
"2016-09-26 23:19:47.246784","66","40512  >  80 [FIN"
"2016-09-26 23:19:47.270130","74","40513  >  80 [SYN] Seq=0 Win=4380 Len=0 MSS=1460 SACK_PERM=1 TSval=51980823 TSecr=0 WS=16"
"2016-09-26 23:19:47.398502","66","40512  >  80 [ACK] Seq=2 Ack=2 Win=4384 Len=0 TSval=51980856 TSecr=2175581523"
"2016-09-26 23:19:47.423297","66","40513  >  80 [ACK] Seq=1 Ack=1 Win=4384 Len=0 TSval=51980862 TSecr=2696760111"
"2016-09-26 23:19:47.423429","66","40513  >  80 [FIN"
"2016-09-26 23:19:47.574321","66","40513  >  80 [ACK] Seq=2 Ack=2 Win=4384 Len=0 TSval=51980901 TSecr=2696760150"
"2016-09-26 23:24:46.923847","74","33696  >  80 [SYN] Seq=0 Win=4380 Len=0 MSS=1460 SACK_PERM=1 TSval=52057534 TSecr=0 WS=16"
"2016-09-26 23:24:47.070802","66","33696  >  80 [ACK] Seq=1 Ack=1 Win=4384 Len=0 TSval=52057572 TSecr=2675035695"
"2016-09-26 23:24:47.070925","66","33696  >  80 [FIN"
"2016-09-26 23:24:47.098659","74","33697  >  80 [SYN] Seq=0 Win=4380 Len=0 MSS=1460 SACK_PERM=1 TSval=52057579 TSecr=0 WS=16"
"2016-09-26 23:24:47.222181","66","33696  >  80 [ACK] Seq=2 Ack=2 Win=4384 Len=0 TSval=52057611 TSecr=2675035732"
"2016-09-26 23:24:47.245332","66","33697  >  80 [ACK] Seq=1 Ack=1 Win=4384 Len=0 TSval=52057617 TSecr=2175656485"
"2016-09-26 23:24:47.245947","66","33697  >  80 [FIN"
"2016-09-26 23:24:47.278506","74","33698  >  80 [SYN] Seq=0 Win=4380 Len=0 MSS=1460 SACK_PERM=1 TSval=52057625 TSecr=0 WS=16"
"2016-09-26 23:24:47.397646","66","33697  >  80 [ACK] Seq=2 Ack=2 Win=4384 Len=0 TSval=52057656 TSecr=2175656522"
"2016-09-26 23:24:47.432815","66","33698  >  80 [ACK] Seq=1 Ack=1 Win=4384 Len=0 TSval=52057665 TSecr=4247357895"
"2016-09-26 23:24:47.434265","66","33698  >  80 [FIN"
"2016-09-26 23:24:47.585231","66","33698  >  80 [ACK] Seq=2 Ack=2 Win=4384 Len=0 TSval=52057704 TSecr=4247357934"
"2016-09-26 23:29:46.931670","74","53279  >  80 [SYN] Seq=0 Win=4380 Len=0 MSS=1460 SACK_PERM=1 TSval=52134336 TSecr=0 WS=16"
"2016-09-26 23:29:47.076533","66","53279  >  80 [ACK] Seq=1 Ack=1 Win=4384 Len=0 TSval=52134374 TSecr=76030997"
"2016-09-26 23:29:47.077076","66","53279  >  80 [FIN"
"2016-09-26 23:29:47.108126","74","53280  >  80 [SYN] Seq=0 Win=4380 Len=0 MSS=1460 SACK_PERM=1 TSval=52134382 TSecr=0 WS=16"
"2016-09-26 23:29:47.228855","66","53279  >  80 [ACK] Seq=2 Ack=2 Win=4384 Len=0 TSval=52134413 TSecr=76031034"
"2016-09-26 23:29:47.264023","66","53280  >  80 [ACK] Seq=1 Ack=1 Win=4384 Len=0 TSval=52134422 TSecr=2676025265"
"2016-09-26 23:29:47.264691","66","53280  >  80 [FIN"
"2016-09-26 23:29:47.304956","74","53281  >  80 [SYN] Seq=0 Win=4380 Len=0 MSS=1460 SACK_PERM=1 TSval=52134432 TSecr=0 WS=16"
"2016-09-26 23:29:47.413389","66","53280  >  80 [ACK] Seq=2 Ack=2 Win=4384 Len=0 TSval=52134460 TSecr=2676025305"
"2016-09-26 23:29:47.459153","66","53281  >  80 [ACK] Seq=1 Ack=1 Win=4384 Len=0 TSval=52134472 TSecr=2674963267"
"2016-09-26 23:29:47.459739","66","53281  >  80 [FIN"
"2016-09-26 23:29:47.611670","66","53281  >  80 [ACK] Seq=2 Ack=2 Win=4384 Len=0 TSval=52134511 TSecr=2674963306"
"2016-09-26 23:34:46.954875","74","41138  >  80 [SYN] Seq=0 Win=4380 Len=0 MSS=1460 SACK_PERM=1 TSval=52211139 TSecr=0 WS=16"
"2016-09-26 23:34:47.109212","66","41138  >  80 [ACK] Seq=1 Ack=1 Win=4384 Len=0 TSval=52211179 TSecr=3207248490"
"2016-09-26 23:34:47.110429","66","41138  >  80 [FIN"
"2016-09-26 23:34:47.130657","74","41139  >  80 [SYN] Seq=0 Win=4380 Len=0 MSS=1460 SACK_PERM=1 TSval=52211184 TSecr=0 WS=16"
"2016-09-26 23:34:47.261663","66","41138  >  80 [ACK] Seq=2 Ack=2 Win=4384 Len=0 TSval=52211218 TSecr=3207248529"
"2016-09-26 23:34:47.284959","66","41139  >  80 [ACK] Seq=1 Ack=1 Win=4384 Len=0 TSval=52211224 TSecr=2654861037"
"2016-09-26 23:34:47.285575","66","41139  >  80 [FIN"
"2016-09-26 23:34:47.303241","74","41140  >  80 [SYN] Seq=0 Win=4380 Len=0 MSS=1460 SACK_PERM=1 TSval=52211228 TSecr=0 WS=16"
"2016-09-26 23:34:47.437678","66","41139  >  80 [ACK] Seq=2 Ack=2 Win=4384 Len=0 TSval=52211263 TSecr=2654861076"
"2016-09-26 23:34:47.460880","66","41140  >  80 [ACK] Seq=1 Ack=1 Win=4384 Len=0 TSval=52211269 TSecr=2697851986"
"2016-09-26 23:34:47.461012","66","41140  >  80 [FIN"
"2016-09-26 23:34:47.613062","66","41140  >  80 [ACK] Seq=2 Ack=2 Win=4384 Len=0 TSval=52211308 TSecr=2697852025"
"2016-09-26 23:39:47.950714","74","40054  >  80 [SYN] Seq=0 Win=4380 Len=0 MSS=1460 SACK_PERM=1 TSval=52288194 TSecr=0 WS=16"
"2016-09-26 23:39:48.102120","66","40054  >  80 [ACK] Seq=1 Ack=1 Win=4384 Len=0 TSval=52288233 TSecr=2639707438"
"2016-09-26 23:39:48.102258","66","40054  >  80 [FIN"
"2016-09-26 23:39:48.136485","74","40055  >  80 [SYN] Seq=0 Win=4380 Len=0 MSS=1460 SACK_PERM=1 TSval=52288242 TSecr=0 WS=16"
"2016-09-26 23:39:48.252918","66","40054  >  80 [ACK] Seq=2 Ack=2 Win=4384 Len=0 TSval=52288272 TSecr=2639707476"
"2016-09-26 23:39:48.290222","66","40055  >  80 [ACK] Seq=1 Ack=1 Win=4384 Len=0 TSval=52288281 TSecr=2697060276"
"2016-09-26 23:39:48.290342","66","40055  >  80 [FIN"
"2016-09-26 23:39:48.320608","74","40056  >  80 [SYN] Seq=0 Win=4380 Len=0 MSS=1460 SACK_PERM=1 TSval=52288289 TSecr=0 WS=16"
"2016-09-26 23:39:48.440375","66","40055  >  80 [ACK] Seq=2 Ack=2 Win=4384 Len=0 TSval=52288320 TSecr=2697060314"
"2016-09-26 23:39:48.475486","66","40056  >  80 [ACK] Seq=1 Ack=1 Win=4384 Len=0 TSval=52288329 TSecr=2418629817"
"2016-09-26 23:39:48.476825","66","40056  >  80 [FIN"
"2016-09-26 23:39:48.627841","66","40056  >  80 [ACK] Seq=2 Ack=2 Win=4384 Len=0 TSval=52288368 TSecr=2418629856"
"2016-09-26 23:44:46.926482","74","44216  >  80 [SYN] Seq=0 Win=4380 Len=0 MSS=1460 SACK_PERM=1 TSval=52364732 TSecr=0 WS=16"
"2016-09-26 23:44:47.076251","66","44216  >  80 [ACK] Seq=1 Ack=1 Win=4384 Len=0 TSval=52364771 TSecr=2593106494"
"2016-09-26 23:44:47.076885","66","44216  >  80 [FIN"
"2016-09-26 23:44:47.091113","74","44217  >  80 [SYN] Seq=0 Win=4380 Len=0 MSS=1460 SACK_PERM=1 TSval=52364774 TSecr=0 WS=16"
"2016-09-26 23:44:47.229700","66","44216  >  80 [ACK] Seq=2 Ack=2 Win=4384 Len=0 TSval=52364810 TSecr=2593106532"
"2016-09-26 23:44:47.240272","66","44217  >  80 [ACK] Seq=1 Ack=1 Win=4384 Len=0 TSval=52364813 TSecr=2676228954"
"2016-09-26 23:44:47.240814","66","44217  >  80 [FIN"
"2016-09-26 23:44:47.254853","74","44218  >  80 [SYN] Seq=0 Win=4380 Len=0 MSS=1460 SACK_PERM=1 TSval=52364816 TSecr=0 WS=16"
"2016-09-26 23:44:47.393460","66","44217  >  80 [ACK] Seq=2 Ack=2 Win=4384 Len=0 TSval=52364852 TSecr=2676228991"
"2016-09-26 23:44:47.404251","66","44218  >  80 [ACK] Seq=1 Ack=1 Win=4384 Len=0 TSval=52364855 TSecr=487992838"
"2016-09-26 23:44:47.404956","66","44218  >  80 [FIN"
"2016-09-26 23:44:47.556696","66","44218  >  80 [ACK] Seq=2 Ack=2 Win=4384 Len=0 TSval=52364894 TSecr=487992875"
"2016-09-26 23:49:46.937477","74","53327  >  80 [SYN] Seq=0 Win=4380 Len=0 MSS=1460 SACK_PERM=1 TSval=52441535 TSecr=0 WS=16"
"2016-09-26 23:49:47.106656","66","53327  >  80 [ACK] Seq=1 Ack=1 Win=4384 Len=0 TSval=52441579 TSecr=2697209973"
"2016-09-26 23:49:47.107192","66","53327  >  80 [FIN"
"2016-09-26 23:49:47.131827","74","53328  >  80 [SYN] Seq=0 Win=4380 Len=0 MSS=1460 SACK_PERM=1 TSval=52441585 TSecr=0 WS=16"
"2016-09-26 23:49:47.259905","66","53327  >  80 [ACK] Seq=2 Ack=2 Win=4384 Len=0 TSval=52441618 TSecr=2697210015"
"2016-09-26 23:49:47.282373","66","53328  >  80 [ACK] Seq=1 Ack=1 Win=4384 Len=0 TSval=52441624 TSecr=2136981139"
"2016-09-26 23:49:47.282894","66","53328  >  80 [FIN"
"2016-09-26 23:49:47.309930","74","53329  >  80 [SYN] Seq=0 Win=4380 Len=0 MSS=1460 SACK_PERM=1 TSval=52441631 TSecr=0 WS=16"
"2016-09-26 23:49:47.435529","66","53328  >  80 [ACK] Seq=2 Ack=2 Win=4384 Len=0 TSval=52441663 TSecr=2136981176"
"2016-09-26 23:49:47.458174","66","53329  >  80 [ACK] Seq=1 Ack=1 Win=4384 Len=0 TSval=52441669 TSecr=2825843493"
"2016-09-26 23:49:47.458293","66","53329  >  80 [FIN"
"2016-09-26 23:49:47.610554","66","53329  >  80 [ACK] Seq=2 Ack=2 Win=4384 Len=0 TSval=52441708 TSecr=2825843530"
"2016-09-26 23:54:46.923166","74","50074  >  80 [SYN] Seq=0 Win=4380 Len=0 MSS=1460 SACK_PERM=1 TSval=52518332 TSecr=0 WS=16"
"2016-09-26 23:54:47.070645","66","50074  >  80 [ACK] Seq=1 Ack=1 Win=4384 Len=0 TSval=52518370 TSecr=2137347855"
"2016-09-26 23:54:47.071263","66","50074  >  80 [FIN"
"2016-09-26 23:54:47.090581","74","50075  >  80 [SYN] Seq=0 Win=4380 Len=0 MSS=1460 SACK_PERM=1 TSval=52518375 TSecr=0 WS=16"
"2016-09-26 23:54:47.222986","66","50074  >  80 [ACK] Seq=2 Ack=2 Win=4384 Len=0 TSval=52518409 TSecr=2137347892"
"2016-09-26 23:54:47.246367","66","50075  >  80 [ACK] Seq=1 Ack=1 Win=4384 Len=0 TSval=52518415 TSecr=2676400259"
"2016-09-26 23:54:47.246910","66","50075  >  80 [FIN"
"2016-09-26 23:54:47.267440","74","50076  >  80 [SYN] Seq=0 Win=4380 Len=0 MSS=1460 SACK_PERM=1 TSval=52518420 TSecr=0 WS=16"
"2016-09-26 23:54:47.410487","66","50075  >  80 [ACK] Seq=2 Ack=2 Win=4384 Len=0 TSval=52518457 TSecr=2676400298"
"2016-09-26 23:54:47.414764","66","50076  >  80 [ACK] Seq=1 Ack=1 Win=4384 Len=0 TSval=52518458 TSecr=2676399258"
"2016-09-26 23:54:47.414879","66","50076  >  80 [FIN"
"2016-09-26 23:54:47.571453","66","50076  >  80 [ACK] Seq=2 Ack=2 Win=4384 Len=0 TSval=52518498 TSecr=2676399294"
"2016-09-26 23:59:46.937779","74","48125  >  80 [SYN] Seq=0 Win=4380 Len=0 MSS=1460 SACK_PERM=1 TSval=52595136 TSecr=0 WS=16"
"2016-09-26 23:59:47.093173","66","48125  >  80 [ACK] Seq=1 Ack=1 Win=4384 Len=0 TSval=52595176 TSecr=2825993397"
"2016-09-26 23:59:47.094569","66","48125  >  80 [FIN"
"2016-09-26 23:59:47.114191","74","48126  >  80 [SYN] Seq=0 Win=4380 Len=0 MSS=1460 SACK_PERM=1 TSval=52595181 TSecr=0 WS=16"
"2016-09-26 23:59:47.245566","66","48125  >  80 [ACK] Seq=2 Ack=2 Win=4384 Len=0 TSval=52595215 TSecr=2825993437"
"2016-09-26 23:59:47.268918","66","48126  >  80 [ACK] Seq=1 Ack=1 Win=4384 Len=0 TSval=52595221 TSecr=2675561758"
"2016-09-26 23:59:47.269584","66","48126  >  80 [FIN"
"2016-09-26 23:59:47.287055","74","48127  >  80 [SYN] Seq=0 Win=4380 Len=0 MSS=1460 SACK_PERM=1 TSval=52595225 TSecr=0 WS=16"
"2016-09-26 23:59:47.422039","66","48126  >  80 [ACK] Seq=2 Ack=2 Win=4384 Len=0 TSval=52595260 TSecr=2675561797"
"2016-09-26 23:59:47.444939","66","48127  >  80 [ACK] Seq=1 Ack=1 Win=4384 Len=0 TSval=52595266 TSecr=2675570387"
"2016-09-26 23:59:47.445070","66","48127  >  80 [FIN"
"2016-09-26 23:59:47.597109","66","48127  >  80 [ACK] Seq=2 Ack=2 Win=4384 Len=0 TSval=52595305 TSecr=2675570427"
"2016-09-27 00:04:46.938283","74","60613  >  80 [SYN] Seq=0 Win=4380 Len=0 MSS=1460 SACK_PERM=1 TSval=52671936 TSecr=0 WS=16"
"2016-09-27 00:04:47.092297","66","60613  >  80 [ACK] Seq=1 Ack=1 Win=4384 Len=0 TSval=52671976 TSecr=5131211"
"2016-09-27 00:04:47.092924","66","60613  >  80 [FIN"
"2016-09-27 00:04:47.113286","74","60614  >  80 [SYN] Seq=0 Win=4380 Len=0 MSS=1460 SACK_PERM=1 TSval=52671981 TSecr=0 WS=16"
"2016-09-27 00:04:47.244715","66","60613  >  80 [ACK] Seq=2 Ack=2 Win=4384 Len=0 TSval=52672015 TSecr=5131249"
"2016-09-27 00:04:47.268136","66","60614  >  80 [ACK] Seq=1 Ack=1 Win=4384 Len=0 TSval=52672021 TSecr=2265060488"
"2016-09-27 00:04:47.268874","66","60614  >  80 [FIN"
"2016-09-27 00:04:47.305987","74","60615  >  80 [SYN] Seq=0 Win=4380 Len=0 MSS=1460 SACK_PERM=1 TSval=52672024 TSecr=0 WS=16"
"2016-09-27 00:04:47.421324","66","60614  >  80 [ACK] Seq=2 Ack=2 Win=4384 Len=0 TSval=52672060 TSecr=2265060527"
"2016-09-27 00:04:47.456130","66","60615  >  80 [ACK] Seq=1 Ack=1 Win=4384 Len=0 TSval=52672069 TSecr=2826085542"
"2016-09-27 00:04:47.456247","66","60615  >  80 [FIN"
"2016-09-27 00:04:47.607927","66","60615  >  80 [ACK] Seq=2 Ack=2 Win=4384 Len=0 TSval=52672108 TSecr=2826085579"
"2016-09-27 00:09:46.957342","74","52975  >  80 [SYN] Seq=0 Win=4380 Len=0 MSS=1460 SACK_PERM=1 TSval=52748741 TSecr=0 WS=16"
"2016-09-27 00:09:47.103113","66","52975  >  80 [ACK] Seq=1 Ack=1 Win=4384 Len=0 TSval=52748779 TSecr=2640157199"
"2016-09-27 00:09:47.103650","66","52975  >  80 [FIN"
"2016-09-27 00:09:47.119770","74","52976  >  80 [SYN] Seq=0 Win=4380 Len=0 MSS=1460 SACK_PERM=1 TSval=52748783 TSecr=0 WS=16"
"2016-09-27 00:09:47.255496","66","52975  >  80 [ACK] Seq=2 Ack=2 Win=4384 Len=0 TSval=52748818 TSecr=2640157235"
"2016-09-27 00:09:47.267949","66","52976  >  80 [ACK] Seq=1 Ack=1 Win=4384 Len=0 TSval=52748821 TSecr=2176331494"
"2016-09-27 00:09:47.268065","66","52976  >  80 [FIN"
"2016-09-27 00:09:47.288104","74","52977  >  80 [SYN] Seq=0 Win=4380 Len=0 MSS=1460 SACK_PERM=1 TSval=52748826 TSecr=0 WS=16"
"2016-09-27 00:09:47.419549","66","52976  >  80 [ACK] Seq=2 Ack=2 Win=4384 Len=0 TSval=52748860 TSecr=2176331531"
"2016-09-27 00:09:47.443002","66","52977  >  80 [ACK] Seq=1 Ack=1 Win=4384 Len=0 TSval=52748866 TSecr=2176333056"
"2016-09-27 00:09:47.443135","66","52977  >  80 [FIN"
"2016-09-27 00:09:47.619608","66","52977  >  80 [ACK] Seq=2 Ack=2 Win=4384 Len=0 TSval=52748911 TSecr=2176333094"
"2016-09-27 00:10:41.473922","74","46547  >  80 [SYN] Seq=0 Win=4380 Len=0 MSS=1460 SACK_PERM=1 TSval=52762697 TSecr=0 WS=16"
"2016-09-27 00:10:41.630652","66","46547  >  80 [ACK] Seq=1 Ack=1 Win=4384 Len=0 TSval=52762738 TSecr=2675724338"
"2016-09-27 00:10:41.631925","66","46547  >  80 [FIN"
"2016-09-27 00:10:41.648334","74","46549  >  80 [SYN] Seq=0 Win=4380 Len=0 MSS=1460 SACK_PERM=1 TSval=52762742 TSecr=0 WS=16"
"2016-09-27 00:10:41.786627","66","46547  >  80 [ACK] Seq=2 Ack=2 Win=4384 Len=0 TSval=52762778 TSecr=2675724378"
"2016-09-27 00:10:41.799789","66","46549  >  80 [ACK] Seq=1 Ack=1 Win=4384 Len=0 TSval=52762781 TSecr=2529532655"
"2016-09-27 00:10:41.800340","66","46549  >  80 [FIN"
"2016-09-27 00:10:41.826215","74","46550  >  80 [SYN] Seq=0 Win=4380 Len=0 MSS=1460 SACK_PERM=1 TSval=52762788 TSecr=0 WS=16"
"2016-09-27 00:10:41.950706","66","46549  >  80 [ACK] Seq=2 Ack=2 Win=4384 Len=0 TSval=52762820 TSecr=2529532693"
"2016-09-27 00:10:41.974016","66","46550  >  80 [ACK] Seq=1 Ack=1 Win=4384 Len=0 TSval=52762826 TSecr=2529532699"
"2016-09-27 00:10:41.974134","66","46550  >  80 [FIN"
"2016-09-27 00:10:42.127260","66","46550  >  80 [ACK] Seq=2 Ack=2 Win=4384 Len=0 TSval=52762865 TSecr=2529532736"
"2016-09-27 00:15:43.106503","74","43045  >  80 [SYN] Seq=0 Win=4380 Len=0 MSS=1460 SACK_PERM=1 TSval=52839916 TSecr=0 WS=16"
"2016-09-27 00:15:43.260223","66","43045  >  80 [ACK] Seq=1 Ack=1 Win=4384 Len=0 TSval=52839955 TSecr=1737613972"
"2016-09-27 00:15:43.260361","66","43045  >  80 [FIN"
"2016-09-27 00:15:43.278682","74","43046  >  80 [SYN] Seq=0 Win=4380 Len=0 MSS=1460 SACK_PERM=1 TSval=52839960 TSecr=0 WS=16"
"2016-09-27 00:15:43.411858","66","43045  >  80 [ACK] Seq=2 Ack=2 Win=4384 Len=0 TSval=52839994 TSecr=1737614010"
"2016-09-27 00:15:43.434424","66","43046  >  80 [ACK] Seq=1 Ack=1 Win=4384 Len=0 TSval=52840000 TSecr=495423021"
"2016-09-27 00:15:43.439544","66","43046  >  80 [FIN"
"2016-09-27 00:15:43.459603","74","43047  >  80 [SYN] Seq=0 Win=4380 Len=0 MSS=1460 SACK_PERM=1 TSval=52840006 TSecr=0 WS=16"
"2016-09-27 00:15:43.594650","66","43046  >  80 [ACK] Seq=2 Ack=2 Win=4384 Len=0 TSval=52840041 TSecr=495423061"
"2016-09-27 00:15:43.606273","66","43047  >  80 [ACK] Seq=1 Ack=1 Win=4384 Len=0 TSval=52840044 TSecr=495421487"
"2016-09-27 00:15:43.606405","66","43047  >  80 [FIN"
"2016-09-27 00:15:43.759904","66","43047  >  80 [ACK] Seq=2 Ack=2 Win=4384 Len=0 TSval=52840083 TSecr=495421523"
"2016-09-27 00:20:43.093987","74","57076  >  80 [SYN] Seq=0 Win=4380 Len=0 MSS=1460 SACK_PERM=1 TSval=52916713 TSecr=0 WS=16"
"2016-09-27 00:20:43.246005","66","57076  >  80 [ACK] Seq=1 Ack=1 Win=4384 Len=0 TSval=52916752 TSecr=2698540941"
"2016-09-27 00:20:43.246616","66","57076  >  80 [FIN"
"2016-09-27 00:20:43.279254","74","57077  >  80 [SYN] Seq=0 Win=4380 Len=0 MSS=1460 SACK_PERM=1 TSval=52916759 TSecr=0 WS=16"
"2016-09-27 00:20:43.398344","66","57076  >  80 [ACK] Seq=2 Ack=2 Win=4384 Len=0 TSval=52916791 TSecr=2698540979"
"2016-09-27 00:20:43.433549","66","57077  >  80 [ACK] Seq=1 Ack=1 Win=4384 Len=0 TSval=52916800 TSecr=2529683060"
"2016-09-27 00:20:43.434299","66","57077  >  80 [FIN"
"2016-09-27 00:20:43.459318","74","57078  >  80 [SYN] Seq=0 Win=4380 Len=0 MSS=1460 SACK_PERM=1 TSval=52916806 TSecr=0 WS=16"
"2016-09-27 00:20:43.586335","66","57077  >  80 [ACK] Seq=2 Ack=2 Win=4384 Len=0 TSval=52916839 TSecr=2529683099"
"2016-09-27 00:20:43.609231","66","57078  >  80 [ACK] Seq=1 Ack=1 Win=4384 Len=0 TSval=52916845 TSecr=2697674104"
"2016-09-27 00:20:43.609626","66","57078  >  80 [FIN"
"2016-09-27 00:20:43.761740","66","57078  >  80 [ACK] Seq=2 Ack=2 Win=4384 Len=0 TSval=52916884 TSecr=2697674142"
"2016-09-27 00:25:42.103004","74","44388  >  80 [SYN] Seq=0 Win=4380 Len=0 MSS=1460 SACK_PERM=1 TSval=52993259 TSecr=0 WS=16"
"2016-09-27 00:25:42.254285","66","44388  >  80 [ACK] Seq=1 Ack=1 Win=4384 Len=0 TSval=52993298 TSecr=2176570240"
"2016-09-27 00:25:42.254423","66","44388  >  80 [FIN"
"2016-09-27 00:25:42.269953","74","44389  >  80 [SYN] Seq=0 Win=4380 Len=0 MSS=1460 SACK_PERM=1 TSval=52993301 TSecr=0 WS=16"
"2016-09-27 00:25:42.417829","66","44388  >  80 [ACK] Seq=2 Ack=2 Win=4384 Len=0 TSval=52993340 TSecr=2176570277"
"2016-09-27 00:25:42.418755","66","44389  >  80 [ACK] Seq=1 Ack=1 Win=4384 Len=0 TSval=52993340 TSecr=2677694830"
"2016-09-27 00:25:42.420092","66","44389  >  80 [FIN"
"2016-09-27 00:25:42.455692","74","44390  >  80 [SYN] Seq=0 Win=4380 Len=0 MSS=1460 SACK_PERM=1 TSval=52993349 TSecr=0 WS=16"
"2016-09-27 00:25:42.569333","66","44389  >  80 [ACK] Seq=2 Ack=2 Win=4384 Len=0 TSval=52993379 TSecr=2677694868"
"2016-09-27 00:25:42.604498","66","44390  >  80 [ACK] Seq=1 Ack=1 Win=4384 Len=0 TSval=52993388 TSecr=1737763807"
"2016-09-27 00:25:42.604632","66","44390  >  80 [FIN"
"2016-09-27 00:25:42.756801","66","44390  >  80 [ACK] Seq=2 Ack=2 Win=4384 Len=0 TSval=52993427 TSecr=1737763844"
"2016-09-27 00:30:42.165138","74","46848  >  80 [SYN] Seq=0 Win=4380 Len=0 MSS=1460 SACK_PERM=1 TSval=53070075 TSecr=0 WS=16"
"2016-09-27 00:30:42.318394","66","46848  >  80 [ACK] Seq=1 Ack=1 Win=4384 Len=0 TSval=53070115 TSecr=2419393262"
"2016-09-27 00:30:42.319125","66","46848  >  80 [FIN"
"2016-09-27 00:30:42.338874","74","46849  >  80 [SYN] Seq=0 Win=4380 Len=0 MSS=1460 SACK_PERM=1 TSval=53070120 TSecr=0 WS=16"
"2016-09-27 00:30:42.470792","66","46848  >  80 [ACK] Seq=2 Ack=2 Win=4384 Len=0 TSval=53070154 TSecr=2419393300"
"2016-09-27 00:30:42.494183","66","46849  >  80 [ACK] Seq=1 Ack=1 Win=4384 Len=0 TSval=53070160 TSecr=2677491121"
"2016-09-27 00:30:42.494805","66","46849  >  80 [FIN"
"2016-09-27 00:30:42.513022","74","46850  >  80 [SYN] Seq=0 Win=4380 Len=0 MSS=1460 SACK_PERM=1 TSval=53070164 TSecr=0 WS=16"
"2016-09-27 00:30:42.646561","66","46849  >  80 [ACK] Seq=2 Ack=2 Win=4384 Len=0 TSval=53070199 TSecr=2677491160"
"2016-09-27 00:30:42.658456","66","46850  >  80 [ACK] Seq=1 Ack=1 Win=4384 Len=0 TSval=53070202 TSecr=495647844"
"2016-09-27 00:30:42.659138","66","46850  >  80 [FIN"
"2016-09-27 00:30:42.810613","66","46850  >  80 [ACK] Seq=2 Ack=2 Win=4384 Len=0 TSval=53070241 TSecr=495647880"
"2016-09-27 00:35:42.098751","74","33281  >  80 [SYN] Seq=0 Win=4380 Len=0 MSS=1460 SACK_PERM=1 TSval=53146859 TSecr=0 WS=16"
"2016-09-27 00:35:42.276749","66","33281  >  80 [ACK] Seq=1 Ack=1 Win=4384 Len=0 TSval=53146899 TSecr=2265524224"
"2016-09-27 00:35:42.276889","66","33281  >  80 [FIN"
"2016-09-27 00:35:42.317612","74","33282  >  80 [SYN] Seq=0 Win=4380 Len=0 MSS=1460 SACK_PERM=1 TSval=53146909 TSecr=0 WS=16"
"2016-09-27 00:35:42.430782","66","33281  >  80 [ACK] Seq=2 Ack=2 Win=4384 Len=0 TSval=53146944 TSecr=2265524268"
"2016-09-27 00:35:42.477544","66","33282  >  80 [ACK] Seq=1 Ack=1 Win=4384 Len=0 TSval=53146956 TSecr=2826549290"
"2016-09-27 00:35:42.478254","66","33282  >  80 [FIN"
"2016-09-27 00:35:42.505668","74","33283  >  80 [SYN] Seq=0 Win=4380 Len=0 MSS=1460 SACK_PERM=1 TSval=53146963 TSecr=0 WS=16"
"2016-09-27 00:35:42.630026","66","33282  >  80 [ACK] Seq=2 Ack=2 Win=4384 Len=0 TSval=53146995 TSecr=2826549330"
"2016-09-27 00:35:42.653436","66","33283  >  80 [ACK] Seq=1 Ack=1 Win=4384 Len=0 TSval=53147001 TSecr=5595114"
"2016-09-27 00:35:42.653561","66","33283  >  80 [FIN"
"2016-09-27 00:35:42.805817","66","33283  >  80 [ACK] Seq=2 Ack=2 Win=4384 Len=0 TSval=53147040 TSecr=5595150"
"2016-09-27 00:40:43.078969","74","52971  >  80 [SYN] Seq=0 Win=4380 Len=0 MSS=1460 SACK_PERM=1 TSval=53223910 TSecr=0 WS=16"
"2016-09-27 00:40:43.226779","66","52971  >  80 [ACK] Seq=1 Ack=1 Win=4384 Len=0 TSval=53223948 TSecr=2678482745"
"2016-09-27 00:40:43.227417","66","52971  >  80 [FIN"
"2016-09-27 00:40:43.245189","74","52972  >  80 [SYN] Seq=0 Win=4380 Len=0 MSS=1460 SACK_PERM=1 TSval=53223952 TSecr=0 WS=16"
"2016-09-27 00:40:43.379135","66","52971  >  80 [ACK] Seq=2 Ack=2 Win=4384 Len=0 TSval=53223987 TSecr=2678482782"
"2016-09-27 00:40:43.390873","66","52972  >  80 [ACK] Seq=1 Ack=1 Win=4384 Len=0 TSval=53223990 TSecr=2419543554"
"2016-09-27 00:40:43.391518","66","52972  >  80 [FIN"
"2016-09-27 00:40:43.405102","74","52973  >  80 [SYN] Seq=0 Win=4380 Len=0 MSS=1460 SACK_PERM=1 TSval=53223993 TSecr=0 WS=16"
"2016-09-27 00:40:43.543244","66","52972  >  80 [ACK] Seq=2 Ack=2 Win=4384 Len=0 TSval=53224029 TSecr=2419543590"
"2016-09-27 00:40:43.554846","66","52973  >  80 [ACK] Seq=1 Ack=1 Win=4384 Len=0 TSval=53224032 TSecr=2210144792"
"2016-09-27 00:40:43.554964","66","52973  >  80 [FIN"
"2016-09-27 00:40:43.708209","66","52973  >  80 [ACK] Seq=2 Ack=2 Win=4384 Len=0 TSval=53224071 TSecr=2210144830"
"2016-09-27 00:45:42.118016","74","53769  >  80 [SYN] Seq=0 Win=4380 Len=0 MSS=1460 SACK_PERM=1 TSval=53300464 TSecr=0 WS=16"
"2016-09-27 00:45:42.285718","66","53769  >  80 [ACK] Seq=1 Ack=1 Win=4384 Len=0 TSval=53300504 TSecr=16107294"
"2016-09-27 00:45:42.290224","66","53769  >  80 [FIN"
"2016-09-27 00:45:42.303710","74","53770  >  80 [SYN] Seq=0 Win=4380 Len=0 MSS=1460 SACK_PERM=1 TSval=53300511 TSecr=0 WS=16"
"2016-09-27 00:45:42.436801","66","53769  >  80 [ACK] Seq=2 Ack=2 Win=4384 Len=0 TSval=53300546 TSecr=16107337"
"2016-09-27 00:45:42.448483","66","53770  >  80 [ACK] Seq=1 Ack=1 Win=4384 Len=0 TSval=53300549 TSecr=2137311344"
"2016-09-27 00:45:42.449284","66","53770  >  80 [FIN"
"2016-09-27 00:45:42.479656","74","53771  >  80 [SYN] Seq=0 Win=4380 Len=0 MSS=1460 SACK_PERM=1 TSval=53300557 TSecr=0 WS=16"
"2016-09-27 00:45:42.600840","66","53770  >  80 [ACK] Seq=2 Ack=2 Win=4384 Len=0 TSval=53300588 TSecr=2137311380"
"2016-09-27 00:45:42.637681","66","53771  >  80 [ACK] Seq=1 Ack=1 Win=4384 Len=0 TSval=53300597 TSecr=2678558111"
"2016-09-27 00:45:42.637815","66","53771  >  80 [FIN"
"2016-09-27 00:45:42.788388","66","53771  >  80 [ACK] Seq=2 Ack=2 Win=4384 Len=0 TSval=53300636 TSecr=2678558150"
"2016-09-27 00:50:43.101761","74","46787  >  80 [SYN] Seq=0 Win=4380 Len=0 MSS=1460 SACK_PERM=1 TSval=53377516 TSecr=0 WS=16"
"2016-09-27 00:50:43.256182","66","46787  >  80 [ACK] Seq=1 Ack=1 Win=4384 Len=0 TSval=53377556 TSecr=495946407"
"2016-09-27 00:50:43.256751","66","46787  >  80 [FIN"
"2016-09-27 00:50:43.270527","74","46788  >  80 [SYN] Seq=0 Win=4380 Len=0 MSS=1460 SACK_PERM=1 TSval=53377559 TSecr=0 WS=16"
"2016-09-27 00:50:43.408665","66","46787  >  80 [ACK] Seq=2 Ack=2 Win=4384 Len=0 TSval=53377595 TSecr=495946446"
"2016-09-27 00:50:43.420715","66","46788  >  80 [ACK] Seq=1 Ack=1 Win=4384 Len=0 TSval=53377598 TSecr=2656000074"
"2016-09-27 00:50:43.421665","66","46788  >  80 [FIN"
"2016-09-27 00:50:43.447531","74","46789  >  80 [SYN] Seq=0 Win=4380 Len=0 MSS=1460 SACK_PERM=1 TSval=53377605 TSecr=0 WS=16"
"2016-09-27 00:50:43.572645","66","46788  >  80 [ACK] Seq=2 Ack=2 Win=4384 Len=0 TSval=53377637 TSecr=2656000112"
"2016-09-27 00:50:43.596037","66","46789  >  80 [ACK] Seq=1 Ack=1 Win=4384 Len=0 TSval=53377643 TSecr=57370605"
"2016-09-27 00:50:43.596173","66","46789  >  80 [FIN"
"2016-09-27 00:50:43.748674","66","46789  >  80 [ACK] Seq=2 Ack=2 Win=4384 Len=0 TSval=53377682 TSecr=57370642"
"2016-09-27 00:55:42.140913","74","51291  >  80 [SYN] Seq=0 Win=4380 Len=0 MSS=1460 SACK_PERM=1 TSval=53454070 TSecr=0 WS=16"
"2016-09-27 00:55:42.298306","66","51291  >  80 [ACK] Seq=1 Ack=1 Win=4384 Len=0 TSval=53454111 TSecr=2826832203"
"2016-09-27 00:55:42.298851","66","51291  >  80 [FIN"
"2016-09-27 00:55:42.315364","74","51292  >  80 [SYN] Seq=0 Win=4380 Len=0 MSS=1460 SACK_PERM=1 TSval=53454115 TSecr=0 WS=16"
"2016-09-27 00:55:42.451244","66","51291  >  80 [ACK] Seq=2 Ack=2 Win=4384 Len=0 TSval=53454150 TSecr=2826832242"
"2016-09-27 00:55:42.462275","66","51292  >  80 [ACK] Seq=1 Ack=1 Win=4384 Len=0 TSval=53454153 TSecr=2419768317"
"2016-09-27 00:55:42.463009","66","51292  >  80 [FIN"
"2016-09-27 00:55:42.494049","74","51293  >  80 [SYN] Seq=0 Win=4380 Len=0 MSS=1460 SACK_PERM=1 TSval=53454161 TSecr=0 WS=16"
"2016-09-27 00:55:42.614765","66","51292  >  80 [ACK] Seq=2 Ack=2 Win=4384 Len=0 TSval=53454192 TSecr=2419768354"
"2016-09-27 00:55:42.649769","66","51293  >  80 [ACK] Seq=1 Ack=1 Win=4384 Len=0 TSval=53454201 TSecr=2826849330"
"2016-09-27 00:55:42.650269","66","51293  >  80 [FIN"
"2016-09-27 00:55:42.813646","66","51293  >  80 [ACK] Seq=2 Ack=2 Win=4384 Len=0 TSval=53454240 TSecr=2826849369"
"2016-09-27 01:00:42.103774","74","42363  >  80 [SYN] Seq=0 Win=4380 Len=0 MSS=1460 SACK_PERM=1 TSval=53530859 TSecr=0 WS=16"
"2016-09-27 01:00:42.252356","66","42363  >  80 [ACK] Seq=1 Ack=1 Win=4384 Len=0 TSval=53530897 TSecr=2520649049"
"2016-09-27 01:00:42.252993","66","42363  >  80 [FIN"
"2016-09-27 01:00:42.270993","74","42364  >  80 [SYN] Seq=0 Win=4380 Len=0 MSS=1460 SACK_PERM=1 TSval=53530901 TSecr=0 WS=16"
"2016-09-27 01:00:42.428130","66","42363  >  80 [ACK] Seq=2 Ack=2 Win=4384 Len=0 TSval=53530936 TSecr=2520649087"
"2016-09-27 01:00:42.439813","66","42364  >  80 [ACK] Seq=1 Ack=1 Win=4384 Len=0 TSval=53530945 TSecr=2177095282"
"2016-09-27 01:00:42.440429","66","42364  >  80 [FIN"
"2016-09-27 01:00:42.460360","74","42365  >  80 [SYN] Seq=0 Win=4380 Len=0 MSS=1460 SACK_PERM=1 TSval=53530950 TSecr=0 WS=16"
"2016-09-27 01:00:42.592149","66","42364  >  80 [ACK] Seq=2 Ack=2 Win=4384 Len=0 TSval=53530984 TSecr=2177095324"
"2016-09-27 01:00:42.615591","66","42365  >  80 [ACK] Seq=1 Ack=1 Win=4384 Len=0 TSval=53530990 TSecr=489131644"
"2016-09-27 01:00:42.615711","66","42365  >  80 [FIN"
"2016-09-27 01:00:42.769936","66","42365  >  80 [ACK] Seq=2 Ack=2 Win=4384 Len=0 TSval=53531029 TSecr=489131683"
"2016-09-27 01:05:42.137439","74","55208  >  80 [SYN] Seq=0 Win=4380 Len=0 MSS=1460 SACK_PERM=1 TSval=53607667 TSecr=0 WS=16"
"2016-09-27 01:05:42.282680","66","55208  >  80 [ACK] Seq=1 Ack=1 Win=4384 Len=0 TSval=53607705 TSecr=496172745"
"2016-09-27 01:05:42.283338","66","55208  >  80 [FIN"
"2016-09-27 01:05:42.314370","74","55209  >  80 [SYN] Seq=0 Win=4380 Len=0 MSS=1460 SACK_PERM=1 TSval=53607713 TSecr=0 WS=16"
"2016-09-27 01:05:42.435079","66","55208  >  80 [ACK] Seq=2 Ack=2 Win=4384 Len=0 TSval=53607744 TSecr=496172781"
"2016-09-27 01:05:42.470697","66","55209  >  80 [ACK] Seq=1 Ack=1 Win=4384 Len=0 TSval=53607753 TSecr=743741350"
"2016-09-27 01:05:42.470828","66","55209  >  80 [FIN"
"2016-09-27 01:05:42.493792","74","55210  >  80 [SYN] Seq=0 Win=4380 Len=0 MSS=1460 SACK_PERM=1 TSval=53607759 TSecr=0 WS=16"
"2016-09-27 01:05:42.622569","66","55209  >  80 [ACK] Seq=2 Ack=2 Win=4384 Len=0 TSval=53607792 TSecr=743741389"
"2016-09-27 01:05:42.646139","66","55210  >  80 [ACK] Seq=1 Ack=1 Win=4384 Len=0 TSval=53607798 TSecr=2678858110"
"2016-09-27 01:05:42.646259","66","55210  >  80 [FIN"
"2016-09-27 01:05:42.798235","66","55210  >  80 [ACK] Seq=2 Ack=2 Win=4384 Len=0 TSval=53607837 TSecr=2678858148"
"2016-09-27 01:10:42.092354","74","45071  >  80 [SYN] Seq=0 Win=4380 Len=0 MSS=1460 SACK_PERM=1 TSval=53684456 TSecr=0 WS=16"
"2016-09-27 01:10:42.246548","66","45071  >  80 [ACK] Seq=1 Ack=1 Win=4384 Len=0 TSval=53684496 TSecr=2677517716"
"2016-09-27 01:10:42.247150","66","45071  >  80 [FIN"
"2016-09-27 01:10:42.274824","74","45072  >  80 [SYN] Seq=0 Win=4380 Len=0 MSS=1460 SACK_PERM=1 TSval=53684502 TSecr=0 WS=16"
"2016-09-27 01:10:42.399522","66","45071  >  80 [ACK] Seq=2 Ack=2 Win=4384 Len=0 TSval=53684535 TSecr=2677517755"
"2016-09-27 01:10:42.422399","66","45072  >  80 [ACK] Seq=1 Ack=1 Win=4384 Len=0 TSval=53684541 TSecr=2677539054"
"2016-09-27 01:10:42.423117","66","45072  >  80 [FIN"
"2016-09-27 01:10:42.451260","74","45073  >  80 [SYN] Seq=0 Win=4380 Len=0 MSS=1460 SACK_PERM=1 TSval=53684548 TSecr=0 WS=16"
"2016-09-27 01:10:42.571129","66","45072  >  80 [ACK] Seq=2 Ack=2 Win=4384 Len=0 TSval=53684579 TSecr=2677539091"
"2016-09-27 01:10:42.608209","66","45073  >  80 [ACK] Seq=1 Ack=1 Win=4384 Len=0 TSval=53684588 TSecr=743816384"
"2016-09-27 01:10:42.608346","66","45073  >  80 [FIN"
"2016-09-27 01:10:42.758327","66","45073  >  80 [ACK] Seq=2 Ack=2 Win=4384 Len=0 TSval=53684627 TSecr=743816423"
"2016-09-27 01:15:42.150161","74","50239  >  80 [SYN] Seq=0 Win=4380 Len=0 MSS=1460 SACK_PERM=1 TSval=53761271 TSecr=0 WS=16"
"2016-09-27 01:15:42.300387","66","50239  >  80 [ACK] Seq=1 Ack=1 Win=4384 Len=0 TSval=53761310 TSecr=2138561673"
"2016-09-27 01:15:42.301190","66","50239  >  80 [FIN"
"2016-09-27 01:15:42.332858","74","50240  >  80 [SYN] Seq=0 Win=4380 Len=0 MSS=1460 SACK_PERM=1 TSval=53761318 TSecr=0 WS=16"
"2016-09-27 01:15:42.452780","66","50239  >  80 [ACK] Seq=2 Ack=2 Win=4384 Len=0 TSval=53761349 TSecr=2138561710"
"2016-09-27 01:15:42.487832","66","50240  >  80 [ACK] Seq=1 Ack=1 Win=4384 Len=0 TSval=53761358 TSecr=2677592775"
"2016-09-27 01:15:42.489281","66","50240  >  80 [FIN"
"2016-09-27 01:15:42.522767","74","50241  >  80 [SYN] Seq=0 Win=4380 Len=0 MSS=1460 SACK_PERM=1 TSval=53761366 TSecr=0 WS=16"
"2016-09-27 01:15:42.640948","66","50240  >  80 [ACK] Seq=2 Ack=2 Win=4384 Len=0 TSval=53761397 TSecr=2677592814"
"2016-09-27 01:15:42.675420","66","50241  >  80 [ACK] Seq=1 Ack=1 Win=4384 Len=0 TSval=53761406 TSecr=1738513829"
"2016-09-27 01:15:42.675551","66","50241  >  80 [FIN"
"2016-09-27 01:15:42.827787","66","50241  >  80 [ACK] Seq=2 Ack=2 Win=4384 Len=0 TSval=53761445 TSecr=1738513868"
"2016-09-27 01:20:12.371279","74","50242  >  80 [SYN] Seq=0 Win=4380 Len=0 MSS=1460 SACK_PERM=1 TSval=53830448 TSecr=0 WS=16"
"2016-09-27 01:20:12.526162","66","50242  >  80 [ACK] Seq=1 Ack=1 Win=4384 Len=0 TSval=53830488 TSecr=2210590811"
"2016-09-27 01:20:12.527667","66","50242  >  80 [FIN"
"2016-09-27 01:20:12.547376","74","50244  >  80 [SYN] Seq=0 Win=4380 Len=0 MSS=1460 SACK_PERM=1 TSval=53830493 TSecr=0 WS=16"
"2016-09-27 01:20:12.679099","66","50242  >  80 [ACK] Seq=2 Ack=2 Win=4384 Len=0 TSval=53830527 TSecr=2210590850"
"2016-09-27 01:20:12.702145","66","50244  >  80 [ACK] Seq=1 Ack=1 Win=4384 Len=0 TSval=53830533 TSecr=2594537906"
"2016-09-27 01:20:12.705887","66","50244  >  80 [FIN"
"2016-09-27 01:20:12.767467","74","50245  >  80 [SYN] Seq=0 Win=4380 Len=0 MSS=1460 SACK_PERM=1 TSval=53830549 TSecr=0 WS=16"
"2016-09-27 01:20:12.855007","66","50244  >  80 [ACK] Seq=2 Ack=2 Win=4384 Len=0 TSval=53830572 TSecr=2594537946"
"2016-09-27 01:20:12.912926","66","50245  >  80 [ACK] Seq=1 Ack=1 Win=4384 Len=0 TSval=53830587 TSecr=2138337546"
"2016-09-27 01:20:12.913045","66","50245  >  80 [FIN"
"2016-09-27 01:20:13.065187","66","50245  >  80 [ACK] Seq=2 Ack=2 Win=4384 Len=0 TSval=53830626 TSecr=2138337582"
"2016-09-27 01:25:13.028910","74","41306  >  80 [SYN] Seq=0 Win=4380 Len=0 MSS=1460 SACK_PERM=1 TSval=53907417 TSecr=0 WS=16"
"2016-09-27 01:25:13.173702","66","41306  >  80 [ACK] Seq=1 Ack=1 Win=4384 Len=0 TSval=53907454 TSecr=2678587522"
"2016-09-27 01:25:13.174500","66","41306  >  80 [FIN"
"2016-09-27 01:25:13.189086","74","41307  >  80 [SYN] Seq=0 Win=4380 Len=0 MSS=1460 SACK_PERM=1 TSval=53907458 TSecr=0 WS=16"
"2016-09-27 01:25:13.326526","66","41306  >  80 [ACK] Seq=2 Ack=2 Win=4384 Len=0 TSval=53907493 TSecr=2678587558"
"2016-09-27 01:25:13.337664","66","41307  >  80 [ACK] Seq=1 Ack=1 Win=4384 Len=0 TSval=53907496 TSecr=2678921800"
"2016-09-27 01:25:13.338278","66","41307  >  80 [FIN"
"2016-09-27 01:25:13.366590","74","41308  >  80 [SYN] Seq=0 Win=4380 Len=0 MSS=1460 SACK_PERM=1 TSval=53907503 TSecr=0 WS=16"
"2016-09-27 01:25:13.490288","66","41307  >  80 [ACK] Seq=2 Ack=2 Win=4384 Len=0 TSval=53907535 TSecr=2678921837"
"2016-09-27 01:25:13.513533","66","41308  >  80 [ACK] Seq=1 Ack=1 Win=4384 Len=0 TSval=53907541 TSecr=2530650585"
"2016-09-27 01:25:13.514233","66","41308  >  80 [FIN"
"2016-09-27 01:25:13.665866","66","41308  >  80 [ACK] Seq=2 Ack=2 Win=4384 Len=0 TSval=53907580 TSecr=2530650622"
"2016-09-27 01:30:13.036743","74","46845  >  80 [SYN] Seq=0 Win=4380 Len=0 MSS=1460 SACK_PERM=1 TSval=53984219 TSecr=0 WS=16"
"2016-09-27 01:30:13.193160","66","46845  >  80 [ACK] Seq=1 Ack=1 Win=4384 Len=0 TSval=53984259 TSecr=2698716505"
"2016-09-27 01:30:13.193297","66","46845  >  80 [FIN"
"2016-09-27 01:30:13.211697","74","46846  >  80 [SYN] Seq=0 Win=4380 Len=0 MSS=1460 SACK_PERM=1 TSval=53984264 TSecr=0 WS=16"
"2016-09-27 01:30:13.344682","66","46845  >  80 [ACK] Seq=2 Ack=2 Win=4384 Len=0 TSval=53984298 TSecr=2698716544"
"2016-09-27 01:30:13.368116","66","46846  >  80 [ACK] Seq=1 Ack=1 Win=4384 Len=0 TSval=53984304 TSecr=2210741018"
"2016-09-27 01:30:13.368657","66","46846  >  80 [FIN"
"2016-09-27 01:30:13.388271","74","46847  >  80 [SYN] Seq=0 Win=4380 Len=0 MSS=1460 SACK_PERM=1 TSval=53984309 TSecr=0 WS=16"
"2016-09-27 01:30:13.520436","66","46846  >  80 [ACK] Seq=2 Ack=2 Win=4384 Len=0 TSval=53984343 TSecr=2210741057"
"2016-09-27 01:30:13.543907","66","46847  >  80 [ACK] Seq=1 Ack=1 Win=4384 Len=0 TSval=53984349 TSecr=2594688120"
"2016-09-27 01:30:13.544295","66","46847  >  80 [FIN"
"2016-09-27 01:30:13.696235","66","46847  >  80 [ACK] Seq=2 Ack=2 Win=4384 Len=0 TSval=53984388 TSecr=2594688159"
"2016-09-27 01:35:13.083259","74","45486  >  80 [SYN] Seq=0 Win=4380 Len=0 MSS=1460 SACK_PERM=1 TSval=54061030 TSecr=0 WS=16"
"2016-09-27 01:35:13.230453","66","45486  >  80 [ACK] Seq=1 Ack=1 Win=4384 Len=0 TSval=54061069 TSecr=2177614499"
"2016-09-27 01:35:13.231200","66","45486  >  80 [FIN"
"2016-09-27 01:35:13.253302","74","45487  >  80 [SYN] Seq=0 Win=4380 Len=0 MSS=1460 SACK_PERM=1 TSval=54061074 TSecr=0 WS=16"
"2016-09-27 01:35:13.382924","66","45486  >  80 [ACK] Seq=2 Ack=2 Win=4384 Len=0 TSval=54061108 TSecr=2177614536"
"2016-09-27 01:35:13.407183","66","45487  >  80 [ACK] Seq=1 Ack=1 Win=4384 Len=0 TSval=54061114 TSecr=2698791557"
"2016-09-27 01:35:13.407319","66","45487  >  80 [FIN"
"2016-09-27 01:35:13.421087","74","45488  >  80 [SYN] Seq=0 Win=4380 Len=0 MSS=1460 SACK_PERM=1 TSval=54061117 TSecr=0 WS=16"
"2016-09-27 01:35:13.558580","66","45487  >  80 [ACK] Seq=2 Ack=2 Win=4384 Len=0 TSval=54061153 TSecr=2698791596"
"2016-09-27 01:35:13.570270","66","45488  >  80 [ACK] Seq=1 Ack=1 Win=4384 Len=0 TSval=54061156 TSecr=4249314426"
"2016-09-27 01:35:13.570402","66","45488  >  80 [FIN"
"2016-09-27 01:35:13.739611","66","45488  >  80 [ACK] Seq=2 Ack=2 Win=4384 Len=0 TSval=54061195 TSecr=4249314463"
"2016-09-27 01:40:13.033027","74","46891  >  80 [SYN] Seq=0 Win=4380 Len=0 MSS=1460 SACK_PERM=1 TSval=54137817 TSecr=0 WS=16"
"2016-09-27 01:40:13.188958","66","46891  >  80 [ACK] Seq=1 Ack=1 Win=4384 Len=0 TSval=54137857 TSecr=2678533798"
"2016-09-27 01:40:13.189612","66","46891  >  80 [FIN"
"2016-09-27 01:40:13.216914","74","46892  >  80 [SYN] Seq=0 Win=4380 Len=0 MSS=1460 SACK_PERM=1 TSval=54137864 TSecr=0 WS=16"
"2016-09-27 01:40:13.352871","66","46891  >  80 [ACK] Seq=2 Ack=2 Win=4384 Len=0 TSval=54137899 TSecr=2678533837"
"2016-09-27 01:40:13.364580","66","46892  >  80 [ACK] Seq=1 Ack=1 Win=4384 Len=0 TSval=54137902 TSecr=2827500043"
"2016-09-27 01:40:13.365338","66","46892  >  80 [FIN"
"2016-09-27 01:40:13.397411","74","46893  >  80 [SYN] Seq=0 Win=4380 Len=0 MSS=1460 SACK_PERM=1 TSval=54137910 TSecr=0 WS=16"
