"No.","Time","Source","Destination","Protocol","Length","Info"
"48","2016-09-23 23:00:10.663863","192.168.1.196","52.1.40.122","TCP","60","[TCP segment of a reassembled PDU]"
"87","2016-09-23 23:00:15.869248","Physical_00:67:5e","Tp-LinkT_51:33:ea","ARP","60","192.168.1.196 is at d0:52:a8:00:67:5e"
"108","2016-09-23 23:00:19.192690","192.168.1.196","52.1.40.122","TLSv1.2","123","Application Data"
"113","2016-09-23 23:00:19.399535","192.168.1.196","52.1.40.122","TCP","60","3063  >  443 [ACK] Seq=71 Ack=70 Win=3072 Len=0"
"165","2016-09-23 23:00:29.383997","192.168.1.196","52.1.40.122","TCP","60","[TCP Keep-Alive] 3063  >  443 [ACK] Seq=70 Ack=70 Win=3072 Len=1"
"199","2016-09-23 23:00:39.573505","192.168.1.196","52.1.40.122","TCP","60","[TCP Keep-Alive] 3063  >  443 [ACK] Seq=70 Ack=70 Win=3072 Len=1"
"220","2016-09-23 23:00:44.251599","192.168.1.196","52.1.40.122","TLSv1.2","123","Application Data"
"223","2016-09-23 23:00:44.458453","192.168.1.196","52.1.40.122","TCP","60","3063  >  443 [ACK] Seq=140 Ack=139 Win=3072 Len=0"
"260","2016-09-23 23:00:54.443183","192.168.1.196","52.1.40.122","TCP","60","[TCP Keep-Alive] 3063  >  443 [ACK] Seq=139 Ack=139 Win=3072 Len=1"
"323","2016-09-23 23:01:04.633063","192.168.1.196","52.1.40.122","TCP","60","[TCP Keep-Alive] 3063  >  443 [ACK] Seq=139 Ack=139 Win=3072 Len=1"
"347","2016-09-23 23:01:09.839263","Physical_00:67:5e","Tp-LinkT_51:33:ea","ARP","60","192.168.1.196 is at d0:52:a8:00:67:5e"
"373","2016-09-23 23:01:14.822740","192.168.1.196","52.1.40.122","TCP","60","[TCP Keep-Alive] 3063  >  443 [ACK] Seq=139 Ack=139 Win=3072 Len=1"
"410","2016-09-23 23:01:25.012478","192.168.1.196","52.1.40.122","TCP","60","[TCP Keep-Alive] 3063  >  443 [ACK] Seq=139 Ack=139 Win=3072 Len=1"
"468","2016-09-23 23:01:35.201958","192.168.1.196","52.1.40.122","TCP","60","[TCP Keep-Alive] 3063  >  443 [ACK] Seq=139 Ack=139 Win=3072 Len=1"
"496","2016-09-23 23:01:43.164326","192.168.1.196","52.1.40.122","TLSv1.2","123","Application Data"
"501","2016-09-23 23:01:43.371193","192.168.1.196","52.1.40.122","TCP","60","3063  >  443 [ACK] Seq=209 Ack=208 Win=3072 Len=0"
"553","2016-09-23 23:01:53.355983","192.168.1.196","52.1.40.122","TCP","60","[TCP Keep-Alive] 3063  >  443 [ACK] Seq=208 Ack=208 Win=3072 Len=1"
"588","2016-09-23 23:01:58.569286","Physical_00:67:5e","Tp-LinkT_51:33:ea","ARP","60","192.168.1.196 is at d0:52:a8:00:67:5e"
"626","2016-09-23 23:02:03.545604","192.168.1.196","52.1.40.122","TCP","60","[TCP Keep-Alive] 3063  >  443 [ACK] Seq=208 Ack=208 Win=3072 Len=1"
"805","2016-09-23 23:02:13.735173","192.168.1.196","52.1.40.122","TCP","60","[TCP Keep-Alive] 3063  >  443 [ACK] Seq=208 Ack=208 Win=3072 Len=1"
"841","2016-09-23 23:02:23.924785","192.168.1.196","52.1.40.122","TCP","60","[TCP Keep-Alive] 3063  >  443 [ACK] Seq=208 Ack=208 Win=3072 Len=1"
"891","2016-09-23 23:02:34.114396","192.168.1.196","52.1.40.122","TCP","60","[TCP Keep-Alive] 3063  >  443 [ACK] Seq=208 Ack=208 Win=3072 Len=1"
"920","2016-09-23 23:02:42.075384","192.168.1.196","52.1.40.122","TLSv1.2","123","Application Data"
"924","2016-09-23 23:02:42.281572","192.168.1.196","52.1.40.122","TCP","60","3063  >  443 [ACK] Seq=278 Ack=277 Win=3072 Len=0"
"945","2016-09-23 23:02:47.289257","Physical_00:67:5e","Tp-LinkT_51:33:ea","ARP","60","192.168.1.196 is at d0:52:a8:00:67:5e"
"973","2016-09-23 23:02:48.490789","192.168.1.196","52.1.40.122","TLSv1.2","123","Application Data"
"975","2016-09-23 23:02:48.698198","192.168.1.196","52.1.40.122","TCP","60","3063  >  443 [ACK] Seq=347 Ack=346 Win=3072 Len=0"
"1105","2016-09-23 23:02:58.682888","192.168.1.196","52.1.40.122","TCP","60","[TCP Keep-Alive] 3063  >  443 [ACK] Seq=346 Ack=346 Win=3072 Len=1"
"1204","2016-09-23 23:03:08.872335","192.168.1.196","52.1.40.122","TCP","60","[TCP Keep-Alive] 3063  >  443 [ACK] Seq=346 Ack=346 Win=3072 Len=1"
"1244","2016-09-23 23:03:19.061916","192.168.1.196","52.1.40.122","TCP","60","[TCP Keep-Alive] 3063  >  443 [ACK] Seq=346 Ack=346 Win=3072 Len=1"
"1306","2016-09-23 23:03:29.251398","192.168.1.196","52.1.40.122","TCP","60","[TCP Keep-Alive] 3063  >  443 [ACK] Seq=346 Ack=346 Win=3072 Len=1"
"1327","2016-09-23 23:03:34.459261","Physical_00:67:5e","Tp-LinkT_51:33:ea","ARP","60","192.168.1.196 is at d0:52:a8:00:67:5e"
"1338","2016-09-23 23:03:39.440932","192.168.1.196","52.1.40.122","TCP","60","[TCP Keep-Alive] 3063  >  443 [ACK] Seq=346 Ack=346 Win=3072 Len=1"
"1364","2016-09-23 23:03:47.402457","192.168.1.196","52.1.40.122","TLSv1.2","123","Application Data"
"1367","2016-09-23 23:03:47.609036","192.168.1.196","52.1.40.122","TCP","60","3063  >  443 [ACK] Seq=416 Ack=415 Win=3072 Len=0"
"1400","2016-09-23 23:03:50.920540","192.168.1.196","52.1.40.122","TLSv1.2","139","Application Data"
"1402","2016-09-23 23:03:51.127311","192.168.1.196","52.1.40.122","TCP","60","3063  >  443 [ACK] Seq=501 Ack=484 Win=3072 Len=0"
"1466","2016-09-23 23:04:01.111834","192.168.1.196","52.1.40.122","TCP","60","[TCP Keep-Alive] 3063  >  443 [ACK] Seq=500 Ack=484 Win=3072 Len=1"
"1508","2016-09-23 23:04:11.301460","192.168.1.196","52.1.40.122","TCP","60","[TCP Keep-Alive] 3063  >  443 [ACK] Seq=500 Ack=484 Win=3072 Len=1"
"1625","2016-09-23 23:04:21.491020","192.168.1.196","52.1.40.122","TCP","60","[TCP Keep-Alive] 3063  >  443 [ACK] Seq=500 Ack=484 Win=3072 Len=1"
"1663","2016-09-23 23:04:26.699264","Physical_00:67:5e","Tp-LinkT_51:33:ea","ARP","60","192.168.1.196 is at d0:52:a8:00:67:5e"
"1688","2016-09-23 23:04:31.680304","192.168.1.196","52.1.40.122","TCP","60","[TCP Keep-Alive] 3063  >  443 [ACK] Seq=500 Ack=484 Win=3072 Len=1"
"1724","2016-09-23 23:04:41.869421","192.168.1.196","52.1.40.122","TCP","60","[TCP Keep-Alive] 3063  >  443 [ACK] Seq=500 Ack=484 Win=3072 Len=1"
"1757","2016-09-23 23:04:49.830909","192.168.1.196","52.1.40.122","TLSv1.2","123","Application Data"
"1761","2016-09-23 23:04:50.043031","192.168.1.196","52.1.40.122","TCP","60","3063  >  443 [ACK] Seq=570 Ack=553 Win=3072 Len=0"
"1824","2016-09-23 23:05:00.027440","192.168.1.196","52.1.40.122","TCP","60","[TCP Keep-Alive] 3063  >  443 [ACK] Seq=569 Ack=553 Win=3072 Len=1"
"1888","2016-09-23 23:05:10.216883","192.168.1.196","52.1.40.122","TCP","60","[TCP Keep-Alive] 3063  >  443 [ACK] Seq=569 Ack=553 Win=3072 Len=1"
"1905","2016-09-23 23:05:15.429286","Physical_00:67:5e","Tp-LinkT_51:33:ea","ARP","60","192.168.1.196 is at d0:52:a8:00:67:5e"
"1912","2016-09-23 23:05:17.792580","192.168.1.196","52.1.40.122","TLSv1.2","123","Application Data"
"1915","2016-09-23 23:05:17.999756","192.168.1.196","52.1.40.122","TCP","60","3063  >  443 [ACK] Seq=639 Ack=622 Win=3072 Len=0"
"1975","2016-09-23 23:05:27.984352","192.168.1.196","52.1.40.122","TCP","60","[TCP Keep-Alive] 3063  >  443 [ACK] Seq=638 Ack=622 Win=3072 Len=1"
"2024","2016-09-23 23:05:38.173981","192.168.1.196","52.1.40.122","TCP","60","[TCP Keep-Alive] 3063  >  443 [ACK] Seq=638 Ack=622 Win=3072 Len=1"
"2081","2016-09-23 23:05:44.962080","192.168.1.196","52.1.40.122","TLSv1.2","123","Application Data"
"2084","2016-09-23 23:05:45.168933","192.168.1.196","52.1.40.122","TCP","60","3063  >  443 [ACK] Seq=708 Ack=691 Win=3072 Len=0"
"2165","2016-09-23 23:05:55.153548","192.168.1.196","52.1.40.122","TCP","60","[TCP Keep-Alive] 3063  >  443 [ACK] Seq=707 Ack=691 Win=3072 Len=1"
"2242","2016-09-23 23:06:05.343117","192.168.1.196","52.1.40.122","TCP","60","[TCP Keep-Alive] 3063  >  443 [ACK] Seq=707 Ack=691 Win=3072 Len=1"
"2269","2016-09-23 23:06:10.549280","Physical_00:67:5e","Tp-LinkT_51:33:ea","ARP","60","192.168.1.196 is at d0:52:a8:00:67:5e"
"2283","2016-09-23 23:06:15.532701","192.168.1.196","52.1.40.122","TCP","60","[TCP Keep-Alive] 3063  >  443 [ACK] Seq=707 Ack=691 Win=3072 Len=1"
"2328","2016-09-23 23:06:25.722243","192.168.1.196","52.1.40.122","TCP","60","[TCP Keep-Alive] 3063  >  443 [ACK] Seq=707 Ack=691 Win=3072 Len=1"
"2449","2016-09-23 23:06:35.911657","192.168.1.196","52.1.40.122","TCP","60","[TCP Keep-Alive] 3063  >  443 [ACK] Seq=707 Ack=691 Win=3072 Len=1"
"2478","2016-09-23 23:06:43.873287","192.168.1.196","52.1.40.122","TLSv1.2","123","Application Data"
"2481","2016-09-23 23:06:44.079551","192.168.1.196","52.1.40.122","TCP","60","3063  >  443 [ACK] Seq=777 Ack=760 Win=3072 Len=0"
"2514","2016-09-23 23:06:54.064166","192.168.1.196","52.1.40.122","TCP","60","[TCP Keep-Alive] 3063  >  443 [ACK] Seq=776 Ack=760 Win=3072 Len=1"
"2563","2016-09-23 23:06:59.269223","Physical_00:67:5e","Tp-LinkT_51:33:ea","ARP","60","192.168.1.196 is at d0:52:a8:00:67:5e"
"2585","2016-09-23 23:07:04.253707","192.168.1.196","52.1.40.122","TCP","60","[TCP Keep-Alive] 3063  >  443 [ACK] Seq=776 Ack=760 Win=3072 Len=1"
"2630","2016-09-23 23:07:14.443504","192.168.1.196","52.1.40.122","TCP","60","[TCP Keep-Alive] 3063  >  443 [ACK] Seq=776 Ack=760 Win=3072 Len=1"
"2695","2016-09-23 23:07:24.633273","192.168.1.196","52.1.40.122","TCP","60","[TCP Keep-Alive] 3063  >  443 [ACK] Seq=776 Ack=760 Win=3072 Len=1"
"2761","2016-09-23 23:07:34.822664","192.168.1.196","52.1.40.122","TCP","60","[TCP Keep-Alive] 3063  >  443 [ACK] Seq=776 Ack=760 Win=3072 Len=1"
"2788","2016-09-23 23:07:42.784577","192.168.1.196","52.1.40.122","TLSv1.2","123","Application Data"
"2791","2016-09-23 23:07:42.990960","192.168.1.196","52.1.40.122","TCP","60","3063  >  443 [ACK] Seq=846 Ack=829 Win=3072 Len=0"
"2805","2016-09-23 23:07:47.128775","192.168.1.196","52.1.40.122","TLSv1.2","123","Application Data"
"2808","2016-09-23 23:07:47.336174","192.168.1.196","52.1.40.122","TCP","60","3063  >  443 [ACK] Seq=915 Ack=898 Win=3072 Len=0"
"2810","2016-09-23 23:07:47.989235","Physical_00:67:5e","Tp-LinkT_51:33:ea","ARP","60","192.168.1.196 is at d0:52:a8:00:67:5e"
"2826","2016-09-23 23:07:51.556403","192.168.1.196","52.1.40.122","TLSv1.2","139","Application Data"
"2828","2016-09-23 23:07:51.765077","192.168.1.196","52.1.40.122","TCP","60","3063  >  443 [ACK] Seq=1000 Ack=967 Win=3072 Len=0"
"2905","2016-09-23 23:08:01.749589","192.168.1.196","52.1.40.122","TCP","60","[TCP Keep-Alive] 3063  >  443 [ACK] Seq=999 Ack=967 Win=3072 Len=1"
"2993","2016-09-23 23:08:11.939196","192.168.1.196","52.1.40.122","TCP","60","[TCP Keep-Alive] 3063  >  443 [ACK] Seq=999 Ack=967 Win=3072 Len=1"
"3039","2016-09-23 23:08:22.128735","192.168.1.196","52.1.40.122","TCP","60","[TCP Keep-Alive] 3063  >  443 [ACK] Seq=999 Ack=967 Win=3072 Len=1"
"3082","2016-09-23 23:08:32.318211","192.168.1.196","52.1.40.122","TCP","60","[TCP Keep-Alive] 3063  >  443 [ACK] Seq=999 Ack=967 Win=3072 Len=1"
"3097","2016-09-23 23:08:37.529234","Physical_00:67:5e","Tp-LinkT_51:33:ea","ARP","60","192.168.1.196 is at d0:52:a8:00:67:5e"
"3108","2016-09-23 23:08:42.507887","192.168.1.196","52.1.40.122","TCP","60","[TCP Keep-Alive] 3063  >  443 [ACK] Seq=999 Ack=967 Win=3072 Len=1"
"3138","2016-09-23 23:08:50.467302","192.168.1.196","52.1.40.122","TLSv1.2","123","Application Data"
"3143","2016-09-23 23:08:50.673694","192.168.1.196","52.1.40.122","TCP","60","3063  >  443 [ACK] Seq=1069 Ack=1036 Win=3072 Len=0"
"3203","2016-09-23 23:09:00.658129","192.168.1.196","52.1.40.122","TCP","60","[TCP Keep-Alive] 3063  >  443 [ACK] Seq=1068 Ack=1036 Win=3072 Len=1"
"3270","2016-09-23 23:09:10.847658","192.168.1.196","52.1.40.122","TCP","60","[TCP Keep-Alive] 3063  >  443 [ACK] Seq=1068 Ack=1036 Win=3072 Len=1"
"3319","2016-09-23 23:09:21.037187","192.168.1.196","52.1.40.122","TCP","60","[TCP Keep-Alive] 3063  >  443 [ACK] Seq=1068 Ack=1036 Win=3072 Len=1"
"3444","2016-09-23 23:09:26.249231","Physical_00:67:5e","Tp-LinkT_51:33:ea","ARP","60","192.168.1.196 is at d0:52:a8:00:67:5e"
"3454","2016-09-23 23:09:31.226621","192.168.1.196","52.1.40.122","TCP","60","[TCP Keep-Alive] 3063  >  443 [ACK] Seq=1068 Ack=1036 Win=3072 Len=1"
"3485","2016-09-23 23:09:36.761287","Physical_00:67:5e","Broadcast","ARP","60","Who has 192.168.1.1? Tell 192.168.1.196"
"3487","2016-09-23 23:09:36.761343","192.168.1.196","192.168.1.1","DNS","72","Standard query 0x5973 A pool.ntp.org"
"3489","2016-09-23 23:09:36.766041","Physical_00:67:5e","Broadcast","ARP","60","Who has 192.168.1.1? Tell 192.168.1.196"
"3491","2016-09-23 23:09:36.766196","192.168.1.196","203.19.252.1","NTP","90","NTP Version 3, client"
"3517","2016-09-23 23:09:41.416098","192.168.1.196","52.1.40.122","TCP","60","[TCP Keep-Alive] 3063  >  443 [ACK] Seq=1068 Ack=1036 Win=3072 Len=1"
"3546","2016-09-23 23:09:49.377296","192.168.1.196","52.1.40.122","TLSv1.2","123","Application Data"
"3551","2016-09-23 23:09:49.583480","192.168.1.196","52.1.40.122","TCP","60","3063  >  443 [ACK] Seq=1138 Ack=1105 Win=3072 Len=0"
"3609","2016-09-23 23:09:59.568006","192.168.1.196","52.1.40.122","TCP","60","[TCP Keep-Alive] 3063  >  443 [ACK] Seq=1137 Ack=1105 Win=3072 Len=1"
"3666","2016-09-23 23:10:09.757550","192.168.1.196","52.1.40.122","TCP","60","[TCP Keep-Alive] 3063  >  443 [ACK] Seq=1137 Ack=1105 Win=3072 Len=1"
"3687","2016-09-23 23:10:14.969230","Physical_00:67:5e","Tp-LinkT_51:33:ea","ARP","60","192.168.1.196 is at d0:52:a8:00:67:5e"
"3696","2016-09-23 23:10:16.385557","192.168.1.196","52.1.40.122","TLSv1.2","123","Application Data"
"3701","2016-09-23 23:10:16.592778","192.168.1.196","52.1.40.122","TCP","60","3063  >  443 [ACK] Seq=1207 Ack=1174 Win=3072 Len=0"
"3761","2016-09-23 23:10:26.577302","192.168.1.196","52.1.40.122","TCP","60","[TCP Keep-Alive] 3063  >  443 [ACK] Seq=1206 Ack=1174 Win=3072 Len=1"
"3810","2016-09-23 23:10:36.766795","192.168.1.196","52.1.40.122","TCP","60","[TCP Keep-Alive] 3063  >  443 [ACK] Seq=1206 Ack=1174 Win=3072 Len=1"
"3832","2016-09-23 23:10:45.664318","192.168.1.196","52.1.40.122","TLSv1.2","123","Application Data"
"3836","2016-09-23 23:10:45.871171","192.168.1.196","52.1.40.122","TCP","60","3063  >  443 [ACK] Seq=1276 Ack=1243 Win=3072 Len=0"
"3856","2016-09-23 23:10:50.869268","Physical_00:67:5e","Tp-LinkT_51:33:ea","ARP","60","192.168.1.196 is at d0:52:a8:00:67:5e"
"3904","2016-09-23 23:10:55.855921","192.168.1.196","52.1.40.122","TCP","60","[TCP Keep-Alive] 3063  >  443 [ACK] Seq=1275 Ack=1243 Win=3072 Len=1"
"3961","2016-09-23 23:11:06.045594","192.168.1.196","52.1.40.122","TCP","60","[TCP Keep-Alive] 3063  >  443 [ACK] Seq=1275 Ack=1243 Win=3072 Len=1"
"4009","2016-09-23 23:11:16.235249","192.168.1.196","52.1.40.122","TCP","60","[TCP Keep-Alive] 3063  >  443 [ACK] Seq=1275 Ack=1243 Win=3072 Len=1"
"4031","2016-09-23 23:11:21.449288","Physical_00:67:5e","Tp-LinkT_51:33:ea","ARP","60","192.168.1.196 is at d0:52:a8:00:67:5e"
"4062","2016-09-23 23:11:26.424667","192.168.1.196","52.1.40.122","TCP","60","[TCP Keep-Alive] 3063  >  443 [ACK] Seq=1275 Ack=1243 Win=3072 Len=1"
"4120","2016-09-23 23:11:36.614115","192.168.1.196","52.1.40.122","TCP","60","[TCP Keep-Alive] 3063  >  443 [ACK] Seq=1275 Ack=1243 Win=3072 Len=1"
"4171","2016-09-23 23:11:44.575745","192.168.1.196","52.1.40.122","TLSv1.2","123","Application Data"
"4174","2016-09-23 23:11:44.782207","192.168.1.196","52.1.40.122","TCP","60","3063  >  443 [ACK] Seq=1345 Ack=1312 Win=3072 Len=0"
"4412","2016-09-23 23:11:52.185970","192.168.1.196","52.1.40.122","TLSv1.2","139","Application Data"
"4414","2016-09-23 23:11:52.396895","192.168.1.196","52.1.40.122","TCP","60","3063  >  443 [ACK] Seq=1430 Ack=1381 Win=3072 Len=0"
"4453","2016-09-23 23:11:57.403499","Physical_00:67:5e","Tp-LinkT_51:33:ea","ARP","60","192.168.1.196 is at d0:52:a8:00:67:5e"
"4478","2016-09-23 23:12:02.381227","192.168.1.196","52.1.40.122","TCP","60","[TCP Keep-Alive] 3063  >  443 [ACK] Seq=1429 Ack=1381 Win=3072 Len=1"
"4513","2016-09-23 23:12:12.570682","192.168.1.196","52.1.40.122","TCP","60","[TCP Keep-Alive] 3063  >  443 [ACK] Seq=1429 Ack=1381 Win=3072 Len=1"
"4547","2016-09-23 23:12:22.760138","192.168.1.196","52.1.40.122","TCP","60","[TCP Keep-Alive] 3063  >  443 [ACK] Seq=1429 Ack=1381 Win=3072 Len=1"
"4591","2016-09-23 23:12:27.969241","Physical_00:67:5e","Tp-LinkT_51:33:ea","ARP","60","192.168.1.196 is at d0:52:a8:00:67:5e"
"4615","2016-09-23 23:12:32.949753","192.168.1.196","52.1.40.122","TCP","60","[TCP Keep-Alive] 3063  >  443 [ACK] Seq=1429 Ack=1381 Win=3072 Len=1"
"4645","2016-09-23 23:12:43.139048","192.168.1.196","52.1.40.122","TCP","60","[TCP Keep-Alive] 3063  >  443 [ACK] Seq=1429 Ack=1381 Win=3072 Len=1"
"4656","2016-09-23 23:12:45.684749","192.168.1.196","52.1.40.122","TLSv1.2","123","Application Data"
"4659","2016-09-23 23:12:45.892088","192.168.1.196","52.1.40.122","TCP","60","3063  >  443 [ACK] Seq=1499 Ack=1450 Win=3072 Len=0"
"4709","2016-09-23 23:12:55.876358","192.168.1.196","52.1.40.122","TCP","60","[TCP Keep-Alive] 3063  >  443 [ACK] Seq=1498 Ack=1450 Win=3072 Len=1"
"4734","2016-09-23 23:13:01.089235","Physical_00:67:5e","Tp-LinkT_51:33:ea","ARP","60","192.168.1.196 is at d0:52:a8:00:67:5e"
"4761","2016-09-23 23:13:06.065707","192.168.1.196","52.1.40.122","TCP","60","[TCP Keep-Alive] 3063  >  443 [ACK] Seq=1498 Ack=1450 Win=3072 Len=1"
"4857","2016-09-23 23:13:16.254940","192.168.1.196","52.1.40.122","TCP","60","[TCP Keep-Alive] 3063  >  443 [ACK] Seq=1498 Ack=1450 Win=3072 Len=1"
"4914","2016-09-23 23:13:26.444210","192.168.1.196","52.1.40.122","TCP","60","[TCP Keep-Alive] 3063  >  443 [ACK] Seq=1498 Ack=1450 Win=3072 Len=1"
"4939","2016-09-23 23:13:31.649270","Physical_00:67:5e","Tp-LinkT_51:33:ea","ARP","60","192.168.1.196 is at d0:52:a8:00:67:5e"
"4961","2016-09-23 23:13:36.633585","192.168.1.196","52.1.40.122","TCP","60","[TCP Keep-Alive] 3063  >  443 [ACK] Seq=1498 Ack=1450 Win=3072 Len=1"
"4995","2016-09-23 23:13:44.594556","192.168.1.196","52.1.40.122","TLSv1.2","123","Application Data"
"5001","2016-09-23 23:13:44.800934","192.168.1.196","52.1.40.122","TCP","60","3063  >  443 [ACK] Seq=1568 Ack=1519 Win=3072 Len=0"
"5043","2016-09-23 23:13:54.785235","192.168.1.196","52.1.40.122","TCP","60","[TCP Keep-Alive] 3063  >  443 [ACK] Seq=1567 Ack=1519 Win=3072 Len=1"
"5096","2016-09-23 23:14:04.974281","192.168.1.196","52.1.40.122","TCP","60","[TCP Keep-Alive] 3063  >  443 [ACK] Seq=1567 Ack=1519 Win=3072 Len=1"
"5118","2016-09-23 23:14:10.179290","Physical_00:67:5e","Tp-LinkT_51:33:ea","ARP","60","192.168.1.196 is at d0:52:a8:00:67:5e"
"5130","2016-09-23 23:14:15.163375","192.168.1.196","52.1.40.122","TCP","60","[TCP Keep-Alive] 3063  >  443 [ACK] Seq=1567 Ack=1519 Win=3072 Len=1"
"5187","2016-09-23 23:14:25.352664","192.168.1.196","52.1.40.122","TCP","60","[TCP Keep-Alive] 3063  >  443 [ACK] Seq=1567 Ack=1519 Win=3072 Len=1"
"5227","2016-09-23 23:14:35.541950","192.168.1.196","52.1.40.122","TCP","60","[TCP Keep-Alive] 3063  >  443 [ACK] Seq=1567 Ack=1519 Win=3072 Len=1"
"5336","2016-09-23 23:14:40.749265","Physical_00:67:5e","Tp-LinkT_51:33:ea","ARP","60","192.168.1.196 is at d0:52:a8:00:67:5e"
"5344","2016-09-23 23:14:43.503037","192.168.1.196","52.1.40.122","TLSv1.2","123","Application Data"
"5348","2016-09-23 23:14:43.709212","192.168.1.196","52.1.40.122","TCP","60","3063  >  443 [ACK] Seq=1637 Ack=1588 Win=3072 Len=0"
"5389","2016-09-23 23:14:53.693487","192.168.1.196","52.1.40.122","TCP","60","[TCP Keep-Alive] 3063  >  443 [ACK] Seq=1636 Ack=1588 Win=3072 Len=1"
"5470","2016-09-23 23:15:03.882576","192.168.1.196","52.1.40.122","TCP","60","[TCP Keep-Alive] 3063  >  443 [ACK] Seq=1636 Ack=1588 Win=3072 Len=1"
"5510","2016-09-23 23:15:14.071736","192.168.1.196","52.1.40.122","TCP","60","[TCP Keep-Alive] 3063  >  443 [ACK] Seq=1636 Ack=1588 Win=3072 Len=1"
"5514","2016-09-23 23:15:14.982752","192.168.1.196","52.1.40.122","TLSv1.2","123","Application Data"
"5520","2016-09-23 23:15:15.190586","192.168.1.196","52.1.40.122","TCP","60","3063  >  443 [ACK] Seq=1706 Ack=1657 Win=3072 Len=0"
"5529","2016-09-23 23:15:19.279256","Physical_00:67:5e","Tp-LinkT_51:33:ea","ARP","60","192.168.1.196 is at d0:52:a8:00:67:5e"
"5557","2016-09-23 23:15:25.174739","192.168.1.196","52.1.40.122","TCP","60","[TCP Keep-Alive] 3063  >  443 [ACK] Seq=1705 Ack=1657 Win=3072 Len=1"
"5618","2016-09-23 23:15:35.363902","192.168.1.196","52.1.40.122","TCP","60","[TCP Keep-Alive] 3063  >  443 [ACK] Seq=1705 Ack=1657 Win=3072 Len=1"
"5654","2016-09-23 23:15:45.553114","192.168.1.196","52.1.40.122","TCP","60","[TCP Keep-Alive] 3063  >  443 [ACK] Seq=1705 Ack=1657 Win=3072 Len=1"
"5658","2016-09-23 23:15:46.375766","192.168.1.196","52.1.40.122","TLSv1.2","123","Application Data"
"5661","2016-09-23 23:15:46.582463","192.168.1.196","52.1.40.122","TCP","60","3063  >  443 [ACK] Seq=1775 Ack=1726 Win=3072 Len=0"
"5682","2016-09-23 23:15:50.759244","Physical_00:67:5e","Tp-LinkT_51:33:ea","ARP","60","192.168.1.196 is at d0:52:a8:00:67:5e"
"5701","2016-09-23 23:15:52.814591","192.168.1.196","52.1.40.122","TLSv1.2","139","Application Data"
"5708","2016-09-23 23:15:53.021493","192.168.1.196","52.1.40.122","TCP","60","3063  >  443 [ACK] Seq=1860 Ack=1795 Win=3072 Len=0"
"5776","2016-09-23 23:16:03.005783","192.168.1.196","52.1.40.122","TCP","60","[TCP Keep-Alive] 3063  >  443 [ACK] Seq=1859 Ack=1795 Win=3072 Len=1"
"5807","2016-09-23 23:16:13.195065","192.168.1.196","52.1.40.122","TCP","60","[TCP Keep-Alive] 3063  >  443 [ACK] Seq=1859 Ack=1795 Win=3072 Len=1"
"5825","2016-09-23 23:16:18.409267","Physical_00:67:5e","Tp-LinkT_51:33:ea","ARP","60","192.168.1.196 is at d0:52:a8:00:67:5e"
"5836","2016-09-23 23:16:23.384210","192.168.1.196","52.1.40.122","TCP","60","[TCP Keep-Alive] 3063  >  443 [ACK] Seq=1859 Ack=1795 Win=3072 Len=1"
"5912","2016-09-23 23:16:33.573299","192.168.1.196","52.1.40.122","TCP","60","[TCP Keep-Alive] 3063  >  443 [ACK] Seq=1859 Ack=1795 Win=3072 Len=1"
"5952","2016-09-23 23:16:43.762386","192.168.1.196","52.1.40.122","TCP","60","[TCP Keep-Alive] 3063  >  443 [ACK] Seq=1859 Ack=1795 Win=3072 Len=1"
"5972","2016-09-23 23:16:48.969280","Physical_00:67:5e","Tp-LinkT_51:33:ea","ARP","60","192.168.1.196 is at d0:52:a8:00:67:5e"
"5979","2016-09-23 23:16:51.724488","192.168.1.196","52.1.40.122","TLSv1.2","123","Application Data"
"5982","2016-09-23 23:16:51.931205","192.168.1.196","52.1.40.122","TCP","60","3063  >  443 [ACK] Seq=1929 Ack=1864 Win=3072 Len=0"
"6042","2016-09-23 23:17:01.915520","192.168.1.196","52.1.40.122","TCP","60","[TCP Keep-Alive] 3063  >  443 [ACK] Seq=1928 Ack=1864 Win=3072 Len=1"
"6096","2016-09-23 23:17:12.104883","192.168.1.196","52.1.40.122","TCP","60","[TCP Keep-Alive] 3063  >  443 [ACK] Seq=1928 Ack=1864 Win=3072 Len=1"
"6117","2016-09-23 23:17:17.319271","Physical_00:67:5e","Tp-LinkT_51:33:ea","ARP","60","192.168.1.196 is at d0:52:a8:00:67:5e"
"6133","2016-09-23 23:17:22.294353","192.168.1.196","52.1.40.122","TCP","60","[TCP Keep-Alive] 3063  >  443 [ACK] Seq=1928 Ack=1864 Win=3072 Len=1"
"6280","2016-09-23 23:17:32.483621","192.168.1.196","52.1.40.122","TCP","60","[TCP Keep-Alive] 3063  >  443 [ACK] Seq=1928 Ack=1864 Win=3072 Len=1"
"6318","2016-09-23 23:17:42.672759","192.168.1.196","52.1.40.122","TCP","60","[TCP Keep-Alive] 3063  >  443 [ACK] Seq=1928 Ack=1864 Win=3072 Len=1"
"6323","2016-09-23 23:17:44.279692","192.168.1.196","52.1.40.122","TLSv1.2","123","Application Data"
"6327","2016-09-23 23:17:44.517027","192.168.1.196","52.1.40.122","TCP","60","3063  >  443 [ACK] Seq=1998 Ack=1933 Win=3072 Len=0"
"6372","2016-09-23 23:17:47.879277","Physical_00:67:5e","Tp-LinkT_51:33:ea","ARP","60","192.168.1.196 is at d0:52:a8:00:67:5e"
"6412","2016-09-23 23:17:54.501455","192.168.1.196","52.1.40.122","TCP","60","[TCP Keep-Alive] 3063  >  443 [ACK] Seq=1997 Ack=1933 Win=3072 Len=1"
"6497","2016-09-23 23:18:04.690717","192.168.1.196","52.1.40.122","TCP","60","[TCP Keep-Alive] 3063  >  443 [ACK] Seq=1997 Ack=1933 Win=3072 Len=1"
"6588","2016-09-23 23:18:14.880131","192.168.1.196","52.1.40.122","TCP","60","[TCP Keep-Alive] 3063  >  443 [ACK] Seq=1997 Ack=1933 Win=3072 Len=1"
"6606","2016-09-23 23:18:20.089242","Physical_00:67:5e","Tp-LinkT_51:33:ea","ARP","60","192.168.1.196 is at d0:52:a8:00:67:5e"
"6625","2016-09-23 23:18:25.069479","192.168.1.196","52.1.40.122","TCP","60","[TCP Keep-Alive] 3063  >  443 [ACK] Seq=1997 Ack=1933 Win=3072 Len=1"
"6680","2016-09-23 23:18:35.258638","192.168.1.196","52.1.40.122","TCP","60","[TCP Keep-Alive] 3063  >  443 [ACK] Seq=1997 Ack=1933 Win=3072 Len=1"
"6710","2016-09-23 23:18:43.189510","192.168.1.196","52.1.40.122","TLSv1.2","123","Application Data"
"6714","2016-09-23 23:18:43.395750","192.168.1.196","52.1.40.122","TCP","60","3063  >  443 [ACK] Seq=2067 Ack=2002 Win=3072 Len=0"
"6738","2016-09-23 23:18:48.399245","Physical_00:67:5e","Tp-LinkT_51:33:ea","ARP","60","192.168.1.196 is at d0:52:a8:00:67:5e"
"6765","2016-09-23 23:18:53.379840","192.168.1.196","52.1.40.122","TCP","60","[TCP Keep-Alive] 3063  >  443 [ACK] Seq=2066 Ack=2002 Win=3072 Len=1"
"6831","2016-09-23 23:19:03.568776","192.168.1.196","52.1.40.122","TCP","60","[TCP Keep-Alive] 3063  >  443 [ACK] Seq=2066 Ack=2002 Win=3072 Len=1"
"6876","2016-09-23 23:19:13.758013","192.168.1.196","52.1.40.122","TCP","60","[TCP Keep-Alive] 3063  >  443 [ACK] Seq=2066 Ack=2002 Win=3072 Len=1"
"6894","2016-09-23 23:19:18.969267","Physical_00:67:5e","Tp-LinkT_51:33:ea","ARP","60","192.168.1.196 is at d0:52:a8:00:67:5e"
"6915","2016-09-23 23:19:23.947094","192.168.1.196","52.1.40.122","TCP","60","[TCP Keep-Alive] 3063  >  443 [ACK] Seq=2066 Ack=2002 Win=3072 Len=1"
"6972","2016-09-23 23:19:34.135982","192.168.1.196","52.1.40.122","TCP","60","[TCP Keep-Alive] 3063  >  443 [ACK] Seq=2066 Ack=2002 Win=3072 Len=1"
"6981","2016-09-23 23:19:36.044614","Physical_00:67:5e","Broadcast","ARP","60","Who has 192.168.1.1? Tell 192.168.1.196"
"6983","2016-09-23 23:19:36.044673","192.168.1.196","192.168.1.1","DNS","72","Standard query 0x5974 A pool.ntp.org"
"6985","2016-09-23 23:19:36.049229","Physical_00:67:5e","Broadcast","ARP","60","Who has 192.168.1.1? Tell 192.168.1.196"
"6987","2016-09-23 23:19:36.049375","192.168.1.196","103.38.120.36","NTP","90","NTP Version 3, client"
"7011","2016-09-23 23:19:42.097940","192.168.1.196","52.1.40.122","TLSv1.2","123","Application Data"
"7014","2016-09-23 23:19:42.304651","192.168.1.196","52.1.40.122","TCP","60","3063  >  443 [ACK] Seq=2136 Ack=2071 Win=3072 Len=0"
"7104","2016-09-23 23:19:47.309243","Physical_00:67:5e","Tp-LinkT_51:33:ea","ARP","60","192.168.1.196 is at d0:52:a8:00:67:5e"
"7127","2016-09-23 23:19:52.288909","192.168.1.196","52.1.40.122","TCP","60","[TCP Keep-Alive] 3063  >  443 [ACK] Seq=2135 Ack=2071 Win=3072 Len=1"
"7132","2016-09-23 23:19:53.447532","192.168.1.196","52.1.40.122","TLSv1.2","139","Application Data"
"7138","2016-09-23 23:19:53.654515","192.168.1.196","52.1.40.122","TCP","60","3063  >  443 [ACK] Seq=2221 Ack=2140 Win=3072 Len=0"
"7201","2016-09-23 23:20:03.638859","192.168.1.196","52.1.40.122","TCP","60","[TCP Keep-Alive] 3063  >  443 [ACK] Seq=2220 Ack=2140 Win=3072 Len=1"
"7257","2016-09-23 23:20:13.579280","192.168.1.196","52.1.40.122","TLSv1.2","123","Application Data"
"7260","2016-09-23 23:20:13.786694","192.168.1.196","52.1.40.122","TCP","60","3063  >  443 [ACK] Seq=2290 Ack=2209 Win=3072 Len=0"
"7286","2016-09-23 23:20:18.789226","Physical_00:67:5e","Tp-LinkT_51:33:ea","ARP","60","192.168.1.196 is at d0:52:a8:00:67:5e"
"7308","2016-09-23 23:20:23.770832","192.168.1.196","52.1.40.122","TCP","60","[TCP Keep-Alive] 3063  >  443 [ACK] Seq=2289 Ack=2209 Win=3072 Len=1"
"7365","2016-09-23 23:20:33.960123","192.168.1.196","52.1.40.122","TCP","60","[TCP Keep-Alive] 3063  >  443 [ACK] Seq=2289 Ack=2209 Win=3072 Len=1"
"7408","2016-09-23 23:20:44.149162","192.168.1.196","52.1.40.122","TCP","60","[TCP Keep-Alive] 3063  >  443 [ACK] Seq=2289 Ack=2209 Win=3072 Len=1"
"7418","2016-09-23 23:20:47.079861","192.168.1.196","52.1.40.122","TLSv1.2","123","Application Data"
"7421","2016-09-23 23:20:47.297632","192.168.1.196","52.1.40.122","TCP","60","3063  >  443 [ACK] Seq=2359 Ack=2278 Win=3072 Len=0"
"7429","2016-09-23 23:20:49.359273","Physical_00:67:5e","Tp-LinkT_51:33:ea","ARP","60","192.168.1.196 is at d0:52:a8:00:67:5e"
"7485","2016-09-23 23:20:57.281719","192.168.1.196","52.1.40.122","TCP","60","[TCP Keep-Alive] 3063  >  443 [ACK] Seq=2358 Ack=2278 Win=3072 Len=1"
"7562","2016-09-23 23:21:07.470543","192.168.1.196","52.1.40.122","TCP","60","[TCP Keep-Alive] 3063  >  443 [ACK] Seq=2358 Ack=2278 Win=3072 Len=1"
"7605","2016-09-23 23:21:17.659433","192.168.1.196","52.1.40.122","TCP","60","[TCP Keep-Alive] 3063  >  443 [ACK] Seq=2358 Ack=2278 Win=3072 Len=1"
"7630","2016-09-23 23:21:22.869281","Physical_00:67:5e","Tp-LinkT_51:33:ea","ARP","60","192.168.1.196 is at d0:52:a8:00:67:5e"
"7667","2016-09-23 23:21:27.848375","192.168.1.196","52.1.40.122","TCP","60","[TCP Keep-Alive] 3063  >  443 [ACK] Seq=2358 Ack=2278 Win=3072 Len=1"
"7719","2016-09-23 23:21:38.037579","192.168.1.196","52.1.40.122","TCP","60","[TCP Keep-Alive] 3063  >  443 [ACK] Seq=2358 Ack=2278 Win=3072 Len=1"
"7772","2016-09-23 23:21:45.987930","192.168.1.196","52.1.40.122","TLSv1.2","123","Application Data"
"7776","2016-09-23 23:21:46.194245","192.168.1.196","52.1.40.122","TCP","60","3063  >  443 [ACK] Seq=2428 Ack=2347 Win=3072 Len=0"
"7802","2016-09-23 23:21:51.199227","Physical_00:67:5e","Tp-LinkT_51:33:ea","ARP","60","192.168.1.196 is at d0:52:a8:00:67:5e"
"7842","2016-09-23 23:21:56.178538","192.168.1.196","52.1.40.122","TCP","60","[TCP Keep-Alive] 3063  >  443 [ACK] Seq=2427 Ack=2347 Win=3072 Len=1"
"7893","2016-09-23 23:22:06.367762","192.168.1.196","52.1.40.122","TCP","60","[TCP Keep-Alive] 3063  >  443 [ACK] Seq=2427 Ack=2347 Win=3072 Len=1"
"8055","2016-09-23 23:22:16.556875","192.168.1.196","52.1.40.122","TCP","60","[TCP Keep-Alive] 3063  >  443 [ACK] Seq=2427 Ack=2347 Win=3072 Len=1"
"8093","2016-09-23 23:22:21.769282","Physical_00:67:5e","Tp-LinkT_51:33:ea","ARP","60","192.168.1.196 is at d0:52:a8:00:67:5e"
"8129","2016-09-23 23:22:26.746135","192.168.1.196","52.1.40.122","TCP","60","[TCP Keep-Alive] 3063  >  443 [ACK] Seq=2427 Ack=2347 Win=3072 Len=1"
"8171","2016-09-23 23:22:36.935242","192.168.1.196","52.1.40.122","TCP","60","[TCP Keep-Alive] 3063  >  443 [ACK] Seq=2427 Ack=2347 Win=3072 Len=1"
"8186","2016-09-23 23:22:42.876783","192.168.1.196","52.1.40.122","TLSv1.2","123","Application Data"
"8190","2016-09-23 23:22:43.083586","192.168.1.196","52.1.40.122","TCP","60","3063  >  443 [ACK] Seq=2497 Ack=2416 Win=3072 Len=0"
"8233","2016-09-23 23:22:53.068026","192.168.1.196","52.1.40.122","TCP","60","[TCP Keep-Alive] 3063  >  443 [ACK] Seq=2496 Ack=2416 Win=3072 Len=1"
"8273","2016-09-23 23:22:58.279287","Physical_00:67:5e","Tp-LinkT_51:33:ea","ARP","60","192.168.1.196 is at d0:52:a8:00:67:5e"
"8314","2016-09-23 23:23:03.257021","192.168.1.196","52.1.40.122","TCP","60","[TCP Keep-Alive] 3063  >  443 [ACK] Seq=2496 Ack=2416 Win=3072 Len=1"
"8403","2016-09-23 23:23:13.446183","192.168.1.196","52.1.40.122","TCP","60","[TCP Keep-Alive] 3063  >  443 [ACK] Seq=2496 Ack=2416 Win=3072 Len=1"
"8439","2016-09-23 23:23:23.635208","192.168.1.196","52.1.40.122","TCP","60","[TCP Keep-Alive] 3063  >  443 [ACK] Seq=2496 Ack=2416 Win=3072 Len=1"
"8475","2016-09-23 23:23:28.849286","Physical_00:67:5e","Tp-LinkT_51:33:ea","ARP","60","192.168.1.196 is at d0:52:a8:00:67:5e"
"8492","2016-09-23 23:23:33.824462","192.168.1.196","52.1.40.122","TCP","60","[TCP Keep-Alive] 3063  >  443 [ACK] Seq=2496 Ack=2416 Win=3072 Len=1"
"8515","2016-09-23 23:23:41.785694","192.168.1.196","52.1.40.122","TLSv1.2","123","Application Data"
"8518","2016-09-23 23:23:41.992063","192.168.1.196","52.1.40.122","TCP","60","3063  >  443 [ACK] Seq=2566 Ack=2485 Win=3072 Len=0"
"8561","2016-09-23 23:23:51.976266","192.168.1.196","52.1.40.122","TCP","60","[TCP Keep-Alive] 3063  >  443 [ACK] Seq=2565 Ack=2485 Win=3072 Len=1"
"8576","2016-09-23 23:23:54.073413","192.168.1.196","52.1.40.122","TLSv1.2","139","Application Data"
"8579","2016-09-23 23:23:54.280618","192.168.1.196","52.1.40.122","TCP","60","3063  >  443 [ACK] Seq=2651 Ack=2554 Win=3072 Len=0"
"8603","2016-09-23 23:23:57.189225","Physical_00:67:5e","Tp-LinkT_51:33:ea","ARP","60","192.168.1.196 is at d0:52:a8:00:67:5e"
"8645","2016-09-23 23:24:04.264853","192.168.1.196","52.1.40.122","TCP","60","[TCP Keep-Alive] 3063  >  443 [ACK] Seq=2650 Ack=2554 Win=3072 Len=1"
"8692","2016-09-23 23:24:14.454005","192.168.1.196","52.1.40.122","TCP","60","[TCP Keep-Alive] 3063  >  443 [ACK] Seq=2650 Ack=2554 Win=3072 Len=1"
"8736","2016-09-23 23:24:24.643253","192.168.1.196","52.1.40.122","TCP","60","[TCP Keep-Alive] 3063  >  443 [ACK] Seq=2650 Ack=2554 Win=3072 Len=1"
"8771","2016-09-23 23:24:29.849275","Physical_00:67:5e","Tp-LinkT_51:33:ea","ARP","60","192.168.1.196 is at d0:52:a8:00:67:5e"
"8795","2016-09-23 23:24:34.832290","192.168.1.196","52.1.40.122","TCP","60","[TCP Keep-Alive] 3063  >  443 [ACK] Seq=2650 Ack=2554 Win=3072 Len=1"
"8833","2016-09-23 23:24:45.021596","192.168.1.196","52.1.40.122","TCP","60","[TCP Keep-Alive] 3063  >  443 [ACK] Seq=2650 Ack=2554 Win=3072 Len=1"
"8859","2016-09-23 23:24:52.982450","192.168.1.196","52.1.40.122","TLSv1.2","123","Application Data"
"8864","2016-09-23 23:24:53.188691","192.168.1.196","52.1.40.122","TCP","60","3063  >  443 [ACK] Seq=2720 Ack=2623 Win=3072 Len=0"
"9016","2016-09-23 23:24:58.189268","Physical_00:67:5e","Tp-LinkT_51:33:ea","ARP","60","192.168.1.196 is at d0:52:a8:00:67:5e"
"9039","2016-09-23 23:25:03.172783","192.168.1.196","52.1.40.122","TCP","60","[TCP Keep-Alive] 3063  >  443 [ACK] Seq=2719 Ack=2623 Win=3072 Len=1"
"9086","2016-09-23 23:25:13.361970","192.168.1.196","52.1.40.122","TCP","60","[TCP Keep-Alive] 3063  >  443 [ACK] Seq=2719 Ack=2623 Win=3072 Len=1"
"9122","2016-09-23 23:25:23.551263","192.168.1.196","52.1.40.122","TCP","60","[TCP Keep-Alive] 3063  >  443 [ACK] Seq=2719 Ack=2623 Win=3072 Len=1"
"9162","2016-09-23 23:25:28.759250","Physical_00:67:5e","Tp-LinkT_51:33:ea","ARP","60","192.168.1.196 is at d0:52:a8:00:67:5e"
"9219","2016-09-23 23:25:33.740308","192.168.1.196","52.1.40.122","TCP","60","[TCP Keep-Alive] 3063  >  443 [ACK] Seq=2719 Ack=2623 Win=3072 Len=1"
"9257","2016-09-23 23:25:43.929684","192.168.1.196","52.1.40.122","TCP","60","[TCP Keep-Alive] 3063  >  443 [ACK] Seq=2719 Ack=2623 Win=3072 Len=1"
"9273","2016-09-23 23:25:47.792625","192.168.1.196","52.1.40.122","TLSv1.2","123","Application Data"
"9278","2016-09-23 23:25:48.000039","192.168.1.196","52.1.40.122","TCP","60","3063  >  443 [ACK] Seq=2789 Ack=2692 Win=3072 Len=0"
"9296","2016-09-23 23:25:52.999239","Physical_00:67:5e","Tp-LinkT_51:33:ea","ARP","60","192.168.1.196 is at d0:52:a8:00:67:5e"
"9349","2016-09-23 23:25:57.984194","192.168.1.196","52.1.40.122","TCP","60","[TCP Keep-Alive] 3063  >  443 [ACK] Seq=2788 Ack=2692 Win=3072 Len=1"
"9364","2016-09-23 23:26:01.111745","192.168.1.196","52.1.40.122","TLSv1.2","123","Application Data"
"9368","2016-09-23 23:26:01.327025","192.168.1.196","52.1.40.122","TCP","60","3063  >  443 [ACK] Seq=2858 Ack=2761 Win=3072 Len=0"
"9419","2016-09-23 23:26:11.311064","192.168.1.196","52.1.40.122","TCP","60","[TCP Keep-Alive] 3063  >  443 [ACK] Seq=2857 Ack=2761 Win=3072 Len=1"
"9442","2016-09-23 23:26:16.519239","Physical_00:67:5e","Tp-LinkT_51:33:ea","ARP","60","192.168.1.196 is at d0:52:a8:00:67:5e"
"9451","2016-09-23 23:26:18.370796","192.168.1.196","52.1.40.122","TLSv1.2","123","Application Data"
"9454","2016-09-23 23:26:18.577490","192.168.1.196","52.1.40.122","TCP","60","3063  >  443 [ACK] Seq=2927 Ack=2830 Win=3072 Len=0"
"9512","2016-09-23 23:26:28.561931","192.168.1.196","52.1.40.122","TCP","60","[TCP Keep-Alive] 3063  >  443 [ACK] Seq=2926 Ack=2830 Win=3072 Len=1"
"9544","2016-09-23 23:26:38.751282","192.168.1.196","52.1.40.122","TCP","60","[TCP Keep-Alive] 3063  >  443 [ACK] Seq=2926 Ack=2830 Win=3072 Len=1"
"9562","2016-09-23 23:26:43.959276","Physical_00:67:5e","Tp-LinkT_51:33:ea","ARP","60","192.168.1.196 is at d0:52:a8:00:67:5e"
"9577","2016-09-23 23:26:48.940706","192.168.1.196","52.1.40.122","TCP","60","[TCP Keep-Alive] 3063  >  443 [ACK] Seq=2926 Ack=2830 Win=3072 Len=1"
"9638","2016-09-23 23:26:59.130057","192.168.1.196","52.1.40.122","TCP","60","[TCP Keep-Alive] 3063  >  443 [ACK] Seq=2926 Ack=2830 Win=3072 Len=1"
"9694","2016-09-23 23:27:09.319308","192.168.1.196","52.1.40.122","TCP","60","[TCP Keep-Alive] 3063  >  443 [ACK] Seq=2926 Ack=2830 Win=3072 Len=1"
"9721","2016-09-23 23:27:14.529261","Physical_00:67:5e","Tp-LinkT_51:33:ea","ARP","60","192.168.1.196 is at d0:52:a8:00:67:5e"
"9731","2016-09-23 23:27:17.280572","192.168.1.196","52.1.40.122","TLSv1.2","123","Application Data"
"9734","2016-09-23 23:27:17.486736","192.168.1.196","52.1.40.122","TCP","60","3063  >  443 [ACK] Seq=2996 Ack=2899 Win=3072 Len=0"
"9788","2016-09-23 23:27:27.470855","192.168.1.196","52.1.40.122","TCP","60","[TCP Keep-Alive] 3063  >  443 [ACK] Seq=2995 Ack=2899 Win=3072 Len=1"
"9906","2016-09-23 23:27:37.659960","192.168.1.196","52.1.40.122","TCP","60","[TCP Keep-Alive] 3063  >  443 [ACK] Seq=2995 Ack=2899 Win=3072 Len=1"
"9927","2016-09-23 23:27:42.869246","Physical_00:67:5e","Tp-LinkT_51:33:ea","ARP","60","192.168.1.196 is at d0:52:a8:00:67:5e"
"9947","2016-09-23 23:27:47.849065","192.168.1.196","52.1.40.122","TCP","60","[TCP Keep-Alive] 3063  >  443 [ACK] Seq=2995 Ack=2899 Win=3072 Len=1"
"9971","2016-09-23 23:27:54.700596","192.168.1.196","52.1.40.122","TLSv1.2","139","Application Data"
"9974","2016-09-23 23:27:54.917616","192.168.1.196","52.1.40.122","TCP","60","3063  >  443 [ACK] Seq=3081 Ack=2968 Win=3072 Len=0"
"10052","2016-09-23 23:28:04.901957","192.168.1.196","52.1.40.122","TCP","60","[TCP Keep-Alive] 3063  >  443 [ACK] Seq=3080 Ack=2968 Win=3072 Len=1"
"10128","2016-09-23 23:28:10.109269","Physical_00:67:5e","Tp-LinkT_51:33:ea","ARP","60","192.168.1.196 is at d0:52:a8:00:67:5e"
"10155","2016-09-23 23:28:15.091319","192.168.1.196","52.1.40.122","TCP","60","[TCP Keep-Alive] 3063  >  443 [ACK] Seq=3080 Ack=2968 Win=3072 Len=1"
"10218","2016-09-23 23:28:25.280645","192.168.1.196","52.1.40.122","TCP","60","[TCP Keep-Alive] 3063  >  443 [ACK] Seq=3080 Ack=2968 Win=3072 Len=1"
"10271","2016-09-23 23:28:35.469778","192.168.1.196","52.1.40.122","TCP","60","[TCP Keep-Alive] 3063  >  443 [ACK] Seq=3080 Ack=2968 Win=3072 Len=1"
"10281","2016-09-23 23:28:40.679242","Physical_00:67:5e","Tp-LinkT_51:33:ea","ARP","60","192.168.1.196 is at d0:52:a8:00:67:5e"
"10297","2016-09-23 23:28:45.658878","192.168.1.196","52.1.40.122","TCP","60","[TCP Keep-Alive] 3063  >  443 [ACK] Seq=3080 Ack=2968 Win=3072 Len=1"
"10303","2016-09-23 23:28:47.669218","192.168.1.196","52.1.40.122","TLSv1.2","123","Application Data"
"10306","2016-09-23 23:28:47.876418","192.168.1.196","52.1.40.122","TCP","60","3063  >  443 [ACK] Seq=3150 Ack=3037 Win=3072 Len=0"
"10360","2016-09-23 23:28:57.860984","192.168.1.196","52.1.40.122","TCP","60","[TCP Keep-Alive] 3063  >  443 [ACK] Seq=3149 Ack=3037 Win=3072 Len=1"
"10429","2016-09-23 23:29:08.050580","192.168.1.196","52.1.40.122","TCP","60","[TCP Keep-Alive] 3063  >  443 [ACK] Seq=3149 Ack=3037 Win=3072 Len=1"
"10445","2016-09-23 23:29:13.259254","Physical_00:67:5e","Tp-LinkT_51:33:ea","ARP","60","192.168.1.196 is at d0:52:a8:00:67:5e"
"10471","2016-09-23 23:29:18.240175","192.168.1.196","52.1.40.122","TCP","60","[TCP Keep-Alive] 3063  >  443 [ACK] Seq=3149 Ack=3037 Win=3072 Len=1"
"10521","2016-09-23 23:29:28.429993","192.168.1.196","52.1.40.122","TCP","60","[TCP Keep-Alive] 3063  >  443 [ACK] Seq=3149 Ack=3037 Win=3072 Len=1"
"10548","2016-09-23 23:29:35.320924","Physical_00:67:5e","Broadcast","ARP","60","Who has 192.168.1.1? Tell 192.168.1.196"
"10550","2016-09-23 23:29:35.320980","192.168.1.196","192.168.1.1","DNS","72","Standard query 0x5975 A pool.ntp.org"
"10552","2016-09-23 23:29:35.325676","Physical_00:67:5e","Broadcast","ARP","60","Who has 192.168.1.1? Tell 192.168.1.196"
"10554","2016-09-23 23:29:35.325827","192.168.1.196","202.127.210.36","NTP","90","NTP Version 3, client"
"10707","2016-09-23 23:29:38.619721","192.168.1.196","52.1.40.122","TCP","60","[TCP Keep-Alive] 3063  >  443 [ACK] Seq=3149 Ack=3037 Win=3072 Len=1"
"10723","2016-09-23 23:29:40.489256","Physical_00:67:5e","Tp-LinkT_51:33:ea","ARP","60","192.168.1.196 is at d0:52:a8:00:67:5e"
"10770","2016-09-23 23:29:46.581282","192.168.1.196","52.1.40.122","TLSv1.2","123","Application Data"
