"No.","Time","Source","Destination","Protocol","Length","Info"
"44","2016-09-24 23:00:10.849630","192.168.1.196","54.210.202.2","TCP","60","[TCP segment of a reassembled PDU]"
"89","2016-09-24 23:00:21.051487","192.168.1.196","54.210.202.2","TCP","60","[TCP Keep-Alive] 2173  >  443 [ACK] Seq=1 Ack=1 Win=3072 Len=1"
"120","2016-09-24 23:00:31.253474","192.168.1.196","54.210.202.2","TCP","60","[TCP Keep-Alive] 2173  >  443 [ACK] Seq=1 Ack=1 Win=3072 Len=1"
"131","2016-09-24 23:00:36.479270","Physical_00:67:5e","Tp-LinkT_51:33:ea","ARP","60","192.168.1.196 is at d0:52:a8:00:67:5e"
"158","2016-09-24 23:00:41.455249","192.168.1.196","54.210.202.2","TCP","60","[TCP Keep-Alive] 2173  >  443 [ACK] Seq=1 Ack=1 Win=3072 Len=1"
"359","2016-09-24 23:00:51.657068","192.168.1.196","54.210.202.2","TCP","60","[TCP Keep-Alive] 2173  >  443 [ACK] Seq=1 Ack=1 Win=3072 Len=1"
"401","2016-09-24 23:00:59.335647","192.168.1.196","54.210.202.2","TLSv1.2","123","Application Data"
"407","2016-09-24 23:00:59.553707","192.168.1.196","54.210.202.2","TCP","60","2173  >  443 [ACK] Seq=71 Ack=70 Win=3072 Len=0"
"456","2016-09-24 23:01:09.539021","192.168.1.196","54.210.202.2","TCP","60","[TCP Keep-Alive] 2173  >  443 [ACK] Seq=70 Ack=70 Win=3072 Len=1"
"475","2016-09-24 23:01:13.675807","Physical_00:67:5e","Broadcast","ARP","60","Who has 192.168.1.1? Tell 192.168.1.196"
"477","2016-09-24 23:01:13.675881","192.168.1.196","192.168.1.1","DNS","72","Standard query 0x009f A pool.ntp.org"
"479","2016-09-24 23:01:13.680639","Physical_00:67:5e","Broadcast","ARP","60","Who has 192.168.1.1? Tell 192.168.1.196"
"481","2016-09-24 23:01:13.680790","192.168.1.196","27.124.125.250","NTP","90","NTP Version 3, client"
"511","2016-09-24 23:01:18.739217","Physical_00:67:5e","Tp-LinkT_51:33:ea","ARP","60","192.168.1.196 is at d0:52:a8:00:67:5e"
"516","2016-09-24 23:01:19.740904","192.168.1.196","54.210.202.2","TCP","60","[TCP Keep-Alive] 2173  >  443 [ACK] Seq=70 Ack=70 Win=3072 Len=1"
"558","2016-09-24 23:01:29.942694","192.168.1.196","54.210.202.2","TCP","60","[TCP Keep-Alive] 2173  >  443 [ACK] Seq=70 Ack=70 Win=3072 Len=1"
"580","2016-09-24 23:01:37.967610","192.168.1.196","54.210.202.2","TLSv1.2","123","Application Data"
"584","2016-09-24 23:01:38.185636","192.168.1.196","54.210.202.2","TCP","60","2173  >  443 [ACK] Seq=140 Ack=139 Win=3072 Len=0"
"644","2016-09-24 23:01:48.170987","192.168.1.196","54.210.202.2","TCP","60","[TCP Keep-Alive] 2173  >  443 [ACK] Seq=139 Ack=139 Win=3072 Len=1"
"684","2016-09-24 23:01:53.389207","Physical_00:67:5e","Tp-LinkT_51:33:ea","ARP","60","192.168.1.196 is at d0:52:a8:00:67:5e"
"703","2016-09-24 23:01:58.372847","192.168.1.196","54.210.202.2","TCP","60","[TCP Keep-Alive] 2173  >  443 [ACK] Seq=139 Ack=139 Win=3072 Len=1"
"755","2016-09-24 23:02:08.574691","192.168.1.196","54.210.202.2","TCP","60","[TCP Keep-Alive] 2173  >  443 [ACK] Seq=139 Ack=139 Win=3072 Len=1"
"798","2016-09-24 23:02:18.776441","192.168.1.196","54.210.202.2","TCP","60","[TCP Keep-Alive] 2173  >  443 [ACK] Seq=139 Ack=139 Win=3072 Len=1"
"819","2016-09-24 23:02:23.999285","Physical_00:67:5e","Tp-LinkT_51:33:ea","ARP","60","192.168.1.196 is at d0:52:a8:00:67:5e"
"843","2016-09-24 23:02:28.978218","192.168.1.196","54.210.202.2","TCP","60","[TCP Keep-Alive] 2173  >  443 [ACK] Seq=139 Ack=139 Win=3072 Len=1"
"872","2016-09-24 23:02:36.883133","192.168.1.196","54.210.202.2","TLSv1.2","123","Application Data"
"876","2016-09-24 23:02:37.136243","192.168.1.196","54.210.202.2","TCP","60","2173  >  443 [ACK] Seq=209 Ack=208 Win=3072 Len=0"
"914","2016-09-24 23:02:47.121446","192.168.1.196","54.210.202.2","TCP","60","[TCP Keep-Alive] 2173  >  443 [ACK] Seq=208 Ack=208 Win=3072 Len=1"
"979","2016-09-24 23:02:57.323242","192.168.1.196","54.210.202.2","TCP","60","[TCP Keep-Alive] 2173  >  443 [ACK] Seq=208 Ack=208 Win=3072 Len=1"
"1016","2016-09-24 23:03:02.549275","Physical_00:67:5e","Tp-LinkT_51:33:ea","ARP","60","192.168.1.196 is at d0:52:a8:00:67:5e"
"1239","2016-09-24 23:03:07.524983","192.168.1.196","54.210.202.2","TCP","60","[TCP Keep-Alive] 2173  >  443 [ACK] Seq=208 Ack=208 Win=3072 Len=1"
"1273","2016-09-24 23:03:17.726773","192.168.1.196","54.210.202.2","TCP","60","[TCP Keep-Alive] 2173  >  443 [ACK] Seq=208 Ack=208 Win=3072 Len=1"
"1322","2016-09-24 23:03:27.928590","192.168.1.196","54.210.202.2","TCP","60","[TCP Keep-Alive] 2173  >  443 [ACK] Seq=208 Ack=208 Win=3072 Len=1"
"1354","2016-09-24 23:03:35.798525","192.168.1.196","54.210.202.2","TLSv1.2","123","Application Data"
"1358","2016-09-24 23:03:36.016419","192.168.1.196","54.210.202.2","TCP","60","2173  >  443 [ACK] Seq=278 Ack=277 Win=3072 Len=0"
"1380","2016-09-24 23:03:41.019267","Physical_00:67:5e","Tp-LinkT_51:33:ea","ARP","60","192.168.1.196 is at d0:52:a8:00:67:5e"
"1408","2016-09-24 23:03:46.001871","192.168.1.196","54.210.202.2","TCP","60","[TCP Keep-Alive] 2173  >  443 [ACK] Seq=277 Ack=277 Win=3072 Len=1"
"1457","2016-09-24 23:03:56.203733","192.168.1.196","54.210.202.2","TCP","60","[TCP Keep-Alive] 2173  >  443 [ACK] Seq=277 Ack=277 Win=3072 Len=1"
"1479","2016-09-24 23:04:01.074015","192.168.1.196","54.210.202.2","TLSv1.2","139","Application Data"
"1482","2016-09-24 23:04:01.292598","192.168.1.196","54.210.202.2","TCP","60","2173  >  443 [ACK] Seq=363 Ack=346 Win=3072 Len=0"
"1582","2016-09-24 23:04:07.294381","192.168.1.196","54.210.202.2","TLSv1.2","123","Application Data"
"1584","2016-09-24 23:04:07.512657","192.168.1.196","54.210.202.2","TCP","60","2173  >  443 [ACK] Seq=432 Ack=415 Win=3072 Len=0"
"1626","2016-09-24 23:04:17.498086","192.168.1.196","54.210.202.2","TCP","60","[TCP Keep-Alive] 2173  >  443 [ACK] Seq=431 Ack=415 Win=3072 Len=1"
"1659","2016-09-24 23:04:22.719288","Physical_00:67:5e","Tp-LinkT_51:33:ea","ARP","60","192.168.1.196 is at d0:52:a8:00:67:5e"
"1671","2016-09-24 23:04:26.239831","192.168.1.196","54.210.202.2","TLSv1.2","123","Application Data"
"1675","2016-09-24 23:04:26.457990","192.168.1.196","54.210.202.2","TCP","60","2173  >  443 [ACK] Seq=501 Ack=484 Win=3072 Len=0"
"1708","2016-09-24 23:04:36.443398","192.168.1.196","54.210.202.2","TCP","60","[TCP Keep-Alive] 2173  >  443 [ACK] Seq=500 Ack=484 Win=3072 Len=1"
"1746","2016-09-24 23:04:46.645366","192.168.1.196","54.210.202.2","TCP","60","[TCP Keep-Alive] 2173  >  443 [ACK] Seq=500 Ack=484 Win=3072 Len=1"
"1787","2016-09-24 23:04:56.847211","192.168.1.196","54.210.202.2","TCP","60","[TCP Keep-Alive] 2173  >  443 [ACK] Seq=500 Ack=484 Win=3072 Len=1"
"1810","2016-09-24 23:05:02.069236","Physical_00:67:5e","Tp-LinkT_51:33:ea","ARP","60","192.168.1.196 is at d0:52:a8:00:67:5e"
"1836","2016-09-24 23:05:07.049183","192.168.1.196","54.210.202.2","TCP","60","[TCP Keep-Alive] 2173  >  443 [ACK] Seq=500 Ack=484 Win=3072 Len=1"
"1885","2016-09-24 23:05:17.251126","192.168.1.196","54.210.202.2","TCP","60","[TCP Keep-Alive] 2173  >  443 [ACK] Seq=500 Ack=484 Win=3072 Len=1"
"1928","2016-09-24 23:05:25.155949","192.168.1.196","54.210.202.2","TLSv1.2","123","Application Data"
"1933","2016-09-24 23:05:25.374592","192.168.1.196","54.210.202.2","TCP","60","2173  >  443 [ACK] Seq=570 Ack=553 Win=3072 Len=0"
"2053","2016-09-24 23:05:35.360070","192.168.1.196","54.210.202.2","TCP","60","[TCP Keep-Alive] 2173  >  443 [ACK] Seq=569 Ack=553 Win=3072 Len=1"
"2108","2016-09-24 23:05:40.579224","Physical_00:67:5e","Tp-LinkT_51:33:ea","ARP","60","192.168.1.196 is at d0:52:a8:00:67:5e"
"2147","2016-09-24 23:05:45.562062","192.168.1.196","54.210.202.2","TCP","60","[TCP Keep-Alive] 2173  >  443 [ACK] Seq=569 Ack=553 Win=3072 Len=1"
"2241","2016-09-24 23:05:55.763954","192.168.1.196","54.210.202.2","TCP","60","[TCP Keep-Alive] 2173  >  443 [ACK] Seq=569 Ack=553 Win=3072 Len=1"
"2288","2016-09-24 23:06:05.965878","192.168.1.196","54.210.202.2","TCP","60","[TCP Keep-Alive] 2173  >  443 [ACK] Seq=569 Ack=553 Win=3072 Len=1"
"2340","2016-09-24 23:06:16.167757","192.168.1.196","54.210.202.2","TCP","60","[TCP Keep-Alive] 2173  >  443 [ACK] Seq=569 Ack=553 Win=3072 Len=1"
"2381","2016-09-24 23:06:21.389250","Physical_00:67:5e","Tp-LinkT_51:33:ea","ARP","60","192.168.1.196 is at d0:52:a8:00:67:5e"
"2387","2016-09-24 23:06:24.072213","192.168.1.196","54.210.202.2","TLSv1.2","123","Application Data"
"2390","2016-09-24 23:06:24.289896","192.168.1.196","54.210.202.2","TCP","60","2173  >  443 [ACK] Seq=639 Ack=622 Win=3072 Len=0"
"2458","2016-09-24 23:06:34.275448","192.168.1.196","54.210.202.2","TCP","60","[TCP Keep-Alive] 2173  >  443 [ACK] Seq=638 Ack=622 Win=3072 Len=1"
"2464","2016-09-24 23:06:36.618411","192.168.1.196","54.210.202.2","TLSv1.2","123","Application Data"
"2470","2016-09-24 23:06:36.836608","192.168.1.196","54.210.202.2","TCP","60","2173  >  443 [ACK] Seq=708 Ack=691 Win=3072 Len=0"
"2532","2016-09-24 23:06:46.822118","192.168.1.196","54.210.202.2","TCP","60","[TCP Keep-Alive] 2173  >  443 [ACK] Seq=707 Ack=691 Win=3072 Len=1"
"2581","2016-09-24 23:06:57.023972","192.168.1.196","54.210.202.2","TCP","60","[TCP Keep-Alive] 2173  >  443 [ACK] Seq=707 Ack=691 Win=3072 Len=1"
"2605","2016-09-24 23:07:02.249280","Physical_00:67:5e","Tp-LinkT_51:33:ea","ARP","60","192.168.1.196 is at d0:52:a8:00:67:5e"
"2617","2016-09-24 23:07:07.225953","192.168.1.196","54.210.202.2","TCP","60","[TCP Keep-Alive] 2173  >  443 [ACK] Seq=707 Ack=691 Win=3072 Len=1"
"2672","2016-09-24 23:07:17.427956","192.168.1.196","54.210.202.2","TCP","60","[TCP Keep-Alive] 2173  >  443 [ACK] Seq=707 Ack=691 Win=3072 Len=1"
"2751","2016-09-24 23:07:27.629962","192.168.1.196","54.210.202.2","TCP","60","[TCP Keep-Alive] 2173  >  443 [ACK] Seq=707 Ack=691 Win=3072 Len=1"
"2785","2016-09-24 23:07:35.534720","192.168.1.196","54.210.202.2","TLSv1.2","123","Application Data"
"2789","2016-09-24 23:07:35.752484","192.168.1.196","54.210.202.2","TCP","60","2173  >  443 [ACK] Seq=777 Ack=760 Win=3072 Len=0"
"2816","2016-09-24 23:07:40.759208","Physical_00:67:5e","Tp-LinkT_51:33:ea","ARP","60","192.168.1.196 is at d0:52:a8:00:67:5e"
"2832","2016-09-24 23:07:45.738033","192.168.1.196","54.210.202.2","TCP","60","[TCP Keep-Alive] 2173  >  443 [ACK] Seq=776 Ack=760 Win=3072 Len=1"
"2886","2016-09-24 23:07:55.940074","192.168.1.196","54.210.202.2","TCP","60","[TCP Keep-Alive] 2173  >  443 [ACK] Seq=776 Ack=760 Win=3072 Len=1"
"2938","2016-09-24 23:08:01.727429","192.168.1.196","54.210.202.2","TLSv1.2","139","Application Data"
"2941","2016-09-24 23:08:01.945439","192.168.1.196","54.210.202.2","TCP","60","2173  >  443 [ACK] Seq=862 Ack=829 Win=3072 Len=0"
"3000","2016-09-24 23:08:11.931016","192.168.1.196","54.210.202.2","TCP","60","[TCP Keep-Alive] 2173  >  443 [ACK] Seq=861 Ack=829 Win=3072 Len=1"
"3025","2016-09-24 23:08:17.149225","Physical_00:67:5e","Tp-LinkT_51:33:ea","ARP","60","192.168.1.196 is at d0:52:a8:00:67:5e"
"3166","2016-09-24 23:08:22.132983","192.168.1.196","54.210.202.2","TCP","60","[TCP Keep-Alive] 2173  >  443 [ACK] Seq=861 Ack=829 Win=3072 Len=1"
"3206","2016-09-24 23:08:32.335205","192.168.1.196","54.210.202.2","TCP","60","[TCP Keep-Alive] 2173  >  443 [ACK] Seq=861 Ack=829 Win=3072 Len=1"
"3257","2016-09-24 23:08:42.537454","192.168.1.196","54.210.202.2","TCP","60","[TCP Keep-Alive] 2173  >  443 [ACK] Seq=861 Ack=829 Win=3072 Len=1"
"3303","2016-09-24 23:08:52.739768","192.168.1.196","54.210.202.2","TCP","60","[TCP Keep-Alive] 2173  >  443 [ACK] Seq=861 Ack=829 Win=3072 Len=1"
"3319","2016-09-24 23:08:57.959275","Physical_00:67:5e","Tp-LinkT_51:33:ea","ARP","60","192.168.1.196 is at d0:52:a8:00:67:5e"
"3333","2016-09-24 23:09:00.645012","192.168.1.196","54.210.202.2","TLSv1.2","123","Application Data"
"3337","2016-09-24 23:09:00.944684","192.168.1.196","54.210.202.2","TCP","60","2173  >  443 [ACK] Seq=931 Ack=898 Win=3072 Len=0"
"3447","2016-09-24 23:09:05.945117","192.168.1.196","54.210.202.2","TLSv1.2","123","Application Data"
"3450","2016-09-24 23:09:06.163569","192.168.1.196","54.210.202.2","TCP","60","2173  >  443 [ACK] Seq=1000 Ack=967 Win=3072 Len=0"
"3489","2016-09-24 23:09:16.149315","192.168.1.196","54.210.202.2","TCP","60","[TCP Keep-Alive] 2173  >  443 [ACK] Seq=999 Ack=967 Win=3072 Len=1"
"3546","2016-09-24 23:09:26.351517","192.168.1.196","54.210.202.2","TCP","60","[TCP Keep-Alive] 2173  >  443 [ACK] Seq=999 Ack=967 Win=3072 Len=1"
"3551","2016-09-24 23:09:27.015763","192.168.1.196","54.210.202.2","TLSv1.2","123","Application Data"
"3555","2016-09-24 23:09:27.235030","192.168.1.196","54.210.202.2","TCP","60","2173  >  443 [ACK] Seq=1069 Ack=1036 Win=3072 Len=0"
"3599","2016-09-24 23:09:37.220481","192.168.1.196","54.210.202.2","TCP","60","[TCP Keep-Alive] 2173  >  443 [ACK] Seq=1068 Ack=1036 Win=3072 Len=1"
"3631","2016-09-24 23:09:42.439246","Physical_00:67:5e","Tp-LinkT_51:33:ea","ARP","60","192.168.1.196 is at d0:52:a8:00:67:5e"
"3651","2016-09-24 23:09:47.422557","192.168.1.196","54.210.202.2","TCP","60","[TCP Keep-Alive] 2173  >  443 [ACK] Seq=1068 Ack=1036 Win=3072 Len=1"
"3701","2016-09-24 23:09:57.624596","192.168.1.196","54.210.202.2","TCP","60","[TCP Keep-Alive] 2173  >  443 [ACK] Seq=1068 Ack=1036 Win=3072 Len=1"
"3764","2016-09-24 23:10:07.826641","192.168.1.196","54.210.202.2","TCP","60","[TCP Keep-Alive] 2173  >  443 [ACK] Seq=1068 Ack=1036 Win=3072 Len=1"
"3836","2016-09-24 23:10:18.028641","192.168.1.196","54.210.202.2","TCP","60","[TCP Keep-Alive] 2173  >  443 [ACK] Seq=1068 Ack=1036 Win=3072 Len=1"
"3868","2016-09-24 23:10:23.249249","Physical_00:67:5e","Tp-LinkT_51:33:ea","ARP","60","192.168.1.196 is at d0:52:a8:00:67:5e"
"3880","2016-09-24 23:10:25.932771","192.168.1.196","54.210.202.2","TLSv1.2","123","Application Data"
"3895","2016-09-24 23:10:26.150530","192.168.1.196","54.210.202.2","TCP","60","2173  >  443 [ACK] Seq=1138 Ack=1105 Win=3072 Len=0"
"3939","2016-09-24 23:10:36.136153","192.168.1.196","54.210.202.2","TCP","60","[TCP Keep-Alive] 2173  >  443 [ACK] Seq=1137 Ack=1105 Win=3072 Len=1"
"3985","2016-09-24 23:10:46.338246","192.168.1.196","54.210.202.2","TCP","60","[TCP Keep-Alive] 2173  >  443 [ACK] Seq=1137 Ack=1105 Win=3072 Len=1"
"4029","2016-09-24 23:10:56.540332","192.168.1.196","54.210.202.2","TCP","60","[TCP Keep-Alive] 2173  >  443 [ACK] Seq=1137 Ack=1105 Win=3072 Len=1"
"4058","2016-09-24 23:11:01.759249","Physical_00:67:5e","Tp-LinkT_51:33:ea","ARP","60","192.168.1.196 is at d0:52:a8:00:67:5e"
"4067","2016-09-24 23:11:06.742376","192.168.1.196","54.210.202.2","TCP","60","[TCP Keep-Alive] 2173  >  443 [ACK] Seq=1137 Ack=1105 Win=3072 Len=1"
"4206","2016-09-24 23:11:13.026066","Physical_00:67:5e","Broadcast","ARP","60","Who has 192.168.1.1? Tell 192.168.1.196"
"4208","2016-09-24 23:11:13.026122","192.168.1.196","192.168.1.1","DNS","72","Standard query 0x00a0 A pool.ntp.org"
"4211","2016-09-24 23:11:13.030893","Physical_00:67:5e","Broadcast","ARP","60","Who has 192.168.1.1? Tell 192.168.1.196"
"4213","2016-09-24 23:11:13.031041","192.168.1.196","59.167.170.228","NTP","90","NTP Version 3, client"
"4238","2016-09-24 23:11:16.944326","192.168.1.196","54.210.202.2","TCP","60","[TCP Keep-Alive] 2173  >  443 [ACK] Seq=1137 Ack=1105 Win=3072 Len=1"
"4286","2016-09-24 23:11:24.849742","192.168.1.196","54.210.202.2","TLSv1.2","123","Application Data"
"4289","2016-09-24 23:11:25.067493","192.168.1.196","54.210.202.2","TCP","60","2173  >  443 [ACK] Seq=1207 Ack=1174 Win=3072 Len=0"
"4343","2016-09-24 23:11:35.053055","192.168.1.196","54.210.202.2","TCP","60","[TCP Keep-Alive] 2173  >  443 [ACK] Seq=1206 Ack=1174 Win=3072 Len=1"
"4345","2016-09-24 23:11:35.271501","192.168.1.196","54.210.202.2","TLSv1.2","123","Application Data"
"4350","2016-09-24 23:11:35.490243","192.168.1.196","54.210.202.2","TCP","60","2173  >  443 [ACK] Seq=1276 Ack=1243 Win=3072 Len=0"
"4375","2016-09-24 23:11:40.269267","Physical_00:67:5e","Tp-LinkT_51:33:ea","ARP","60","192.168.1.196 is at d0:52:a8:00:67:5e"
"4392","2016-09-24 23:11:45.475848","192.168.1.196","54.210.202.2","TCP","60","[TCP Keep-Alive] 2173  >  443 [ACK] Seq=1275 Ack=1243 Win=3072 Len=1"
"4442","2016-09-24 23:11:55.677897","192.168.1.196","54.210.202.2","TCP","60","[TCP Keep-Alive] 2173  >  443 [ACK] Seq=1275 Ack=1243 Win=3072 Len=1"
"4472","2016-09-24 23:12:02.391352","192.168.1.196","54.210.202.2","TLSv1.2","139","Application Data"
"4476","2016-09-24 23:12:02.610233","192.168.1.196","54.210.202.2","TCP","60","2173  >  443 [ACK] Seq=1361 Ack=1312 Win=3072 Len=0"
"4521","2016-09-24 23:12:12.595775","192.168.1.196","54.210.202.2","TCP","60","[TCP Keep-Alive] 2173  >  443 [ACK] Seq=1360 Ack=1312 Win=3072 Len=1"
"4554","2016-09-24 23:12:17.819208","Physical_00:67:5e","Tp-LinkT_51:33:ea","ARP","60","192.168.1.196 is at d0:52:a8:00:67:5e"
"4585","2016-09-24 23:12:22.797662","192.168.1.196","54.210.202.2","TCP","60","[TCP Keep-Alive] 2173  >  443 [ACK] Seq=1360 Ack=1312 Win=3072 Len=1"
"4629","2016-09-24 23:12:32.999495","192.168.1.196","54.210.202.2","TCP","60","[TCP Keep-Alive] 2173  >  443 [ACK] Seq=1360 Ack=1312 Win=3072 Len=1"
"4674","2016-09-24 23:12:43.201526","192.168.1.196","54.210.202.2","TCP","60","[TCP Keep-Alive] 2173  >  443 [ACK] Seq=1360 Ack=1312 Win=3072 Len=1"
"4733","2016-09-24 23:12:53.403442","192.168.1.196","54.210.202.2","TCP","60","[TCP Keep-Alive] 2173  >  443 [ACK] Seq=1360 Ack=1312 Win=3072 Len=1"
"4773","2016-09-24 23:12:58.629242","Physical_00:67:5e","Tp-LinkT_51:33:ea","ARP","60","192.168.1.196 is at d0:52:a8:00:67:5e"
"4785","2016-09-24 23:13:01.307573","192.168.1.196","54.210.202.2","TLSv1.2","123","Application Data"
"4789","2016-09-24 23:13:01.525321","192.168.1.196","54.210.202.2","TCP","60","2173  >  443 [ACK] Seq=1430 Ack=1381 Win=3072 Len=0"
"4819","2016-09-24 23:13:11.510675","192.168.1.196","54.210.202.2","TCP","60","[TCP Keep-Alive] 2173  >  443 [ACK] Seq=1429 Ack=1381 Win=3072 Len=1"
"4868","2016-09-24 23:13:21.712479","192.168.1.196","54.210.202.2","TCP","60","[TCP Keep-Alive] 2173  >  443 [ACK] Seq=1429 Ack=1381 Win=3072 Len=1"
"4914","2016-09-24 23:13:31.914280","192.168.1.196","54.210.202.2","TCP","60","[TCP Keep-Alive] 2173  >  443 [ACK] Seq=1429 Ack=1381 Win=3072 Len=1"
"4930","2016-09-24 23:13:37.139286","Physical_00:67:5e","Tp-LinkT_51:33:ea","ARP","60","192.168.1.196 is at d0:52:a8:00:67:5e"
"4972","2016-09-24 23:13:42.116126","192.168.1.196","54.210.202.2","TCP","60","[TCP Keep-Alive] 2173  >  443 [ACK] Seq=1429 Ack=1381 Win=3072 Len=1"
"5171","2016-09-24 23:13:52.317969","192.168.1.196","54.210.202.2","TCP","60","[TCP Keep-Alive] 2173  >  443 [ACK] Seq=1429 Ack=1381 Win=3072 Len=1"
"5209","2016-09-24 23:14:00.222441","192.168.1.196","54.210.202.2","TLSv1.2","123","Application Data"
"5213","2016-09-24 23:14:00.440711","192.168.1.196","54.210.202.2","TCP","60","2173  >  443 [ACK] Seq=1499 Ack=1450 Win=3072 Len=0"
"5229","2016-09-24 23:14:04.600512","192.168.1.196","54.210.202.2","TLSv1.2","123","Application Data"
"5232","2016-09-24 23:14:04.818816","192.168.1.196","54.210.202.2","TCP","60","2173  >  443 [ACK] Seq=1568 Ack=1519 Win=3072 Len=0"
"5372","2016-09-24 23:14:14.804151","192.168.1.196","54.210.202.2","TCP","60","[TCP Keep-Alive] 2173  >  443 [ACK] Seq=1567 Ack=1519 Win=3072 Len=1"
"5411","2016-09-24 23:14:20.029234","Physical_00:67:5e","Tp-LinkT_51:33:ea","ARP","60","192.168.1.196 is at d0:52:a8:00:67:5e"
"5438","2016-09-24 23:14:25.005855","192.168.1.196","54.210.202.2","TCP","60","[TCP Keep-Alive] 2173  >  443 [ACK] Seq=1567 Ack=1519 Win=3072 Len=1"
"5449","2016-09-24 23:14:27.795352","192.168.1.196","54.210.202.2","TLSv1.2","123","Application Data"
"5455","2016-09-24 23:14:28.014157","192.168.1.196","54.210.202.2","TCP","60","2173  >  443 [ACK] Seq=1637 Ack=1588 Win=3072 Len=0"
"5504","2016-09-24 23:14:37.999670","192.168.1.196","54.210.202.2","TCP","60","[TCP Keep-Alive] 2173  >  443 [ACK] Seq=1636 Ack=1588 Win=3072 Len=1"
"5542","2016-09-24 23:14:48.201495","192.168.1.196","54.210.202.2","TCP","60","[TCP Keep-Alive] 2173  >  443 [ACK] Seq=1636 Ack=1588 Win=3072 Len=1"
"5594","2016-09-24 23:14:58.403500","192.168.1.196","54.210.202.2","TCP","60","[TCP Keep-Alive] 2173  >  443 [ACK] Seq=1636 Ack=1588 Win=3072 Len=1"
"5621","2016-09-24 23:15:03.629230","Physical_00:67:5e","Tp-LinkT_51:33:ea","ARP","60","192.168.1.196 is at d0:52:a8:00:67:5e"
"5638","2016-09-24 23:15:08.605501","192.168.1.196","54.210.202.2","TCP","60","[TCP Keep-Alive] 2173  >  443 [ACK] Seq=1636 Ack=1588 Win=3072 Len=1"
"5668","2016-09-24 23:15:18.807547","192.168.1.196","54.210.202.2","TCP","60","[TCP Keep-Alive] 2173  >  443 [ACK] Seq=1636 Ack=1588 Win=3072 Len=1"
"5719","2016-09-24 23:15:26.712785","192.168.1.196","54.210.202.2","TLSv1.2","123","Application Data"
"5722","2016-09-24 23:15:26.930464","192.168.1.196","54.210.202.2","TCP","60","2173  >  443 [ACK] Seq=1706 Ack=1657 Win=3072 Len=0"
"5774","2016-09-24 23:15:36.915994","192.168.1.196","54.210.202.2","TCP","60","[TCP Keep-Alive] 2173  >  443 [ACK] Seq=1705 Ack=1657 Win=3072 Len=1"
"5822","2016-09-24 23:15:47.117735","192.168.1.196","54.210.202.2","TCP","60","[TCP Keep-Alive] 2173  >  443 [ACK] Seq=1705 Ack=1657 Win=3072 Len=1"
"5856","2016-09-24 23:15:52.339211","Physical_00:67:5e","Tp-LinkT_51:33:ea","ARP","60","192.168.1.196 is at d0:52:a8:00:67:5e"
"5875","2016-09-24 23:15:57.319719","192.168.1.196","54.210.202.2","TCP","60","[TCP Keep-Alive] 2173  >  443 [ACK] Seq=1705 Ack=1657 Win=3072 Len=1"
"5897","2016-09-24 23:16:03.043197","192.168.1.196","54.210.202.2","TLSv1.2","139","Application Data"
"5900","2016-09-24 23:16:03.261318","192.168.1.196","54.210.202.2","TCP","60","2173  >  443 [ACK] Seq=1791 Ack=1726 Win=3072 Len=0"
"5933","2016-09-24 23:16:13.247010","192.168.1.196","54.210.202.2","TCP","60","[TCP Keep-Alive] 2173  >  443 [ACK] Seq=1790 Ack=1726 Win=3072 Len=1"
"5994","2016-09-24 23:16:23.449033","192.168.1.196","54.210.202.2","TCP","60","[TCP Keep-Alive] 2173  >  443 [ACK] Seq=1790 Ack=1726 Win=3072 Len=1"
"6187","2016-09-24 23:16:33.651024","192.168.1.196","54.210.202.2","TCP","60","[TCP Keep-Alive] 2173  >  443 [ACK] Seq=1790 Ack=1726 Win=3072 Len=1"
"6194","2016-09-24 23:16:33.927700","192.168.1.196","54.210.202.2","TLSv1.2","123","Application Data"
"6197","2016-09-24 23:16:34.145799","192.168.1.196","54.210.202.2","TCP","60","2173  >  443 [ACK] Seq=1860 Ack=1795 Win=3072 Len=0"
"6225","2016-09-24 23:16:38.869245","Physical_00:67:5e","Tp-LinkT_51:33:ea","ARP","60","192.168.1.196 is at d0:52:a8:00:67:5e"
"6252","2016-09-24 23:16:44.131354","192.168.1.196","54.210.202.2","TCP","60","[TCP Keep-Alive] 2173  >  443 [ACK] Seq=1859 Ack=1795 Win=3072 Len=1"
"6351","2016-09-24 23:16:54.333278","192.168.1.196","54.210.202.2","TCP","60","[TCP Keep-Alive] 2173  >  443 [ACK] Seq=1859 Ack=1795 Win=3072 Len=1"
"6378","2016-09-24 23:17:04.535421","192.168.1.196","54.210.202.2","TCP","60","[TCP Keep-Alive] 2173  >  443 [ACK] Seq=1859 Ack=1795 Win=3072 Len=1"
"6410","2016-09-24 23:17:14.737433","192.168.1.196","54.210.202.2","TCP","60","[TCP Keep-Alive] 2173  >  443 [ACK] Seq=1859 Ack=1795 Win=3072 Len=1"
"6461","2016-09-24 23:17:24.939403","192.168.1.196","54.210.202.2","TCP","60","[TCP Keep-Alive] 2173  >  443 [ACK] Seq=1859 Ack=1795 Win=3072 Len=1"
"6483","2016-09-24 23:17:30.159244","Physical_00:67:5e","Tp-LinkT_51:33:ea","ARP","60","192.168.1.196 is at d0:52:a8:00:67:5e"
"6491","2016-09-24 23:17:32.844381","192.168.1.196","54.210.202.2","TLSv1.2","123","Application Data"
"6495","2016-09-24 23:17:33.061930","192.168.1.196","54.210.202.2","TCP","60","2173  >  443 [ACK] Seq=1929 Ack=1864 Win=3072 Len=0"
"6582","2016-09-24 23:17:43.047389","192.168.1.196","54.210.202.2","TCP","60","[TCP Keep-Alive] 2173  >  443 [ACK] Seq=1928 Ack=1864 Win=3072 Len=1"
"6639","2016-09-24 23:17:53.249381","192.168.1.196","54.210.202.2","TCP","60","[TCP Keep-Alive] 2173  >  443 [ACK] Seq=1928 Ack=1864 Win=3072 Len=1"
"6677","2016-09-24 23:18:03.451539","192.168.1.196","54.210.202.2","TCP","60","[TCP Keep-Alive] 2173  >  443 [ACK] Seq=1928 Ack=1864 Win=3072 Len=1"
"6711","2016-09-24 23:18:13.653517","192.168.1.196","54.210.202.2","TCP","60","[TCP Keep-Alive] 2173  >  443 [ACK] Seq=1928 Ack=1864 Win=3072 Len=1"
"6734","2016-09-24 23:18:18.879231","Physical_00:67:5e","Tp-LinkT_51:33:ea","ARP","60","192.168.1.196 is at d0:52:a8:00:67:5e"
"6780","2016-09-24 23:18:23.855559","192.168.1.196","54.210.202.2","TCP","60","[TCP Keep-Alive] 2173  >  443 [ACK] Seq=1928 Ack=1864 Win=3072 Len=1"
"6817","2016-09-24 23:18:31.761061","192.168.1.196","54.210.202.2","TLSv1.2","123","Application Data"
"6824","2016-09-24 23:18:31.978811","192.168.1.196","54.210.202.2","TCP","60","2173  >  443 [ACK] Seq=1998 Ack=1933 Win=3072 Len=0"
"6854","2016-09-24 23:18:41.964273","192.168.1.196","54.210.202.2","TCP","60","[TCP Keep-Alive] 2173  >  443 [ACK] Seq=1997 Ack=1933 Win=3072 Len=1"
"6999","2016-09-24 23:18:52.166333","192.168.1.196","54.210.202.2","TCP","60","[TCP Keep-Alive] 2173  >  443 [ACK] Seq=1997 Ack=1933 Win=3072 Len=1"
"7035","2016-09-24 23:19:02.368240","192.168.1.196","54.210.202.2","TCP","60","[TCP Keep-Alive] 2173  >  443 [ACK] Seq=1997 Ack=1933 Win=3072 Len=1"
"7039","2016-09-24 23:19:03.297883","192.168.1.196","54.210.202.2","TLSv1.2","123","Application Data"
"7043","2016-09-24 23:19:03.526728","192.168.1.196","54.210.202.2","TCP","60","2173  >  443 [ACK] Seq=2067 Ack=2002 Win=3072 Len=0"
"7073","2016-09-24 23:19:07.589259","Physical_00:67:5e","Tp-LinkT_51:33:ea","ARP","60","192.168.1.196 is at d0:52:a8:00:67:5e"
"7087","2016-09-24 23:19:13.511908","192.168.1.196","54.210.202.2","TCP","60","[TCP Keep-Alive] 2173  >  443 [ACK] Seq=2066 Ack=2002 Win=3072 Len=1"
"7139","2016-09-24 23:19:23.713969","192.168.1.196","54.210.202.2","TCP","60","[TCP Keep-Alive] 2173  >  443 [ACK] Seq=2066 Ack=2002 Win=3072 Len=1"
"7262","2016-09-24 23:19:28.570779","192.168.1.196","54.210.202.2","TLSv1.2","123","Application Data"
"7267","2016-09-24 23:19:28.789161","192.168.1.196","54.210.202.2","TCP","60","2173  >  443 [ACK] Seq=2136 Ack=2071 Win=3072 Len=0"
"7304","2016-09-24 23:19:38.774670","192.168.1.196","54.210.202.2","TCP","60","[TCP Keep-Alive] 2173  >  443 [ACK] Seq=2135 Ack=2071 Win=3072 Len=1"
"7332","2016-09-24 23:19:43.999211","Physical_00:67:5e","Tp-LinkT_51:33:ea","ARP","60","192.168.1.196 is at d0:52:a8:00:67:5e"
"7364","2016-09-24 23:19:48.976735","192.168.1.196","54.210.202.2","TCP","60","[TCP Keep-Alive] 2173  >  443 [ACK] Seq=2135 Ack=2071 Win=3072 Len=1"
"7418","2016-09-24 23:19:59.178792","192.168.1.196","54.210.202.2","TCP","60","[TCP Keep-Alive] 2173  >  443 [ACK] Seq=2135 Ack=2071 Win=3072 Len=1"
"7439","2016-09-24 23:20:03.702403","192.168.1.196","54.210.202.2","TLSv1.2","139","Application Data"
"7445","2016-09-24 23:20:03.920918","192.168.1.196","54.210.202.2","TCP","60","2173  >  443 [ACK] Seq=2221 Ack=2140 Win=3072 Len=0"
"7484","2016-09-24 23:20:13.906558","192.168.1.196","54.210.202.2","TCP","60","[TCP Keep-Alive] 2173  >  443 [ACK] Seq=2220 Ack=2140 Win=3072 Len=1"
"7525","2016-09-24 23:20:19.129249","Physical_00:67:5e","Tp-LinkT_51:33:ea","ARP","60","192.168.1.196 is at d0:52:a8:00:67:5e"
"7548","2016-09-24 23:20:24.108677","192.168.1.196","54.210.202.2","TCP","60","[TCP Keep-Alive] 2173  >  443 [ACK] Seq=2220 Ack=2140 Win=3072 Len=1"
"7593","2016-09-24 23:20:34.310518","192.168.1.196","54.210.202.2","TCP","60","[TCP Keep-Alive] 2173  >  443 [ACK] Seq=2220 Ack=2140 Win=3072 Len=1"
"7639","2016-09-24 23:20:44.512321","192.168.1.196","54.210.202.2","TCP","60","[TCP Keep-Alive] 2173  >  443 [ACK] Seq=2220 Ack=2140 Win=3072 Len=1"
"7721","2016-09-24 23:20:54.714187","192.168.1.196","54.210.202.2","TCP","60","[TCP Keep-Alive] 2173  >  443 [ACK] Seq=2220 Ack=2140 Win=3072 Len=1"
"7747","2016-09-24 23:20:59.939247","Physical_00:67:5e","Tp-LinkT_51:33:ea","ARP","60","192.168.1.196 is at d0:52:a8:00:67:5e"
"7759","2016-09-24 23:21:02.618612","192.168.1.196","54.210.202.2","TLSv1.2","123","Application Data"
"7762","2016-09-24 23:21:02.836356","192.168.1.196","54.210.202.2","TCP","60","2173  >  443 [ACK] Seq=2290 Ack=2209 Win=3072 Len=0"
"7801","2016-09-24 23:21:12.376298","Physical_00:67:5e","Broadcast","ARP","60","Who has 192.168.1.1? Tell 192.168.1.196"
"7803","2016-09-24 23:21:12.376351","192.168.1.196","192.168.1.1","DNS","72","Standard query 0x00a1 A pool.ntp.org"
"7805","2016-09-24 23:21:12.380982","Physical_00:67:5e","Broadcast","ARP","60","Who has 192.168.1.1? Tell 192.168.1.196"
"7807","2016-09-24 23:21:12.381129","192.168.1.196","202.60.94.15","NTP","90","NTP Version 3, client"
"7809","2016-09-24 23:21:12.821814","192.168.1.196","54.210.202.2","TCP","60","[TCP Keep-Alive] 2173  >  443 [ACK] Seq=2289 Ack=2209 Win=3072 Len=1"
"7861","2016-09-24 23:21:23.023813","192.168.1.196","54.210.202.2","TCP","60","[TCP Keep-Alive] 2173  >  443 [ACK] Seq=2289 Ack=2209 Win=3072 Len=1"
"7901","2016-09-24 23:21:32.585211","192.168.1.196","54.210.202.2","TLSv1.2","123","Application Data"
"7906","2016-09-24 23:21:32.803579","192.168.1.196","54.210.202.2","TCP","60","2173  >  443 [ACK] Seq=2359 Ack=2278 Win=3072 Len=0"
"8003","2016-09-24 23:21:37.809258","Physical_00:67:5e","Tp-LinkT_51:33:ea","ARP","60","192.168.1.196 is at d0:52:a8:00:67:5e"
"8021","2016-09-24 23:21:42.788822","192.168.1.196","54.210.202.2","TCP","60","[TCP Keep-Alive] 2173  >  443 [ACK] Seq=2358 Ack=2278 Win=3072 Len=1"
"8076","2016-09-24 23:21:52.990731","192.168.1.196","54.210.202.2","TCP","60","[TCP Keep-Alive] 2173  >  443 [ACK] Seq=2358 Ack=2278 Win=3072 Len=1"
"8140","2016-09-24 23:22:03.192806","192.168.1.196","54.210.202.2","TCP","60","[TCP Keep-Alive] 2173  >  443 [ACK] Seq=2358 Ack=2278 Win=3072 Len=1"
"8180","2016-09-24 23:22:13.394781","192.168.1.196","54.210.202.2","TCP","60","[TCP Keep-Alive] 2173  >  443 [ACK] Seq=2358 Ack=2278 Win=3072 Len=1"
"8203","2016-09-24 23:22:18.619257","Physical_00:67:5e","Tp-LinkT_51:33:ea","ARP","60","192.168.1.196 is at d0:52:a8:00:67:5e"
"8240","2016-09-24 23:22:23.596975","192.168.1.196","54.210.202.2","TCP","60","[TCP Keep-Alive] 2173  >  443 [ACK] Seq=2358 Ack=2278 Win=3072 Len=1"
"8279","2016-09-24 23:22:31.502616","192.168.1.196","54.210.202.2","TLSv1.2","123","Application Data"
"8283","2016-09-24 23:22:31.720474","192.168.1.196","54.210.202.2","TCP","60","2173  >  443 [ACK] Seq=2428 Ack=2347 Win=3072 Len=0"
"8346","2016-09-24 23:22:41.706089","192.168.1.196","54.210.202.2","TCP","60","[TCP Keep-Alive] 2173  >  443 [ACK] Seq=2427 Ack=2347 Win=3072 Len=1"
"8412","2016-09-24 23:22:51.908332","192.168.1.196","54.210.202.2","TCP","60","[TCP Keep-Alive] 2173  >  443 [ACK] Seq=2427 Ack=2347 Win=3072 Len=1"
"8441","2016-09-24 23:22:57.129284","Physical_00:67:5e","Tp-LinkT_51:33:ea","ARP","60","192.168.1.196 is at d0:52:a8:00:67:5e"
"8462","2016-09-24 23:23:02.110691","192.168.1.196","54.210.202.2","TCP","60","[TCP Keep-Alive] 2173  >  443 [ACK] Seq=2427 Ack=2347 Win=3072 Len=1"
"8519","2016-09-24 23:23:12.312943","192.168.1.196","54.210.202.2","TCP","60","[TCP Keep-Alive] 2173  >  443 [ACK] Seq=2427 Ack=2347 Win=3072 Len=1"
"8589","2016-09-24 23:23:22.515035","192.168.1.196","54.210.202.2","TCP","60","[TCP Keep-Alive] 2173  >  443 [ACK] Seq=2427 Ack=2347 Win=3072 Len=1"
"8621","2016-09-24 23:23:30.419795","192.168.1.196","54.210.202.2","TLSv1.2","123","Application Data"
"8624","2016-09-24 23:23:30.637587","192.168.1.196","54.210.202.2","TCP","60","2173  >  443 [ACK] Seq=2497 Ack=2416 Win=3072 Len=0"
"8640","2016-09-24 23:23:35.639251","Physical_00:67:5e","Tp-LinkT_51:33:ea","ARP","60","192.168.1.196 is at d0:52:a8:00:67:5e"
"8677","2016-09-24 23:23:40.623175","192.168.1.196","54.210.202.2","TCP","60","[TCP Keep-Alive] 2173  >  443 [ACK] Seq=2496 Ack=2416 Win=3072 Len=1"
"8801","2016-09-24 23:23:50.825212","192.168.1.196","54.210.202.2","TCP","60","[TCP Keep-Alive] 2173  >  443 [ACK] Seq=2496 Ack=2416 Win=3072 Len=1"
"8848","2016-09-24 23:24:01.027231","192.168.1.196","54.210.202.2","TCP","60","[TCP Keep-Alive] 2173  >  443 [ACK] Seq=2496 Ack=2416 Win=3072 Len=1"
"8855","2016-09-24 23:24:01.912821","192.168.1.196","54.210.202.2","TLSv1.2","123","Application Data"
"8858","2016-09-24 23:24:02.130978","192.168.1.196","54.210.202.2","TCP","60","2173  >  443 [ACK] Seq=2566 Ack=2485 Win=3072 Len=0"
"8870","2016-09-24 23:24:04.358706","192.168.1.196","54.210.202.2","TLSv1.2","139","Application Data"
"8873","2016-09-24 23:24:04.576911","192.168.1.196","54.210.202.2","TCP","60","2173  >  443 [ACK] Seq=2651 Ack=2554 Win=3072 Len=0"
"8894","2016-09-24 23:24:09.579229","Physical_00:67:5e","Tp-LinkT_51:33:ea","ARP","60","192.168.1.196 is at d0:52:a8:00:67:5e"
"8911","2016-09-24 23:24:14.562466","192.168.1.196","54.210.202.2","TCP","60","[TCP Keep-Alive] 2173  >  443 [ACK] Seq=2650 Ack=2554 Win=3072 Len=1"
"8963","2016-09-24 23:24:24.764795","192.168.1.196","54.210.202.2","TCP","60","[TCP Keep-Alive] 2173  >  443 [ACK] Seq=2650 Ack=2554 Win=3072 Len=1"
"8991","2016-09-24 23:24:29.346209","192.168.1.196","54.210.202.2","TLSv1.2","123","Application Data"
"8996","2016-09-24 23:24:29.564624","192.168.1.196","54.210.202.2","TCP","60","2173  >  443 [ACK] Seq=2720 Ack=2623 Win=3072 Len=0"
"9126","2016-09-24 23:24:34.569255","Physical_00:67:5e","Tp-LinkT_51:33:ea","ARP","60","192.168.1.196 is at d0:52:a8:00:67:5e"
"9151","2016-09-24 23:24:39.550408","192.168.1.196","54.210.202.2","TCP","60","[TCP Keep-Alive] 2173  >  443 [ACK] Seq=2719 Ack=2623 Win=3072 Len=1"
"9232","2016-09-24 23:24:49.752497","192.168.1.196","54.210.202.2","TCP","60","[TCP Keep-Alive] 2173  >  443 [ACK] Seq=2719 Ack=2623 Win=3072 Len=1"
"9288","2016-09-24 23:24:59.954599","192.168.1.196","54.210.202.2","TCP","60","[TCP Keep-Alive] 2173  >  443 [ACK] Seq=2719 Ack=2623 Win=3072 Len=1"
"9308","2016-09-24 23:25:05.179244","Physical_00:67:5e","Tp-LinkT_51:33:ea","ARP","60","192.168.1.196 is at d0:52:a8:00:67:5e"
"9325","2016-09-24 23:25:10.156889","192.168.1.196","54.210.202.2","TCP","60","[TCP Keep-Alive] 2173  >  443 [ACK] Seq=2719 Ack=2623 Win=3072 Len=1"
"9382","2016-09-24 23:25:20.359093","192.168.1.196","54.210.202.2","TCP","60","[TCP Keep-Alive] 2173  >  443 [ACK] Seq=2719 Ack=2623 Win=3072 Len=1"
"9413","2016-09-24 23:25:28.263860","192.168.1.196","54.210.202.2","TLSv1.2","123","Application Data"
"9416","2016-09-24 23:25:28.483466","192.168.1.196","54.210.202.2","TCP","60","2173  >  443 [ACK] Seq=2789 Ack=2692 Win=3072 Len=0"
"9433","2016-09-24 23:25:33.489229","Physical_00:67:5e","Tp-LinkT_51:33:ea","ARP","60","192.168.1.196 is at d0:52:a8:00:67:5e"
"9453","2016-09-24 23:25:38.469057","192.168.1.196","54.210.202.2","TCP","60","[TCP Keep-Alive] 2173  >  443 [ACK] Seq=2788 Ack=2692 Win=3072 Len=1"
"9489","2016-09-24 23:25:48.671018","192.168.1.196","54.210.202.2","TCP","60","[TCP Keep-Alive] 2173  >  443 [ACK] Seq=2788 Ack=2692 Win=3072 Len=1"
"9536","2016-09-24 23:25:57.511034","192.168.1.196","54.210.202.2","TLSv1.2","123","Application Data"
"9539","2016-09-24 23:25:57.729041","192.168.1.196","54.210.202.2","TCP","60","2173  >  443 [ACK] Seq=2858 Ack=2761 Win=3072 Len=0"
"9562","2016-09-24 23:26:02.729302","Physical_00:67:5e","Tp-LinkT_51:33:ea","ARP","60","192.168.1.196 is at d0:52:a8:00:67:5e"
"9593","2016-09-24 23:26:07.714539","192.168.1.196","54.210.202.2","TCP","60","[TCP Keep-Alive] 2173  >  443 [ACK] Seq=2857 Ack=2761 Win=3072 Len=1"
"9637","2016-09-24 23:26:17.916669","192.168.1.196","54.210.202.2","TCP","60","[TCP Keep-Alive] 2173  >  443 [ACK] Seq=2857 Ack=2761 Win=3072 Len=1"
"9690","2016-09-24 23:26:28.118866","192.168.1.196","54.210.202.2","TCP","60","[TCP Keep-Alive] 2173  >  443 [ACK] Seq=2857 Ack=2761 Win=3072 Len=1"
"9709","2016-09-24 23:26:31.243089","192.168.1.196","54.210.202.2","TLSv1.2","123","Application Data"
"9713","2016-09-24 23:26:31.461184","192.168.1.196","54.210.202.2","TCP","60","2173  >  443 [ACK] Seq=2927 Ack=2830 Win=3072 Len=0"
"9722","2016-09-24 23:26:33.339282","Physical_00:67:5e","Tp-LinkT_51:33:ea","ARP","60","192.168.1.196 is at d0:52:a8:00:67:5e"
"9752","2016-09-24 23:26:41.446826","192.168.1.196","54.210.202.2","TCP","60","[TCP Keep-Alive] 2173  >  443 [ACK] Seq=2926 Ack=2830 Win=3072 Len=1"
"9838","2016-09-24 23:26:51.648824","192.168.1.196","54.210.202.2","TCP","60","[TCP Keep-Alive] 2173  >  443 [ACK] Seq=2926 Ack=2830 Win=3072 Len=1"
"9871","2016-09-24 23:26:56.869243","Physical_00:67:5e","Tp-LinkT_51:33:ea","ARP","60","192.168.1.196 is at d0:52:a8:00:67:5e"
"9898","2016-09-24 23:27:01.850879","192.168.1.196","54.210.202.2","TCP","60","[TCP Keep-Alive] 2173  >  443 [ACK] Seq=2926 Ack=2830 Win=3072 Len=1"
"9999","2016-09-24 23:27:12.052707","192.168.1.196","54.210.202.2","TCP","60","[TCP Keep-Alive] 2173  >  443 [ACK] Seq=2926 Ack=2830 Win=3072 Len=1"
"10055","2016-09-24 23:27:22.254738","192.168.1.196","54.210.202.2","TCP","60","[TCP Keep-Alive] 2173  >  443 [ACK] Seq=2926 Ack=2830 Win=3072 Len=1"
"10083","2016-09-24 23:27:27.479273","Physical_00:67:5e","Tp-LinkT_51:33:ea","ARP","60","192.168.1.196 is at d0:52:a8:00:67:5e"
"10095","2016-09-24 23:27:30.160532","192.168.1.196","54.210.202.2","TLSv1.2","123","Application Data"
"10098","2016-09-24 23:27:30.379134","192.168.1.196","54.210.202.2","TCP","60","2173  >  443 [ACK] Seq=2996 Ack=2899 Win=3072 Len=0"
"10132","2016-09-24 23:27:40.364640","192.168.1.196","54.210.202.2","TCP","60","[TCP Keep-Alive] 2173  >  443 [ACK] Seq=2995 Ack=2899 Win=3072 Len=1"
"10183","2016-09-24 23:27:50.566700","192.168.1.196","54.210.202.2","TCP","60","[TCP Keep-Alive] 2173  >  443 [ACK] Seq=2995 Ack=2899 Win=3072 Len=1"
"10207","2016-09-24 23:27:55.789229","Physical_00:67:5e","Tp-LinkT_51:33:ea","ARP","60","192.168.1.196 is at d0:52:a8:00:67:5e"
"10227","2016-09-24 23:28:00.768843","192.168.1.196","54.210.202.2","TCP","60","[TCP Keep-Alive] 2173  >  443 [ACK] Seq=2995 Ack=2899 Win=3072 Len=1"
"10245","2016-09-24 23:28:05.019891","192.168.1.196","54.210.202.2","TLSv1.2","139","Application Data"
"10248","2016-09-24 23:28:05.238154","192.168.1.196","54.210.202.2","TCP","60","2173  >  443 [ACK] Seq=3081 Ack=2968 Win=3072 Len=0"
"10293","2016-09-24 23:28:15.223623","192.168.1.196","54.210.202.2","TCP","60","[TCP Keep-Alive] 2173  >  443 [ACK] Seq=3080 Ack=2968 Win=3072 Len=1"
"10327","2016-09-24 23:28:20.449222","Physical_00:67:5e","Tp-LinkT_51:33:ea","ARP","60","192.168.1.196 is at d0:52:a8:00:67:5e"
"10350","2016-09-24 23:28:25.425415","192.168.1.196","54.210.202.2","TCP","60","[TCP Keep-Alive] 2173  >  443 [ACK] Seq=3080 Ack=2968 Win=3072 Len=1"
"10391","2016-09-24 23:28:35.627405","192.168.1.196","54.210.202.2","TCP","60","[TCP Keep-Alive] 2173  >  443 [ACK] Seq=3080 Ack=2968 Win=3072 Len=1"
"10484","2016-09-24 23:28:45.829514","192.168.1.196","54.210.202.2","TCP","60","[TCP Keep-Alive] 2173  >  443 [ACK] Seq=3080 Ack=2968 Win=3072 Len=1"
"10547","2016-09-24 23:28:51.049213","Physical_00:67:5e","Tp-LinkT_51:33:ea","ARP","60","192.168.1.196 is at d0:52:a8:00:67:5e"
"10574","2016-09-24 23:28:56.031507","192.168.1.196","54.210.202.2","TCP","60","[TCP Keep-Alive] 2173  >  443 [ACK] Seq=3080 Ack=2968 Win=3072 Len=1"
"10590","2016-09-24 23:29:00.578962","192.168.1.196","54.210.202.2","TLSv1.2","123","Application Data"
"10593","2016-09-24 23:29:00.797331","192.168.1.196","54.210.202.2","TCP","60","2173  >  443 [ACK] Seq=3150 Ack=3037 Win=3072 Len=0"
"10632","2016-09-24 23:29:10.782832","192.168.1.196","54.210.202.2","TCP","60","[TCP Keep-Alive] 2173  >  443 [ACK] Seq=3149 Ack=3037 Win=3072 Len=1"
"10682","2016-09-24 23:29:20.984941","192.168.1.196","54.210.202.2","TCP","60","[TCP Keep-Alive] 2173  >  443 [ACK] Seq=3149 Ack=3037 Win=3072 Len=1"
"10720","2016-09-24 23:29:30.124011","192.168.1.196","54.210.202.2","TLSv1.2","123","Application Data"
"10724","2016-09-24 23:29:30.342820","192.168.1.196","54.210.202.2","TCP","60","2173  >  443 [ACK] Seq=3219 Ack=3106 Win=3072 Len=0"
"10790","2016-09-24 23:29:40.328379","192.168.1.196","54.210.202.2","TCP","60","[TCP Keep-Alive] 2173  >  443 [ACK] Seq=3218 Ack=3106 Win=3072 Len=1"
"10813","2016-09-24 23:29:45.549255","Physical_00:67:5e","Tp-LinkT_51:33:ea","ARP","60","192.168.1.196 is at d0:52:a8:00:67:5e"
"10840","2016-09-24 23:29:50.530358","192.168.1.196","54.210.202.2","TCP","60","[TCP Keep-Alive] 2173  >  443 [ACK] Seq=3218 Ack=3106 Win=3072 Len=1"
