"No.","Time","Source","Destination","Protocol","Length","Info"
"17","2016-10-07 22:00:04.319458","192.168.1.196","52.1.40.122","TCP","60","[TCP segment of a reassembled PDU]"
"26","2016-10-07 22:00:06.321083","192.168.1.196","52.1.40.122","TLSv1.2","123","Application Data"
"32","2016-10-07 22:00:06.538848","192.168.1.196","52.1.40.122","TCP","60","2179  >  443 [ACK] Seq=71 Ack=70 Win=3072 Len=0"
"103","2016-10-07 22:00:16.524519","192.168.1.196","52.1.40.122","TCP","60","[TCP Keep-Alive] 2179  >  443 [ACK] Seq=70 Ack=70 Win=3072 Len=1"
"128","2016-10-07 22:00:26.726386","192.168.1.196","52.1.40.122","TCP","60","[TCP Keep-Alive] 2179  >  443 [ACK] Seq=70 Ack=70 Win=3072 Len=1"
"187","2016-10-07 22:00:31.949272","Physical_00:67:5e","Tp-LinkT_51:33:ea","ARP","60","192.168.1.196 is at d0:52:a8:00:67:5e"
"226","2016-10-07 22:00:36.928576","192.168.1.196","52.1.40.122","TCP","60","[TCP Keep-Alive] 2179  >  443 [ACK] Seq=70 Ack=70 Win=3072 Len=1"
"333","2016-10-07 22:00:47.130650","192.168.1.196","52.1.40.122","TCP","60","[TCP Keep-Alive] 2179  >  443 [ACK] Seq=70 Ack=70 Win=3072 Len=1"
"376","2016-10-07 22:00:57.333073","192.168.1.196","52.1.40.122","TCP","60","[TCP Keep-Alive] 2179  >  443 [ACK] Seq=70 Ack=70 Win=3072 Len=1"
"416","2016-10-07 22:01:05.239632","192.168.1.196","52.1.40.122","TLSv1.2","123","Application Data"
"420","2016-10-07 22:01:05.462841","192.168.1.196","52.1.40.122","TCP","60","2179  >  443 [ACK] Seq=140 Ack=139 Win=3072 Len=0"
"453","2016-10-07 22:01:10.459258","Physical_00:67:5e","Tp-LinkT_51:33:ea","ARP","60","192.168.1.196 is at d0:52:a8:00:67:5e"
"498","2016-10-07 22:01:15.448955","192.168.1.196","52.1.40.122","TCP","60","[TCP Keep-Alive] 2179  >  443 [ACK] Seq=139 Ack=139 Win=3072 Len=1"
"531","2016-10-07 22:01:23.813573","192.168.1.196","52.1.40.122","TLSv1.2","139","Application Data"
"535","2016-10-07 22:01:24.031311","192.168.1.196","52.1.40.122","TCP","60","2179  >  443 [ACK] Seq=225 Ack=208 Win=3072 Len=0"
"569","2016-10-07 22:01:34.017349","192.168.1.196","52.1.40.122","TCP","60","[TCP Keep-Alive] 2179  >  443 [ACK] Seq=224 Ack=208 Win=3072 Len=1"
"620","2016-10-07 22:01:44.219511","192.168.1.196","52.1.40.122","TCP","60","[TCP Keep-Alive] 2179  >  443 [ACK] Seq=224 Ack=208 Win=3072 Len=1"
"712","2016-10-07 22:01:49.439213","Physical_00:67:5e","Tp-LinkT_51:33:ea","ARP","60","192.168.1.196 is at d0:52:a8:00:67:5e"
"802","2016-10-07 22:01:54.421690","192.168.1.196","52.1.40.122","TCP","60","[TCP Keep-Alive] 2179  >  443 [ACK] Seq=224 Ack=208 Win=3072 Len=1"
"896","2016-10-07 22:02:03.028775","192.168.1.196","52.1.40.122","TLSv1.2","123","Application Data"
"899","2016-10-07 22:02:03.248520","192.168.1.196","52.1.40.122","TCP","60","2179  >  443 [ACK] Seq=294 Ack=277 Win=3072 Len=0"
"938","2016-10-07 22:02:13.234590","192.168.1.196","52.1.40.122","TCP","60","[TCP Keep-Alive] 2179  >  443 [ACK] Seq=293 Ack=277 Win=3072 Len=1"
"1071","2016-10-07 22:02:23.436645","192.168.1.196","52.1.40.122","TCP","60","[TCP Keep-Alive] 2179  >  443 [ACK] Seq=293 Ack=277 Win=3072 Len=1"
"1096","2016-10-07 22:02:28.659257","Physical_00:67:5e","Tp-LinkT_51:33:ea","ARP","60","192.168.1.196 is at d0:52:a8:00:67:5e"
"1119","2016-10-07 22:02:33.639040","192.168.1.196","52.1.40.122","TCP","60","[TCP Keep-Alive] 2179  >  443 [ACK] Seq=293 Ack=277 Win=3072 Len=1"
"1196","2016-10-07 22:02:43.841415","192.168.1.196","52.1.40.122","TCP","60","[TCP Keep-Alive] 2179  >  443 [ACK] Seq=293 Ack=277 Win=3072 Len=1"
"1259","2016-10-07 22:02:54.043551","192.168.1.196","52.1.40.122","TCP","60","[TCP Keep-Alive] 2179  >  443 [ACK] Seq=293 Ack=277 Win=3072 Len=1"
"1354","2016-10-07 22:03:01.947786","192.168.1.196","52.1.40.122","TLSv1.2","123","Application Data"
"1357","2016-10-07 22:03:02.164864","192.168.1.196","52.1.40.122","TCP","60","2179  >  443 [ACK] Seq=363 Ack=346 Win=3072 Len=0"
"1389","2016-10-07 22:03:07.169280","Physical_00:67:5e","Tp-LinkT_51:33:ea","ARP","60","192.168.1.196 is at d0:52:a8:00:67:5e"
"1425","2016-10-07 22:03:12.150887","192.168.1.196","52.1.40.122","TCP","60","[TCP Keep-Alive] 2179  >  443 [ACK] Seq=362 Ack=346 Win=3072 Len=1"
"1483","2016-10-07 22:03:22.352973","192.168.1.196","52.1.40.122","TCP","60","[TCP Keep-Alive] 2179  >  443 [ACK] Seq=362 Ack=346 Win=3072 Len=1"
"1518","2016-10-07 22:03:32.555108","192.168.1.196","52.1.40.122","TCP","60","[TCP Keep-Alive] 2179  >  443 [ACK] Seq=362 Ack=346 Win=3072 Len=1"
"1557","2016-10-07 22:03:42.757056","192.168.1.196","52.1.40.122","TCP","60","[TCP Keep-Alive] 2179  >  443 [ACK] Seq=362 Ack=346 Win=3072 Len=1"
"1606","2016-10-07 22:03:47.979229","Physical_00:67:5e","Tp-LinkT_51:33:ea","ARP","60","192.168.1.196 is at d0:52:a8:00:67:5e"
"1639","2016-10-07 22:03:52.959090","192.168.1.196","52.1.40.122","TCP","60","[TCP Keep-Alive] 2179  >  443 [ACK] Seq=362 Ack=346 Win=3072 Len=1"
"1653","2016-10-07 22:04:00.865113","192.168.1.196","52.1.40.122","TLSv1.2","123","Application Data"
"1656","2016-10-07 22:04:01.083552","192.168.1.196","52.1.40.122","TCP","60","2179  >  443 [ACK] Seq=432 Ack=415 Win=3072 Len=0"
"1695","2016-10-07 22:04:11.069301","192.168.1.196","52.1.40.122","TCP","60","[TCP Keep-Alive] 2179  >  443 [ACK] Seq=431 Ack=415 Win=3072 Len=1"
"1754","2016-10-07 22:04:21.271881","192.168.1.196","52.1.40.122","TCP","60","[TCP Keep-Alive] 2179  >  443 [ACK] Seq=431 Ack=415 Win=3072 Len=1"
"1811","2016-10-07 22:04:31.474288","192.168.1.196","52.1.40.122","TCP","60","[TCP Keep-Alive] 2179  >  443 [ACK] Seq=431 Ack=415 Win=3072 Len=1"
"1834","2016-10-07 22:04:32.343618","192.168.1.196","52.1.40.122","TLSv1.2","123","Application Data"
"1844","2016-10-07 22:04:32.578556","192.168.1.196","52.1.40.122","TCP","60","2179  >  443 [ACK] Seq=501 Ack=484 Win=3072 Len=0"
"1887","2016-10-07 22:04:36.699271","Physical_00:67:5e","Tp-LinkT_51:33:ea","ARP","60","192.168.1.196 is at d0:52:a8:00:67:5e"
"1911","2016-10-07 22:04:42.564492","192.168.1.196","52.1.40.122","TCP","60","[TCP Keep-Alive] 2179  >  443 [ACK] Seq=500 Ack=484 Win=3072 Len=1"
"1980","2016-10-07 22:04:52.766673","192.168.1.196","52.1.40.122","TCP","60","[TCP Keep-Alive] 2179  >  443 [ACK] Seq=500 Ack=484 Win=3072 Len=1"
"2008","2016-10-07 22:05:02.969158","192.168.1.196","52.1.40.122","TCP","60","[TCP Keep-Alive] 2179  >  443 [ACK] Seq=500 Ack=484 Win=3072 Len=1"
"2108","2016-10-07 22:05:07.183120","192.168.1.196","52.1.40.122","TLSv1.2","123","Application Data"
"2112","2016-10-07 22:05:07.400829","192.168.1.196","52.1.40.122","TCP","60","2179  >  443 [ACK] Seq=570 Ack=553 Win=3072 Len=0"
"2164","2016-10-07 22:05:17.386815","192.168.1.196","52.1.40.122","TCP","60","[TCP Keep-Alive] 2179  >  443 [ACK] Seq=569 Ack=553 Win=3072 Len=1"
"2196","2016-10-07 22:05:22.609256","Physical_00:67:5e","Tp-LinkT_51:33:ea","ARP","60","192.168.1.196 is at d0:52:a8:00:67:5e"
"2200","2016-10-07 22:05:24.484541","192.168.1.196","52.1.40.122","TLSv1.2","139","Application Data"
"2203","2016-10-07 22:05:24.702165","192.168.1.196","52.1.40.122","TCP","60","2179  >  443 [ACK] Seq=655 Ack=622 Win=3072 Len=0"
"2245","2016-10-07 22:05:34.688205","192.168.1.196","52.1.40.122","TCP","60","[TCP Keep-Alive] 2179  >  443 [ACK] Seq=654 Ack=622 Win=3072 Len=1"
"2291","2016-10-07 22:05:44.890411","192.168.1.196","52.1.40.122","TCP","60","[TCP Keep-Alive] 2179  >  443 [ACK] Seq=654 Ack=622 Win=3072 Len=1"
"2382","2016-10-07 22:05:55.092531","192.168.1.196","52.1.40.122","TCP","60","[TCP Keep-Alive] 2179  >  443 [ACK] Seq=654 Ack=622 Win=3072 Len=1"
"2426","2016-10-07 22:06:05.294527","192.168.1.196","52.1.40.122","TCP","60","[TCP Keep-Alive] 2179  >  443 [ACK] Seq=654 Ack=622 Win=3072 Len=1"
"2454","2016-10-07 22:06:10.519232","Physical_00:67:5e","Tp-LinkT_51:33:ea","ARP","60","192.168.1.196 is at d0:52:a8:00:67:5e"
"2472","2016-10-07 22:06:15.496521","192.168.1.196","52.1.40.122","TCP","60","[TCP Keep-Alive] 2179  >  443 [ACK] Seq=654 Ack=622 Win=3072 Len=1"
"2522","2016-10-07 22:06:23.403165","192.168.1.196","52.1.40.122","TLSv1.2","123","Application Data"
"2525","2016-10-07 22:06:23.620719","192.168.1.196","52.1.40.122","TCP","60","2179  >  443 [ACK] Seq=724 Ack=691 Win=3072 Len=0"
"2588","2016-10-07 22:06:33.606543","192.168.1.196","52.1.40.122","TCP","60","[TCP Keep-Alive] 2179  >  443 [ACK] Seq=723 Ack=691 Win=3072 Len=1"
"2649","2016-10-07 22:06:43.808646","192.168.1.196","52.1.40.122","TCP","60","[TCP Keep-Alive] 2179  >  443 [ACK] Seq=723 Ack=691 Win=3072 Len=1"
"2719","2016-10-07 22:06:54.011085","192.168.1.196","52.1.40.122","TCP","60","[TCP Keep-Alive] 2179  >  443 [ACK] Seq=723 Ack=691 Win=3072 Len=1"
"2742","2016-10-07 22:06:59.229276","Physical_00:67:5e","Tp-LinkT_51:33:ea","ARP","60","192.168.1.196 is at d0:52:a8:00:67:5e"
"2750","2016-10-07 22:07:01.656830","192.168.1.196","52.1.40.122","TLSv1.2","123","Application Data"
"2753","2016-10-07 22:07:01.875426","192.168.1.196","52.1.40.122","TCP","60","2179  >  443 [ACK] Seq=793 Ack=760 Win=3072 Len=0"
"2795","2016-10-07 22:07:11.861388","192.168.1.196","52.1.40.122","TCP","60","[TCP Keep-Alive] 2179  >  443 [ACK] Seq=792 Ack=760 Win=3072 Len=1"
"2798","2016-10-07 22:07:12.229039","Physical_00:67:5e","Broadcast","ARP","60","Who has 192.168.1.1? Tell 192.168.1.196"
"2800","2016-10-07 22:07:12.229097","192.168.1.196","192.168.1.1","DNS","72","Standard query 0x0833 A pool.ntp.org"
"2802","2016-10-07 22:07:12.233800","Physical_00:67:5e","Broadcast","ARP","60","Who has 192.168.1.1? Tell 192.168.1.196"
"2804","2016-10-07 22:07:12.233946","192.168.1.196","204.2.134.163","NTP","90","NTP Version 3, client"
"2876","2016-10-07 22:07:22.063776","192.168.1.196","52.1.40.122","TCP","60","[TCP Keep-Alive] 2179  >  443 [ACK] Seq=792 Ack=760 Win=3072 Len=1"
"2929","2016-10-07 22:07:32.265858","192.168.1.196","52.1.40.122","TCP","60","[TCP Keep-Alive] 2179  >  443 [ACK] Seq=792 Ack=760 Win=3072 Len=1"
"3110","2016-10-07 22:07:42.468085","192.168.1.196","52.1.40.122","TCP","60","[TCP Keep-Alive] 2179  >  443 [ACK] Seq=792 Ack=760 Win=3072 Len=1"
"3151","2016-10-07 22:07:47.689252","Physical_00:67:5e","Tp-LinkT_51:33:ea","ARP","60","192.168.1.196 is at d0:52:a8:00:67:5e"
"3177","2016-10-07 22:07:52.670359","192.168.1.196","52.1.40.122","TCP","60","[TCP Keep-Alive] 2179  >  443 [ACK] Seq=792 Ack=760 Win=3072 Len=1"
"3297","2016-10-07 22:08:00.576013","192.168.1.196","52.1.40.122","TLSv1.2","123","Application Data"
"3301","2016-10-07 22:08:00.793300","192.168.1.196","52.1.40.122","TCP","60","2179  >  443 [ACK] Seq=862 Ack=829 Win=3072 Len=0"
"3337","2016-10-07 22:08:10.779264","192.168.1.196","52.1.40.122","TCP","60","[TCP Keep-Alive] 2179  >  443 [ACK] Seq=861 Ack=829 Win=3072 Len=1"
"3385","2016-10-07 22:08:20.981652","192.168.1.196","52.1.40.122","TCP","60","[TCP Keep-Alive] 2179  >  443 [ACK] Seq=861 Ack=829 Win=3072 Len=1"
"3437","2016-10-07 22:08:31.184104","192.168.1.196","52.1.40.122","TCP","60","[TCP Keep-Alive] 2179  >  443 [ACK] Seq=861 Ack=829 Win=3072 Len=1"
"3477","2016-10-07 22:08:36.409273","Physical_00:67:5e","Tp-LinkT_51:33:ea","ARP","60","192.168.1.196 is at d0:52:a8:00:67:5e"
"3492","2016-10-07 22:08:41.386329","192.168.1.196","52.1.40.122","TCP","60","[TCP Keep-Alive] 2179  >  443 [ACK] Seq=861 Ack=829 Win=3072 Len=1"
"3555","2016-10-07 22:08:51.588382","192.168.1.196","52.1.40.122","TCP","60","[TCP Keep-Alive] 2179  >  443 [ACK] Seq=861 Ack=829 Win=3072 Len=1"
"3587","2016-10-07 22:08:59.494398","192.168.1.196","52.1.40.122","TLSv1.2","123","Application Data"
"3591","2016-10-07 22:08:59.711473","192.168.1.196","52.1.40.122","TCP","60","2179  >  443 [ACK] Seq=931 Ack=898 Win=3072 Len=0"
"3652","2016-10-07 22:09:09.697372","192.168.1.196","52.1.40.122","TCP","60","[TCP Keep-Alive] 2179  >  443 [ACK] Seq=930 Ack=898 Win=3072 Len=1"
"3687","2016-10-07 22:09:14.919252","Physical_00:67:5e","Tp-LinkT_51:33:ea","ARP","60","192.168.1.196 is at d0:52:a8:00:67:5e"
"3725","2016-10-07 22:09:19.899522","192.168.1.196","52.1.40.122","TCP","60","[TCP Keep-Alive] 2179  >  443 [ACK] Seq=930 Ack=898 Win=3072 Len=1"
"4039","2016-10-07 22:09:25.145506","192.168.1.196","52.1.40.122","TLSv1.2","139","Application Data"
"4045","2016-10-07 22:09:25.363240","192.168.1.196","52.1.40.122","TCP","60","2179  >  443 [ACK] Seq=1016 Ack=967 Win=3072 Len=0"
"4111","2016-10-07 22:09:30.968495","192.168.1.196","52.1.40.122","TLSv1.2","123","Application Data"
"4118","2016-10-07 22:09:31.187728","192.168.1.196","52.1.40.122","TCP","60","2179  >  443 [ACK] Seq=1085 Ack=1036 Win=3072 Len=0"
"4206","2016-10-07 22:09:41.173267","192.168.1.196","52.1.40.122","TCP","60","[TCP Keep-Alive] 2179  >  443 [ACK] Seq=1084 Ack=1036 Win=3072 Len=1"
"4267","2016-10-07 22:09:51.375303","192.168.1.196","52.1.40.122","TCP","60","[TCP Keep-Alive] 2179  >  443 [ACK] Seq=1084 Ack=1036 Win=3072 Len=1"
"4287","2016-10-07 22:09:56.599285","Physical_00:67:5e","Tp-LinkT_51:33:ea","ARP","60","192.168.1.196 is at d0:52:a8:00:67:5e"
"4302","2016-10-07 22:10:01.577430","192.168.1.196","52.1.40.122","TCP","60","[TCP Keep-Alive] 2179  >  443 [ACK] Seq=1084 Ack=1036 Win=3072 Len=1"
"4415","2016-10-07 22:10:08.053138","192.168.1.196","52.1.40.122","TLSv1.2","123","Application Data"
"4420","2016-10-07 22:10:08.271372","192.168.1.196","52.1.40.122","TCP","60","2179  >  443 [ACK] Seq=1154 Ack=1105 Win=3072 Len=0"
"4474","2016-10-07 22:10:18.257236","192.168.1.196","52.1.40.122","TCP","60","[TCP Keep-Alive] 2179  >  443 [ACK] Seq=1153 Ack=1105 Win=3072 Len=1"
"4524","2016-10-07 22:10:28.459308","192.168.1.196","52.1.40.122","TCP","60","[TCP Keep-Alive] 2179  >  443 [ACK] Seq=1153 Ack=1105 Win=3072 Len=1"
"4546","2016-10-07 22:10:33.679248","Physical_00:67:5e","Tp-LinkT_51:33:ea","ARP","60","192.168.1.196 is at d0:52:a8:00:67:5e"
"4568","2016-10-07 22:10:38.661840","192.168.1.196","52.1.40.122","TCP","60","[TCP Keep-Alive] 2179  >  443 [ACK] Seq=1153 Ack=1105 Win=3072 Len=1"
"4630","2016-10-07 22:10:48.864001","192.168.1.196","52.1.40.122","TCP","60","[TCP Keep-Alive] 2179  >  443 [ACK] Seq=1153 Ack=1105 Win=3072 Len=1"
"4671","2016-10-07 22:10:59.066521","192.168.1.196","52.1.40.122","TCP","60","[TCP Keep-Alive] 2179  >  443 [ACK] Seq=1153 Ack=1105 Win=3072 Len=1"
"4710","2016-10-07 22:11:06.972530","192.168.1.196","52.1.40.122","TLSv1.2","123","Application Data"
"4715","2016-10-07 22:11:07.189814","192.168.1.196","52.1.40.122","TCP","60","2179  >  443 [ACK] Seq=1223 Ack=1174 Win=3072 Len=0"
"4744","2016-10-07 22:11:12.189275","Physical_00:67:5e","Tp-LinkT_51:33:ea","ARP","60","192.168.1.196 is at d0:52:a8:00:67:5e"
"4771","2016-10-07 22:11:17.176173","192.168.1.196","52.1.40.122","TCP","60","[TCP Keep-Alive] 2179  >  443 [ACK] Seq=1222 Ack=1174 Win=3072 Len=1"
"4801","2016-10-07 22:11:27.378729","192.168.1.196","52.1.40.122","TCP","60","[TCP Keep-Alive] 2179  >  443 [ACK] Seq=1222 Ack=1174 Win=3072 Len=1"
"4861","2016-10-07 22:11:37.581186","192.168.1.196","52.1.40.122","TCP","60","[TCP Keep-Alive] 2179  >  443 [ACK] Seq=1222 Ack=1174 Win=3072 Len=1"
"4945","2016-10-07 22:11:47.783581","192.168.1.196","52.1.40.122","TCP","60","[TCP Keep-Alive] 2179  >  443 [ACK] Seq=1222 Ack=1174 Win=3072 Len=1"
"4985","2016-10-07 22:11:53.009212","Physical_00:67:5e","Tp-LinkT_51:33:ea","ARP","60","192.168.1.196 is at d0:52:a8:00:67:5e"
"4997","2016-10-07 22:11:57.986031","192.168.1.196","52.1.40.122","TCP","60","[TCP Keep-Alive] 2179  >  443 [ACK] Seq=1222 Ack=1174 Win=3072 Len=1"
"5006","2016-10-07 22:12:00.286088","192.168.1.196","52.1.40.122","TLSv1.2","123","Application Data"
"5009","2016-10-07 22:12:00.504334","192.168.1.196","52.1.40.122","TCP","60","2179  >  443 [ACK] Seq=1292 Ack=1243 Win=3072 Len=0"
"5057","2016-10-07 22:12:10.490334","192.168.1.196","52.1.40.122","TCP","60","[TCP Keep-Alive] 2179  >  443 [ACK] Seq=1291 Ack=1243 Win=3072 Len=1"
"5203","2016-10-07 22:12:20.692810","192.168.1.196","52.1.40.122","TCP","60","[TCP Keep-Alive] 2179  >  443 [ACK] Seq=1291 Ack=1243 Win=3072 Len=1"
"5239","2016-10-07 22:12:30.895165","192.168.1.196","52.1.40.122","TCP","60","[TCP Keep-Alive] 2179  >  443 [ACK] Seq=1291 Ack=1243 Win=3072 Len=1"
"5260","2016-10-07 22:12:36.119230","Physical_00:67:5e","Tp-LinkT_51:33:ea","ARP","60","192.168.1.196 is at d0:52:a8:00:67:5e"
"5310","2016-10-07 22:12:41.097619","192.168.1.196","52.1.40.122","TCP","60","[TCP Keep-Alive] 2179  >  443 [ACK] Seq=1291 Ack=1243 Win=3072 Len=1"
"5383","2016-10-07 22:12:51.300077","192.168.1.196","52.1.40.122","TCP","60","[TCP Keep-Alive] 2179  >  443 [ACK] Seq=1291 Ack=1243 Win=3072 Len=1"
"5487","2016-10-07 22:12:59.206026","192.168.1.196","52.1.40.122","TLSv1.2","123","Application Data"
"5490","2016-10-07 22:12:59.423244","192.168.1.196","52.1.40.122","TCP","60","2179  >  443 [ACK] Seq=1361 Ack=1312 Win=3072 Len=0"
"5529","2016-10-07 22:13:09.409418","192.168.1.196","52.1.40.122","TCP","60","[TCP Keep-Alive] 2179  >  443 [ACK] Seq=1360 Ack=1312 Win=3072 Len=1"
"5550","2016-10-07 22:13:14.629244","Physical_00:67:5e","Tp-LinkT_51:33:ea","ARP","60","192.168.1.196 is at d0:52:a8:00:67:5e"
"5579","2016-10-07 22:13:19.611835","192.168.1.196","52.1.40.122","TCP","60","[TCP Keep-Alive] 2179  >  443 [ACK] Seq=1360 Ack=1312 Win=3072 Len=1"
"5606","2016-10-07 22:13:25.819188","192.168.1.196","52.1.40.122","TLSv1.2","139","Application Data"
"5609","2016-10-07 22:13:26.036716","192.168.1.196","52.1.40.122","TCP","60","2179  >  443 [ACK] Seq=1446 Ack=1381 Win=3072 Len=0"
"5661","2016-10-07 22:13:36.022916","192.168.1.196","52.1.40.122","TCP","60","[TCP Keep-Alive] 2179  >  443 [ACK] Seq=1445 Ack=1381 Win=3072 Len=1"
"5720","2016-10-07 22:13:46.225273","192.168.1.196","52.1.40.122","TCP","60","[TCP Keep-Alive] 2179  >  443 [ACK] Seq=1445 Ack=1381 Win=3072 Len=1"
"5763","2016-10-07 22:13:51.449228","Physical_00:67:5e","Tp-LinkT_51:33:ea","ARP","60","192.168.1.196 is at d0:52:a8:00:67:5e"
"5842","2016-10-07 22:13:56.427682","192.168.1.196","52.1.40.122","TCP","60","[TCP Keep-Alive] 2179  >  443 [ACK] Seq=1445 Ack=1381 Win=3072 Len=1"
"5904","2016-10-07 22:14:06.630013","192.168.1.196","52.1.40.122","TCP","60","[TCP Keep-Alive] 2179  >  443 [ACK] Seq=1445 Ack=1381 Win=3072 Len=1"
"5965","2016-10-07 22:14:16.832166","192.168.1.196","52.1.40.122","TCP","60","[TCP Keep-Alive] 2179  >  443 [ACK] Seq=1445 Ack=1381 Win=3072 Len=1"
"6004","2016-10-07 22:14:24.738640","192.168.1.196","52.1.40.122","TLSv1.2","123","Application Data"
"6007","2016-10-07 22:14:24.955922","192.168.1.196","52.1.40.122","TCP","60","2179  >  443 [ACK] Seq=1515 Ack=1450 Win=3072 Len=0"
"6034","2016-10-07 22:14:29.592222","192.168.1.196","52.1.40.122","TLSv1.2","123","Application Data"
"6037","2016-10-07 22:14:29.810165","192.168.1.196","52.1.40.122","TCP","60","2179  >  443 [ACK] Seq=1584 Ack=1519 Win=3072 Len=0"
"6039","2016-10-07 22:14:29.959225","Physical_00:67:5e","Tp-LinkT_51:33:ea","ARP","60","192.168.1.196 is at d0:52:a8:00:67:5e"
"6082","2016-10-07 22:14:39.796103","192.168.1.196","52.1.40.122","TCP","60","[TCP Keep-Alive] 2179  >  443 [ACK] Seq=1583 Ack=1519 Win=3072 Len=1"
"6149","2016-10-07 22:14:49.998435","192.168.1.196","52.1.40.122","TCP","60","[TCP Keep-Alive] 2179  >  443 [ACK] Seq=1583 Ack=1519 Win=3072 Len=1"
"6214","2016-10-07 22:15:00.200825","192.168.1.196","52.1.40.122","TCP","60","[TCP Keep-Alive] 2179  >  443 [ACK] Seq=1583 Ack=1519 Win=3072 Len=1"
"6335","2016-10-07 22:15:05.419262","Physical_00:67:5e","Tp-LinkT_51:33:ea","ARP","60","192.168.1.196 is at d0:52:a8:00:67:5e"
"6350","2016-10-07 22:15:08.909845","192.168.1.196","52.1.40.122","TLSv1.2","123","Application Data"
"6354","2016-10-07 22:15:09.127583","192.168.1.196","52.1.40.122","TCP","60","2179  >  443 [ACK] Seq=1653 Ack=1588 Win=3072 Len=0"
"6399","2016-10-07 22:15:19.113446","192.168.1.196","52.1.40.122","TCP","60","[TCP Keep-Alive] 2179  >  443 [ACK] Seq=1652 Ack=1588 Win=3072 Len=1"
"6429","2016-10-07 22:15:29.315808","192.168.1.196","52.1.40.122","TCP","60","[TCP Keep-Alive] 2179  >  443 [ACK] Seq=1652 Ack=1588 Win=3072 Len=1"
"6481","2016-10-07 22:15:39.518109","192.168.1.196","52.1.40.122","TCP","60","[TCP Keep-Alive] 2179  >  443 [ACK] Seq=1652 Ack=1588 Win=3072 Len=1"
"6509","2016-10-07 22:15:44.739260","Physical_00:67:5e","Tp-LinkT_51:33:ea","ARP","60","192.168.1.196 is at d0:52:a8:00:67:5e"
"6547","2016-10-07 22:15:49.720489","192.168.1.196","52.1.40.122","TCP","60","[TCP Keep-Alive] 2179  >  443 [ACK] Seq=1652 Ack=1588 Win=3072 Len=1"
"6595","2016-10-07 22:15:59.922729","192.168.1.196","52.1.40.122","TCP","60","[TCP Keep-Alive] 2179  >  443 [ACK] Seq=1652 Ack=1588 Win=3072 Len=1"
"6638","2016-10-07 22:16:07.830175","192.168.1.196","52.1.40.122","TLSv1.2","123","Application Data"
"6642","2016-10-07 22:16:08.047393","192.168.1.196","52.1.40.122","TCP","60","2179  >  443 [ACK] Seq=1722 Ack=1657 Win=3072 Len=0"
"6718","2016-10-07 22:16:18.033614","192.168.1.196","52.1.40.122","TCP","60","[TCP Keep-Alive] 2179  >  443 [ACK] Seq=1721 Ack=1657 Win=3072 Len=1"
"6755","2016-10-07 22:16:23.259245","Physical_00:67:5e","Tp-LinkT_51:33:ea","ARP","60","192.168.1.196 is at d0:52:a8:00:67:5e"
"6770","2016-10-07 22:16:28.236142","192.168.1.196","52.1.40.122","TCP","60","[TCP Keep-Alive] 2179  >  443 [ACK] Seq=1721 Ack=1657 Win=3072 Len=1"
"6810","2016-10-07 22:16:38.438467","192.168.1.196","52.1.40.122","TCP","60","[TCP Keep-Alive] 2179  >  443 [ACK] Seq=1721 Ack=1657 Win=3072 Len=1"
"6857","2016-10-07 22:16:48.640708","192.168.1.196","52.1.40.122","TCP","60","[TCP Keep-Alive] 2179  >  443 [ACK] Seq=1721 Ack=1657 Win=3072 Len=1"
"6923","2016-10-07 22:16:58.842962","192.168.1.196","52.1.40.122","TCP","60","[TCP Keep-Alive] 2179  >  443 [ACK] Seq=1721 Ack=1657 Win=3072 Len=1"
"6924","2016-10-07 22:16:58.898780","192.168.1.196","52.1.40.122","TLSv1.2","123","Application Data"
"6928","2016-10-07 22:16:59.116603","192.168.1.196","52.1.40.122","TCP","60","2179  >  443 [ACK] Seq=1791 Ack=1726 Win=3072 Len=0"
"6955","2016-10-07 22:17:04.059242","Physical_00:67:5e","Tp-LinkT_51:33:ea","ARP","60","192.168.1.196 is at d0:52:a8:00:67:5e"
"7015","2016-10-07 22:17:09.102641","192.168.1.196","52.1.40.122","TCP","60","[TCP Keep-Alive] 2179  >  443 [ACK] Seq=1790 Ack=1726 Win=3072 Len=1"
"7042","2016-10-07 22:17:11.610295","Physical_00:67:5e","Broadcast","ARP","60","Who has 192.168.1.1? Tell 192.168.1.196"
"7044","2016-10-07 22:17:11.610355","192.168.1.196","192.168.1.1","DNS","72","Standard query 0x0834 A pool.ntp.org"
"7046","2016-10-07 22:17:11.615263","Physical_00:67:5e","Broadcast","ARP","60","Who has 192.168.1.1? Tell 192.168.1.196"
"7048","2016-10-07 22:17:11.615408","192.168.1.196","202.127.210.36","NTP","90","NTP Version 3, client"
"7093","2016-10-07 22:17:19.305002","192.168.1.196","52.1.40.122","TCP","60","[TCP Keep-Alive] 2179  >  443 [ACK] Seq=1790 Ack=1726 Win=3072 Len=1"
"7123","2016-10-07 22:17:26.485166","192.168.1.196","52.1.40.122","TLSv1.2","139","Application Data"
"7126","2016-10-07 22:17:26.702719","192.168.1.196","52.1.40.122","TCP","60","2179  >  443 [ACK] Seq=1876 Ack=1795 Win=3072 Len=0"
"7175","2016-10-07 22:17:36.688802","192.168.1.196","52.1.40.122","TCP","60","[TCP Keep-Alive] 2179  >  443 [ACK] Seq=1875 Ack=1795 Win=3072 Len=1"
"7213","2016-10-07 22:17:41.909285","Physical_00:67:5e","Tp-LinkT_51:33:ea","ARP","60","192.168.1.196 is at d0:52:a8:00:67:5e"
"7328","2016-10-07 22:17:46.891209","192.168.1.196","52.1.40.122","TCP","60","[TCP Keep-Alive] 2179  >  443 [ACK] Seq=1875 Ack=1795 Win=3072 Len=1"
"7375","2016-10-07 22:17:57.093536","192.168.1.196","52.1.40.122","TCP","60","[TCP Keep-Alive] 2179  >  443 [ACK] Seq=1875 Ack=1795 Win=3072 Len=1"
"7498","2016-10-07 22:18:07.295819","192.168.1.196","52.1.40.122","TCP","60","[TCP Keep-Alive] 2179  >  443 [ACK] Seq=1875 Ack=1795 Win=3072 Len=1"
"7544","2016-10-07 22:18:17.498255","192.168.1.196","52.1.40.122","TCP","60","[TCP Keep-Alive] 2179  >  443 [ACK] Seq=1875 Ack=1795 Win=3072 Len=1"
"7572","2016-10-07 22:18:22.719264","Physical_00:67:5e","Tp-LinkT_51:33:ea","ARP","60","192.168.1.196 is at d0:52:a8:00:67:5e"
"7586","2016-10-07 22:18:25.405268","192.168.1.196","52.1.40.122","TLSv1.2","123","Application Data"
"7589","2016-10-07 22:18:25.622285","192.168.1.196","52.1.40.122","TCP","60","2179  >  443 [ACK] Seq=1945 Ack=1864 Win=3072 Len=0"
"7643","2016-10-07 22:18:35.608312","192.168.1.196","52.1.40.122","TCP","60","[TCP Keep-Alive] 2179  >  443 [ACK] Seq=1944 Ack=1864 Win=3072 Len=1"
"7688","2016-10-07 22:18:45.810784","192.168.1.196","52.1.40.122","TCP","60","[TCP Keep-Alive] 2179  >  443 [ACK] Seq=1944 Ack=1864 Win=3072 Len=1"
"7753","2016-10-07 22:18:56.013430","192.168.1.196","52.1.40.122","TCP","60","[TCP Keep-Alive] 2179  >  443 [ACK] Seq=1944 Ack=1864 Win=3072 Len=1"
"7797","2016-10-07 22:19:06.215894","192.168.1.196","52.1.40.122","TCP","60","[TCP Keep-Alive] 2179  >  443 [ACK] Seq=1944 Ack=1864 Win=3072 Len=1"
"7826","2016-10-07 22:19:11.439242","Physical_00:67:5e","Tp-LinkT_51:33:ea","ARP","60","192.168.1.196 is at d0:52:a8:00:67:5e"
"7857","2016-10-07 22:19:16.418445","192.168.1.196","52.1.40.122","TCP","60","[TCP Keep-Alive] 2179  >  443 [ACK] Seq=1944 Ack=1864 Win=3072 Len=1"
"7886","2016-10-07 22:19:24.325767","192.168.1.196","52.1.40.122","TLSv1.2","123","Application Data"
"7890","2016-10-07 22:19:24.543058","192.168.1.196","52.1.40.122","TCP","60","2179  >  443 [ACK] Seq=2014 Ack=1933 Win=3072 Len=0"
"7906","2016-10-07 22:19:28.209374","192.168.1.196","52.1.40.122","TLSv1.2","123","Application Data"
"7909","2016-10-07 22:19:28.426969","192.168.1.196","52.1.40.122","TCP","60","2179  >  443 [ACK] Seq=2083 Ack=2002 Win=3072 Len=0"
"7965","2016-10-07 22:19:38.413384","192.168.1.196","52.1.40.122","TCP","60","[TCP Keep-Alive] 2179  >  443 [ACK] Seq=2082 Ack=2002 Win=3072 Len=1"
"8015","2016-10-07 22:19:48.615993","192.168.1.196","52.1.40.122","TCP","60","[TCP Keep-Alive] 2179  >  443 [ACK] Seq=2082 Ack=2002 Win=3072 Len=1"
"8052","2016-10-07 22:19:53.839251","Physical_00:67:5e","Tp-LinkT_51:33:ea","ARP","60","192.168.1.196 is at d0:52:a8:00:67:5e"
"8080","2016-10-07 22:19:58.818403","192.168.1.196","52.1.40.122","TCP","60","[TCP Keep-Alive] 2179  >  443 [ACK] Seq=2082 Ack=2002 Win=3072 Len=1"
"8119","2016-10-07 22:20:09.020746","192.168.1.196","52.1.40.122","TCP","60","[TCP Keep-Alive] 2179  >  443 [ACK] Seq=2082 Ack=2002 Win=3072 Len=1"
"8126","2016-10-07 22:20:09.809504","192.168.1.196","52.1.40.122","TLSv1.2","123","Application Data"
"8130","2016-10-07 22:20:10.027144","192.168.1.196","52.1.40.122","TCP","60","2179  >  443 [ACK] Seq=2152 Ack=2071 Win=3072 Len=0"
"8182","2016-10-07 22:20:20.013408","192.168.1.196","52.1.40.122","TCP","60","[TCP Keep-Alive] 2179  >  443 [ACK] Seq=2151 Ack=2071 Win=3072 Len=1"
"8301","2016-10-07 22:20:30.216047","192.168.1.196","52.1.40.122","TCP","60","[TCP Keep-Alive] 2179  >  443 [ACK] Seq=2151 Ack=2071 Win=3072 Len=1"
"8345","2016-10-07 22:20:40.418590","192.168.1.196","52.1.40.122","TCP","60","[TCP Keep-Alive] 2179  >  443 [ACK] Seq=2151 Ack=2071 Win=3072 Len=1"
"8367","2016-10-07 22:20:45.639225","Physical_00:67:5e","Tp-LinkT_51:33:ea","ARP","60","192.168.1.196 is at d0:52:a8:00:67:5e"
"8418","2016-10-07 22:20:50.621318","192.168.1.196","52.1.40.122","TCP","60","[TCP Keep-Alive] 2179  >  443 [ACK] Seq=2151 Ack=2071 Win=3072 Len=1"
"8486","2016-10-07 22:21:00.824118","192.168.1.196","52.1.40.122","TCP","60","[TCP Keep-Alive] 2179  >  443 [ACK] Seq=2151 Ack=2071 Win=3072 Len=1"
"8528","2016-10-07 22:21:08.731214","192.168.1.196","52.1.40.122","TLSv1.2","123","Application Data"
"8531","2016-10-07 22:21:08.948233","192.168.1.196","52.1.40.122","TCP","60","2179  >  443 [ACK] Seq=2221 Ack=2140 Win=3072 Len=0"
"8583","2016-10-07 22:21:18.934514","192.168.1.196","52.1.40.122","TCP","60","[TCP Keep-Alive] 2179  >  443 [ACK] Seq=2220 Ack=2140 Win=3072 Len=1"
"8605","2016-10-07 22:21:27.164702","192.168.1.196","52.1.40.122","TLSv1.2","139","Application Data"
"8608","2016-10-07 22:21:27.384310","192.168.1.196","52.1.40.122","TCP","60","2179  >  443 [ACK] Seq=2306 Ack=2209 Win=3072 Len=0"
"8641","2016-10-07 22:21:32.389223","Physical_00:67:5e","Tp-LinkT_51:33:ea","ARP","60","192.168.1.196 is at d0:52:a8:00:67:5e"
"8666","2016-10-07 22:21:37.370648","192.168.1.196","52.1.40.122","TCP","60","[TCP Keep-Alive] 2179  >  443 [ACK] Seq=2305 Ack=2209 Win=3072 Len=1"
"8719","2016-10-07 22:21:47.573172","192.168.1.196","52.1.40.122","TCP","60","[TCP Keep-Alive] 2179  >  443 [ACK] Seq=2305 Ack=2209 Win=3072 Len=1"
"8780","2016-10-07 22:21:57.518805","192.168.1.196","52.1.40.122","TLSv1.2","123","Application Data"
"8785","2016-10-07 22:21:57.736408","192.168.1.196","52.1.40.122","TCP","60","2179  >  443 [ACK] Seq=2375 Ack=2278 Win=3072 Len=0"
"8833","2016-10-07 22:22:07.722611","192.168.1.196","52.1.40.122","TCP","60","[TCP Keep-Alive] 2179  >  443 [ACK] Seq=2374 Ack=2278 Win=3072 Len=1"
"8900","2016-10-07 22:22:17.925022","192.168.1.196","52.1.40.122","TCP","60","[TCP Keep-Alive] 2179  >  443 [ACK] Seq=2374 Ack=2278 Win=3072 Len=1"
"8929","2016-10-07 22:22:23.149275","Physical_00:67:5e","Tp-LinkT_51:33:ea","ARP","60","192.168.1.196 is at d0:52:a8:00:67:5e"
"8943","2016-10-07 22:22:28.127630","192.168.1.196","52.1.40.122","TCP","60","[TCP Keep-Alive] 2179  >  443 [ACK] Seq=2374 Ack=2278 Win=3072 Len=1"
"9011","2016-10-07 22:22:38.330123","192.168.1.196","52.1.40.122","TCP","60","[TCP Keep-Alive] 2179  >  443 [ACK] Seq=2374 Ack=2278 Win=3072 Len=1"
"9119","2016-10-07 22:22:48.532667","192.168.1.196","52.1.40.122","TCP","60","[TCP Keep-Alive] 2179  >  443 [ACK] Seq=2374 Ack=2278 Win=3072 Len=1"
"9163","2016-10-07 22:22:56.439463","192.168.1.196","52.1.40.122","TLSv1.2","123","Application Data"
"9167","2016-10-07 22:22:56.656794","192.168.1.196","52.1.40.122","TCP","60","2179  >  443 [ACK] Seq=2444 Ack=2347 Win=3072 Len=0"
"9464","2016-10-07 22:23:06.643158","192.168.1.196","52.1.40.122","TCP","60","[TCP Keep-Alive] 2179  >  443 [ACK] Seq=2443 Ack=2347 Win=3072 Len=1"
"9490","2016-10-07 22:23:11.859283","Physical_00:67:5e","Tp-LinkT_51:33:ea","ARP","60","192.168.1.196 is at d0:52:a8:00:67:5e"
"9527","2016-10-07 22:23:16.845822","192.168.1.196","52.1.40.122","TCP","60","[TCP Keep-Alive] 2179  >  443 [ACK] Seq=2443 Ack=2347 Win=3072 Len=1"
"9567","2016-10-07 22:23:27.048535","192.168.1.196","52.1.40.122","TCP","60","[TCP Keep-Alive] 2179  >  443 [ACK] Seq=2443 Ack=2347 Win=3072 Len=1"
"9608","2016-10-07 22:23:37.250898","192.168.1.196","52.1.40.122","TCP","60","[TCP Keep-Alive] 2179  >  443 [ACK] Seq=2443 Ack=2347 Win=3072 Len=1"
"9678","2016-10-07 22:23:47.453380","192.168.1.196","52.1.40.122","TCP","60","[TCP Keep-Alive] 2179  >  443 [ACK] Seq=2443 Ack=2347 Win=3072 Len=1"
"9714","2016-10-07 22:23:55.360298","192.168.1.196","52.1.40.122","TLSv1.2","123","Application Data"
"9717","2016-10-07 22:23:55.577767","192.168.1.196","52.1.40.122","TCP","60","2179  >  443 [ACK] Seq=2513 Ack=2416 Win=3072 Len=0"
"9731","2016-10-07 22:24:00.579274","Physical_00:67:5e","Tp-LinkT_51:33:ea","ARP","60","192.168.1.196 is at d0:52:a8:00:67:5e"
"9769","2016-10-07 22:24:05.564091","192.168.1.196","52.1.40.122","TCP","60","[TCP Keep-Alive] 2179  >  443 [ACK] Seq=2512 Ack=2416 Win=3072 Len=1"
"9818","2016-10-07 22:24:15.766619","192.168.1.196","52.1.40.122","TCP","60","[TCP Keep-Alive] 2179  >  443 [ACK] Seq=2512 Ack=2416 Win=3072 Len=1"
"9874","2016-10-07 22:24:25.969262","192.168.1.196","52.1.40.122","TCP","60","[TCP Keep-Alive] 2179  >  443 [ACK] Seq=2512 Ack=2416 Win=3072 Len=1"
"9877","2016-10-07 22:24:26.830798","192.168.1.196","52.1.40.122","TLSv1.2","123","Application Data"
"9880","2016-10-07 22:24:27.048471","192.168.1.196","52.1.40.122","TCP","60","2179  >  443 [ACK] Seq=2582 Ack=2485 Win=3072 Len=0"
"9889","2016-10-07 22:24:31.189228","Physical_00:67:5e","Tp-LinkT_51:33:ea","ARP","60","192.168.1.196 is at d0:52:a8:00:67:5e"
"9938","2016-10-07 22:24:37.034841","192.168.1.196","52.1.40.122","TCP","60","[TCP Keep-Alive] 2179  >  443 [ACK] Seq=2581 Ack=2485 Win=3072 Len=1"
"10003","2016-10-07 22:24:47.237517","192.168.1.196","52.1.40.122","TCP","60","[TCP Keep-Alive] 2179  >  443 [ACK] Seq=2581 Ack=2485 Win=3072 Len=1"
"10060","2016-10-07 22:24:57.440166","192.168.1.196","52.1.40.122","TCP","60","[TCP Keep-Alive] 2179  >  443 [ACK] Seq=2581 Ack=2485 Win=3072 Len=1"
"10076","2016-10-07 22:25:02.659274","Physical_00:67:5e","Tp-LinkT_51:33:ea","ARP","60","192.168.1.196 is at d0:52:a8:00:67:5e"
"10106","2016-10-07 22:25:07.642849","192.168.1.196","52.1.40.122","TCP","60","[TCP Keep-Alive] 2179  >  443 [ACK] Seq=2581 Ack=2485 Win=3072 Len=1"
"10114","2016-10-07 22:25:10.633175","192.168.1.196","52.1.40.122","TLSv1.2","123","Application Data"
"10117","2016-10-07 22:25:10.850968","192.168.1.196","52.1.40.122","TCP","60","2179  >  443 [ACK] Seq=2651 Ack=2554 Win=3072 Len=0"
"10248","2016-10-07 22:25:20.837303","192.168.1.196","52.1.40.122","TCP","60","[TCP Keep-Alive] 2179  >  443 [ACK] Seq=2650 Ack=2554 Win=3072 Len=1"
"10290","2016-10-07 22:25:27.837792","192.168.1.196","52.1.40.122","TLSv1.2","139","Application Data"
"10293","2016-10-07 22:25:28.055737","192.168.1.196","52.1.40.122","TCP","60","2179  >  443 [ACK] Seq=2736 Ack=2623 Win=3072 Len=0"
"10310","2016-10-07 22:25:33.059247","Physical_00:67:5e","Tp-LinkT_51:33:ea","ARP","60","192.168.1.196 is at d0:52:a8:00:67:5e"
"10350","2016-10-07 22:25:38.042144","192.168.1.196","52.1.40.122","TCP","60","[TCP Keep-Alive] 2179  >  443 [ACK] Seq=2735 Ack=2623 Win=3072 Len=1"
"10431","2016-10-07 22:25:48.244846","192.168.1.196","52.1.40.122","TCP","60","[TCP Keep-Alive] 2179  >  443 [ACK] Seq=2735 Ack=2623 Win=3072 Len=1"
"10472","2016-10-07 22:25:58.447425","192.168.1.196","52.1.40.122","TCP","60","[TCP Keep-Alive] 2179  >  443 [ACK] Seq=2735 Ack=2623 Win=3072 Len=1"
"10492","2016-10-07 22:26:03.669286","Physical_00:67:5e","Tp-LinkT_51:33:ea","ARP","60","192.168.1.196 is at d0:52:a8:00:67:5e"
"10530","2016-10-07 22:26:08.649999","192.168.1.196","52.1.40.122","TCP","60","[TCP Keep-Alive] 2179  >  443 [ACK] Seq=2735 Ack=2623 Win=3072 Len=1"
"10608","2016-10-07 22:26:18.852413","192.168.1.196","52.1.40.122","TCP","60","[TCP Keep-Alive] 2179  >  443 [ACK] Seq=2735 Ack=2623 Win=3072 Len=1"
"10660","2016-10-07 22:26:26.759118","192.168.1.196","52.1.40.122","TLSv1.2","123","Application Data"
"10665","2016-10-07 22:26:26.976316","192.168.1.196","52.1.40.122","TCP","60","2179  >  443 [ACK] Seq=2805 Ack=2692 Win=3072 Len=0"
"10715","2016-10-07 22:26:36.962604","192.168.1.196","52.1.40.122","TCP","60","[TCP Keep-Alive] 2179  >  443 [ACK] Seq=2804 Ack=2692 Win=3072 Len=1"
"10734","2016-10-07 22:26:42.179279","Physical_00:67:5e","Tp-LinkT_51:33:ea","ARP","60","192.168.1.196 is at d0:52:a8:00:67:5e"
"10768","2016-10-07 22:26:47.165073","192.168.1.196","52.1.40.122","TCP","60","[TCP Keep-Alive] 2179  >  443 [ACK] Seq=2804 Ack=2692 Win=3072 Len=1"
"10810","2016-10-07 22:26:56.179415","192.168.1.196","52.1.40.122","TLSv1.2","123","Application Data"
"10814","2016-10-07 22:26:56.397092","192.168.1.196","52.1.40.122","TCP","60","2179  >  443 [ACK] Seq=2874 Ack=2761 Win=3072 Len=0"
"10867","2016-10-07 22:27:06.383393","192.168.1.196","52.1.40.122","TCP","60","[TCP Keep-Alive] 2179  >  443 [ACK] Seq=2873 Ack=2761 Win=3072 Len=1"
"10919","2016-10-07 22:27:11.006870","Physical_00:67:5e","Broadcast","ARP","60","Who has 192.168.1.1? Tell 192.168.1.196"
"10921","2016-10-07 22:27:11.006943","192.168.1.196","192.168.1.1","DNS","72","Standard query 0x0835 A pool.ntp.org"
"10923","2016-10-07 22:27:11.007656","Physical_00:67:5e","Broadcast","ARP","60","Who has 192.168.1.1? Tell 192.168.1.196"
"10925","2016-10-07 22:27:11.007809","192.168.1.196","192.189.54.17","NTP","90","NTP Version 3, client"
"10942","2016-10-07 22:27:16.029259","Physical_00:67:5e","Tp-LinkT_51:33:ea","ARP","60","192.168.1.196 is at d0:52:a8:00:67:5e"
"10951","2016-10-07 22:27:16.585960","192.168.1.196","52.1.40.122","TCP","60","[TCP Keep-Alive] 2179  >  443 [ACK] Seq=2873 Ack=2761 Win=3072 Len=1"
"11001","2016-10-07 22:27:26.788714","192.168.1.196","52.1.40.122","TCP","60","[TCP Keep-Alive] 2179  >  443 [ACK] Seq=2873 Ack=2761 Win=3072 Len=1"
"11045","2016-10-07 22:27:36.991290","192.168.1.196","52.1.40.122","TCP","60","[TCP Keep-Alive] 2179  >  443 [ACK] Seq=2873 Ack=2761 Win=3072 Len=1"
"11121","2016-10-07 22:27:47.193898","192.168.1.196","52.1.40.122","TCP","60","[TCP Keep-Alive] 2179  >  443 [ACK] Seq=2873 Ack=2761 Win=3072 Len=1"
"11154","2016-10-07 22:27:52.419239","Physical_00:67:5e","Tp-LinkT_51:33:ea","ARP","60","192.168.1.196 is at d0:52:a8:00:67:5e"
"11160","2016-10-07 22:27:55.101503","192.168.1.196","52.1.40.122","TLSv1.2","123","Application Data"
"11163","2016-10-07 22:27:55.318596","192.168.1.196","52.1.40.122","TCP","60","2179  >  443 [ACK] Seq=2943 Ack=2830 Win=3072 Len=0"
"11360","2016-10-07 22:28:05.304967","192.168.1.196","52.1.40.122","TCP","60","[TCP Keep-Alive] 2179  >  443 [ACK] Seq=2942 Ack=2830 Win=3072 Len=1"
"11401","2016-10-07 22:28:15.507525","192.168.1.196","52.1.40.122","TCP","60","[TCP Keep-Alive] 2179  >  443 [ACK] Seq=2942 Ack=2830 Win=3072 Len=1"
"11447","2016-10-07 22:28:25.709965","192.168.1.196","52.1.40.122","TCP","60","[TCP Keep-Alive] 2179  >  443 [ACK] Seq=2942 Ack=2830 Win=3072 Len=1"
"11476","2016-10-07 22:28:30.929240","Physical_00:67:5e","Tp-LinkT_51:33:ea","ARP","60","192.168.1.196 is at d0:52:a8:00:67:5e"
"11507","2016-10-07 22:28:35.912347","192.168.1.196","52.1.40.122","TCP","60","[TCP Keep-Alive] 2179  >  443 [ACK] Seq=2942 Ack=2830 Win=3072 Len=1"
"11549","2016-10-07 22:28:46.115119","192.168.1.196","52.1.40.122","TCP","60","[TCP Keep-Alive] 2179  >  443 [ACK] Seq=2942 Ack=2830 Win=3072 Len=1"
"11591","2016-10-07 22:28:54.021929","192.168.1.196","52.1.40.122","TLSv1.2","123","Application Data"
"11594","2016-10-07 22:28:54.239223","192.168.1.196","52.1.40.122","TCP","60","2179  >  443 [ACK] Seq=3012 Ack=2899 Win=3072 Len=0"
"11621","2016-10-07 22:29:04.225529","192.168.1.196","52.1.40.122","TCP","60","[TCP Keep-Alive] 2179  >  443 [ACK] Seq=3011 Ack=2899 Win=3072 Len=1"
"11639","2016-10-07 22:29:09.449226","Physical_00:67:5e","Tp-LinkT_51:33:ea","ARP","60","192.168.1.196 is at d0:52:a8:00:67:5e"
"11674","2016-10-07 22:29:14.428143","192.168.1.196","52.1.40.122","TCP","60","[TCP Keep-Alive] 2179  >  443 [ACK] Seq=3011 Ack=2899 Win=3072 Len=1"
"11921","2016-10-07 22:29:24.630793","192.168.1.196","52.1.40.122","TCP","60","[TCP Keep-Alive] 2179  >  443 [ACK] Seq=3011 Ack=2899 Win=3072 Len=1"
"11982","2016-10-07 22:29:25.451011","192.168.1.196","52.1.40.122","TLSv1.2","123","Application Data"
"11999","2016-10-07 22:29:25.669195","192.168.1.196","52.1.40.122","TCP","60","2179  >  443 [ACK] Seq=3081 Ack=2968 Win=3072 Len=0"
"12124","2016-10-07 22:29:28.513098","192.168.1.196","52.1.40.122","TLSv1.2","139","Application Data"
"12127","2016-10-07 22:29:28.730639","192.168.1.196","52.1.40.122","TCP","60","2179  >  443 [ACK] Seq=3166 Ack=3037 Win=3072 Len=0"
"12234","2016-10-07 22:29:38.717208","192.168.1.196","52.1.40.122","TCP","60","[TCP Keep-Alive] 2179  >  443 [ACK] Seq=3165 Ack=3037 Win=3072 Len=1"
"12290","2016-10-07 22:29:43.943875","Physical_00:67:5e","Tp-LinkT_51:33:ea","ARP","60","192.168.1.196 is at d0:52:a8:00:67:5e"
"12315","2016-10-07 22:29:48.919907","192.168.1.196","52.1.40.122","TCP","60","[TCP Keep-Alive] 2179  >  443 [ACK] Seq=3165 Ack=3037 Win=3072 Len=1"
"12356","2016-10-07 22:29:59.122656","192.168.1.196","52.1.40.122","TCP","60","[TCP Keep-Alive] 2179  >  443 [ACK] Seq=3165 Ack=3037 Win=3072 Len=1"
"12413","2016-10-07 22:30:09.325457","192.168.1.196","52.1.40.122","TCP","60","[TCP Keep-Alive] 2179  >  443 [ACK] Seq=3165 Ack=3037 Win=3072 Len=1"
"12429","2016-10-07 22:30:11.500925","192.168.1.196","52.1.40.122","TLSv1.2","123","Application Data"
"12433","2016-10-07 22:30:11.745837","192.168.1.196","52.1.40.122","TCP","60","2179  >  443 [ACK] Seq=3235 Ack=3106 Win=3072 Len=0"
"12474","2016-10-07 22:30:21.732284","192.168.1.196","52.1.40.122","TCP","60","[TCP Keep-Alive] 2179  >  443 [ACK] Seq=3234 Ack=3106 Win=3072 Len=1"
"12497","2016-10-07 22:30:26.949234","Physical_00:67:5e","Tp-LinkT_51:33:ea","ARP","60","192.168.1.196 is at d0:52:a8:00:67:5e"
