"No.","Time","Source","Destination","Protocol","Length","Info"
"1","0.000000","192.168.2.3","192.168.2.1","ICMP","98","Echo (ping) request  id=0x0592, seq=1/256, ttl=64 (reply in 2)"
"5","0.247408","192.168.2.3","216.58.197.14","TCP","66","42654  >  443 [FIN, ACK] Seq=1 Ack=57 Win=1048 Len=0 TSval=49140243 TSecr=2076118751"
"7","0.302111","192.168.2.3","224.0.0.251","MDNS","82","Standard query 0x0000 PTR _googlecast._tcp.local, ""QM"" question"
"8","0.302113","192.168.2.3","224.0.0.251","MDNS","413","Standard query response 0x0000 PTR Google-Home-d8ff63fb78680c8a1c8ccacd5fd7f560._googlecast._tcp.local TXT, cache flush SRV, cache flush 0 0 8009 d8ff63fb-7868-0c8a-1c8c-cacd5fd7f560.local A, cache flush 192.168.2.3"
"9","0.350571","192.168.2.3","224.0.0.251","MDNS","82","Standard query 0x0000 PTR _googlezone._tcp.local, ""QM"" question"
"10","0.352048","192.168.2.3","224.0.0.251","MDNS","268","Standard query response 0x0000 PTR d8ff63fb-7868-0c8a-1c8c-cacd5fd7f560._googlezone._tcp.local TXT, cache flush SRV, cache flush 210 61 10001 d8ff63fb-7868-0c8a-1c8c-cacd5fd7f560.local A, cache flush 192.168.2.3"
"11","0.545353","192.168.2.3","203.211.199.120","TLSv1.2","787","Application Data"
"16","0.557540","192.168.2.3","203.211.199.120","TCP","66","33965  >  443 [ACK] Seq=722 Ack=2897 Win=999 Len=0 TSval=49140274 TSecr=146901072"
"17","0.557916","192.168.2.3","203.211.199.120","TCP","66","33965  >  443 [ACK] Seq=722 Ack=5199 Win=999 Len=0 TSval=49140274 TSecr=146901072"
"18","1.020703","192.168.2.3","192.168.2.1","ICMP","98","Echo (ping) request  id=0x0592, seq=2/512, ttl=64 (reply in 19)"
"20","1.044834","192.168.2.3","8.8.8.8","ICMP","98","Echo (ping) request  id=0x0598, seq=1/256, ttl=64 (reply in 21)"
"22","2.050403","192.168.2.3","8.8.8.8","ICMP","98","Echo (ping) request  id=0x0598, seq=2/512, ttl=64 (reply in 23)"
"24","2.058880","192.168.2.3","8.8.8.8","DNS","74","Standard query 0xd1e7 A www.google.com"
"25","2.058882","192.168.2.3","8.8.8.8","DNS","74","Standard query 0xae7e AAAA www.google.com"
"28","4.618045","192.168.2.3","216.58.197.14","UDP","65","34803  >  443 Len=23"
"30","6.606400","192.168.2.3","203.211.199.120","TLSv1.2","787","Application Data"
"35","6.625006","192.168.2.3","203.211.199.120","TCP","66","33965  >  443 [ACK] Seq=1443 Ack=8095 Win=999 Len=0 TSval=49140881 TSecr=146907138"
"36","6.625008","192.168.2.3","203.211.199.120","TCP","66","33965  >  443 [ACK] Seq=1443 Ack=10397 Win=999 Len=0 TSval=49140881 TSecr=146907138"
"37","12.668457","192.168.2.3","203.211.199.120","TLSv1.2","787","Application Data"
"42","12.694638","192.168.2.3","203.211.199.120","TCP","66","33965  >  443 [ACK] Seq=2164 Ack=13293 Win=999 Len=0 TSval=49141488 TSecr=146913209"
"43","12.696577","192.168.2.3","203.211.199.120","TCP","66","33965  >  443 [ACK] Seq=2164 Ack=15589 Win=999 Len=0 TSval=49141488 TSecr=146913209"
"44","13.489658","192.168.2.3","35.186.224.53","TCP","66","60218  >  443 [ACK] Seq=1 Ack=1 Win=583 Len=0 TSval=49141568 TSecr=2232963780"
"46","14.289613","192.168.2.3","216.58.197.14","TCP","66","42674  >  443 [ACK] Seq=1 Ack=1 Win=627 Len=0 TSval=49141648 TSecr=1659789530"
"47","14.290004","192.168.2.3","151.101.76.246","TCP","66","60375  >  443 [ACK] Seq=1 Ack=1 Win=1222 Len=0 TSval=49141648 TSecr=522672252"
"50","14.432621","192.168.2.3","203.211.199.120","TCP","66","33970  >  443 [ACK] Seq=1 Ack=1 Win=545 Len=0 TSval=49141662 TSecr=146869948"
"52","15.039578","192.168.2.3","216.58.197.14","TCP","66","42682  >  443 [ACK] Seq=1 Ack=1 Win=583 Len=0 TSval=49141723 TSecr=3089629575"
"54","15.251607","192.168.2.3","151.101.194.217","TCP","66","49703  >  443 [ACK] Seq=1 Ack=1 Win=661 Len=0 TSval=49141744 TSecr=502310652"
"56","15.672143","192.168.2.3","216.58.197.3","TCP","66","49713  >  443 [ACK] Seq=1 Ack=1 Win=793 Len=0 TSval=49141786 TSecr=3928125463"
"58","16.210126","192.168.2.3","216.58.197.14","TCP","66","42663  >  443 [ACK] Seq=1 Ack=1 Win=329 Len=0 TSval=49141840 TSecr=2191724699"
"60","16.691392","192.168.2.3","216.58.199.234","TCP","66","38637  >  443 [ACK] Seq=1 Ack=1 Win=661 Len=0 TSval=49141888 TSecr=2635329886"
"62","16.791733","192.168.2.3","203.211.199.122","TCP","66","46971  >  443 [ACK] Seq=1 Ack=1 Win=455 Len=0 TSval=49141898 TSecr=148162859"
"63","16.791737","192.168.2.3","203.211.199.122","TCP","66","46972  >  443 [ACK] Seq=1 Ack=1 Win=455 Len=0 TSval=49141898 TSecr=148162860"
"66","18.735037","192.168.2.3","203.211.199.120","TLSv1.2","787","Application Data"
"71","18.765474","192.168.2.3","203.211.199.120","TCP","66","33965  >  443 [ACK] Seq=2885 Ack=18485 Win=999 Len=0 TSval=49142095 TSecr=146919272"
"72","18.765878","192.168.2.3","203.211.199.120","TCP","66","33965  >  443 [ACK] Seq=2885 Ack=20787 Win=999 Len=0 TSval=49142095 TSecr=146919272"
"73","23.183826","192.168.2.3","216.58.197.14","TLSv1.2","159","Application Data"
"74","23.183829","192.168.2.3","216.58.197.14","TLSv1.2","104","Application Data"
"75","23.183829","192.168.2.3","216.58.197.14","TLSv1.2","366","Application Data"
"80","23.229896","192.168.2.3","216.58.197.14","TCP","66","42670  >  443 [ACK] Seq=432 Ack=39 Win=661 Len=0 TSval=49142542 TSecr=4183046972"
"85","23.269104","192.168.2.3","216.58.197.14","TCP","66","42670  >  443 [ACK] Seq=432 Ack=108 Win=661 Len=0 TSval=49142545 TSecr=4183047051"
"86","23.269106","192.168.2.3","216.58.197.14","TCP","66","42670  >  443 [ACK] Seq=432 Ack=396 Win=661 Len=0 TSval=49142546 TSecr=4183047051"
"87","23.269498","192.168.2.3","216.58.197.14","TCP","66","42670  >  443 [ACK] Seq=432 Ack=643 Win=661 Len=0 TSval=49142546 TSecr=4183047051"
"88","23.269717","192.168.2.3","216.58.197.14","TCP","66","42670  >  443 [ACK] Seq=432 Ack=681 Win=661 Len=0 TSval=49142546 TSecr=4183047051"
"89","23.274168","192.168.2.3","216.58.197.14","TLSv1.2","104","Application Data"
"91","24.819936","192.168.2.3","203.211.199.120","TLSv1.2","787","Application Data"
"96","24.841004","192.168.2.3","203.211.199.120","TCP","66","33965  >  443 [ACK] Seq=3606 Ack=23683 Win=999 Len=0 TSval=49142703 TSecr=146925353"
"97","24.841382","192.168.2.3","203.211.199.120","TCP","66","33965  >  443 [ACK] Seq=3606 Ack=25985 Win=999 Len=0 TSval=49142703 TSecr=146925354"
"100","27.889399","192.168.2.3","108.177.97.188","TCP","66","42999  >  5228 [ACK] Seq=1 Ack=1 Win=661 Len=0 TSval=49143008 TSecr=532789161"
"104","27.966204","192.168.2.3","35.186.224.53","TCP","66","[TCP Previous segment not captured] 60218  >  443 [FIN, ACK] Seq=2 Ack=57 Win=583 Len=0 TSval=49143015 TSecr=2233023370"
"109","30.718044","192.168.2.3","216.58.197.14","TCP","66","[TCP Previous segment not captured] 42663  >  443 [FIN, ACK] Seq=2 Ack=57 Win=329 Len=0 TSval=49143290 TSecr=2191784323"
"111","30.897304","192.168.2.3","203.211.199.120","TLSv1.2","787","Application Data"
"116","30.952576","192.168.2.3","216.58.197.14","TCP","66","[TCP Retransmission] 42663  >  443 [FIN, ACK] Seq=2 Ack=57 Win=329 Len=0 TSval=49143312 TSecr=2191784323"
"117","30.952577","192.168.2.3","203.211.199.120","TCP","66","33965  >  443 [ACK] Seq=4327 Ack=30329 Win=999 Len=0 TSval=49143312 TSecr=146931435"
"119","30.978881","192.168.2.3","203.211.199.120","TCP","66","33965  >  443 [ACK] Seq=4327 Ack=31182 Win=999 Len=0 TSval=49143317 TSecr=146931435"
"122","31.155774","192.168.2.3","216.58.199.234","TCP","66","[TCP Previous segment not captured] 38637  >  443 [FIN, ACK] Seq=2 Ack=57 Win=661 Len=0 TSval=49143334 TSecr=2635389463"
"124","32.534116","192.168.2.3","108.177.97.188","TCP","66","43011  >  5228 [ACK] Seq=1 Ack=1 Win=450 Len=0 TSval=49143472 TSecr=783633547"
"126","32.874370","192.168.2.3","8.8.8.8","DNS","75","Standard query 0xcd0c A play.google.com"
"128","32.920713","192.168.2.3","216.58.197.14","GQUIC","1392","Client Hello, PKN: 1, CID: 1933795123221563294"
"132","32.982896","192.168.2.3","216.58.197.14","GQUIC","1392","Client Hello, PKN: 2, CID: 1933795123221563294"
"136","33.044484","192.168.2.3","216.58.197.14","GQUIC","81","Payload (Encrypted), PKN: 3, CID: 1933795123221563294"
"137","33.044485","192.168.2.3","216.58.197.14","GQUIC","72","Payload (Encrypted), PKN: 4, CID: 1933795123221563294"
"138","33.044486","192.168.2.3","216.58.197.14","GQUIC","1036","Payload (Encrypted), PKN: 5, CID: 1933795123221563294"
"144","33.099165","192.168.2.3","216.58.197.14","GQUIC","72","Payload (Encrypted), PKN: 6, CID: 1933795123221563294"
"145","33.100853","192.168.2.3","216.58.197.14","GQUIC","72","Payload (Encrypted), PKN: 7, CID: 1933795123221563294"
"149","34.429512","192.168.2.3","203.211.199.120","TCP","66","[TCP Previous segment not captured] 33970  >  443 [ACK] Seq=2 Ack=24 Win=545 Len=0 TSval=49143662 TSecr=146934948"
"150","34.469403","192.168.2.3","203.211.199.120","TCP","66","33970  >  443 [ACK] Seq=2 Ack=25 Win=545 Len=0 TSval=49143666 TSecr=146934948"
"151","36.370524","192.168.2.3","216.58.197.4","TCP","66","53439  >  443 [ACK] Seq=1 Ack=1 Win=862 Len=0 TSval=49143856 TSecr=1294946583"
"155","36.790524","192.168.2.3","203.211.199.122","TCP","66","[TCP Previous segment not captured] 46972  >  443 [ACK] Seq=2 Ack=24 Win=455 Len=0 TSval=49143898 TSecr=148227860"
"156","36.791777","192.168.2.3","203.211.199.122","TCP","66","[TCP Previous segment not captured] 46971  >  443 [ACK] Seq=2 Ack=24 Win=455 Len=0 TSval=49143898 TSecr=148227860"
"159","36.829121","192.168.2.3","203.211.199.122","TCP","66","46971  >  443 [ACK] Seq=2 Ack=25 Win=455 Len=0 TSval=49143902 TSecr=148227860"
"160","36.839800","192.168.2.3","203.211.199.122","TCP","66","46972  >  443 [ACK] Seq=2 Ack=25 Win=455 Len=0 TSval=49143903 TSecr=148227860"
"161","36.982958","192.168.2.3","203.211.199.122","TCP","66","46971  >  443 [RST, ACK] Seq=2 Ack=25 Win=455 Len=0 TSval=49143917 TSecr=148227860"
"162","36.982961","192.168.2.3","203.211.199.122","TCP","66","46972  >  443 [RST, ACK] Seq=2 Ack=25 Win=455 Len=0 TSval=49143917 TSecr=148227860"
"163","36.982962","192.168.2.3","203.211.199.120","TCP","66","33970  >  443 [RST, ACK] Seq=2 Ack=25 Win=545 Len=0 TSval=49143917 TSecr=146934948"
"164","36.984036","192.168.2.3","203.211.199.120","TLSv1.2","787","Application Data"
"169","37.011046","192.168.2.3","203.211.199.120","TCP","66","33965  >  443 [ACK] Seq=5048 Ack=32630 Win=982 Len=0 TSval=49143919 TSecr=146937519"
"170","37.011047","192.168.2.3","203.211.199.120","TCP","66","33965  >  443 [ACK] Seq=5048 Ack=34078 Win=982 Len=0 TSval=49143919 TSecr=146937519"
"171","37.011486","192.168.2.3","203.211.199.120","TCP","66","33965  >  443 [ACK] Seq=5048 Ack=35526 Win=982 Len=0 TSval=49143920 TSecr=146937519"
"172","37.011776","192.168.2.3","203.211.199.120","TCP","66","33965  >  443 [ACK] Seq=5048 Ack=36373 Win=998 Len=0 TSval=49143920 TSecr=146937519"
"174","43.046378","192.168.2.3","203.211.199.120","TLSv1.2","787","Application Data"
"179","43.063834","192.168.2.3","203.211.199.120","TCP","66","33965  >  443 [ACK] Seq=5769 Ack=37821 Win=982 Len=0 TSval=49144525 TSecr=146943579"
"180","43.063836","192.168.2.3","203.211.199.120","TCP","66","33965  >  443 [ACK] Seq=5769 Ack=39269 Win=982 Len=0 TSval=49144525 TSecr=146943579"
"181","43.064211","192.168.2.3","203.211.199.120","TCP","66","33965  >  443 [ACK] Seq=5769 Ack=40717 Win=982 Len=0 TSval=49144525 TSecr=146943579"
"182","43.064213","192.168.2.3","203.211.199.120","TCP","66","33965  >  443 [ACK] Seq=5769 Ack=41564 Win=982 Len=0 TSval=49144525 TSecr=146943579"
"183","48.050443","192.168.2.3","216.58.197.14","GQUIC","65","Payload (Encrypted), PKN: 8, CID: 1933795123221563294"
"185","49.097555","192.168.2.3","203.211.199.120","TLSv1.2","787","Application Data"
"190","49.125432","192.168.2.3","203.211.199.120","TCP","66","33965  >  443 [ACK] Seq=6490 Ack=43012 Win=982 Len=0 TSval=49145131 TSecr=146949635"
"191","49.125434","192.168.2.3","203.211.199.120","TCP","66","33965  >  443 [ACK] Seq=6490 Ack=44460 Win=982 Len=0 TSval=49145131 TSecr=146949635"
"192","49.127267","192.168.2.3","203.211.199.120","TCP","66","33965  >  443 [ACK] Seq=6490 Ack=46761 Win=982 Len=0 TSval=49145131 TSecr=146949635"
"194","54.721005","192.168.2.3","8.8.8.8","DNS","89","Standard query 0xb689 A connectivitycheck.gstatic.com"
"196","54.777167","192.168.2.3","216.58.197.3","GQUIC","1392","Client Hello, PKN: 1, CID: 5094430293523007528"
"197","54.777170","192.168.2.3","216.58.197.3","GQUIC","407","Payload (Encrypted), PKN: 2, CID: 5094430293523007528"
"201","54.823838","192.168.2.3","216.58.197.3","GQUIC","83","Payload (Encrypted), PKN: 3, CID: 5094430293523007528"
"202","54.823840","192.168.2.3","216.58.197.3","GQUIC","72","Payload (Encrypted), PKN: 4, CID: 5094430293523007528"
"204","54.866158","192.168.2.3","216.58.197.3","GQUIC","72","Payload (Encrypted), PKN: 5, CID: 5094430293523007528"
"205","55.168402","192.168.2.3","203.211.199.120","TLSv1.2","787","Application Data"
"210","55.191292","192.168.2.3","203.211.199.120","TCP","66","33965  >  443 [ACK] Seq=7211 Ack=48209 Win=982 Len=0 TSval=49145737 TSecr=146955704"
"211","55.191294","192.168.2.3","203.211.199.120","TCP","66","33965  >  443 [ACK] Seq=7211 Ack=49657 Win=982 Len=0 TSval=49145737 TSecr=146955704"
"212","55.191294","192.168.2.3","203.211.199.120","TCP","66","33965  >  443 [ACK] Seq=7211 Ack=51105 Win=982 Len=0 TSval=49145737 TSecr=146955704"
"213","55.191295","192.168.2.3","203.211.199.120","TCP","66","33965  >  443 [ACK] Seq=7211 Ack=51958 Win=998 Len=0 TSval=49145737 TSecr=146955704"
"214","57.791342","192.168.2.3","108.177.97.188","TLSv1.2","91","[TCP Previous segment not captured] , Application Data"
"216","57.830971","192.168.2.3","108.177.97.188","TCP","66","42999  >  5228 [ACK] Seq=27 Ack=26 Win=661 Len=0 TSval=49146002 TSecr=532864107"
"217","59.409073","192.168.2.3","216.58.197.14","TCP","66","[TCP Dup ACK 46#1] 42674  >  443 [ACK] Seq=1 Ack=1 Win=627 Len=0 TSval=49146160 TSecr=1659834576"
"218","59.409081","192.168.2.3","151.101.76.246","TCP","66","[TCP Dup ACK 47#1] 60375  >  443 [ACK] Seq=1 Ack=1 Win=1222 Len=0 TSval=49146160 TSecr=522683532"
"222","60.207246","192.168.2.3","216.58.197.14","TCP","66","[TCP Dup ACK 52#1] 42682  >  443 [ACK] Seq=1 Ack=1 Win=583 Len=0 TSval=49146240 TSecr=3089674579"
"224","60.369099","192.168.2.3","151.101.194.217","TCP","66","[TCP Dup ACK 54#1] 49703  >  443 [ACK] Seq=1 Ack=1 Win=661 Len=0 TSval=49146256 TSecr=502321932"
"226","60.689528","192.168.2.3","216.58.197.3","TCP","66","[TCP Dup ACK 56#1] 49713  >  443 [ACK] Seq=1 Ack=1 Win=793 Len=0 TSval=49146288 TSecr=3928170465"
"228","61.238671","192.168.2.3","203.211.199.120","TLSv1.2","787","Application Data"
"233","61.257324","192.168.2.3","203.211.199.120","TCP","66","33965  >  443 [ACK] Seq=7932 Ack=53406 Win=982 Len=0 TSval=49146344 TSecr=146961777"
"234","61.257326","192.168.2.3","203.211.199.120","TCP","66","33965  >  443 [ACK] Seq=7932 Ack=54854 Win=982 Len=0 TSval=49146345 TSecr=146961777"
"235","61.257678","192.168.2.3","203.211.199.120","TCP","66","33965  >  443 [ACK] Seq=7932 Ack=56302 Win=982 Len=0 TSval=49146345 TSecr=146961777"
"236","61.258065","192.168.2.3","203.211.199.120","TCP","66","33965  >  443 [ACK] Seq=7932 Ack=57149 Win=982 Len=0 TSval=49146345 TSecr=146961777"
"237","63.280083","192.168.2.3","192.168.2.1","ICMP","98","Echo (ping) request  id=0x069e, seq=1/256, ttl=64 (reply in 238)"
"239","64.298202","192.168.2.3","192.168.2.1","ICMP","98","Echo (ping) request  id=0x069e, seq=2/512, ttl=64 (reply in 240)"
"241","64.331555","192.168.2.3","8.8.8.8","ICMP","98","Echo (ping) request  id=0x06a4, seq=1/256, ttl=64 (reply in 242)"
"243","64.375249","192.168.2.3","216.58.197.14","TLSv1.2","160","Application Data"
"244","64.375252","192.168.2.3","216.58.197.14","TLSv1.2","104","Application Data"
"245","64.375252","192.168.2.3","216.58.197.14","TLSv1.2","517","Application Data"
"250","64.417069","192.168.2.3","216.58.197.14","TCP","66","42670  >  443 [ACK] Seq=1053 Ack=719 Win=661 Len=0 TSval=49146661 TSecr=4183088166"
"255","64.457005","192.168.2.3","216.58.197.14","TCP","66","42670  >  443 [ACK] Seq=1053 Ack=788 Win=661 Len=0 TSval=49146664 TSecr=4183088242"
"256","64.457007","192.168.2.3","216.58.197.14","TCP","66","42670  >  443 [ACK] Seq=1053 Ack=893 Win=661 Len=0 TSval=49146665 TSecr=4183088242"
"257","64.457388","192.168.2.3","216.58.197.14","TCP","66","42670  >  443 [ACK] Seq=1053 Ack=1173 Win=661 Len=0 TSval=49146665 TSecr=4183088242"
"258","64.457794","192.168.2.3","216.58.197.14","TCP","66","42670  >  443 [ACK] Seq=1053 Ack=1211 Win=661 Len=0 TSval=49146665 TSecr=4183088242"
"259","64.458367","192.168.2.3","216.58.197.14","TLSv1.2","104","Application Data"
"261","65.347052","192.168.2.3","8.8.8.8","ICMP","98","Echo (ping) request  id=0x06a4, seq=2/512, ttl=64 (reply in 262)"
"263","65.353785","192.168.2.3","8.8.8.8","DNS","74","Standard query 0x5862 A www.google.com"
"264","65.353977","192.168.2.3","8.8.8.8","DNS","74","Standard query 0x0746 AAAA www.google.com"
"267","67.294177","192.168.2.3","203.211.199.120","TLSv1.2","787","Application Data"
"272","67.314107","192.168.2.3","203.211.199.120","TCP","66","33965  >  443 [ACK] Seq=8653 Ack=58597 Win=982 Len=0 TSval=49146950 TSecr=146967834"
"273","67.314109","192.168.2.3","203.211.199.120","TCP","66","33965  >  443 [ACK] Seq=8653 Ack=60045 Win=982 Len=0 TSval=49146950 TSecr=146967834"
"274","67.314499","192.168.2.3","203.211.199.120","TCP","66","33965  >  443 [ACK] Seq=8653 Ack=61493 Win=982 Len=0 TSval=49146950 TSecr=146967834"
"275","67.314500","192.168.2.3","203.211.199.120","TCP","66","33965  >  443 [ACK] Seq=8653 Ack=62341 Win=998 Len=0 TSval=49146950 TSecr=146967834"
"277","73.377232","192.168.2.3","203.211.199.120","TLSv1.2","787","Application Data"
"283","73.443158","192.168.2.3","203.211.199.120","TCP","66","33965  >  443 [ACK] Seq=9374 Ack=67533 Win=948 Len=0 TSval=49147562 TSecr=146973948"
"285","77.648869","192.168.2.3","108.177.97.188","TCP","66","[TCP Dup ACK 124#1] 43011  >  5228 [ACK] Seq=1 Ack=1 Win=450 Len=0 TSval=49147984 TSecr=783678657"
"287","79.476609","192.168.2.3","203.211.199.120","TLSv1.2","787","Application Data"
"293","79.498572","192.168.2.3","203.211.199.120","TCP","66","33965  >  443 [ACK] Seq=10095 Ack=68981 Win=982 Len=0 TSval=49148169 TSecr=146980019"
"294","79.498573","192.168.2.3","203.211.199.120","TCP","66","33965  >  443 [ACK] Seq=10095 Ack=70429 Win=982 Len=0 TSval=49148169 TSecr=146980019"
"295","79.500604","192.168.2.3","203.211.199.120","TCP","66","33965  >  443 [ACK] Seq=10095 Ack=71877 Win=982 Len=0 TSval=49148169 TSecr=146980019"
"296","79.504096","192.168.2.3","203.211.199.120","TCP","66","33965  >  443 [ACK] Seq=10095 Ack=72731 Win=998 Len=0 TSval=49148169 TSecr=146980019"
"297","81.488089","192.168.2.3","216.58.197.4","TCP","66","[TCP Dup ACK 151#1] 53439  >  443 [ACK] Seq=1 Ack=1 Win=862 Len=0 TSval=49148368 TSecr=1294991720"
"300","85.542649","192.168.2.3","203.211.199.120","TLSv1.2","787","Application Data"
"305","85.564239","192.168.2.3","203.211.199.120","TCP","66","33965  >  443 [ACK] Seq=10816 Ack=74179 Win=982 Len=0 TSval=49148775 TSecr=146986084"
"306","85.564241","192.168.2.3","203.211.199.120","TCP","66","33965  >  443 [ACK] Seq=10816 Ack=75627 Win=982 Len=0 TSval=49148775 TSecr=146986084"
"307","85.564242","192.168.2.3","203.211.199.120","TCP","66","33965  >  443 [ACK] Seq=10816 Ack=77929 Win=982 Len=0 TSval=49148775 TSecr=146986084"
"308","91.593814","192.168.2.3","151.101.76.246","TCP","66","[TCP Previous segment not captured] 60375  >  443 [FIN, ACK] Seq=2 Ack=1 Win=1222 Len=0 TSval=49149378 TSecr=522694813"
"309","91.594517","192.168.2.3","203.211.199.120","TLSv1.2","787","Application Data"
"314","91.616733","192.168.2.3","203.211.199.120","TCP","66","33965  >  443 [ACK] Seq=11537 Ack=79377 Win=982 Len=0 TSval=49149380 TSecr=146992132"
"315","91.616735","192.168.2.3","203.211.199.120","TCP","66","33965  >  443 [ACK] Seq=11537 Ack=80825 Win=982 Len=0 TSval=49149380 TSecr=146992132"
"316","91.617191","192.168.2.3","203.211.199.120","TCP","66","33965  >  443 [ACK] Seq=11537 Ack=82273 Win=982 Len=0 TSval=49149381 TSecr=146992132"
"317","91.617550","192.168.2.3","203.211.199.120","TCP","66","33965  >  443 [ACK] Seq=11537 Ack=83127 Win=982 Len=0 TSval=49149381 TSecr=146992132"
"320","91.661805","192.168.2.3","151.101.76.246","TCP","54","60375  >  443 [RST] Seq=3 Win=0 Len=0"
"321","91.661807","192.168.2.3","151.101.76.246","TCP","54","60375  >  443 [RST] Seq=3 Win=0 Len=0"
"322","97.661242","192.168.2.3","203.211.199.120","TLSv1.2","787","Application Data"
"327","97.709103","192.168.2.3","203.211.199.120","TCP","78","[TCP Dup ACK 317#1] 33965  >  443 [ACK] Seq=12258 Ack=83127 Win=999 Len=0 TSval=49149988 TSecr=146992132 SLE=84575 SRE=86023"
"329","97.898364","192.168.2.3","203.211.199.120","TCP","66","33965  >  443 [ACK] Seq=12258 Ack=86023 Win=954 Len=0 TSval=49150009 TSecr=146998417"
"332","97.909505","192.168.2.3","203.211.199.120","TCP","66","33965  >  443 [ACK] Seq=12258 Ack=87471 Win=982 Len=0 TSval=49150010 TSecr=146998428"
"333","97.915162","192.168.2.3","203.211.199.120","TCP","66","33965  >  443 [ACK] Seq=12258 Ack=88325 Win=998 Len=0 TSval=49150010 TSecr=146998428"
"334","99.790964","192.168.2.3","8.8.8.8","DNS","79","Standard query 0xc307 A clients4.google.com"
"336","99.851752","192.168.2.3","216.58.197.14","GQUIC","1392","Client Hello, PKN: 1, CID: 13898513501542256662"
"340","99.898886","192.168.2.3","216.58.197.14","GQUIC","81","Payload (Encrypted), PKN: 2, CID: 13898513501542256662"
"341","99.898890","192.168.2.3","216.58.197.14","GQUIC","72","Payload (Encrypted), PKN: 3, CID: 13898513501542256662"
"342","99.899052","192.168.2.3","216.58.197.14","GQUIC","1392","Payload (Encrypted), PKN: 4, CID: 13898513501542256662"
"343","99.899240","192.168.2.3","216.58.197.14","GQUIC","1392","Payload (Encrypted), PKN: 5, CID: 13898513501542256662"
"344","99.899241","192.168.2.3","216.58.197.14","GQUIC","1392","Payload (Encrypted), PKN: 6, CID: 13898513501542256662"
"345","99.899519","192.168.2.3","216.58.197.14","GQUIC","1392","Payload (Encrypted), PKN: 7, CID: 13898513501542256662"
"346","99.899684","192.168.2.3","216.58.197.14","GQUIC","1392","Payload (Encrypted), PKN: 8, CID: 13898513501542256662"
"347","99.899750","192.168.2.3","216.58.197.14","GQUIC","1392","Payload (Encrypted), PKN: 9, CID: 13898513501542256662"
"348","99.900003","192.168.2.3","216.58.197.14","GQUIC","1392","Payload (Encrypted), PKN: 10, CID: 13898513501542256662"
"349","99.900154","192.168.2.3","216.58.197.14","GQUIC","1392","Payload (Encrypted), PKN: 11, CID: 13898513501542256662"
"350","99.900243","192.168.2.3","216.58.197.14","GQUIC","1392","Payload (Encrypted), PKN: 12, CID: 13898513501542256662"
"351","99.900339","192.168.2.3","216.58.197.14","GQUIC","1392","Payload (Encrypted), PKN: 13, CID: 13898513501542256662"
"352","99.900582","192.168.2.3","216.58.197.14","GQUIC","1392","Payload (Encrypted), PKN: 14, CID: 13898513501542256662"
"353","99.900965","192.168.2.3","216.58.197.14","GQUIC","1392","Payload (Encrypted), PKN: 15, CID: 13898513501542256662"
"358","99.910722","192.168.2.3","216.58.197.14","GQUIC","1392","Payload (Encrypted), PKN: 16, CID: 13898513501542256662"
"359","99.911114","192.168.2.3","216.58.197.14","GQUIC","1392","Payload (Encrypted), PKN: 17, CID: 13898513501542256662"
"360","99.911537","192.168.2.3","216.58.197.14","GQUIC","1392","Payload (Encrypted), PKN: 18, CID: 13898513501542256662"
"361","99.911807","192.168.2.3","216.58.197.14","GQUIC","1392","Payload (Encrypted), PKN: 19, CID: 13898513501542256662"
"362","99.911808","192.168.2.3","216.58.197.14","GQUIC","1392","Payload (Encrypted), PKN: 20, CID: 13898513501542256662"
"363","99.912363","192.168.2.3","216.58.197.14","GQUIC","1392","Payload (Encrypted), PKN: 21, CID: 13898513501542256662"
"364","99.912365","192.168.2.3","216.58.197.14","GQUIC","1392","Payload (Encrypted), PKN: 22, CID: 13898513501542256662"
"365","99.912638","192.168.2.3","216.58.197.14","GQUIC","1392","Payload (Encrypted), PKN: 23, CID: 13898513501542256662"
"366","99.912820","192.168.2.3","216.58.197.14","GQUIC","1392","Payload (Encrypted), PKN: 24, CID: 13898513501542256662"
"367","99.913129","192.168.2.3","216.58.197.14","GQUIC","1392","Payload (Encrypted), PKN: 25, CID: 13898513501542256662"
"368","99.913131","192.168.2.3","216.58.197.14","GQUIC","1392","Payload (Encrypted), PKN: 26, CID: 13898513501542256662"
"369","99.913353","192.168.2.3","216.58.197.14","GQUIC","1392","Payload (Encrypted), PKN: 27, CID: 13898513501542256662"
"370","99.913742","192.168.2.3","216.58.197.14","GQUIC","1392","Payload (Encrypted), PKN: 28, CID: 13898513501542256662"
"371","99.914100","192.168.2.3","216.58.197.14","GQUIC","1392","Payload (Encrypted), PKN: 29, CID: 13898513501542256662"
"372","99.914102","192.168.2.3","216.58.197.14","GQUIC","1392","Payload (Encrypted), PKN: 30, CID: 13898513501542256662"
"373","99.914400","192.168.2.3","216.58.197.14","GQUIC","1392","Payload (Encrypted), PKN: 31, CID: 13898513501542256662"
"374","99.914402","192.168.2.3","216.58.197.14","GQUIC","201","Payload (Encrypted), PKN: 32, CID: 13898513501542256662"
"386","100.017777","192.168.2.3","216.58.197.14","GQUIC","72","Payload (Encrypted), PKN: 33, CID: 13898513501542256662"
"387","102.334271","192.168.2.3","224.0.0.251","MDNS","82","Standard query 0x0000 PTR _googlecast._tcp.local, ""QM"" question"
"388","102.334274","192.168.2.3","224.0.0.251","MDNS","413","Standard query response 0x0000 PTR Google-Home-d8ff63fb78680c8a1c8ccacd5fd7f560._googlecast._tcp.local TXT, cache flush SRV, cache flush 0 0 8009 d8ff63fb-7868-0c8a-1c8c-cacd5fd7f560.local A, cache flush 192.168.2.3"
"389","102.367210","192.168.2.3","224.0.0.251","MDNS","82","Standard query 0x0000 PTR _googlezone._tcp.local, ""QM"" question"
"390","102.367212","192.168.2.3","224.0.0.251","MDNS","268","Standard query response 0x0000 PTR d8ff63fb-7868-0c8a-1c8c-cacd5fd7f560._googlezone._tcp.local TXT, cache flush SRV, cache flush 210 61 10001 d8ff63fb-7868-0c8a-1c8c-cacd5fd7f560.local A, cache flush 192.168.2.3"
"391","102.927347","192.168.2.3","108.177.97.188","TCP","66","[TCP Keep-Alive] 42999  >  5228 [ACK] Seq=26 Ack=26 Win=661 Len=0 TSval=49150512 TSecr=532864107"
"393","103.941746","192.168.2.3","203.211.199.120","TLSv1.2","787","Application Data"
"398","103.962259","192.168.2.3","203.211.199.120","TCP","66","33965  >  443 [ACK] Seq=12979 Ack=91221 Win=982 Len=0 TSval=49150615 TSecr=147004483"
"399","103.962730","192.168.2.3","203.211.199.120","TCP","66","33965  >  443 [ACK] Seq=12979 Ack=93523 Win=982 Len=0 TSval=49150615 TSecr=147004483"
"400","104.529728","192.168.2.3","216.58.197.14","TCP","66","[TCP Dup ACK 46#2] 42674  >  443 [ACK] Seq=1 Ack=1 Win=627 Len=0 TSval=49150672 TSecr=1659879698"
"402","105.325744","192.168.2.3","216.58.197.14","TCP","66","[TCP Dup ACK 52#2] 42682  >  443 [ACK] Seq=1 Ack=1 Win=583 Len=0 TSval=49150752 TSecr=3089719743"
"404","105.487820","192.168.2.3","151.101.194.217","TCP","66","[TCP Dup ACK 54#2] 49703  >  443 [ACK] Seq=1 Ack=1 Win=661 Len=0 TSval=49150768 TSecr=502333212"
"406","105.804936","192.168.2.3","216.58.197.3","TCP","66","[TCP Dup ACK 56#2] 49713  >  443 [ACK] Seq=1 Ack=1 Win=793 Len=0 TSval=49150800 TSecr=3928215485"
"408","109.646651","192.168.2.3","216.58.197.14","TCP","66","[TCP Keep-Alive] 42670  >  443 [ACK] Seq=1090 Ack=1211 Win=661 Len=0 TSval=49151184 TSecr=4183088288"
"410","110.000469","192.168.2.3","203.211.199.120","TLSv1.2","787","Application Data"
"415","110.021528","192.168.2.3","203.211.199.120","TCP","66","33965  >  443 [ACK] Seq=13700 Ack=94971 Win=982 Len=0 TSval=49151221 TSecr=147010542"
"416","110.021530","192.168.2.3","203.211.199.120","TCP","66","33965  >  443 [ACK] Seq=13700 Ack=96419 Win=982 Len=0 TSval=49151221 TSecr=147010542"
"417","110.021530","192.168.2.3","203.211.199.120","TCP","66","33965  >  443 [ACK] Seq=13700 Ack=97867 Win=982 Len=0 TSval=49151221 TSecr=147010542"
"418","110.021531","192.168.2.3","203.211.199.120","TCP","66","33965  >  443 [ACK] Seq=13700 Ack=98720 Win=998 Len=0 TSval=49151221 TSecr=147010542"
"419","114.868804","192.168.2.3","8.8.8.8","DNS","89","Standard query 0x0294 A connectivitycheck.gstatic.com"
"421","114.888687","192.168.2.3","216.58.197.3","GQUIC","1392","Client Hello, PKN: 1, CID: 12876545144316722270"
"422","114.888695","192.168.2.3","216.58.197.3","GQUIC","407","Payload (Encrypted), PKN: 2, CID: 12876545144316722270"
"423","114.915754","192.168.2.3","216.58.197.14","GQUIC","65","Payload (Encrypted), PKN: 34, CID: 13898513501542256662"
"427","114.939105","192.168.2.3","216.58.197.3","GQUIC","83","Payload (Encrypted), PKN: 3, CID: 12876545144316722270"
"428","114.939108","192.168.2.3","216.58.197.3","GQUIC","72","Payload (Encrypted), PKN: 4, CID: 12876545144316722270"
"431","114.977843","192.168.2.3","216.58.197.3","GQUIC","72","Payload (Encrypted), PKN: 5, CID: 12876545144316722270"
"432","116.169841","192.168.2.3","203.211.199.120","TLSv1.2","787","Application Data"
"437","116.194998","192.168.2.3","203.211.199.120","TCP","66","33965  >  443 [ACK] Seq=14421 Ack=100168 Win=982 Len=0 TSval=49151838 TSecr=147016713"
"438","116.195000","192.168.2.3","203.211.199.120","TCP","66","33965  >  443 [ACK] Seq=14421 Ack=101616 Win=982 Len=0 TSval=49151838 TSecr=147016713"
"439","116.195001","192.168.2.3","203.211.199.120","TCP","66","33965  >  443 [ACK] Seq=14421 Ack=103064 Win=960 Len=0 TSval=49151839 TSecr=147016713"
"440","116.195001","192.168.2.3","203.211.199.120","TCP","66","33965  >  443 [ACK] Seq=14421 Ack=103917 Win=948 Len=0 TSval=49151839 TSecr=147016713"
"441","122.231019","192.168.2.3","203.211.199.120","TLSv1.2","787","Application Data"
"446","122.248447","192.168.2.3","203.211.199.120","TCP","66","33965  >  443 [ACK] Seq=15142 Ack=105365 Win=982 Len=0 TSval=49152444 TSecr=147022775"
"447","122.248449","192.168.2.3","203.211.199.120","TCP","66","33965  >  443 [ACK] Seq=15142 Ack=106813 Win=982 Len=0 TSval=49152444 TSecr=147022775"
"448","122.248743","192.168.2.3","203.211.199.120","TCP","66","33965  >  443 [ACK] Seq=15142 Ack=108261 Win=982 Len=0 TSval=49152444 TSecr=147022775"
"449","122.249152","192.168.2.3","203.211.199.120","TCP","66","33965  >  443 [ACK] Seq=15142 Ack=109108 Win=998 Len=0 TSval=49152444 TSecr=147022775"
"450","122.769684","192.168.2.3","108.177.97.188","TCP","66","[TCP Dup ACK 124#2] 43011  >  5228 [ACK] Seq=1 Ack=1 Win=450 Len=0 TSval=49152496 TSecr=783723775"
"452","126.526632","192.168.2.3","192.168.2.1","ICMP","98","Echo (ping) request  id=0x07ac, seq=1/256, ttl=64 (reply in 453)"
"454","126.604821","192.168.2.3","216.58.197.4","TCP","66","[TCP Dup ACK 151#2] 53439  >  443 [ACK] Seq=1 Ack=1 Win=862 Len=0 TSval=49152880 TSecr=1295036840"
"456","127.544941","192.168.2.3","192.168.2.1","ICMP","98","Echo (ping) request  id=0x07ac, seq=2/512, ttl=64 (reply in 457)"
"458","127.575657","192.168.2.3","8.8.8.8","ICMP","98","Echo (ping) request  id=0x07b2, seq=1/256, ttl=64 (reply in 459)"
"460","128.292630","192.168.2.3","203.211.199.120","TLSv1.2","787","Application Data"
"465","128.313587","192.168.2.3","203.211.199.120","TCP","66","33965  >  443 [ACK] Seq=15863 Ack=110556 Win=982 Len=0 TSval=49153050 TSecr=147028839"
"466","128.313589","192.168.2.3","203.211.199.120","TCP","66","33965  >  443 [ACK] Seq=15863 Ack=112004 Win=982 Len=0 TSval=49153050 TSecr=147028839"
"467","128.313589","192.168.2.3","203.211.199.120","TCP","66","33965  >  443 [ACK] Seq=15863 Ack=113452 Win=982 Len=0 TSval=49153050 TSecr=147028839"
"468","128.313590","192.168.2.3","203.211.199.120","TCP","66","33965  >  443 [ACK] Seq=15863 Ack=114305 Win=998 Len=0 TSval=49153050 TSecr=147028839"
"469","128.583770","192.168.2.3","8.8.8.8","ICMP","98","Echo (ping) request  id=0x07b2, seq=2/512, ttl=64 (reply in 470)"
"471","128.592208","192.168.2.3","8.8.8.8","DNS","74","Standard query 0xc264 A www.google.com"
"472","128.592211","192.168.2.3","8.8.8.8","DNS","74","Standard query 0x8283 AAAA www.google.com"
"475","134.351534","192.168.2.3","203.211.199.120","TLSv1.2","787","Application Data"
"480","134.371337","192.168.2.3","203.211.199.120","TCP","66","33965  >  443 [ACK] Seq=16584 Ack=115753 Win=982 Len=0 TSval=49153656 TSecr=147034898"
"481","134.371339","192.168.2.3","203.211.199.120","TCP","66","33965  >  443 [ACK] Seq=16584 Ack=117201 Win=982 Len=0 TSval=49153656 TSecr=147034898"
"482","134.372789","192.168.2.3","203.211.199.120","TCP","66","33965  >  443 [ACK] Seq=16584 Ack=118649 Win=982 Len=0 TSval=49153656 TSecr=147034898"
"483","134.372791","192.168.2.3","203.211.199.120","TCP","66","33965  >  443 [ACK] Seq=16584 Ack=119502 Win=998 Len=0 TSval=49153656 TSecr=147034898"
"484","140.410530","192.168.2.3","203.211.199.120","TLSv1.2","787","Application Data"
"489","140.425872","192.168.2.3","203.211.199.120","TCP","66","33965  >  443 [ACK] Seq=17305 Ack=120950 Win=982 Len=0 TSval=49154262 TSecr=147040952"
"490","140.425874","192.168.2.3","203.211.199.120","TCP","66","33965  >  443 [ACK] Seq=17305 Ack=122398 Win=982 Len=0 TSval=49154262 TSecr=147040952"
"491","140.428606","192.168.2.3","203.211.199.120","TCP","66","33965  >  443 [ACK] Seq=17305 Ack=123846 Win=982 Len=0 TSval=49154262 TSecr=147040952"
"492","140.429026","192.168.2.3","203.211.199.120","TCP","66","33965  >  443 [ACK] Seq=17305 Ack=124699 Win=998 Len=0 TSval=49154262 TSecr=147040952"
"493","146.469155","192.168.2.3","203.211.199.120","TLSv1.2","787","Application Data"
"498","146.495202","192.168.2.3","203.211.199.120","TCP","66","33965  >  443 [ACK] Seq=18026 Ack=126147 Win=982 Len=0 TSval=49154868 TSecr=147047015"
"499","146.495204","192.168.2.3","203.211.199.120","TCP","66","33965  >  443 [ACK] Seq=18026 Ack=127595 Win=982 Len=0 TSval=49154868 TSecr=147047015"
"500","146.495204","192.168.2.3","203.211.199.120","TCP","66","33965  >  443 [ACK] Seq=18026 Ack=129043 Win=982 Len=0 TSval=49154869 TSecr=147047015"
"501","146.508381","192.168.2.3","203.211.199.120","TCP","66","33965  >  443 [ACK] Seq=18026 Ack=129897 Win=998 Len=0 TSval=49154869 TSecr=147047015"
"502","148.042849","192.168.2.3","108.177.97.188","TCP","66","[TCP Keep-Alive] 42999  >  5228 [ACK] Seq=26 Ack=26 Win=661 Len=0 TSval=49155024 TSecr=532909245"
"504","149.644675","192.168.2.3","216.58.197.14","TCP","66","[TCP Dup ACK 46#3] 42674  >  443 [ACK] Seq=1 Ack=1 Win=627 Len=0 TSval=49155184 TSecr=1659924821"
"506","150.442530","192.168.2.3","216.58.197.14","TCP","66","[TCP Dup ACK 52#3] 42682  >  443 [ACK] Seq=1 Ack=1 Win=583 Len=0 TSval=49155264 TSecr=3089764864"
"508","150.603082","192.168.2.3","151.101.194.217","TCP","66","[TCP Dup ACK 54#3] 49703  >  443 [ACK] Seq=1 Ack=1 Win=661 Len=0 TSval=49155280 TSecr=502344493"
"510","150.923090","192.168.2.3","216.58.197.3","TCP","66","[TCP Dup ACK 56#3] 49713  >  443 [ACK] Seq=1 Ack=1 Win=793 Len=0 TSval=49155312 TSecr=3928260603"
"512","152.518780","192.168.2.3","203.211.199.120","TLSv1.2","787","Application Data"
"517","152.545970","192.168.2.3","203.211.199.120","TCP","66","33965  >  443 [ACK] Seq=18747 Ack=131345 Win=982 Len=0 TSval=49155474 TSecr=147053074"
"518","152.545971","192.168.2.3","203.211.199.120","TCP","66","33965  >  443 [ACK] Seq=18747 Ack=132793 Win=982 Len=0 TSval=49155474 TSecr=147053074"
"519","152.545972","192.168.2.3","203.211.199.120","TCP","66","33965  >  443 [ACK] Seq=18747 Ack=134241 Win=960 Len=0 TSval=49155474 TSecr=147053074"
"520","152.547294","192.168.2.3","203.211.199.120","TCP","66","33965  >  443 [ACK] Seq=18747 Ack=135089 Win=948 Len=0 TSval=49155474 TSecr=147053074"
"523","154.764003","192.168.2.3","216.58.197.14","TCP","66","[TCP Keep-Alive] 42670  >  443 [ACK] Seq=1090 Ack=1211 Win=661 Len=0 TSval=49155696 TSecr=4183133440"
"526","158.598962","192.168.2.3","203.211.199.120","TLSv1.2","787","Application Data"
"531","158.618437","192.168.2.3","203.211.199.120","TCP","66","33965  >  443 [ACK] Seq=19468 Ack=136537 Win=982 Len=0 TSval=49156081 TSecr=147059148"
"532","158.618439","192.168.2.3","203.211.199.120","TCP","66","33965  >  443 [ACK] Seq=19468 Ack=137985 Win=982 Len=0 TSval=49156081 TSecr=147059148"
"533","158.618849","192.168.2.3","203.211.199.120","TCP","66","33965  >  443 [ACK] Seq=19468 Ack=139433 Win=982 Len=0 TSval=49156081 TSecr=147059148"
"534","158.619166","192.168.2.3","203.211.199.120","TCP","66","33965  >  443 [ACK] Seq=19468 Ack=140287 Win=998 Len=0 TSval=49156081 TSecr=147059148"
"536","164.657345","192.168.2.3","203.211.199.120","TLSv1.2","787","Application Data"
"541","164.676687","192.168.2.3","203.211.199.120","TCP","66","33965  >  443 [ACK] Seq=20189 Ack=141735 Win=982 Len=0 TSval=49156687 TSecr=147065201"
"542","164.676689","192.168.2.3","203.211.199.120","TCP","66","33965  >  443 [ACK] Seq=20189 Ack=143183 Win=982 Len=0 TSval=49156687 TSecr=147065201"
"543","164.676690","192.168.2.3","203.211.199.120","TCP","66","33965  >  443 [ACK] Seq=20189 Ack=144631 Win=982 Len=0 TSval=49156687 TSecr=147065201"
"544","164.676690","192.168.2.3","203.211.199.120","TCP","66","33965  >  443 [ACK] Seq=20189 Ack=145485 Win=998 Len=0 TSval=49156687 TSecr=147065201"
"545","167.883329","192.168.2.3","108.177.97.188","TCP","66","[TCP Dup ACK 124#3] 43011  >  5228 [ACK] Seq=1 Ack=1 Win=450 Len=0 TSval=49157008 TSecr=783768899"
"548","170.699832","192.168.2.3","203.211.199.120","TLSv1.2","787","Application Data"
"553","170.725909","192.168.2.3","203.211.199.120","TCP","66","33965  >  443 [ACK] Seq=20910 Ack=146933 Win=982 Len=0 TSval=49157292 TSecr=147071253"
"554","170.725912","192.168.2.3","203.211.199.120","TCP","66","33965  >  443 [ACK] Seq=20910 Ack=148381 Win=982 Len=0 TSval=49157292 TSecr=147071253"
"555","170.726210","192.168.2.3","203.211.199.120","TCP","66","33965  >  443 [ACK] Seq=20910 Ack=149829 Win=982 Len=0 TSval=49157292 TSecr=147071253"
"556","170.726212","192.168.2.3","203.211.199.120","TCP","66","33965  >  443 [ACK] Seq=20910 Ack=150677 Win=998 Len=0 TSval=49157292 TSecr=147071253"
"557","171.721530","192.168.2.3","216.58.197.4","TCP","66","[TCP Dup ACK 151#3] 53439  >  443 [ACK] Seq=1 Ack=1 Win=862 Len=0 TSval=49157392 TSecr=1295081960"
"559","174.949446","192.168.2.3","8.8.8.8","DNS","89","Standard query 0x9af5 A connectivitycheck.gstatic.com"
"561","175.012856","192.168.2.3","172.217.27.67","GQUIC","1392","Client Hello, PKN: 1, CID: 4317180654469591771"
"562","175.013121","192.168.2.3","172.217.27.67","GQUIC","407","Payload (Encrypted), PKN: 2, CID: 4317180654469591771"
"566","175.065395","192.168.2.3","172.217.27.67","GQUIC","83","Payload (Encrypted), PKN: 3, CID: 4317180654469591771"
"567","175.065401","192.168.2.3","172.217.27.67","GQUIC","72","Payload (Encrypted), PKN: 4, CID: 4317180654469591771"
"569","175.105046","192.168.2.3","172.217.27.67","GQUIC","72","Payload (Encrypted), PKN: 5, CID: 4317180654469591771"
"570","176.762016","192.168.2.3","203.211.199.120","TLSv1.2","787","Application Data"
"575","176.784953","192.168.2.3","203.211.199.120","TCP","66","33965  >  443 [ACK] Seq=21631 Ack=152125 Win=982 Len=0 TSval=49157897 TSecr=147077307"
"576","176.784960","192.168.2.3","203.211.199.120","TCP","66","33965  >  443 [ACK] Seq=21631 Ack=153573 Win=982 Len=0 TSval=49157897 TSecr=147077307"
"577","176.784962","192.168.2.3","203.211.199.120","TCP","66","33965  >  443 [ACK] Seq=21631 Ack=155021 Win=982 Len=0 TSval=49157898 TSecr=147077307"
"578","176.784964","192.168.2.3","203.211.199.120","TCP","66","33965  >  443 [ACK] Seq=21631 Ack=155875 Win=998 Len=0 TSval=49157898 TSecr=147077307"
"580","177.828119","192.168.2.3","108.177.97.188","TLSv1.2","91","Application Data"
"582","177.868135","192.168.2.3","108.177.97.188","TCP","66","42999  >  5228 [ACK] Seq=52 Ack=51 Win=661 Len=0 TSval=49158006 TSecr=532984151"
"583","182.842813","192.168.2.3","203.211.199.120","TLSv1.2","787","Application Data"
"588","182.878310","192.168.2.3","203.211.199.120","TCP","66","33965  >  443 [ACK] Seq=22352 Ack=157323 Win=982 Len=0 TSval=49158507 TSecr=147083409"
"589","182.878723","192.168.2.3","203.211.199.120","TCP","66","33965  >  443 [ACK] Seq=22352 Ack=158771 Win=982 Len=0 TSval=49158507 TSecr=147083409"
